title,pubdate,id,authors,categories,search,abstract,displaydate
"A Dynamic, Interpreted CheckList for Meaning-oriented NLG Metric
  Evaluation -- through the Lens of Semantic Similarity Rating",2022-05-24 16:19:32+00:00,http://arxiv.org/abs/2205.12176v1,"Laura Zeidler, Juri Opitz, Anette Frank",cs.CL,knowledge,"Evaluating the quality of generated text is difficult, since traditional NLG
evaluation metrics, focusing more on surface form than meaning, often fail to
assign appropriate scores. This is especially problematic for AMR-to-text
evaluation, given the abstract nature of AMR. Our work aims to support the
development and improvement of NLG evaluation metrics that focus on meaning, by
developing a dynamic CheckList for NLG metrics that is interpreted by being
organized around meaning-relevant linguistic phenomena. Each test instance
consists of a pair of sentences with their AMR graphs and a human-produced
textual semantic similarity or relatedness score. Our CheckList facilitates
comparative evaluation of metrics and reveals strengths and weaknesses of novel
and traditional metrics. We demonstrate the usefulness of CheckList by
designing a new metric GraCo that computes lexical cohesion graphs over AMR
concepts. Our analysis suggests that GraCo presents an interesting NLG metric
worth future investigation and that meaning-oriented NLG metrics can profit
from graph-based metric components using AMR.",2022-05-24
What Makes Data-to-Text Generation Hard for Pretrained Language Models?,2022-05-23 17:58:39+00:00,http://arxiv.org/abs/2205.11505v1,"Moniba Keymanesh, Adrian Benton, Mark Dredze","cs.CL, cs.AI, cs.IR, cs.LG",knowledge,"Expressing natural language descriptions of structured facts or relations --
data-to-text generation (D2T) -- increases the accessibility of structured
knowledge repositories. Previous work shows that pre-trained language
models(PLMs) perform remarkably well on this task after fine-tuning on a
significant amount of task-specific training data. On the other hand, while
auto-regressive PLMs can generalize from a few task examples, their efficacy at
D2T is largely unexplored. Furthermore, we have an incomplete understanding of
the limits of PLMs on D2T.
  In this work, we conduct an empirical study of both fine-tuned and
auto-regressive PLMs on the DART multi-domain D2T dataset. We consider their
performance as a function of the amount of task-specific data and how these
data are incorporated into the models: zero and few-shot learning, and
fine-tuning of model weights. In addition, we probe the limits of PLMs by
measuring performance on subsets of the evaluation data: novel predicates and
abstractive test examples. To improve the performance on these subsets, we
investigate two techniques: providing predicate descriptions in the context and
re-ranking generated candidates by information reflected in the source.
Finally, we conduct a human evaluation of model errors and show that D2T
generation tasks would benefit from datasets with more careful manual curation.",2022-05-23
A Self-Paced Mixed Distillation Method for Non-Autoregressive Generation,2022-05-23 09:54:53+00:00,http://arxiv.org/abs/2205.11162v1,"Weizhen Qi, Yeyun Gong, Yelong Shen, Jian Jiao, Yu Yan, Houqiang Li, Ruofei Zhang, Weizhu Chen, Nan Duan",cs.CL,knowledge,"Non-Autoregressive generation is a sequence generation paradigm, which
removes the dependency between target tokens. It could efficiently reduce the
text generation latency with parallel decoding in place of token-by-token
sequential decoding. However, due to the known multi-modality problem,
Non-Autoregressive (NAR) models significantly under-perform Auto-regressive
(AR) models on various language generation tasks. Among the NAR models, BANG is
the first large-scale pre-training model on English un-labeled raw text corpus.
It considers different generation paradigms as its pre-training tasks including
Auto-regressive (AR), Non-Autoregressive (NAR), and semi-Non-Autoregressive
(semi-NAR) information flow with multi-stream strategy. It achieves
state-of-the-art performance without any distillation techniques. However, AR
distillation has been shown to be a very effective solution for improving NAR
performance. In this paper, we propose a novel self-paced mixed distillation
method to further improve the generation quality of BANG. Firstly, we propose
the mixed distillation strategy based on the AR stream knowledge. Secondly, we
encourage the model to focus on the samples with the same modality by
self-paced learning. The proposed self-paced mixed distillation algorithm
improves the generation quality and has no influence on the inference latency.
We carry out extensive experiments on summarization and question generation
tasks to validate the effectiveness. To further illustrate the commercial value
of our approach, we conduct experiments on three generation tasks in real-world
advertisements applications. Experimental results on commercial data show the
effectiveness of the proposed model. Compared with BANG, it achieves
significant BLEU score improvement. On the other hand, compared with
auto-regressive generation method, it achieves more than 7x speedup.",2022-05-23
"CORAL: Contextual Response Retrievability Loss Function for Training
  Dialog Generation Models",2022-05-21 10:36:22+00:00,http://arxiv.org/abs/2205.10558v1,"Bishal Santra, Ravi Ghadia, Arpit Dwivedi, Manish Gupta, Pawan Goyal",cs.CL,knowledge,"Natural Language Generation (NLG) represents a large collection of tasks in
the field of NLP. While many of these tasks have been tackled well by the
cross-entropy (CE) loss, the task of dialog generation poses a few unique
challenges for this loss function. First, CE loss assumes that for any given
input, the only possible output is the one available as the ground truth in the
training dataset. In general, this is not true for any task, as there can be
multiple semantically equivalent sentences, each with a different surface form.
This problem gets exaggerated further for the dialog generation task, as there
can be multiple valid responses (for a given context) that not only have
different surface forms but are also not semantically equivalent. Second, CE
loss does not take the context into consideration while processing the response
and, hence, it treats all ground truths with equal importance irrespective of
the context. But, we may want our final agent to avoid certain classes of
responses (e.g. bland, non-informative or biased responses) and give relatively
higher weightage for more context-specific responses. To circumvent these
shortcomings of the CE loss, in this paper, we propose a novel loss function,
CORAL, that directly optimizes recently proposed estimates of human preference
for generated responses. Using CORAL, we can train dialog generation models
without assuming non-existence of response other than the ground-truth. Also,
the CORAL loss is computed based on both the context and the response.
Extensive comparisons on two benchmark datasets show that the proposed methods
outperform strong state-of-the-art baseline models of different sizes.",2022-05-21
"Exploiting Inductive Bias in Transformers for Unsupervised
  Disentanglement of Syntax and Semantics with VAEs",2022-05-12 08:21:38+00:00,http://arxiv.org/abs/2205.05943v2,"Ghazi Felhi, Joseph Le Roux, Djamé Seddah","cs.CL, cs.LG",knowledge,"We propose a generative model for text generation, which exhibits
disentangled latent representations of syntax and semantics. Contrary to
previous work, this model does not need syntactic information such as
constituency parses, or semantic information such as paraphrase pairs. Our
model relies solely on the inductive bias found in attention-based
architectures such as Transformers.
  In the attention of Transformers, keys handle information selection while
values specify what information is conveyed. Our model, dubbed QKVAE, uses
Attention in its decoder to read latent variables where one latent variable
infers keys while another infers values. We run experiments on latent
representations and experiments on syntax/semantics transfer which show that
QKVAE displays clear signs of disentangled syntax and semantics. We also show
that our model displays competitive syntax transfer capabilities when compared
to supervised models and that comparable supervised models need a fairly large
amount of data (more than 50K samples) to outperform it on both syntactic and
semantic transfer. The code for our experiments is publicly available.",2022-05-12
"Robust (Controlled) Table-to-Text Generation with Structure-Aware
  Equivariance Learning",2022-05-08 23:37:27+00:00,http://arxiv.org/abs/2205.03972v1,"Fei Wang, Zhewei Xu, Pedro Szekely, Muhao Chen","cs.CL, cs.AI, cs.LG",knowledge,"Controlled table-to-text generation seeks to generate natural language
descriptions for highlighted subparts of a table. Previous SOTA systems still
employ a sequence-to-sequence generation method, which merely captures the
table as a linear structure and is brittle when table layouts change. We seek
to go beyond this paradigm by (1) effectively expressing the relations of
content pieces in the table, and (2) making our model robust to
content-invariant structural transformations. Accordingly, we propose an
equivariance learning framework, which encodes tables with a structure-aware
self-attention mechanism. This prunes the full self-attention structure into an
order-invariant graph attention that captures the connected graph structure of
cells belonging to the same row or column, and it differentiates between
relevant cells and irrelevant cells from the structural perspective. Our
framework also modifies the positional encoding mechanism to preserve the
relative position of tokens in the same cell but enforce position invariance
among different cells. Our technology is free to be plugged into existing
table-to-text generation models, and has improved T5-based models to offer
better performance on ToTTo and HiTab. Moreover, on a harder version of ToTTo,
we preserve promising performance, while previous SOTA systems, even with
transformation-based data augmentation, have seen significant performance
drops. Our code is available at https://github.com/luka-group/Lattice.",2022-05-08
Language Models Can See: Plugging Visual Controls in Text Generation,2022-05-05 13:56:18+00:00,http://arxiv.org/abs/2205.02655v1,"Yixuan Su, Tian Lan, Yahui Liu, Fangyu Liu, Dani Yogatama, Yan Wang, Lingpeng Kong, Nigel Collier","cs.CV, cs.CL",knowledge,"Generative language models (LMs) such as GPT-2/3 can be prompted to generate
text with remarkable quality. While they are designed for text-prompted
generation, it remains an open question how the generation process could be
guided by modalities beyond text such as images. In this work, we propose a
training-free framework, called MAGIC (iMAge-Guided text generatIon with CLIP),
for plugging in visual controls in the generation process and enabling LMs to
perform multimodal tasks (e.g., image captioning) in a zero-shot manner. MAGIC
is a simple yet efficient plug-and-play framework, which directly combines an
off-the-shelf LM (i.e., GPT-2) and an image-text matching model (i.e., CLIP)
for image-grounded text generation. During decoding, MAGIC influences the
generation of the LM by introducing a CLIP-induced score, called magic score,
which regularizes the generated result to be semantically related to a given
image while being coherent to the previously generated context. Notably, the
proposed decoding scheme does not involve any gradient update operation,
therefore being computationally efficient. On the challenging task of zero-shot
image captioning, MAGIC outperforms the state-of-the-art method by notable
margins with a nearly 27 times decoding speedup. MAGIC is a flexible framework
and is theoretically compatible with any text generation tasks that incorporate
image grounding. In the experiments, we showcase that it is also capable of
performing visually grounded story generation given both an image and a text
prompt.",2022-05-05
Efficient Few-Shot Fine-Tuning for Opinion Summarization,2022-05-04 16:38:37+00:00,http://arxiv.org/abs/2205.02170v1,"Arthur Bražinskas, Ramesh Nallapati, Mohit Bansal, Markus Dreyer","cs.CL, cs.AI, cs.LG",knowledge,"Abstractive summarization models are typically pre-trained on large amounts
of generic texts, then fine-tuned on tens or hundreds of thousands of annotated
samples. However, in opinion summarization, large annotated datasets of reviews
paired with reference summaries are not available and would be expensive to
create. This calls for fine-tuning methods robust to overfitting on small
datasets. In addition, generically pre-trained models are often not accustomed
to the specifics of customer reviews and, after fine-tuning, yield summaries
with disfluencies and semantic mistakes. To address these problems, we utilize
an efficient few-shot method based on adapters which, as we show, can easily
store in-domain knowledge. Instead of fine-tuning the entire model, we add
adapters and pre-train them in a task-specific way on a large corpus of
unannotated customer reviews, using held-out reviews as pseudo summaries. Then,
fine-tune the adapters on the small available human-annotated dataset. We show
that this self-supervised adapter pre-training improves summary quality over
standard fine-tuning by 2.0 and 1.3 ROUGE-L points on the Amazon and Yelp
datasets, respectively. Finally, for summary personalization, we condition on
aspect keyword queries, automatically created from generic datasets. In the
same vein, we pre-train the adapters in a query-based manner on customer
reviews and then fine-tune them on annotated datasets. This results in
better-organized summary content reflected in improved coherence and fewer
redundancies.",2022-05-04
"Faithful to the Document or to the World? Mitigating Hallucinations via
  Entity-linked Knowledge in Abstractive Summarization",2022-04-28 20:28:45+00:00,http://arxiv.org/abs/2204.13761v1,"Yue Dong, John Wieting, Pat Verga",cs.CL,knowledge,"Despite recent advances in abstractive summarization, current summarization
systems still suffer from content hallucinations where models generate text
that is either irrelevant or contradictory to the source document. However,
prior work has been predicated on the assumption that any generated facts not
appearing explicitly in the source are undesired hallucinations. Methods have
been proposed to address this scenario by ultimately improving `faithfulness'
to the source document, but in reality, there is a large portion of entities in
the gold reference targets that are not directly in the source. In this work,
we show that these entities are not aberrations, but they instead require
utilizing external world knowledge to infer reasoning paths from entities in
the source. We show that by utilizing an external knowledge base, we can
improve the faithfulness of summaries without simply making them more
extractive, and additionally, we show that external knowledge bases linked from
the source can benefit the factuality of generated summaries.",2022-04-28
"Recovering Patient Journeys: A Corpus of Biomedical Entities and
  Relations on Twitter (BEAR)",2022-04-21 08:18:44+00:00,http://arxiv.org/abs/2204.09952v1,"Amelie Wührl, Roman Klinger","cs.CL, cs.IR",knowledge,"Text mining and information extraction for the medical domain has focused on
scientific text generated by researchers. However, their direct access to
individual patient experiences or patient-doctor interactions can be limited.
Information provided on social media, e.g., by patients and their relatives,
complements the knowledge in scientific text. It reflects the patient's journey
and their subjective perspective on the process of developing symptoms, being
diagnosed and offered a treatment, being cured or learning to live with a
medical condition. The value of this type of data is therefore twofold:
Firstly, it offers direct access to people's perspectives. Secondly, it might
cover information that is not available elsewhere, including self-treatment or
self-diagnoses. Named entity recognition and relation extraction are methods to
structure information that is available in unstructured text. However, existing
medical social media corpora focused on a comparably small set of entities and
relations and particular domains, rather than putting the patient into the
center of analyses. With this paper we contribute a corpus with a rich set of
annotation layers following the motivation to uncover and model patients'
journeys and experiences in more detail. We label 14 entity classes (incl.
environmental factors, diagnostics, biochemical processes, patients'
quality-of-life descriptions, pathogens, medical conditions, and treatments)
and 20 relation classes (e.g., prevents, influences, interactions, causes) most
of which have not been considered before for social media data. The publicly
available dataset consists of 2,100 tweets with approx. 6,000 entity and 3,000
relation annotations. In a corpus analysis we find that over 80 % of documents
contain relevant entities. Over 50 % of tweets express relations which we
consider essential for uncovering patients' narratives about their journeys.",2022-04-21
"A Survey on Non-Autoregressive Generation for Neural Machine Translation
  and Beyond",2022-04-20 07:25:22+00:00,http://arxiv.org/abs/2204.09269v1,"Yisheng Xiao, Lijun Wu, Junliang Guo, Juntao Li, Min Zhang, Tao Qin, Tie-yan Liu","cs.CL, cs.LG",knowledge,"Non-autoregressive (NAR) generation, which is first proposed in neural
machine translation (NMT) to speed up inference, has attracted much attention
in both machine learning and natural language processing communities. While NAR
generation can significantly accelerate inference speed for machine
translation, the speedup comes at the cost of sacrificed translation accuracy
compared to its counterpart, auto-regressive (AR) generation. In recent years,
many new models and algorithms have been designed/proposed to bridge the
accuracy gap between NAR generation and AR generation. In this paper, we
conduct a systematic survey with comparisons and discussions of various
non-autoregressive translation (NAT) models from different aspects.
Specifically, we categorize the efforts of NAT into several groups, including
data manipulation, modeling methods, training criterion, decoding algorithms,
and the benefit from pre-trained models. Furthermore, we briefly review other
applications of NAR models beyond machine translation, such as dialogue
generation, text summarization, grammar error correction, semantic parsing,
speech synthesis, and automatic speech recognition. In addition, we also
discuss potential directions for future exploration, including releasing the
dependency of KD, dynamic length prediction, pre-training for NAR, and wider
applications, etc. We hope this survey can help researchers capture the latest
progress in NAR generation, inspire the design of advanced NAR models and
algorithms, and enable industry practitioners to choose appropriate solutions
for their applications. The web page of this survey is at
\url{https://github.com/LitterBrother-Xiao/Overview-of-Non-autoregressive-Applications}.",2022-04-20
"Rows from Many Sources: Enriching row completions from Wikidata with a
  pre-trained Language Model",2022-04-14 15:11:52+00:00,http://arxiv.org/abs/2204.07014v1,"Carina Negreanu, Alperen Karaoglu, Jack Williams, Shuang Chen, Daniel Fabian, Andrew Gordon, Chin-Yew Lin","cs.CL, cs.AI",knowledge,"Row completion is the task of augmenting a given table of text and numbers
with additional, relevant rows. The task divides into two steps: subject
suggestion, the task of populating the main column; and gap filling, the task
of populating the remaining columns. We present state-of-the-art results for
subject suggestion and gap filling measured on a standard benchmark
(WikiTables). Our idea is to solve this task by harmoniously combining
knowledge base table interpretation and free text generation. We interpret the
table using the knowledge base to suggest new rows and generate metadata like
headers through property linking. To improve candidate diversity, we synthesize
additional rows using free text generation via GPT-3, and crucially, we exploit
the metadata we interpret to produce better prompts for text generation.
Finally, we verify that the additional synthesized content can be linked to the
knowledge base or a trusted web source such as Wikipedia.",2022-04-14
"GAP: A Graph-aware Language Model Framework for Knowledge Graph-to-Text
  Generation",2022-04-13 23:53:37+00:00,http://arxiv.org/abs/2204.06674v1,"Anthony Colas, Mehrdad Alvandipour, Daisy Zhe Wang",cs.CL,knowledge,"Recent improvements in KG-to-text generation are due to additional auxiliary
pre-trained tasks designed to give the fine-tune task a boost in performance.
These tasks require extensive computational resources while only suggesting
marginal improvements. Here, we demonstrate that by fusing graph-aware elements
into existing pre-trained language models, we are able to outperform
state-of-the-art models and close the gap imposed by additional pre-train
tasks. We do so by proposing a mask structure to capture neighborhood
information and a novel type encoder that adds a bias to the graph-attention
weights depending on the connection type. Experiments on two KG-to-text
benchmark datasets show these models to be superior in quality while involving
fewer parameters and no additional pre-trained tasks. By formulating the
problem as a framework, we can interchange the various proposed components and
begin interpreting KG-to-text generative models based on the topological and
type information found in a graph.",2022-04-13
"Explanation Graph Generation via Pre-trained Language Models: An
  Empirical Study with Contrastive Learning",2022-04-11 00:58:27+00:00,http://arxiv.org/abs/2204.04813v1,"Swarnadeep Saha, Prateek Yadav, Mohit Bansal","cs.CL, cs.AI, cs.LG",knowledge,"Pre-trained sequence-to-sequence language models have led to widespread
success in many natural language generation tasks. However, there has been
relatively less work on analyzing their ability to generate structured outputs
such as graphs. Unlike natural language, graphs have distinct structural and
semantic properties in the context of a downstream NLP task, e.g., generating a
graph that is connected and acyclic can be attributed to its structural
constraints, while the semantics of a graph can refer to how meaningfully an
edge represents the relation between two node concepts. In this work, we study
pre-trained language models that generate explanation graphs in an end-to-end
manner and analyze their ability to learn the structural constraints and
semantics of such graphs. We first show that with limited supervision,
pre-trained language models often generate graphs that either violate these
constraints or are semantically incoherent. Since curating large amount of
human-annotated graphs is expensive and tedious, we propose simple yet
effective ways of graph perturbations via node and edge edit operations that
lead to structurally and semantically positive and negative graphs. Next, we
leverage these graphs in different contrastive learning models with Max-Margin
and InfoNCE losses. Our methods lead to significant improvements in both
structural and semantic accuracy of explanation graphs and also generalize to
other similar graph generation tasks. Lastly, we show that human errors are the
best negatives for contrastive learning and also that automatically generating
more such human-like negative graphs can lead to further improvements. Our code
and models are publicly available at https://github.com/swarnaHub/ExplagraphGen",2022-04-11
"Explaining Deep Convolutional Neural Networks via Latent Visual-Semantic
  Filter Attention",2022-04-10 04:57:56+00:00,http://arxiv.org/abs/2204.04601v1,"Yu Yang, Seungbae Kim, Jungseock Joo","cs.CV, cs.AI, cs.LG",knowledge,"Interpretability is an important property for visual models as it helps
researchers and users understand the internal mechanism of a complex model.
However, generating semantic explanations about the learned representation is
challenging without direct supervision to produce such explanations. We propose
a general framework, Latent Visual Semantic Explainer (LaViSE), to teach any
existing convolutional neural network to generate text descriptions about its
own latent representations at the filter level. Our method constructs a mapping
between the visual and semantic spaces using generic image datasets, using
images and category names. It then transfers the mapping to the target domain
which does not have semantic labels. The proposed framework employs a modular
structure and enables to analyze any trained network whether or not its
original training data is available. We show that our method can generate novel
descriptions for learned filters beyond the set of categories defined in the
training dataset and perform an extensive evaluation on multiple datasets. We
also demonstrate a novel application of our method for unsupervised dataset
bias analysis which allows us to automatically discover hidden biases in
datasets or compare different subsets without using additional labels. The
dataset and code are made public to facilitate further research.",2022-04-10
