title,pubdate,id,authors,categories,search,abstract,displaydate
"What do you MEME? Generating Explanations for Visual Semantic Role
  Labelling in Memes",2022-12-01 18:21:36+00:00,http://arxiv.org/abs/2212.00715v1,"Shivam Sharma, Siddhant Agarwal, Tharun Suresh, Preslav Nakov, Md. Shad Akhtar, Tanmoy Charkraborty","cs.CY, cs.CL",knowledge,"Memes are powerful means for effective communication on social media. Their
effortless amalgamation of viral visuals and compelling messages can have
far-reaching implications with proper marketing. Previous research on memes has
primarily focused on characterizing their affective spectrum and detecting
whether the meme's message insinuates any intended harm, such as hate, offense,
racism, etc. However, memes often use abstraction, which can be elusive. Here,
we introduce a novel task - EXCLAIM, generating explanations for visual
semantic role labeling in memes. To this end, we curate ExHVV, a novel dataset
that offers natural language explanations of connotative roles for three types
of entities - heroes, villains, and victims, encompassing 4,680 entities
present in 3K memes. We also benchmark ExHVV with several strong unimodal and
multimodal baselines. Moreover, we posit LUMEN, a novel multimodal, multi-task
learning framework that endeavors to address EXCLAIM optimally by jointly
learning to predict the correct semantic roles and correspondingly to generate
suitable natural language explanations. LUMEN distinctly outperforms the best
baseline across 18 standard natural language generation evaluation metrics. Our
systematic evaluation and analyses demonstrate that characteristic multimodal
cues required for adjudicating semantic roles are also helpful for generating
suitable explanations.",2022-12-01
"CliMedBERT: A Pre-trained Language Model for Climate and Health-related
  Text",2022-12-01 17:44:09+00:00,http://arxiv.org/abs/2212.00689v1,"B. Jalalzadeh Fard, S. A. Hasan, J. E. Bell","cs.CL, 68T50, I.2.7",knowledge,"Climate change is threatening human health in unprecedented orders and many
ways. These threats are expected to grow unless effective and evidence-based
policies are developed and acted upon to minimize or eliminate them. Attaining
such a task requires the highest degree of the flow of knowledge from science
into policy. The multidisciplinary, location-specific, and vastness of
published science makes it challenging to keep track of novel work in this
area, as well as making the traditional knowledge synthesis methods inefficient
in infusing science into policy. To this end, we consider developing multiple
domain-specific language models (LMs) with different variations from Climate-
and Health-related information, which can serve as a foundational step toward
capturing available knowledge to enable solving different tasks, such as
detecting similarities between climate- and health-related concepts,
fact-checking, relation extraction, evidence of health effects to policy text
generation, and more. To our knowledge, this is the first work that proposes
developing multiple domain-specific language models for the considered domains.
We will make the developed models, resources, and codebase available for the
researchers.",2022-12-01
"On the Importance of Image Encoding in Automated Chest X-Ray Report
  Generation",2022-11-24 08:02:52+00:00,http://arxiv.org/abs/2211.13465v1,"Otabek Nazarov, Mohammad Yaqub, Karthik Nandakumar","cs.CV, cs.AI",knowledge,"Chest X-ray is one of the most popular medical imaging modalities due to its
accessibility and effectiveness. However, there is a chronic shortage of
well-trained radiologists who can interpret these images and diagnose the
patient's condition. Therefore, automated radiology report generation can be a
very helpful tool in clinical practice. A typical report generation workflow
consists of two main steps: (i) encoding the image into a latent space and (ii)
generating the text of the report based on the latent image embedding. Many
existing report generation techniques use a standard convolutional neural
network (CNN) architecture for image encoding followed by a Transformer-based
decoder for medical text generation. In most cases, CNN and the decoder are
trained jointly in an end-to-end fashion. In this work, we primarily focus on
understanding the relative importance of encoder and decoder components.
Towards this end, we analyze four different image encoding approaches: direct,
fine-grained, CLIP-based, and Cluster-CLIP-based encodings in conjunction with
three different decoders on the large-scale MIMIC-CXR dataset. Among these
encoders, the cluster CLIP visual encoder is a novel approach that aims to
generate more discriminative and explainable representations. CLIP-based
encoders produce comparable results to traditional CNN-based encoders in terms
of NLP metrics, while fine-grained encoding outperforms all other encoders both
in terms of NLP and clinical accuracy metrics, thereby validating the
importance of image encoder to effectively extract semantic information. GitHub
repository: https://github.com/mudabek/encoding-cxr-report-gen",2022-11-24
Retrieval-Augmented Multimodal Language Modeling,2022-11-22 20:26:44+00:00,http://arxiv.org/abs/2211.12561v1,"Michihiro Yasunaga, Armen Aghajanyan, Weijia Shi, Rich James, Jure Leskovec, Percy Liang, Mike Lewis, Luke Zettlemoyer, Wen-tau Yih","cs.CV, cs.CL, cs.LG",knowledge,"Recent multimodal models such as DALL-E and CM3 have achieved remarkable
progress in text-to-image and image-to-text generation. However, these models
store all learned knowledge (e.g., the appearance of the Eiffel Tower) in the
model parameters, requiring increasingly larger models and training data to
capture more knowledge. To integrate knowledge in a more scalable and modular
way, we propose a retrieval-augmented multimodal model, which enables a base
multimodal model (generator) to refer to relevant knowledge fetched by a
retriever from external memory (e.g., multimodal documents on the web).
Specifically, we implement a retriever using the pretrained CLIP model and a
generator using the CM3 Transformer architecture, and train this model using
the LAION dataset. Our resulting model, named Retrieval-Augmented CM3 (RA-CM3),
is the first multimodal model that can retrieve and generate mixtures of text
and images. We show that RA-CM3 significantly outperforms baseline multimodal
models such as DALL-E and CM3 on both image and caption generation tasks (12
FID and 17 CIDEr improvements on MS-COCO), while requiring much less compute
for training (<30% of DALL-E). Moreover, we show that RA-CM3 exhibits novel
capabilities such as knowledge-intensive image generation and multimodal
in-context learning.",2022-11-22
"Towards Computationally Verifiable Semantic Grounding for Language
  Models",2022-11-16 17:35:52+00:00,http://arxiv.org/abs/2211.09070v1,"Chris Alberti, Kuzman Ganchev, Michael Collins, Sebastian Gehrmann, Ciprian Chelba",cs.CL,knowledge,"The paper presents an approach to semantic grounding of language models (LMs)
that conceptualizes the LM as a conditional model generating text given a
desired semantic message formalized as a set of entity-relationship triples. It
embeds the LM in an auto-encoder by feeding its output to a semantic parser
whose output is in the same representation domain as the input message.
Compared to a baseline that generates text using greedy search, we demonstrate
two techniques that improve the fluency and semantic accuracy of the generated
text: The first technique samples multiple candidate text sequences from which
the semantic parser chooses. The second trains the language model while keeping
the semantic parser frozen to improve the semantic accuracy of the
auto-encoder. We carry out experiments on the English WebNLG 3.0 data set,
using BLEU to measure the fluency of generated text and standard parsing
metrics to measure semantic accuracy. We show that our proposed approaches
significantly improve on the greedy search baseline. Human evaluation
corroborates the results of the automatic evaluation experiments.",2022-11-16
kogito: A Commonsense Knowledge Inference Toolkit,2022-11-15 19:04:13+00:00,http://arxiv.org/abs/2211.08451v1,"Mete Ismayilzada, Antoine Bosselut",cs.CL,knowledge,"In this paper, we present kogito, an open-source tool for generating
commonsense inferences about situations described in text. kogito provides an
intuitive and extensible interface to interact with natural language generation
models that can be used for hypothesizing commonsense knowledge inference from
a textual input. In particular, kogito offers several features for targeted,
multi-granularity knowledge generation. These include a standardized API for
training and evaluating knowledge models, and generating and filtering
inferences from them. We also include helper functions for converting natural
language texts into a format ingestible by knowledge models - intermediate
pipeline stages such as knowledge head extraction from text, heuristic and
model-based knowledge head-relation matching, and an ability to define and use
custom knowledge relations. We make the code for kogito available at
https://github.com/epfl-nlp/kogito along with thorough documentation at
https://kogito.readthedocs.io.",2022-11-15
A Survey of Knowledge-Enhanced Pre-trained Language Models,2022-11-11 04:29:02+00:00,http://arxiv.org/abs/2211.05994v3,"Linmei Hu, Zeyi Liu, Ziwang Zhao, Lei Hou, Liqiang Nie, Juanzi Li",cs.CL,knowledge,"Pre-trained Language Models (PLMs) which are trained on large text corpus via
self-supervised learning method, have yielded promising performance on various
tasks in Natural Language Processing (NLP). However, though PLMs with huge
parameters can effectively possess rich knowledge learned from massive training
text and benefit downstream tasks at the fine-tuning stage, they still have
some limitations such as poor reasoning ability due to the lack of external
knowledge. Research has been dedicated to incorporating knowledge into PLMs to
tackle these issues. In this paper, we present a comprehensive review of
Knowledge-Enhanced Pre-trained Language Models (KE-PLMs) to provide a clear
insight into this thriving field. We introduce appropriate taxonomies
respectively for Natural Language Understanding (NLU) and Natural Language
Generation (NLG) to highlight these two main tasks of NLP. For NLU, we divide
the types of knowledge into four categories: linguistic knowledge, text
knowledge, knowledge graph (KG), and rule knowledge. The KE-PLMs for NLG are
categorized into KG-based and retrieval-based methods. Finally, we point out
some promising future directions of KE-PLMs.",2022-11-11
"CCPrompt: Counterfactual Contrastive Prompt-Tuning for Many-Class
  Classification",2022-11-11 03:45:59+00:00,http://arxiv.org/abs/2211.05987v1,"Yang Li, Canran Xu, Tao Shen, Jing Jiang, Guodong Long",cs.CL,knowledge,"With the success of the prompt-tuning paradigm in Natural Language Processing
(NLP), various prompt templates have been proposed to further stimulate
specific knowledge for serving downstream tasks, e.g., machine translation,
text generation, relation extraction, and so on. Existing prompt templates are
mainly shared among all training samples with the information of task
description. However, training samples are quite diverse. The sharing task
description is unable to stimulate the unique task-related information in each
training sample, especially for tasks with the finite-label space. To exploit
the unique task-related information, we imitate the human decision process
which aims to find the contrastive attributes between the objective factual and
their potential counterfactuals. Thus, we propose the \textbf{C}ounterfactual
\textbf{C}ontrastive \textbf{Prompt}-Tuning (CCPrompt) approach for many-class
classification, e.g., relation classification, topic classification, and entity
typing. Compared with simple classification tasks, these tasks have more
complex finite-label spaces and are more rigorous for prompts. First of all, we
prune the finite label space to construct fact-counterfactual pairs. Then, we
exploit the contrastive attributes by projecting training instances onto every
fact-counterfactual pair. We further set up global prototypes corresponding
with all contrastive attributes for selecting valid contrastive attributes as
additional tokens in the prompt template. Finally, a simple Siamese
representation learning is employed to enhance the robustness of the model. We
conduct experiments on relation classification, topic classification, and
entity typing tasks in both fully supervised setting and few-shot setting. The
results indicate that our model outperforms former baselines.",2022-11-11
"Measuring Reliability of Large Language Models through Semantic
  Consistency",2022-11-10 20:21:07+00:00,http://arxiv.org/abs/2211.05853v1,"Harsh Raj, Domenic Rosati, Subhabrata Majumdar","cs.CL, cs.AI, cs.CY",knowledge,"While large pretrained language models (PLMs) demonstrate incredible fluency
and performance on many natural language tasks, recent work has shown that
well-performing PLMs are very sensitive to what prompts are feed into them.
Even when prompts are semantically identical, language models may give very
different answers. When considering safe and trustworthy deployments of PLMs we
would like their outputs to be consistent under prompts that mean the same
thing or convey the same intent. While some work has looked into how
state-of-the-art PLMs address this need, they have been limited to only
evaluating lexical equality of single- or multi-word answers and do not address
consistency of generative text sequences. In order to understand consistency of
PLMs under text generation settings, we develop a measure of semantic
consistency that allows the comparison of open-ended text outputs. We implement
several versions of this consistency metric to evaluate the performance of a
number of PLMs on paraphrased versions of questions in the TruthfulQA dataset,
we find that our proposed metrics are considerably more consistent than
traditional metrics embodying lexical consistency, and also correlate with
human evaluation of output consistency to a higher degree.",2022-11-10
Generative Transformers for Design Concept Generation,2022-11-07 11:29:10+00:00,http://arxiv.org/abs/2211.03468v1,"Qihao Zhu, Jianxi Luo",cs.CL,knowledge,"Generating novel and useful concepts is essential during the early design
stage to explore a large variety of design opportunities, which usually
requires advanced design thinking ability and a wide range of knowledge from
designers. Growing works on computer-aided tools have explored the retrieval of
knowledge and heuristics from design data. However, they only provide stimuli
to inspire designers from limited aspects. This study explores the recent
advance of the natural language generation (NLG) technique in the artificial
intelligence (AI) field to automate the early-stage design concept generation.
Specifically, a novel approach utilizing the generative pre-trained transformer
(GPT) is proposed to leverage the knowledge and reasoning from textual data and
transform them into new concepts in understandable language. Three concept
generation tasks are defined to leverage different knowledge and reasoning:
domain knowledge synthesis, problem-driven synthesis, and analogy-driven
synthesis. The experiments with both human and data-driven evaluation show good
performance in generating novel and useful concepts.",2022-11-07
CLSE: Corpus of Linguistically Significant Entities,2022-11-04 12:56:12+00:00,http://arxiv.org/abs/2211.02423v1,"Aleksandr Chuklin, Justin Zhao, Mihir Kale",cs.CL,knowledge,"One of the biggest challenges of natural language generation (NLG) is the
proper handling of named entities. Named entities are a common source of
grammar mistakes such as wrong prepositions, wrong article handling, or
incorrect entity inflection. Without factoring linguistic representation, such
errors are often underrepresented when evaluating on a small set of arbitrarily
picked argument values, or when translating a dataset from a linguistically
simpler language, like English, to a linguistically complex language, like
Russian. However, for some applications, broadly precise grammatical
correctness is critical -- native speakers may find entity-related grammar
errors silly, jarring, or even offensive.
  To enable the creation of more linguistically diverse NLG datasets, we
release a Corpus of Linguistically Significant Entities (CLSE) annotated by
linguist experts. The corpus includes 34 languages and covers 74 different
semantic types to support various applications from airline ticketing to video
games. To demonstrate one possible use of CLSE, we produce an augmented version
of the Schema-Guided Dialog Dataset, SGD-CLSE. Using the CLSE's entities and a
small number of human translations, we create a linguistically representative
NLG evaluation benchmark in three languages: French (high-resource), Marathi
(low-resource), and Russian (highly inflected language). We establish quality
baselines for neural, template-based, and hybrid NLG systems and discuss the
strengths and weaknesses of each approach.",2022-11-04
Dialect-robust Evaluation of Generated Text,2022-11-02 07:12:23+00:00,http://arxiv.org/abs/2211.00922v1,"Jiao Sun, Thibault Sellam, Elizabeth Clark, Tu Vu, Timothy Dozat, Dan Garrette, Aditya Siddhant, Jacob Eisenstein, Sebastian Gehrmann",cs.CL,knowledge,"Evaluation metrics that are not robust to dialect variation make it
impossible to tell how well systems perform for many groups of users, and can
even penalize systems for producing text in lower-resource dialects. However,
currently, there exists no way to quantify how metrics respond to change in the
dialect of a generated utterance. We thus formalize dialect robustness and
dialect awareness as goals for NLG evaluation metrics. We introduce a suite of
methods and corresponding statistical tests one can use to assess metrics in
light of the two goals. Applying the suite to current state-of-the-art metrics,
we demonstrate that they are not dialect-robust and that semantic perturbations
frequently lead to smaller decreases in a metric than the introduction of
dialect features. As a first step to overcome this limitation, we propose a
training schema, NANO, which introduces regional and language information to
the pretraining process of a metric. We demonstrate that NANO provides a
size-efficient way for models to improve the dialect robustness while
simultaneously improving their performance on the standard metric benchmark.",2022-11-02
"Seq2Seq-SC: End-to-End Semantic Communication Systems with Pre-trained
  Language Model",2022-10-27 07:48:18+00:00,http://arxiv.org/abs/2210.15237v1,"Ju-Hyung Lee, Dong-Ho Lee, Eunsoo Sheen, Thomas Choi, Jay Pujara, Joongheon Kim","eess.SP, cs.CL",knowledge,"While semantic communication is expected to bring unprecedented communication
efficiency in comparison to classical communication, many challenges must be
resolved to realize its potential. In this work, we provide a realistic
semantic network dubbed seq2seq-SC, which is compatible to 5G NR and can work
with generalized text dataset utilizing pre-trained language model. We also
utilize a performance metric (SBERT) which can accurately measure semantic
similarity and show that seq2seq-SC achieves superior performance while
extracting semantically meaningful information.",2022-10-27
Contrastive Search Is What You Need For Neural Text Generation,2022-10-25 16:40:48+00:00,http://arxiv.org/abs/2210.14140v1,"Yixuan Su, Nigel Collier",cs.CL,knowledge,"Generating text with autoregressive language models (LMs) is of great
importance to many natural language processing (NLP) applications. Previous
solutions for this task often produce text that contains degenerative
expressions or lacks semantic consistency. Recently, Su et al. introduced a new
decoding method, contrastive search, based on the isotropic representation
space of the language model and obtained new state of the art on various
benchmarks. Additionally, Su et al. argued that the representations of
autoregressive LMs (e.g. GPT-2) are intrinsically anisotropic which is also
shared by previous study. Therefore, to ensure the language model follows an
isotropic distribution, Su et al. proposed a contrastive learning scheme,
SimCTG, which calibrates the language model's representations through
additional training.
  In this study, we first answer the question: ""Are autoregressive LMs really
anisotropic?"". To this end, we extensively evaluate the isotropy of LMs across
16 major languages. Surprisingly, we find that the anisotropic problem only
exists in the two specific English GPT-2-small/medium models. On the other
hand, all other evaluated LMs are naturally isotropic which is in contrast to
the conclusion drawn by previous studies. Based on our findings, we further
assess the contrastive search decoding method using off-the-shelf LMs on four
generation tasks across 16 languages. Our experimental results demonstrate that
contrastive search significantly outperforms previous decoding methods without
any additional training. More notably, on 12 out of 16 evaluated languages,
contrastive search performs comparably with human-level performances as judged
by human evaluations.",2022-10-25
"Mapping Process for the Task: Wikidata Statements to Text as Wikipedia
  Sentences",2022-10-23 08:34:33+00:00,http://arxiv.org/abs/2210.12659v1,"Hoang Thang Ta, Alexander Gelbukha, Grigori Sidorov","cs.CL, cs.AI",knowledge,"Acknowledged as one of the most successful online cooperative projects in
human society, Wikipedia has obtained rapid growth in recent years and desires
continuously to expand content and disseminate knowledge values for everyone
globally. The shortage of volunteers brings to Wikipedia many issues, including
developing content for over 300 languages at the present. Therefore, the
benefit that machines can automatically generate content to reduce human
efforts on Wikipedia language projects could be considerable. In this paper, we
propose our mapping process for the task of converting Wikidata statements to
natural language text (WS2T) for Wikipedia projects at the sentence level. The
main step is to organize statements, represented as a group of quadruples and
triples, and then to map them to corresponding sentences in English Wikipedia.
We evaluate the output corpus in various aspects: sentence structure analysis,
noise filtering, and relationships between sentence components based on word
embedding models. The results are helpful not only for the data-to-text
generation task but also for other relevant works in the field.",2022-10-23
"Hard Gate Knowledge Distillation -- Leverage Calibration for Robust and
  Reliable Language Model",2022-10-22 11:57:10+00:00,http://arxiv.org/abs/2210.12427v1,"Dongkyu Lee, Zhiliang Tian, Yingxiu Zhao, Ka Chun Cheung, Nevin L. Zhang","cs.CL, cs.AI",knowledge,"In knowledge distillation, a student model is trained with supervisions from
both knowledge from a teacher and observations drawn from a training data
distribution. Knowledge of a teacher is considered a subject that holds
inter-class relations which send a meaningful supervision to a student; hence,
much effort has been put to find such knowledge to be distilled. In this paper,
we explore a question that has been given little attention: ""when to distill
such knowledge."" The question is answered in our work with the concept of model
calibration; we view a teacher model not only as a source of knowledge but also
as a gauge to detect miscalibration of a student. This simple and yet novel
view leads to a hard gate knowledge distillation scheme that switches between
learning from a teacher model and training data. We verify the gating mechanism
in the context of natural language generation at both the token-level and the
sentence-level. Empirical comparisons with strong baselines show that hard gate
knowledge distillation not only improves model generalization, but also
significantly lowers model calibration error.",2022-10-22
What do Large Language Models Learn beyond Language?,2022-10-21 23:43:13+00:00,http://arxiv.org/abs/2210.12302v1,"Avinash Madasu, Shashank Srivastava",cs.CL,knowledge,"Large language models (LMs) have rapidly become a mainstay in Natural
Language Processing. These models are known to acquire rich linguistic
knowledge from training on large amounts of text. In this paper, we investigate
if pre-training on text also confers these models with helpful `inductive
biases' for non-linguistic reasoning. On a set of 19 diverse non-linguistic
tasks involving quantitative computations, recognizing regular expressions and
reasoning over strings. We find that pretrained models significantly outperform
comparable non-pretrained neural models. This remains true also in experiments
with training non-pretrained models with fewer parameters to account for model
regularization effects. We further explore the effect of text domain on LMs by
pretraining models from text from different domains and provenances. Our
experiments surprisingly reveal that the positive effects of pre-training
persist even when pretraining on multi-lingual text or computer code, and even
for text generated from synthetic languages. Our findings suggest a hitherto
unexplored deep connection between pre-training and inductive learning
abilities of language models.",2022-10-21
