title,pubdate,id,authors,categories,search,abstract,displaydate
Controllable Text Generation for Open-Domain Creativity and Fairness,2022-09-24 22:40:01+00:00,http://arxiv.org/abs/2209.12099v1,Nanyun Peng,"cs.CL, cs.AI",knowledge,"Recent advances in large pre-trained language models have demonstrated strong
results in generating natural languages and significantly improved performances
for many natural language generation (NLG) applications such as machine
translation and text summarization. However, when the generation tasks are more
open-ended and the content is under-specified, existing techniques struggle to
generate long-term coherent and creative content. Moreover, the models exhibit
and even amplify social biases that are learned from the training corpora. This
happens because the generation models are trained to capture the surface
patterns (i.e. sequences of words), instead of capturing underlying semantics
and discourse structures, as well as background knowledge including social
norms. In this paper, I introduce our recent works on controllable text
generation to enhance the creativity and fairness of language generation
models. We explore hierarchical generation and constrained decoding, with
applications to creative language generation including story, poetry, and
figurative languages, and bias mitigation for generation models.",2022-09-24
"Can we do that simpler? Simple, Efficient, High-Quality Evaluation
  Metrics for NLG",2022-09-20 10:12:07+00:00,http://arxiv.org/abs/2209.09593v1,"Jens Grünwald, Christoph Leiter, Steffen Eger","cs.CL, cs.LG",knowledge,"We explore efficient evaluation metrics for Natural Language Generation
(NLG). To implement efficient metrics, we replace (i) computation-heavy
transformers in metrics such as BERTScore, MoverScore, BARTScore, XMoverScore,
etc. with lighter versions (such as distilled ones) and (ii) cubic inference
time alignment algorithms such as Word Mover Distance with linear and quadratic
approximations. We consider six evaluation metrics (both monolingual and
multilingual), assessed on three different machine translation datasets, and 16
light-weight transformers as replacement. We find, among others, that (a)
TinyBERT shows best quality-efficiency tradeoff for semantic similarity metrics
of the BERTScore family, retaining 97\% quality and being 5x faster at
inference time on average, (b) there is a large difference in speed-ups on CPU
vs. GPU (much higher speed-ups on CPU), and (c) WMD approximations yield no
efficiency gains but lead to a substantial drop in quality on 2 out of 3
datasets we examine.",2022-09-20
Selective Token Generation for Few-shot Natural Language Generation,2022-09-17 00:48:52+00:00,http://arxiv.org/abs/2209.08206v1,"Daejin Jo, Taehwan Kwon, Eun-Sol Kim, Sungwoong Kim","cs.CL, cs.LG",knowledge,"Natural language modeling with limited training data is a challenging
problem, and many algorithms make use of large-scale pretrained language models
(PLMs) for this due to its great generalization ability. Among them, additive
learning that incorporates a task-specific adapter on top of the fixed
large-scale PLM has been popularly used in the few-shot setting. However, this
added adapter is still easy to disregard the knowledge of the PLM especially
for few-shot natural language generation (NLG) since an entire sequence is
usually generated by only the newly trained adapter. Therefore, in this work,
we develop a novel additive learning algorithm based on reinforcement learning
(RL) that selectively outputs language tokens between the task-general PLM and
the task-specific adapter during both training and inference. This output token
selection over the two generators allows the adapter to take into account
solely the task-relevant parts in sequence generation, and therefore makes it
more robust to overfitting as well as more stable in RL training. In addition,
to obtain the complementary adapter from the PLM for each few-shot task, we
exploit a separate selecting module that is also simultaneously trained using
RL. Experimental results on various few-shot NLG tasks including question
answering, data-to-text generation and text summarization demonstrate that the
proposed selective token generation significantly outperforms the previous
additive learning algorithms based on the PLMs.",2022-09-17
"TwHIN-BERT: A Socially-Enriched Pre-trained Language Model for
  Multilingual Tweet Representations",2022-09-15 19:01:21+00:00,http://arxiv.org/abs/2209.07562v1,"Xinyang Zhang, Yury Malkov, Omar Florez, Serim Park, Brian McWilliams, Jiawei Han, Ahmed El-Kishky",cs.CL,knowledge,"We present TwHIN-BERT, a multilingual language model trained on in-domain
data from the popular social network Twitter. TwHIN-BERT differs from prior
pre-trained language models as it is trained with not only text-based
self-supervision, but also with a social objective based on the rich social
engagements within a Twitter heterogeneous information network (TwHIN). Our
model is trained on 7 billion tweets covering over 100 distinct languages
providing a valuable representation to model short, noisy, user-generated text.
We evaluate our model on a variety of multilingual social recommendation and
semantic understanding tasks and demonstrate significant metric improvement
over established pre-trained language models. We will freely open-source
TwHIN-BERT and our curated hashtag prediction and social engagement benchmark
datasets to the research community.",2022-09-15
Distribution Aware Metrics for Conditional Natural Language Generation,2022-09-15 17:58:13+00:00,http://arxiv.org/abs/2209.07518v1,"David M Chan, Yiming Ni, Austin Myers, Sudheendra Vijayanarasimhan, David A Ross, John Canny","cs.CL, cs.AI, cs.CV, cs.LG",knowledge,"Traditional automated metrics for evaluating conditional natural language
generation use pairwise comparisons between a single generated text and the
best-matching gold-standard ground truth text. When multiple ground truths are
available, scores are aggregated using an average or max operation across
references. While this approach works well when diversity in the ground truth
data (i.e. dispersion of the distribution of conditional texts) can be ascribed
to noise, such as in automated speech recognition, it does not allow for robust
evaluation in the case where diversity in the ground truths represents signal
for the model. In this work we argue that existing metrics are not appropriate
for domains such as visual description or summarization where ground truths are
semantically diverse, and where the diversity in those captions captures useful
additional information about the context. We propose a novel paradigm for
multi-candidate evaluation of conditional language generation models, and a new
family of metrics that compare the distributions of reference and
model-generated caption sets using small sample sets of each. We demonstrate
the utility of our approach with a case study in visual description: where we
show that existing models optimize for single-description quality over
diversity, and gain some insights into how sampling methods and temperature
impact description quality and diversity.",2022-09-15
vec2text with Round-Trip Translations,2022-09-14 17:20:18+00:00,http://arxiv.org/abs/2209.06792v1,"Geoffrey Cideron, Sertan Girgin, Anton Raichuk, Olivier Pietquin, Olivier Bachem, Léonard Hussenot","cs.CL, cs.LG",knowledge,"We investigate models that can generate arbitrary natural language text (e.g.
all English sentences) from a bounded, convex and well-behaved control space.
We call them universal vec2text models. Such models would allow making semantic
decisions in the vector space (e.g. via reinforcement learning) while the
natural language generation is handled by the vec2text model. We propose four
desired properties: universality, diversity, fluency, and semantic structure,
that such vec2text models should possess and we provide quantitative and
qualitative methods to assess them. We implement a vec2text model by adding a
bottleneck to a 250M parameters Transformer model and training it with an
auto-encoding objective on 400M sentences (10B tokens) extracted from a massive
web corpus. We propose a simple data augmentation technique based on round-trip
translations and show in extensive experiments that the resulting vec2text
model surprisingly leads to vector spaces that fulfill our four desired
properties and that this model strongly outperforms both standard and denoising
auto-encoders.",2022-09-14
"Visual Recipe Flow: A Dataset for Learning Visual State Changes of
  Objects with Recipe Flows",2022-09-13 09:38:32+00:00,http://arxiv.org/abs/2209.05840v1,"Keisuke Shirai, Atsushi Hashimoto, Taichi Nishimura, Hirotaka Kameko, Shuhei Kurita, Yoshitaka Ushiku, Shinsuke Mori","cs.CL, cs.AI",knowledge,"We present a new multimodal dataset called Visual Recipe Flow, which enables
us to learn each cooking action result in a recipe text. The dataset consists
of object state changes and the workflow of the recipe text. The state change
is represented as an image pair, while the workflow is represented as a recipe
flow graph (r-FG). The image pairs are grounded in the r-FG, which provides the
cross-modal relation. With our dataset, one can try a range of applications,
from multimodal commonsense reasoning and procedural text generation.",2022-09-13
Elaboration-Generating Commonsense Question Answering at Scale,2022-09-02 18:32:09+00:00,http://arxiv.org/abs/2209.01232v1,"Wenya Wang, Vivek Srikumar, Hanna Hajishirzi, Noah A. Smith",cs.CL,knowledge,"In question answering requiring common sense, language models (e.g., GPT-3)
have been used to generate text expressing background knowledge that helps
improve performance. Yet the cost of working with such models is very high; in
this work, we finetune smaller language models to generate useful intermediate
context, referred to here as elaborations. Our framework alternates between
updating two language models -- an elaboration generator and an answer
predictor -- allowing each to influence the other. Using less than 0.5% of the
parameters of GPT-3, our model outperforms alternatives with similar sizes and
closes the gap on GPT-3 on four commonsense question answering benchmarks.
Human evaluations show that the quality of the generated elaborations is high.",2022-09-02
Multi-Modal Experience Inspired AI Creation,2022-09-02 11:50:41+00:00,http://arxiv.org/abs/2209.02427v1,"Qian Cao, Xu Chen, Ruihua Song, Hao Jiang, Guang Yang, Zhao Cao",cs.AI,knowledge,"AI creation, such as poem or lyrics generation, has attracted increasing
attention from both industry and academic communities, with many promising
models proposed in the past few years. Existing methods usually estimate the
outputs based on single and independent visual or textual information. However,
in reality, humans usually make creations according to their experiences, which
may involve different modalities and be sequentially correlated. To model such
human capabilities, in this paper, we define and solve a novel AI creation
problem based on human experiences. More specifically, we study how to generate
texts based on sequential multi-modal information. Compared with the previous
works, this task is much more difficult because the designed model has to well
understand and adapt the semantics among different modalities and effectively
convert them into the output in a sequential manner. To alleviate these
difficulties, we firstly design a multi-channel sequence-to-sequence
architecture equipped with a multi-modal attention network. For more effective
optimization, we then propose a curriculum negative sampling strategy tailored
for the sequential inputs. To benchmark this problem and demonstrate the
effectiveness of our model, we manually labeled a new multi-modal experience
dataset. With this dataset, we conduct extensive experiments by comparing our
model with a series of representative baselines, where we can demonstrate
significant improvements in our model based on both automatic and
human-centered metrics. The code and data are available at:
\url{https://github.com/Aman-4-Real/MMTG}.",2022-09-02
Unified Knowledge Prompt Pre-training for Customer Service Dialogues,2022-08-31 06:23:53+00:00,http://arxiv.org/abs/2208.14652v1,"Keqing He, Jingang Wang, Chaobo Sun, Wei Wu",cs.CL,knowledge,"Dialogue bots have been widely applied in customer service scenarios to
provide timely and user-friendly experience. These bots must classify the
appropriate domain of a dialogue, understand the intent of users, and generate
proper responses. Existing dialogue pre-training models are designed only for
several dialogue tasks and ignore weakly-supervised expert knowledge in
customer service dialogues. In this paper, we propose a novel unified knowledge
prompt pre-training framework, UFA (\textbf{U}nified Model \textbf{F}or
\textbf{A}ll Tasks), for customer service dialogues. We formulate all the tasks
of customer service dialogues as a unified text-to-text generation task and
introduce a knowledge-driven prompt strategy to jointly learn from a mixture of
distinct dialogue tasks. We pre-train UFA on a large-scale Chinese customer
service corpus collected from practical scenarios and get significant
improvements on both natural language understanding (NLU) and natural language
generation (NLG) benchmarks.",2022-08-31
"StoryTrans: Non-Parallel Story Author-Style Transfer with Discourse
  Representations and Content Enhancing",2022-08-29 08:47:49+00:00,http://arxiv.org/abs/2208.13423v1,"Xuekai Zhu, Jian Guan, Minlie Huang, Juan Liu",cs.CL,knowledge,"Non-parallel text style transfer is an important task in natural language
generation. However, previous studies concentrate on the token or sentence
level, such as sentence sentiment and formality transfer, but neglect long
style transfer at the discourse level. Long texts usually involve more
complicated author linguistic preferences such as discourse structures than
sentences. In this paper, we formulate the task of non-parallel story
author-style transfer, which requires transferring an input story into a
specified author style while maintaining source semantics. To tackle this
problem, we propose a generation model, named StoryTrans, which leverages
discourse representations to capture source content information and transfer
them to target styles with learnable style embeddings. We use an additional
training objective to disentangle stylistic features from the learned discourse
representation to prevent the model from degenerating to an auto-encoder.
Moreover, to enhance content preservation, we design a mask-and-fill framework
to explicitly fuse style-specific keywords of source texts into generation.
Furthermore, we constructed new datasets for this task in Chinese and English,
respectively. Extensive experiments show that our model outperforms strong
baselines in overall performance of style transfer and content preservation.",2022-08-29
"GenTUS: Simulating User Behaviour and Language in Task-oriented
  Dialogues with Generative Transformers",2022-08-23 09:01:17+00:00,http://arxiv.org/abs/2208.10817v1,"Hsien-Chin Lin, Christian Geishauser, Shutong Feng, Nurul Lubis, Carel van Niekerk, Michael Heck, Milica Gašić",cs.CL,knowledge,"User simulators (USs) are commonly used to train task-oriented dialogue
systems (DSs) via reinforcement learning. The interactions often take place on
semantic level for efficiency, but there is still a gap from semantic actions
to natural language, which causes a mismatch between training and deployment
environment. Incorporating a natural language generation (NLG) module with USs
during training can partly deal with this problem. However, since the policy
and NLG of USs are optimised separately, these simulated user utterances may
not be natural enough in a given context. In this work, we propose a generative
transformer-based user simulator (GenTUS). GenTUS consists of an
encoder-decoder structure, which means it can optimise both the user policy and
natural language generation jointly. GenTUS generates both semantic actions and
natural language utterances, preserving interpretability and enhancing language
variation. In addition, by representing the inputs and outputs as word
sequences and by using a large pre-trained language model we can achieve
generalisability in feature representation. We evaluate GenTUS with automatic
metrics and human evaluation. Our results show that GenTUS generates more
natural language and is able to transfer to an unseen ontology in a zero-shot
fashion. In addition, its behaviour can be further shaped with reinforcement
learning opening the door to training specialised user simulators.",2022-08-23
Automatic tagging of knowledge points for K12 math problems,2022-08-21 11:11:30+00:00,http://arxiv.org/abs/2208.09867v1,"Xiaolu Wang, Ziqi Ding, Liangyu Chen",cs.CL,knowledge,"Automatic tagging of knowledge points for practice problems is the basis for
managing question bases and improving the automation and intelligence of
education. Therefore, it is of great practical significance to study the
automatic tagging technology for practice problems. However, there are few
studies on the automatic tagging of knowledge points for math problems. Math
texts have more complex structures and semantics compared with general texts
because they contain unique elements such as symbols and formulas. Therefore,
it is difficult to meet the accuracy requirement of knowledge point prediction
by directly applying the text classification techniques in general domains. In
this paper, K12 math problems taken as the research object, the LABS model
based on label-semantic attention and multi-label smoothing combining textual
features is proposed to improve the automatic tagging of knowledge points for
math problems. The model combines the text classification techniques in general
domains and the unique features of math texts. The results show that the models
using label-semantic attention or multi-label smoothing perform better on
precision, recall, and F1-score metrics than the traditional BiLSTM model,
while the LABS model using both performs best. It can be seen that label
information can guide the neural networks to extract meaningful information
from the problem text, which improves the text classification performance of
the model. Moreover, multi-label smoothing combining textual features can fully
explore the relationship between text and labels, improve the model's
prediction ability for new data and improve the model's classification
accuracy.",2022-08-21
"Performance Optimization for Semantic Communications: An Attention-based
  Reinforcement Learning Approach",2022-08-17 11:39:16+00:00,http://arxiv.org/abs/2208.08239v1,"Yining Wang, Mingzhe Chen, Tao Luo, Walid Saad, Dusit Niyato, H. Vincent Poor, Shuguang Cui","cs.IT, cs.AI, math.IT",knowledge,"In this paper, a semantic communication framework is proposed for textual
data transmission. In the studied model, a base station (BS) extracts the
semantic information from textual data, and transmits it to each user. The
semantic information is modeled by a knowledge graph (KG) that consists of a
set of semantic triples. After receiving the semantic information, each user
recovers the original text using a graph-to-text generation model. To measure
the performance of the considered semantic communication framework, a metric of
semantic similarity (MSS) that jointly captures the semantic accuracy and
completeness of the recovered text is proposed. Due to wireless resource
limitations, the BS may not be able to transmit the entire semantic information
to each user and satisfy the transmission delay constraint. Hence, the BS must
select an appropriate resource block for each user as well as determine and
transmit part of the semantic information to the users. As such, we formulate
an optimization problem whose goal is to maximize the total MSS by jointly
optimizing the resource allocation policy and determining the partial semantic
information to be transmitted. To solve this problem, a
proximal-policy-optimization-based reinforcement learning (RL) algorithm
integrated with an attention network is proposed. The proposed algorithm can
evaluate the importance of each triple in the semantic information using an
attention network and then, build a relationship between the importance
distribution of the triples in the semantic information and the total MSS.
Compared to traditional RL algorithms, the proposed algorithm can dynamically
adjust its learning rate thus ensuring convergence to a locally optimal
solution.",2022-08-17
Understanding Attention for Vision-and-Language Tasks,2022-08-17 06:45:07+00:00,http://arxiv.org/abs/2208.08104v1,"Feiqi Cao, Soyeon Caren Han, Siqu Long, Changwei Xu, Josiah Poon","cs.CV, cs.CL",knowledge,"Attention mechanism has been used as an important component across
Vision-and-Language(VL) tasks in order to bridge the semantic gap between
visual and textual features. While attention has been widely used in VL tasks,
it has not been examined the capability of different attention alignment
calculation in bridging the semantic gap between visual and textual clues. In
this research, we conduct a comprehensive analysis on understanding the role of
attention alignment by looking into the attention score calculation methods and
check how it actually represents the visual region's and textual token's
significance for the global assessment. We also analyse the conditions which
attention score calculation mechanism would be more (or less) interpretable,
and which may impact the model performance on three different VL tasks,
including visual question answering, text-to-image generation, text-and-image
matching (both sentence and image retrieval). Our analysis is the first of its
kind and provides useful insights of the importance of each attention alignment
score calculation when applied at the training phase of VL tasks, commonly
ignored in attention-based cross modal models, and/or pretrained models.",2022-08-17
"A Representation Modeling Based Language GAN with Completely Random
  Initialization",2022-08-04 08:56:04+00:00,http://arxiv.org/abs/2208.02531v1,"Da Ren, Qing Li",cs.CL,knowledge,"Text generative models trained via Maximum Likelihood Estimation (MLE) suffer
from the notorious exposure bias problem, and Generative Adversarial Networks
(GANs) are shown to have potential to tackle it. Existing language GANs adopt
estimators like REINFORCE or continuous relaxations to model word
distributions. The inherent limitations of such estimators lead current models
to rely on pre-training techniques (MLE pre-training or pre-trained
embeddings). Representation modeling methods which are free from those
limitations, however, are seldom explored because of its poor performance in
previous attempts. Our analyses reveal that invalid sampling method and
unhealthy gradients are the main contributors to its unsatisfactory
performance. In this work, we present two techniques to tackle these problems:
dropout sampling and fully normalized LSTM. Based on these two techniques, we
propose InitialGAN whose parameters are randomly initialized completely.
Besides, we introduce a new evaluation metric, Least Coverage Rate, to better
evaluate the quality of generated samples. The experimental results demonstrate
that InitialGAN outperforms both MLE and other compared models. To the best of
our knowledge, it is the first time a language GAN can outperform MLE without
any pre-training techniques.",2022-08-04
"LaKo: Knowledge-driven Visual Question Answering via Late
  Knowledge-to-Text Injection",2022-07-26 13:29:51+00:00,http://arxiv.org/abs/2207.12888v1,"Zhuo Chen, Yufeng Huang, Jiaoyan Chen, Yuxia Geng, Yin Fang, Jeff Pan, Ningyu Zhang, Wen Zhang","cs.CV, cs.AI",knowledge,"Visual question answering (VQA) often requires an understanding of visual
concepts and language semantics, which relies on external knowledge. Most
existing methods exploit pre-trained language models or/and unstructured text,
but the knowledge in these resources are often incomplete and noisy. Some
methods prefer to use knowledge graphs (KGs) which often have intensive
structured knowledge, but the research is still quite preliminary. In this
paper, we propose LaKo, a knowledge-driven VQA method via Late
Knowledge-to-text Injection. To effectively incorporate an external KG, we
transfer triples into text and propose a late injection mechanism. Finally we
address VQA as a text generation task with an effective encoder-decoder
paradigm. In the evaluation with OKVQA datasets, our method achieves
state-of-the-art results.",2022-07-26
