title,pubdate,id,authors,categories,search,abstract,displaydate
"Synthesis and Evaluation of a Domain-specific Large Data Set for
  Dungeons & Dragons",2022-12-18 12:54:45+00:00,http://arxiv.org/abs/2212.09080v1,"Akila Peiris, Nisansa de Silva","cs.CL, cs.LG",knowledge,"This paper introduces the Forgotten Realms Wiki (FRW) data set and domain
specific natural language generation using FRW along with related analyses.
Forgotten Realms is the de-facto default setting of the popular open ended
tabletop fantasy role playing game, Dungeons & Dragons. The data set was
extracted from the Forgotten Realms Fandom wiki consisting of more than over
45,200 articles. The FRW data set is constituted of 11 sub-data sets in a
number of formats: raw plain text, plain text annotated by article title,
directed link graphs, wiki info-boxes annotated by the wiki article title,
Poincar\'e embedding of first link graph, multiple Word2Vec and Doc2Vec models
of the corpus. This is the first data set of this size for the Dungeons &
Dragons domain. We then present a pairwise similarity comparison benchmark
which utilizes similarity measures. In addition, we perform D&D domain specific
natural language generation using the corpus and evaluate the named entity
classification with respect to the lore of Forgotten Realms.",2022-12-18
Plansformer: Generating Symbolic Plans using Transformers,2022-12-16 19:06:49+00:00,http://arxiv.org/abs/2212.08681v1,"Vishal Pallagani, Bharath Muppasani, Keerthiram Murugesan, Francesca Rossi, Lior Horesh, Biplav Srivastava, Francesco Fabiano, Andrea Loreggia",cs.AI,knowledge,"Large Language Models (LLMs) have been the subject of active research,
significantly advancing the field of Natural Language Processing (NLP). From
BERT to BLOOM, LLMs have surpassed state-of-the-art results in various natural
language tasks such as question answering, summarization, and text generation.
Many ongoing efforts focus on understanding LLMs' capabilities, including their
knowledge of the world, syntax, and semantics. However, extending the textual
prowess of LLMs to symbolic reasoning has been slow and predominantly focused
on tackling problems related to the mathematical field. In this paper, we
explore the use of LLMs for automated planning - a branch of AI concerned with
the realization of action sequences (plans) to achieve a goal, typically
executed by intelligent agents, autonomous robots, and unmanned vehicles. We
introduce Plansformer; an LLM fine-tuned on planning problems and capable of
generating plans with favorable behavior in terms of correctness and length
with reduced knowledge-engineering efforts. We also demonstrate the
adaptability of Plansformer in solving different planning domains with varying
complexities, owing to the transfer learning abilities of LLMs. For one
configuration of Plansformer, we achieve ~97% valid plans, out of which ~95%
are optimal for Towers of Hanoi - a puzzle-solving domain.",2022-12-16
"MURMUR: Modular Multi-Step Reasoning for Semi-Structured Data-to-Text
  Generation",2022-12-16 17:36:23+00:00,http://arxiv.org/abs/2212.08607v1,"Swarnadeep Saha, Xinyan Velocity Yu, Mohit Bansal, Ramakanth Pasunuru, Asli Celikyilmaz","cs.CL, cs.AI, cs.LG",knowledge,"Prompting large language models has enabled significant recent progress in
multi-step reasoning over text. However, when applied to text generation from
semi-structured data (e.g., graphs or tables), these methods typically suffer
from low semantic coverage, hallucination, and logical inconsistency. We
propose MURMUR, a neuro-symbolic modular approach to text generation from
semi-structured data with multi-step reasoning. MURMUR is a best-first search
method that generates reasoning paths using: (1) neural and symbolic modules
with specific linguistic and logical skills, (2) a grammar whose production
rules define valid compositions of modules, and (3) value functions that assess
the quality of each reasoning step. We conduct experiments on two diverse
data-to-text generation tasks like WebNLG and LogicNLG. These tasks differ in
their data representations (graphs and tables) and span multiple linguistic and
logical skills. MURMUR obtains significant improvements over recent few-shot
baselines like direct prompting and chain-of-thought prompting, while also
achieving comparable performance to fine-tuned GPT-2 on out-of-domain data.
Moreover, human evaluation shows that MURMUR generates highly faithful and
correct reasoning paths that lead to 26% more logically consistent summaries on
LogicNLG, compared to direct prompting.",2022-12-16
ROSCOE: A Suite of Metrics for Scoring Step-by-Step Reasoning,2022-12-15 15:52:39+00:00,http://arxiv.org/abs/2212.07919v1,"Olga Golovneva, Moya Chen, Spencer Poff, Martin Corredor, Luke Zettlemoyer, Maryam Fazel-Zarandi, Asli Celikyilmaz","cs.CL, cs.LG",knowledge,"Large language models show improved downstream task performance when prompted
to generate step-by-step reasoning to justify their final answers. These
reasoning steps greatly improve model interpretability and verification, but
objectively studying their correctness (independent of the final answer) is
difficult without reliable methods for automatic evaluation. We simply do not
know how often the stated reasoning steps actually support the final end task
predictions. In this work, we present ROSCOE, a suite of interpretable,
unsupervised automatic scores that improve and extend previous text generation
evaluation metrics. To evaluate ROSCOE against baseline metrics, we design a
typology of reasoning errors and collect synthetic and human evaluation scores
on commonly used reasoning datasets. In contrast with existing metrics, ROSCOE
can measure semantic consistency, logicality, informativeness, fluency, and
factuality - among other traits - by leveraging properties of step-by-step
rationales. We empirically verify the strength of our metrics on five human
annotated and six programmatically perturbed diagnostics datasets - covering a
diverse set of tasks that require reasoning skills and show that ROSCOE can
consistently outperform baseline metrics.",2022-12-15
"Collaborating Heterogeneous Natural Language Processing Tasks via
  Federated Learning",2022-12-12 09:27:50+00:00,http://arxiv.org/abs/2212.05789v1,"Chenhe Dong, Yuexiang Xie, Bolin Ding, Ying Shen, Yaliang Li",cs.CL,knowledge,"The increasing privacy concerns on personal private text data promote the
development of federated learning (FL) in recent years. However, the existing
studies on applying FL in NLP are not suitable to coordinate participants with
heterogeneous or private learning objectives. In this study, we further broaden
the application scope of FL in NLP by proposing an Assign-Then-Contrast
(denoted as ATC) framework, which enables clients with heterogeneous NLP tasks
to construct an FL course and learn useful knowledge from each other.
Specifically, the clients are suggested to first perform local training with
the unified tasks assigned by the server rather than using their own learning
objectives, which is called the Assign training stage. After that, in the
Contrast training stage, clients train with different local learning objectives
and exchange knowledge with other clients who contribute consistent and useful
model updates. We conduct extensive experiments on six widely-used datasets
covering both Natural Language Understanding (NLU) and Natural Language
Generation (NLG) tasks, and the proposed ATC framework achieves significant
improvements compared with various baseline methods. The source code is
available at
\url{https://github.com/alibaba/FederatedScope/tree/master/federatedscope/nlp/hetero_tasks}.",2022-12-12
Discovering Latent Knowledge in Language Models Without Supervision,2022-12-07 18:17:56+00:00,http://arxiv.org/abs/2212.03827v1,"Collin Burns, Haotian Ye, Dan Klein, Jacob Steinhardt","cs.CL, cs.AI, cs.LG",knowledge,"Existing techniques for training language models can be misaligned with the
truth: if we train models with imitation learning, they may reproduce errors
that humans make; if we train them to generate text that humans rate highly,
they may output errors that human evaluators can't detect. We propose
circumventing this issue by directly finding latent knowledge inside the
internal activations of a language model in a purely unsupervised way.
Specifically, we introduce a method for accurately answering yes-no questions
given only unlabeled model activations. It works by finding a direction in
activation space that satisfies logical consistency properties, such as that a
statement and its negation have opposite truth values. We show that despite
using no supervision and no model outputs, our method can recover diverse
knowledge represented in large language models: across 6 models and 10
question-answering datasets, it outperforms zero-shot accuracy by 4\% on
average. We also find that it cuts prompt sensitivity in half and continues to
maintain high accuracy even when models are prompted to generate incorrect
answers. Our results provide an initial step toward discovering what language
models know, distinct from what they say, even when we don't have access to
explicit ground truth labels.",2022-12-07
"Harnessing Knowledge and Reasoning for Human-Like Natural Language
  Generation: A Brief Review",2022-12-07 16:18:19+00:00,http://arxiv.org/abs/2212.03747v1,"Jiangjie Chen, Yanghua Xiao",cs.CL,knowledge,"The rapid development and application of natural language generation (NLG)
techniques has revolutionized the field of automatic text production. However,
these techniques are still limited in their ability to produce human-like text
that is truly reasonable and informative. In this paper, we explore the
importance of NLG being guided by knowledge, in order to convey human-like
reasoning through language generation. We propose ten goals for intelligent NLG
systems to pursue, and briefly review the achievement of NLG techniques guided
by knowledge and reasoning. We also conclude by envisioning future directions
and challenges in the pursuit of these goals.",2022-12-07
Momentum Decoding: Open-ended Text Generation As Graph Exploration,2022-12-05 11:16:47+00:00,http://arxiv.org/abs/2212.02175v1,"Tian Lan, Yixuan Su, Shuhang Liu, Heyan Huang, Xian-Ling Mao",cs.CL,knowledge,"Open-ended text generation with autoregressive language models (LMs) is one
of the core tasks in natural language processing. However, maximization-based
decoding methods (e.g., greedy/beam search) often lead to the degeneration
problem, i.e., the generated text is unnatural and contains undesirable
repetitions. Existing solutions to this problem either introduce randomness
prone to incoherence or require a look-ahead mechanism that demands extra
computational overhead. In this study, we formulate open-ended text generation
from a new perspective, i.e., we view it as an exploration process within a
directed graph. Thereby, we understand the phenomenon of degeneration as
circular loops within the directed graph. Based on our formulation, we propose
a novel decoding method -- \textit{momentum decoding} -- which encourages the
LM to \textit{greedily} explore new nodes outside the current graph. Meanwhile,
it also allows the LM to return to the existing nodes with a momentum
downgraded by a pre-defined resistance function. We extensively test our
approach on three benchmarks from different domains through automatic and human
evaluations. The results show that momentum decoding performs comparably with
the current state of the art while enjoying notably improved inference speed
and computation FLOPs. Furthermore, we conduct a detailed analysis to reveal
the merits and inner workings of our approach. Our codes and other related
resources are publicly available at
https://github.com/gmftbyGMFTBY/MomentumDecoding.",2022-12-05
"Learning Automata-Based Task Knowledge Representation from Large-Scale
  Generative Language Models",2022-12-04 22:34:16+00:00,http://arxiv.org/abs/2212.01944v1,"Yunhao Yang, Jean-Raphaël Gaglione, Ufuk Topcu","cs.FL, cs.CL",knowledge,"Automata-based representations play an important role in control and planning
in sequential decision-making, but obtaining high-level task knowledge for
building automata is often difficult. Although large-scale generative language
models (GLMs) can help automatically distill task knowledge, the textual
outputs from GLMs are not directly utilizable in sequential decision-making. We
resolve this problem by proposing a novel algorithm named GLM2FSA, which
obtains high-level task knowledge, represented in a finite state automaton
(FSA), from a given brief description of the task goal. GLM2FSA sends queries
to a GLM for task knowledge in textual form and then builds a FSA to represent
the textual knowledge. This algorithm fills the gap between text and
automata-based representations, and the constructed FSA can be directly
utilized in sequential decision-making. We provide examples to demonstrate how
GLM2FSA constructs FSAs to represent knowledge encoded in the texts generated
by the large-scale GLMs.",2022-12-04
"What do you MEME? Generating Explanations for Visual Semantic Role
  Labelling in Memes",2022-12-01 18:21:36+00:00,http://arxiv.org/abs/2212.00715v1,"Shivam Sharma, Siddhant Agarwal, Tharun Suresh, Preslav Nakov, Md. Shad Akhtar, Tanmoy Charkraborty","cs.CY, cs.CL",knowledge,"Memes are powerful means for effective communication on social media. Their
effortless amalgamation of viral visuals and compelling messages can have
far-reaching implications with proper marketing. Previous research on memes has
primarily focused on characterizing their affective spectrum and detecting
whether the meme's message insinuates any intended harm, such as hate, offense,
racism, etc. However, memes often use abstraction, which can be elusive. Here,
we introduce a novel task - EXCLAIM, generating explanations for visual
semantic role labeling in memes. To this end, we curate ExHVV, a novel dataset
that offers natural language explanations of connotative roles for three types
of entities - heroes, villains, and victims, encompassing 4,680 entities
present in 3K memes. We also benchmark ExHVV with several strong unimodal and
multimodal baselines. Moreover, we posit LUMEN, a novel multimodal, multi-task
learning framework that endeavors to address EXCLAIM optimally by jointly
learning to predict the correct semantic roles and correspondingly to generate
suitable natural language explanations. LUMEN distinctly outperforms the best
baseline across 18 standard natural language generation evaluation metrics. Our
systematic evaluation and analyses demonstrate that characteristic multimodal
cues required for adjudicating semantic roles are also helpful for generating
suitable explanations.",2022-12-01
"CliMedBERT: A Pre-trained Language Model for Climate and Health-related
  Text",2022-12-01 17:44:09+00:00,http://arxiv.org/abs/2212.00689v1,"B. Jalalzadeh Fard, S. A. Hasan, J. E. Bell","cs.CL, 68T50, I.2.7",knowledge,"Climate change is threatening human health in unprecedented orders and many
ways. These threats are expected to grow unless effective and evidence-based
policies are developed and acted upon to minimize or eliminate them. Attaining
such a task requires the highest degree of the flow of knowledge from science
into policy. The multidisciplinary, location-specific, and vastness of
published science makes it challenging to keep track of novel work in this
area, as well as making the traditional knowledge synthesis methods inefficient
in infusing science into policy. To this end, we consider developing multiple
domain-specific language models (LMs) with different variations from Climate-
and Health-related information, which can serve as a foundational step toward
capturing available knowledge to enable solving different tasks, such as
detecting similarities between climate- and health-related concepts,
fact-checking, relation extraction, evidence of health effects to policy text
generation, and more. To our knowledge, this is the first work that proposes
developing multiple domain-specific language models for the considered domains.
We will make the developed models, resources, and codebase available for the
researchers.",2022-12-01
"On the Importance of Image Encoding in Automated Chest X-Ray Report
  Generation",2022-11-24 08:02:52+00:00,http://arxiv.org/abs/2211.13465v1,"Otabek Nazarov, Mohammad Yaqub, Karthik Nandakumar","cs.CV, cs.AI",knowledge,"Chest X-ray is one of the most popular medical imaging modalities due to its
accessibility and effectiveness. However, there is a chronic shortage of
well-trained radiologists who can interpret these images and diagnose the
patient's condition. Therefore, automated radiology report generation can be a
very helpful tool in clinical practice. A typical report generation workflow
consists of two main steps: (i) encoding the image into a latent space and (ii)
generating the text of the report based on the latent image embedding. Many
existing report generation techniques use a standard convolutional neural
network (CNN) architecture for image encoding followed by a Transformer-based
decoder for medical text generation. In most cases, CNN and the decoder are
trained jointly in an end-to-end fashion. In this work, we primarily focus on
understanding the relative importance of encoder and decoder components.
Towards this end, we analyze four different image encoding approaches: direct,
fine-grained, CLIP-based, and Cluster-CLIP-based encodings in conjunction with
three different decoders on the large-scale MIMIC-CXR dataset. Among these
encoders, the cluster CLIP visual encoder is a novel approach that aims to
generate more discriminative and explainable representations. CLIP-based
encoders produce comparable results to traditional CNN-based encoders in terms
of NLP metrics, while fine-grained encoding outperforms all other encoders both
in terms of NLP and clinical accuracy metrics, thereby validating the
importance of image encoder to effectively extract semantic information. GitHub
repository: https://github.com/mudabek/encoding-cxr-report-gen",2022-11-24
Retrieval-Augmented Multimodal Language Modeling,2022-11-22 20:26:44+00:00,http://arxiv.org/abs/2211.12561v1,"Michihiro Yasunaga, Armen Aghajanyan, Weijia Shi, Rich James, Jure Leskovec, Percy Liang, Mike Lewis, Luke Zettlemoyer, Wen-tau Yih","cs.CV, cs.CL, cs.LG",knowledge,"Recent multimodal models such as DALL-E and CM3 have achieved remarkable
progress in text-to-image and image-to-text generation. However, these models
store all learned knowledge (e.g., the appearance of the Eiffel Tower) in the
model parameters, requiring increasingly larger models and training data to
capture more knowledge. To integrate knowledge in a more scalable and modular
way, we propose a retrieval-augmented multimodal model, which enables a base
multimodal model (generator) to refer to relevant knowledge fetched by a
retriever from external memory (e.g., multimodal documents on the web).
Specifically, we implement a retriever using the pretrained CLIP model and a
generator using the CM3 Transformer architecture, and train this model using
the LAION dataset. Our resulting model, named Retrieval-Augmented CM3 (RA-CM3),
is the first multimodal model that can retrieve and generate mixtures of text
and images. We show that RA-CM3 significantly outperforms baseline multimodal
models such as DALL-E and CM3 on both image and caption generation tasks (12
FID and 17 CIDEr improvements on MS-COCO), while requiring much less compute
for training (<30% of DALL-E). Moreover, we show that RA-CM3 exhibits novel
capabilities such as knowledge-intensive image generation and multimodal
in-context learning.",2022-11-22
"Towards Computationally Verifiable Semantic Grounding for Language
  Models",2022-11-16 17:35:52+00:00,http://arxiv.org/abs/2211.09070v1,"Chris Alberti, Kuzman Ganchev, Michael Collins, Sebastian Gehrmann, Ciprian Chelba",cs.CL,knowledge,"The paper presents an approach to semantic grounding of language models (LMs)
that conceptualizes the LM as a conditional model generating text given a
desired semantic message formalized as a set of entity-relationship triples. It
embeds the LM in an auto-encoder by feeding its output to a semantic parser
whose output is in the same representation domain as the input message.
Compared to a baseline that generates text using greedy search, we demonstrate
two techniques that improve the fluency and semantic accuracy of the generated
text: The first technique samples multiple candidate text sequences from which
the semantic parser chooses. The second trains the language model while keeping
the semantic parser frozen to improve the semantic accuracy of the
auto-encoder. We carry out experiments on the English WebNLG 3.0 data set,
using BLEU to measure the fluency of generated text and standard parsing
metrics to measure semantic accuracy. We show that our proposed approaches
significantly improve on the greedy search baseline. Human evaluation
corroborates the results of the automatic evaluation experiments.",2022-11-16
kogito: A Commonsense Knowledge Inference Toolkit,2022-11-15 19:04:13+00:00,http://arxiv.org/abs/2211.08451v1,"Mete Ismayilzada, Antoine Bosselut",cs.CL,knowledge,"In this paper, we present kogito, an open-source tool for generating
commonsense inferences about situations described in text. kogito provides an
intuitive and extensible interface to interact with natural language generation
models that can be used for hypothesizing commonsense knowledge inference from
a textual input. In particular, kogito offers several features for targeted,
multi-granularity knowledge generation. These include a standardized API for
training and evaluating knowledge models, and generating and filtering
inferences from them. We also include helper functions for converting natural
language texts into a format ingestible by knowledge models - intermediate
pipeline stages such as knowledge head extraction from text, heuristic and
model-based knowledge head-relation matching, and an ability to define and use
custom knowledge relations. We make the code for kogito available at
https://github.com/epfl-nlp/kogito along with thorough documentation at
https://kogito.readthedocs.io.",2022-11-15
A Survey of Knowledge-Enhanced Pre-trained Language Models,2022-11-11 04:29:02+00:00,http://arxiv.org/abs/2211.05994v3,"Linmei Hu, Zeyi Liu, Ziwang Zhao, Lei Hou, Liqiang Nie, Juanzi Li",cs.CL,knowledge,"Pre-trained Language Models (PLMs) which are trained on large text corpus via
self-supervised learning method, have yielded promising performance on various
tasks in Natural Language Processing (NLP). However, though PLMs with huge
parameters can effectively possess rich knowledge learned from massive training
text and benefit downstream tasks at the fine-tuning stage, they still have
some limitations such as poor reasoning ability due to the lack of external
knowledge. Research has been dedicated to incorporating knowledge into PLMs to
tackle these issues. In this paper, we present a comprehensive review of
Knowledge-Enhanced Pre-trained Language Models (KE-PLMs) to provide a clear
insight into this thriving field. We introduce appropriate taxonomies
respectively for Natural Language Understanding (NLU) and Natural Language
Generation (NLG) to highlight these two main tasks of NLP. For NLU, we divide
the types of knowledge into four categories: linguistic knowledge, text
knowledge, knowledge graph (KG), and rule knowledge. The KE-PLMs for NLG are
categorized into KG-based and retrieval-based methods. Finally, we point out
some promising future directions of KE-PLMs.",2022-11-11
"CCPrompt: Counterfactual Contrastive Prompt-Tuning for Many-Class
  Classification",2022-11-11 03:45:59+00:00,http://arxiv.org/abs/2211.05987v1,"Yang Li, Canran Xu, Tao Shen, Jing Jiang, Guodong Long",cs.CL,knowledge,"With the success of the prompt-tuning paradigm in Natural Language Processing
(NLP), various prompt templates have been proposed to further stimulate
specific knowledge for serving downstream tasks, e.g., machine translation,
text generation, relation extraction, and so on. Existing prompt templates are
mainly shared among all training samples with the information of task
description. However, training samples are quite diverse. The sharing task
description is unable to stimulate the unique task-related information in each
training sample, especially for tasks with the finite-label space. To exploit
the unique task-related information, we imitate the human decision process
which aims to find the contrastive attributes between the objective factual and
their potential counterfactuals. Thus, we propose the \textbf{C}ounterfactual
\textbf{C}ontrastive \textbf{Prompt}-Tuning (CCPrompt) approach for many-class
classification, e.g., relation classification, topic classification, and entity
typing. Compared with simple classification tasks, these tasks have more
complex finite-label spaces and are more rigorous for prompts. First of all, we
prune the finite label space to construct fact-counterfactual pairs. Then, we
exploit the contrastive attributes by projecting training instances onto every
fact-counterfactual pair. We further set up global prototypes corresponding
with all contrastive attributes for selecting valid contrastive attributes as
additional tokens in the prompt template. Finally, a simple Siamese
representation learning is employed to enhance the robustness of the model. We
conduct experiments on relation classification, topic classification, and
entity typing tasks in both fully supervised setting and few-shot setting. The
results indicate that our model outperforms former baselines.",2022-11-11
