title,pubdate,id,authors,categories,search,abstract,displaydate
"CHARD: Clinical Health-Aware Reasoning Across Dimensions for Text
  Generation Models",2022-10-09 07:16:58+00:00,http://arxiv.org/abs/2210.04191v1,"Steven Y. Feng, Vivek Khetan, Bogdan Sacaleanu, Anatole Gershman, Eduard Hovy","cs.CL, cs.AI, cs.LG",knowledge,"We motivate and introduce CHARD: Clinical Health-Aware Reasoning across
Dimensions, to investigate the capability of text generation models to act as
implicit clinical knowledge bases and generate free-flow textual explanations
about various health-related conditions across several dimensions. We collect
and present an associated dataset, CHARDat, consisting of explanations about 52
health conditions across three clinical dimensions. We conduct extensive
experiments using BART and T5 along with data augmentation, and perform
automatic, human, and qualitative analyses. We show that while our models can
perform decently, CHARD is very challenging with strong potential for further
exploration.",2022-10-09
BLAB Reporter: Automated journalism covering the Blue Amazon,2022-10-08 21:51:50+00:00,http://arxiv.org/abs/2210.06431v1,"Yan V. Sym, João Gabriel M. Campos, Fabio G. Cozman",cs.CL,knowledge,"This demo paper introduces the BLAB Reporter, a robot-journalist covering the
Brazilian Blue Amazon. The Reporter is based on a pipeline architecture for
Natural Language Generation; it offers daily reports, news summaries and
curious facts in Brazilian Portuguese. By collecting, storing and analysing
structured data from publicly available sources, the robot-journalist uses
domain knowledge to generate and publish texts in Twitter. Code and corpus are
publicly available",2022-10-08
Bird-Eye Transformers for Text Generation Models,2022-10-08 09:51:15+00:00,http://arxiv.org/abs/2210.03985v1,"Lei Sha, Yuhang Song, Yordan Yordanov, Tommaso Salvatori, Thomas Lukasiewicz",cs.CL,knowledge,"Transformers have become an indispensable module for text generation models
since their great success in machine translation. Previous works attribute
the~success of transformers to the query-key-value dot-product attention, which
provides a robust inductive bias by the fully connected token graphs. However,
we found that self-attention has a severe limitation. When predicting the
(i+1)-th token, self-attention only takes the i-th token as an information
collector, and it tends to give a high attention weight to those tokens similar
to itself. Therefore, most of the historical information that occurred before
the i-th token is not taken into consideration. Based on this observation, in
this paper, we propose a new architecture, called bird-eye transformer(BET),
which goes one step further to improve the performance of transformers by
reweighting self-attention to encourage it to focus more on important
historical information. We have conducted experiments on multiple text
generation tasks, including machine translation (2 datasets) and language
models (3 datasets). These experimental~results show that our proposed model
achieves a better performance than the baseline transformer architectures
on~all~datasets. The code is released at:
\url{https://sites.google.com/view/bet-transformer/home}.",2022-10-08
A Unified Encoder-Decoder Framework with Entity Memory,2022-10-07 01:15:30+00:00,http://arxiv.org/abs/2210.03273v1,"Zhihan Zhang, Wenhao Yu, Chenguang Zhu, Meng Jiang",cs.CL,knowledge,"Entities, as important carriers of real-world knowledge, play a key role in
many NLP tasks. We focus on incorporating entity knowledge into an
encoder-decoder framework for informative text generation. Existing approaches
tried to index, retrieve, and read external documents as evidence, but they
suffered from a large computational overhead. In this work, we propose an
encoder-decoder framework with an entity memory, namely EDMem. The entity
knowledge is stored in the memory as latent representations, and the memory is
pre-trained on Wikipedia along with encoder-decoder parameters. To precisely
generate entity names, we design three decoding methods to constrain entity
generation by linking entities in the memory. EDMem is a unified framework that
can be used on various entity-intensive question answering and generation
tasks. Extensive experimental results show that EDMem outperforms both
memory-based auto-encoder models and non-memory encoder-decoder models.",2022-10-07
"Unsupervised Sentence Textual Similarity with Compositional Phrase
  Semantics",2022-10-05 14:14:04+00:00,http://arxiv.org/abs/2210.02284v1,"Zihao Wang, Jiaheng Dou, Yong Zhang",cs.CL,knowledge,"Measuring Sentence Textual Similarity (STS) is a classic task that can be
applied to many downstream NLP applications such as text generation and
retrieval. In this paper, we focus on unsupervised STS that works on various
domains but only requires minimal data and computational resources.
Theoretically, we propose a light-weighted Expectation-Correction (EC)
formulation for STS computation. EC formulation unifies unsupervised STS
approaches including the cosine similarity of Additively Composed (AC) sentence
embeddings, Optimal Transport (OT), and Tree Kernels (TK). Moreover, we propose
the Recursive Optimal Transport Similarity (ROTS) algorithm to capture the
compositional phrase semantics by composing multiple recursive EC formulations.
ROTS finishes in linear time and is faster than its predecessors. ROTS is
empirically more effective and scalable than previous approaches. Extensive
experiments on 29 STS tasks under various settings show the clear advantage of
ROTS over existing approaches. Detailed ablation studies demonstrate the
effectiveness of our approaches.",2022-10-05
Synonym Detection Using Syntactic Dependency And Neural Embeddings,2022-09-30 03:16:41+00:00,http://arxiv.org/abs/2209.15202v1,"Dongqiang Yang, Pikun Wang, Xiaodong Sun, Ning Li","cs.CL, cs.AI",knowledge,"Recent advances on the Vector Space Model have significantly improved some
NLP applications such as neural machine translation and natural language
generation. Although word co-occurrences in context have been widely used in
counting-/predicting-based distributional models, the role of syntactic
dependencies in deriving distributional semantics has not yet been thoroughly
investigated. By comparing various Vector Space Models in detecting synonyms in
TOEFL, we systematically study the salience of syntactic dependencies in
accounting for distributional similarity. We separate syntactic dependencies
into different groups according to their various grammatical roles and then use
context-counting to construct their corresponding raw and SVD-compressed
matrices. Moreover, using the same training hyperparameters and corpora, we
study typical neural embeddings in the evaluation. We further study the
effectiveness of injecting human-compiled semantic knowledge into neural
embeddings on computing distributional similarity. Our results show that the
syntactically conditioned contexts can interpret lexical semantics better than
the unconditioned ones, whereas retrofitting neural embeddings with semantic
knowledge can significantly improve synonym detection.",2022-09-30
"Co-Writing Screenplays and Theatre Scripts with Language Models: An
  Evaluation by Industry Professionals",2022-09-29 17:26:22+00:00,http://arxiv.org/abs/2209.14958v1,"Piotr Mirowski, Kory W. Mathewson, Jaylen Pittman, Richard Evans","cs.HC, cs.CL",knowledge,"Language models are increasingly attracting interest from writers. However,
such models lack long-range semantic coherence, limiting their usefulness for
longform creative writing. We address this limitation by applying language
models hierarchically, in a system we call Dramatron. By building structural
context via prompt chaining, Dramatron can generate coherent scripts and
screenplays complete with title, characters, story beats, location
descriptions, and dialogue. We illustrate Dramatron's usefulness as an
interactive co-creative system with a user study of 15 theatre and film
industry professionals. Participants co-wrote theatre scripts and screenplays
with Dramatron and engaged in open-ended interviews. We report critical
reflections both from our interviewees and from independent reviewers who
watched stagings of the works to illustrate how both Dramatron and hierarchical
text generation could be useful for human-machine co-creativity. Finally, we
discuss the suitability of Dramatron for co-creativity, ethical considerations
-- including plagiarism and bias -- and participatory models for the design and
deployment of such tools.",2022-09-29
"DR.BENCH: Diagnostic Reasoning Benchmark for Clinical Natural Language
  Processing",2022-09-29 16:05:53+00:00,http://arxiv.org/abs/2209.14901v1,"Yanjun Gao, Dmitriy Dligach, Timothy Miller, John Caskey, Brihat Sharma, Matthew M Churpek, Majid Afshar","cs.CL, cs.AI",knowledge,"The meaningful use of electronic health records (EHR) continues to progress
in the digital era with clinical decision support systems augmented by
artificial intelligence. A priority in improving provider experience is to
overcome information overload and reduce the cognitive burden so fewer medical
errors and cognitive biases are introduced during patient care. One major type
of medical error is diagnostic error due to systematic or predictable errors in
judgment that rely on heuristics. The potential for clinical natural language
processing (cNLP) to model diagnostic reasoning in humans with forward
reasoning from data to diagnosis and potentially reduce the cognitive burden
and medical error has not been investigated. Existing tasks to advance the
science in cNLP have largely focused on information extraction and named entity
recognition through classification tasks. We introduce a novel suite of tasks
coined as Diagnostic Reasoning Benchmarks, DR.BENCH, as a new benchmark for
developing and evaluating cNLP models with clinical diagnostic reasoning
ability. The suite includes six tasks from ten publicly available datasets
addressing clinical text understanding, medical knowledge reasoning, and
diagnosis generation. DR.BENCH is the first clinical suite of tasks designed to
be a natural language generation framework to evaluate pre-trained language
models. Experiments with state-of-the-art pre-trained generative language
models using large general domain models and models that were continually
trained on a medical corpus demonstrate opportunities for improvement when
evaluated in DR. BENCH. We share DR. BENCH as a publicly available GitLab
repository with a systematic approach to load and evaluate models for the cNLP
community.",2022-09-29
FiD-Light: Efficient and Effective Retrieval-Augmented Text Generation,2022-09-28 17:54:55+00:00,http://arxiv.org/abs/2209.14290v1,"Sebastian Hofstätter, Jiecao Chen, Karthik Raman, Hamed Zamani","cs.CL, cs.IR",knowledge,"Retrieval-augmented generation models offer many benefits over standalone
language models: besides a textual answer to a given query they provide
provenance items retrieved from an updateable knowledge base. However, they are
also more complex systems and need to handle long inputs. In this work, we
introduce FiD-Light to strongly increase the efficiency of the state-of-the-art
retrieval-augmented FiD model, while maintaining the same level of
effectiveness. Our FiD-Light model constrains the information flow from the
encoder (which encodes passages separately) to the decoder (using concatenated
encoded representations). Furthermore, we adapt FiD-Light with re-ranking
capabilities through textual source pointers, to improve the top-ranked
provenance precision. Our experiments on a diverse set of seven knowledge
intensive tasks (KILT) show FiD-Light consistently improves the Pareto frontier
between query latency and effectiveness. FiD-Light with source pointing sets
substantial new state-of-the-art results on six KILT tasks for combined text
generation and provenance retrieval evaluation, while maintaining reasonable
efficiency.",2022-09-28
Informative Text Generation from Knowledge Triples,2022-09-26 14:35:57+00:00,http://arxiv.org/abs/2209.12733v1,"Zihao Fu, Yijiang River Dong, Lidong Bing, Wai Lam",cs.CL,knowledge,"As the development of the encoder-decoder architecture, researchers are able
to study the text generation tasks with broader types of data. Among them,
KB-to-text aims at converting a set of knowledge triples into human readable
sentences. In the original setting, the task assumes that the input triples and
the text are exactly aligned in the perspective of the embodied
knowledge/information. In this paper, we extend this setting and explore how to
facilitate the trained model to generate more informative text, namely,
containing more information about the triple entities but not conveyed by the
input triples. To solve this problem, we propose a novel memory augmented
generator that employs a memory network to memorize the useful knowledge
learned during the training and utilizes such information together with the
input triples to generate text in the operational or testing phase. We derive a
dataset from WebNLG for our new setting and conduct extensive experiments to
investigate the effectiveness of our model as well as uncover the intrinsic
characteristics of the setting.",2022-09-26
Controllable Text Generation for Open-Domain Creativity and Fairness,2022-09-24 22:40:01+00:00,http://arxiv.org/abs/2209.12099v1,Nanyun Peng,"cs.CL, cs.AI",knowledge,"Recent advances in large pre-trained language models have demonstrated strong
results in generating natural languages and significantly improved performances
for many natural language generation (NLG) applications such as machine
translation and text summarization. However, when the generation tasks are more
open-ended and the content is under-specified, existing techniques struggle to
generate long-term coherent and creative content. Moreover, the models exhibit
and even amplify social biases that are learned from the training corpora. This
happens because the generation models are trained to capture the surface
patterns (i.e. sequences of words), instead of capturing underlying semantics
and discourse structures, as well as background knowledge including social
norms. In this paper, I introduce our recent works on controllable text
generation to enhance the creativity and fairness of language generation
models. We explore hierarchical generation and constrained decoding, with
applications to creative language generation including story, poetry, and
figurative languages, and bias mitigation for generation models.",2022-09-24
"Can we do that simpler? Simple, Efficient, High-Quality Evaluation
  Metrics for NLG",2022-09-20 10:12:07+00:00,http://arxiv.org/abs/2209.09593v1,"Jens Grünwald, Christoph Leiter, Steffen Eger","cs.CL, cs.LG",knowledge,"We explore efficient evaluation metrics for Natural Language Generation
(NLG). To implement efficient metrics, we replace (i) computation-heavy
transformers in metrics such as BERTScore, MoverScore, BARTScore, XMoverScore,
etc. with lighter versions (such as distilled ones) and (ii) cubic inference
time alignment algorithms such as Word Mover Distance with linear and quadratic
approximations. We consider six evaluation metrics (both monolingual and
multilingual), assessed on three different machine translation datasets, and 16
light-weight transformers as replacement. We find, among others, that (a)
TinyBERT shows best quality-efficiency tradeoff for semantic similarity metrics
of the BERTScore family, retaining 97\% quality and being 5x faster at
inference time on average, (b) there is a large difference in speed-ups on CPU
vs. GPU (much higher speed-ups on CPU), and (c) WMD approximations yield no
efficiency gains but lead to a substantial drop in quality on 2 out of 3
datasets we examine.",2022-09-20
Selective Token Generation for Few-shot Natural Language Generation,2022-09-17 00:48:52+00:00,http://arxiv.org/abs/2209.08206v1,"Daejin Jo, Taehwan Kwon, Eun-Sol Kim, Sungwoong Kim","cs.CL, cs.LG",knowledge,"Natural language modeling with limited training data is a challenging
problem, and many algorithms make use of large-scale pretrained language models
(PLMs) for this due to its great generalization ability. Among them, additive
learning that incorporates a task-specific adapter on top of the fixed
large-scale PLM has been popularly used in the few-shot setting. However, this
added adapter is still easy to disregard the knowledge of the PLM especially
for few-shot natural language generation (NLG) since an entire sequence is
usually generated by only the newly trained adapter. Therefore, in this work,
we develop a novel additive learning algorithm based on reinforcement learning
(RL) that selectively outputs language tokens between the task-general PLM and
the task-specific adapter during both training and inference. This output token
selection over the two generators allows the adapter to take into account
solely the task-relevant parts in sequence generation, and therefore makes it
more robust to overfitting as well as more stable in RL training. In addition,
to obtain the complementary adapter from the PLM for each few-shot task, we
exploit a separate selecting module that is also simultaneously trained using
RL. Experimental results on various few-shot NLG tasks including question
answering, data-to-text generation and text summarization demonstrate that the
proposed selective token generation significantly outperforms the previous
additive learning algorithms based on the PLMs.",2022-09-17
"TwHIN-BERT: A Socially-Enriched Pre-trained Language Model for
  Multilingual Tweet Representations",2022-09-15 19:01:21+00:00,http://arxiv.org/abs/2209.07562v1,"Xinyang Zhang, Yury Malkov, Omar Florez, Serim Park, Brian McWilliams, Jiawei Han, Ahmed El-Kishky",cs.CL,knowledge,"We present TwHIN-BERT, a multilingual language model trained on in-domain
data from the popular social network Twitter. TwHIN-BERT differs from prior
pre-trained language models as it is trained with not only text-based
self-supervision, but also with a social objective based on the rich social
engagements within a Twitter heterogeneous information network (TwHIN). Our
model is trained on 7 billion tweets covering over 100 distinct languages
providing a valuable representation to model short, noisy, user-generated text.
We evaluate our model on a variety of multilingual social recommendation and
semantic understanding tasks and demonstrate significant metric improvement
over established pre-trained language models. We will freely open-source
TwHIN-BERT and our curated hashtag prediction and social engagement benchmark
datasets to the research community.",2022-09-15
Distribution Aware Metrics for Conditional Natural Language Generation,2022-09-15 17:58:13+00:00,http://arxiv.org/abs/2209.07518v1,"David M Chan, Yiming Ni, Austin Myers, Sudheendra Vijayanarasimhan, David A Ross, John Canny","cs.CL, cs.AI, cs.CV, cs.LG",knowledge,"Traditional automated metrics for evaluating conditional natural language
generation use pairwise comparisons between a single generated text and the
best-matching gold-standard ground truth text. When multiple ground truths are
available, scores are aggregated using an average or max operation across
references. While this approach works well when diversity in the ground truth
data (i.e. dispersion of the distribution of conditional texts) can be ascribed
to noise, such as in automated speech recognition, it does not allow for robust
evaluation in the case where diversity in the ground truths represents signal
for the model. In this work we argue that existing metrics are not appropriate
for domains such as visual description or summarization where ground truths are
semantically diverse, and where the diversity in those captions captures useful
additional information about the context. We propose a novel paradigm for
multi-candidate evaluation of conditional language generation models, and a new
family of metrics that compare the distributions of reference and
model-generated caption sets using small sample sets of each. We demonstrate
the utility of our approach with a case study in visual description: where we
show that existing models optimize for single-description quality over
diversity, and gain some insights into how sampling methods and temperature
impact description quality and diversity.",2022-09-15
vec2text with Round-Trip Translations,2022-09-14 17:20:18+00:00,http://arxiv.org/abs/2209.06792v1,"Geoffrey Cideron, Sertan Girgin, Anton Raichuk, Olivier Pietquin, Olivier Bachem, Léonard Hussenot","cs.CL, cs.LG",knowledge,"We investigate models that can generate arbitrary natural language text (e.g.
all English sentences) from a bounded, convex and well-behaved control space.
We call them universal vec2text models. Such models would allow making semantic
decisions in the vector space (e.g. via reinforcement learning) while the
natural language generation is handled by the vec2text model. We propose four
desired properties: universality, diversity, fluency, and semantic structure,
that such vec2text models should possess and we provide quantitative and
qualitative methods to assess them. We implement a vec2text model by adding a
bottleneck to a 250M parameters Transformer model and training it with an
auto-encoding objective on 400M sentences (10B tokens) extracted from a massive
web corpus. We propose a simple data augmentation technique based on round-trip
translations and show in extensive experiments that the resulting vec2text
model surprisingly leads to vector spaces that fulfill our four desired
properties and that this model strongly outperforms both standard and denoising
auto-encoders.",2022-09-14
"Visual Recipe Flow: A Dataset for Learning Visual State Changes of
  Objects with Recipe Flows",2022-09-13 09:38:32+00:00,http://arxiv.org/abs/2209.05840v1,"Keisuke Shirai, Atsushi Hashimoto, Taichi Nishimura, Hirotaka Kameko, Shuhei Kurita, Yoshitaka Ushiku, Shinsuke Mori","cs.CL, cs.AI",knowledge,"We present a new multimodal dataset called Visual Recipe Flow, which enables
us to learn each cooking action result in a recipe text. The dataset consists
of object state changes and the workflow of the recipe text. The state change
is represented as an image pair, while the workflow is represented as a recipe
flow graph (r-FG). The image pairs are grounded in the r-FG, which provides the
cross-modal relation. With our dataset, one can try a range of applications,
from multimodal commonsense reasoning and procedural text generation.",2022-09-13
Elaboration-Generating Commonsense Question Answering at Scale,2022-09-02 18:32:09+00:00,http://arxiv.org/abs/2209.01232v1,"Wenya Wang, Vivek Srikumar, Hanna Hajishirzi, Noah A. Smith",cs.CL,knowledge,"In question answering requiring common sense, language models (e.g., GPT-3)
have been used to generate text expressing background knowledge that helps
improve performance. Yet the cost of working with such models is very high; in
this work, we finetune smaller language models to generate useful intermediate
context, referred to here as elaborations. Our framework alternates between
updating two language models -- an elaboration generator and an answer
predictor -- allowing each to influence the other. Using less than 0.5% of the
parameters of GPT-3, our model outperforms alternatives with similar sizes and
closes the gap on GPT-3 on four commonsense question answering benchmarks.
Human evaluations show that the quality of the generated elaborations is high.",2022-09-02
Multi-Modal Experience Inspired AI Creation,2022-09-02 11:50:41+00:00,http://arxiv.org/abs/2209.02427v1,"Qian Cao, Xu Chen, Ruihua Song, Hao Jiang, Guang Yang, Zhao Cao",cs.AI,knowledge,"AI creation, such as poem or lyrics generation, has attracted increasing
attention from both industry and academic communities, with many promising
models proposed in the past few years. Existing methods usually estimate the
outputs based on single and independent visual or textual information. However,
in reality, humans usually make creations according to their experiences, which
may involve different modalities and be sequentially correlated. To model such
human capabilities, in this paper, we define and solve a novel AI creation
problem based on human experiences. More specifically, we study how to generate
texts based on sequential multi-modal information. Compared with the previous
works, this task is much more difficult because the designed model has to well
understand and adapt the semantics among different modalities and effectively
convert them into the output in a sequential manner. To alleviate these
difficulties, we firstly design a multi-channel sequence-to-sequence
architecture equipped with a multi-modal attention network. For more effective
optimization, we then propose a curriculum negative sampling strategy tailored
for the sequential inputs. To benchmark this problem and demonstrate the
effectiveness of our model, we manually labeled a new multi-modal experience
dataset. With this dataset, we conduct extensive experiments by comparing our
model with a series of representative baselines, where we can demonstrate
significant improvements in our model based on both automatic and
human-centered metrics. The code and data are available at:
\url{https://github.com/Aman-4-Real/MMTG}.",2022-09-02
