title,pubdate,id,authors,categories,search,abstract,displaydate
Input-length-shortening and text generation via attention values,2023-03-14 02:11:24+00:00,http://arxiv.org/abs/2303.07585v1,"Neşet Özkan Tan, Alex Yuxuan Peng, Joshua Bensemann, Qiming Bao, Tim Hartill, Mark Gahegan, Michael Witbrock",cs.CL,knowledge,"Identifying words that impact a task's performance more than others is a
challenge in natural language processing. Transformers models have recently
addressed this issue by incorporating an attention mechanism that assigns
greater attention (i.e., relevance) scores to some words than others. Because
of the attention mechanism's high computational cost, transformer models
usually have an input-length limitation caused by hardware constraints. This
limitation applies to many transformers, including the well-known bidirectional
encoder representations of the transformer (BERT) model. In this paper, we
examined BERT's attention assignment mechanism, focusing on two questions: (1)
How can attention be employed to reduce input length? (2) How can attention be
used as a control mechanism for conditional text generation? We investigated
these questions in the context of a text classification task. We discovered
that BERT's early layers assign more critical attention scores for text
classification tasks compared to later layers. We demonstrated that the first
layer's attention sums could be used to filter tokens in a given sequence,
considerably decreasing the input length while maintaining good test accuracy.
We also applied filtering, which uses a compute-efficient semantic similarities
algorithm, and discovered that retaining approximately 6\% of the original
sequence is sufficient to obtain 86.5\% accuracy. Finally, we showed that we
could generate data in a stable manner and indistinguishable from the original
one by only using a small percentage (10\%) of the tokens with high attention
scores according to BERT's first layer.",2023-03-14
Transformer-based Planning for Symbolic Regression,2023-03-13 03:29:58+00:00,http://arxiv.org/abs/2303.06833v1,"Parshin Shojaee, Kazem Meidani, Amir Barati Farimani, Chandan K. Reddy","cs.LG, cs.AI",knowledge,"Symbolic regression (SR) is a challenging task in machine learning that
involves finding a mathematical expression for a function based on its values.
Recent advancements in SR have demonstrated the efficacy of pretrained
transformer-based models for generating equations as sequences, which benefit
from large-scale pretraining on synthetic datasets and offer considerable
advantages over GP-based methods in terms of inference time. However, these
models focus on supervised pretraining goals borrowed from text generation and
ignore equation-specific objectives like accuracy and complexity. To address
this, we propose TPSR, a Transformer-based Planning strategy for Symbolic
Regression that incorporates Monte Carlo Tree Search into the transformer
decoding process. TPSR, as opposed to conventional decoding strategies, allows
for the integration of non-differentiable feedback, such as fitting accuracy
and complexity, as external sources of knowledge into the equation generation
process. Extensive experiments on various datasets show that our approach
outperforms state-of-the-art methods, enhancing the model's fitting-complexity
trade-off, extrapolation abilities, and robustness to noise. We also
demonstrate that the utilization of various caching mechanisms can further
enhance the efficiency of TPSR.",2023-03-13
"Large Language Models as Zero-Shot Human Models for Human-Robot
  Interaction",2023-03-06 23:16:24+00:00,http://arxiv.org/abs/2303.03548v1,"Bowen Zhang, Harold Soh","cs.RO, cs.CL, cs.HC, cs.LG",knowledge,"Human models play a crucial role in human-robot interaction (HRI), enabling
robots to consider the impact of their actions on people and plan their
behavior accordingly. However, crafting good human models is challenging;
capturing context-dependent human behavior requires significant prior knowledge
and/or large amounts of interaction data, both of which are difficult to
obtain. In this work, we explore the potential of large-language models (LLMs)
-- which have consumed vast amounts of human-generated text data -- to act as
zero-shot human models for HRI. Our experiments on three social datasets yield
promising results; the LLMs are able to achieve performance comparable to
purpose-built models. That said, we also discuss current limitations, such as
sensitivity to prompts and spatial/numerical reasoning mishaps. Based on our
findings, we demonstrate how LLM-based human models can be integrated into a
social robot's planning process and applied in HRI scenarios. Specifically, we
present one case study on a simulated trust-based table-clearing task and
replicate past results that relied on custom models. Next, we conduct a new
robot utensil-passing experiment (n = 65) where preliminary results show that
planning with a LLM-based human model can achieve gains over a basic myopic
plan. In summary, our results show that LLMs offer a promising (but incomplete)
approach to human modeling for HRI.",2023-03-06
A Universal Question-Answering Platform for Knowledge Graphs,2023-03-01 15:35:32+00:00,http://arxiv.org/abs/2303.00595v1,"Reham Omar, Ishika Dhall, Panos Kalnis, Essam Mansour","cs.AI, cs.CL, cs.DB",knowledge,"Knowledge from diverse application domains is organized as knowledge graphs
(KGs) that are stored in RDF engines accessible in the web via SPARQL
endpoints. Expressing a well-formed SPARQL query requires information about the
graph structure and the exact URIs of its components, which is impractical for
the average user. Question answering (QA) systems assist by translating natural
language questions to SPARQL. Existing QA systems are typically based on
application-specific human-curated rules, or require prior information,
expensive pre-processing and model adaptation for each targeted KG. Therefore,
they are hard to generalize to a broad set of applications and KGs.
  In this paper, we propose KGQAn, a universal QA system that does not need to
be tailored to each target KG. Instead of curated rules, KGQAn introduces a
novel formalization of question understanding as a text generation problem to
convert a question into an intermediate abstract representation via a neural
sequence-to-sequence model. We also develop a just-in-time linker that maps at
query time the abstract representation to a SPARQL query for a specific KG,
using only the publicly accessible APIs and the existing indices of the RDF
store, without requiring any pre-processing. Our experiments with several real
KGs demonstrate that KGQAn is easily deployed and outperforms by a large margin
the state-of-the-art in terms of quality of answers and processing time,
especially for arbitrary KGs, unseen during the training.",2023-03-01
Inseq: An Interpretability Toolkit for Sequence Generation Models,2023-02-27 16:45:50+00:00,http://arxiv.org/abs/2302.13942v1,"Gabriele Sarti, Nils Feldhus, Ludwig Sickert, Oskar van der Wal","cs.CL, cs.AI, cs.HC, cs.LG",knowledge,"Past work in natural language processing interpretability focused mainly on
popular classification tasks while largely overlooking generation settings,
partly due to a lack of dedicated tools. In this work, we introduce Inseq, a
Python library to democratize access to interpretability analyses of sequence
generation models. Inseq enables intuitive and optimized extraction of models'
internal information and feature importance scores for popular decoder-only and
encoder-decoder Transformers architectures. We showcase its potential by
adopting it to highlight gender biases in machine translation models and locate
factual knowledge inside GPT-2. Thanks to its extensible interface supporting
cutting-edge techniques such as contrastive feature attribution, Inseq can
drive future advances in explainable natural language generation, centralizing
good practices and enabling fair and reproducible model evaluations.",2023-02-27
"Toward Fairness in Text Generation via Mutual Information Minimization
  based on Importance Sampling",2023-02-25 18:29:02+00:00,http://arxiv.org/abs/2302.13136v1,"Rui Wang, Pengyu Cheng, Ricardo Henao","cs.CL, cs.AI",knowledge,"Pretrained language models (PLMs), such as GPT2, have achieved remarkable
empirical performance in text generation tasks. However, pretrained on
large-scale natural language corpora, the generated text from PLMs may exhibit
social bias against disadvantaged demographic groups. To improve the fairness
of PLMs in text generation, we propose to minimize the mutual information
between the semantics in the generated text sentences and their demographic
polarity, i.e., the demographic group to which the sentence is referring. In
this way, the mentioning of a demographic group (e.g., male or female) is
encouraged to be independent from how it is described in the generated text,
thus effectively alleviating the social bias. Moreover, we propose to
efficiently estimate the upper bound of the above mutual information via
importance sampling, leveraging a natural language corpus. We also propose a
distillation mechanism that preserves the language modeling ability of the PLMs
after debiasing. Empirical results on real-world benchmarks demonstrate that
the proposed method yields superior performance in term of both fairness and
language modeling ability.",2023-02-25
Few-Shot Table-to-Text Generation with Prompt-based Adapter,2023-02-24 05:48:53+00:00,http://arxiv.org/abs/2302.12468v1,"Zhixin Guo, Minyxuan Yan, Jiexing Qi, Jianping Zhou, Ziwei He, Zhouhan Lin, Guanjie Zheng, Xinbing Wang",cs.CL,knowledge,"Pre-trained language models (PLMs) have made remarkable progress in
table-to-text generation tasks. However, the topological gap between tabular
data and text and the lack of domain-specific knowledge make it difficult for
PLMs to produce faithful text, especially in real-world applications with
limited resources. In this paper, we mitigate the above challenges by
introducing a novel augmentation method: Prompt-based Adapter (PA), which
targets table-to-text generation under few-shot conditions. The core insight
design of the PA is to inject prompt templates for augmenting domain-specific
knowledge and table-related representations into the model for bridging the
structural gap between tabular data and descriptions through adapters. Such
prompt-based knowledge augmentation method brings at least two benefits: (1)
enables us to fully use the large amounts of unlabelled domain-specific
knowledge, which can alleviate the PLMs' inherent shortcomings of lacking
domain knowledge; (2) allows us to design different types of tasks supporting
the generative challenge. Extensive experiments and analyses are conducted on
three open-domain few-shot NLG datasets: Humans, Books, and Songs. Compared to
previous state-of-the-art approaches, our model achieves superior performance
in terms of both fluency and accuracy as judged by human and automatic
evaluations.",2023-02-24
How Does In-Context Learning Help Prompt Tuning?,2023-02-22 17:45:12+00:00,http://arxiv.org/abs/2302.11521v1,"Simeng Sun, Yang Liu, Dan Iter, Chenguang Zhu, Mohit Iyyer",cs.CL,knowledge,"Fine-tuning large language models is becoming ever more impractical due to
their rapidly-growing scale. This motivates the use of parameter-efficient
adaptation methods such as prompt tuning (PT), which adds a small number of
tunable embeddings to an otherwise frozen model, and in-context learning (ICL),
in which demonstrations of the task are provided to the model in natural
language without any additional training. Recently, Singhal et al. (2022)
propose ``instruction prompt tuning'' (IPT), which combines PT with ICL by
concatenating a natural language demonstration with learned prompt embeddings.
While all of these methods have proven effective on different tasks, how they
interact with each other remains unexplored. In this paper, we empirically
study when and how in-context examples improve prompt tuning by measuring the
effectiveness of ICL, PT, and IPT on five text generation tasks with multiple
base language models. We observe that (1) IPT does \emph{not} always outperform
PT, and in fact requires the in-context demonstration to be semantically
similar to the test input to yield improvements; (2) PT is unstable and
exhibits high variance, but combining PT and ICL (into IPT) consistently
reduces variance across all five tasks; and (3) prompts learned for a specific
source task via PT exhibit positive transfer when paired with in-context
examples of a different target task. Our results offer actionable insights on
choosing a suitable parameter-efficient adaptation method for a given task.",2023-02-22
KILM: Knowledge Injection into Encoder-Decoder Language Models,2023-02-17 22:48:07+00:00,http://arxiv.org/abs/2302.09170v1,"Yan Xu, Mahdi Namazifar, Devamanyu Hazarika, Aishwarya Padmakumar, Yang Liu, Dilek Hakkani-Tür","cs.CL, cs.AI",knowledge,"Large pre-trained language models (PLMs) have been shown to retain implicit
knowledge within their parameters. To enhance this implicit knowledge, we
propose Knowledge Injection into Language Models (KILM), a novel approach that
injects entity-related knowledge into encoder-decoder PLMs, via a generative
knowledge infilling objective through continued pre-training. This is done
without architectural modifications to the PLMs or adding additional
parameters. Experimental results over a suite of knowledge-intensive tasks
spanning numerous datasets show that KILM enables models to retain more
knowledge and hallucinate less, while preserving their original performance on
general NLU and NLG tasks. KILM also demonstrates improved zero-shot
performances on tasks such as entity disambiguation, outperforming
state-of-the-art models having 30x more parameters.",2023-02-17
Do We Still Need Clinical Language Models?,2023-02-16 05:08:34+00:00,http://arxiv.org/abs/2302.08091v1,"Eric Lehman, Evan Hernandez, Diwakar Mahajan, Jonas Wulff, Micah J. Smith, Zachary Ziegler, Daniel Nadler, Peter Szolovits, Alistair Johnson, Emily Alsentzer",cs.CL,knowledge,"Although recent advances in scaling large language models (LLMs) have
resulted in improvements on many NLP tasks, it remains unclear whether these
models trained primarily with general web text are the right tool in highly
specialized, safety critical domains such as clinical text. Recent results have
suggested that LLMs encode a surprising amount of medical knowledge. This
raises an important question regarding the utility of smaller domain-specific
language models. With the success of general-domain LLMs, is there still a need
for specialized clinical models? To investigate this question, we conduct an
extensive empirical analysis of 12 language models, ranging from 220M to 175B
parameters, measuring their performance on 3 different clinical tasks that test
their ability to parse and reason over electronic health records. As part of
our experiments, we train T5-Base and T5-Large models from scratch on clinical
notes from MIMIC III and IV to directly investigate the efficiency of clinical
tokens. We show that relatively small specialized clinical models substantially
outperform all in-context learning approaches, even when finetuned on limited
annotated data. Further, we find that pretraining on clinical tokens allows for
smaller, more parameter-efficient models that either match or outperform much
larger language models trained on general text. We release the code and the
models used under the PhysioNet Credentialed Health Data license and data use
agreement.",2023-02-16
"Tree-Based Representation and Generation of Natural and Mathematical
  Language",2023-02-15 22:38:34+00:00,http://arxiv.org/abs/2302.07974v1,"Alexander Scarlatos, Andrew Lan",cs.CL,knowledge,"Mathematical language in scientific communications and educational scenarios
is important yet relatively understudied compared to natural languages. Recent
works on mathematical language focus either on representing stand-alone
mathematical expressions, especially in their natural tree format, or
mathematical reasoning in pre-trained natural language models. Existing works
on jointly modeling and generating natural and mathematical languages simply
treat mathematical expressions as text, without accounting for the rigid
structural properties of mathematical expressions. In this paper, we propose a
series of modifications to existing language models to jointly represent and
generate text and math: representing mathematical expressions as sequences of
node tokens in their operator tree format, using math symbol and tree position
embeddings to preserve the semantic and structural properties of mathematical
expressions, and using a constrained decoding method to generate mathematically
valid expressions. We ground our modifications in GPT-2, resulting in a model
MathGPT, and demonstrate that it outperforms baselines on mathematical
expression generation tasks.",2023-02-15
"Investigating the Effect of Relative Positional Embeddings on
  AMR-to-Text Generation with Structural Adapters",2023-02-12 12:43:36+00:00,http://arxiv.org/abs/2302.05900v1,"Sebastien Montella, Alexis Nasr, Johannes Heinecke, Frederic Bechet, Lina M. Rojas-Barahona",cs.CL,knowledge,"Text generation from Abstract Meaning Representation (AMR) has substantially
benefited from the popularized Pretrained Language Models (PLMs). Myriad
approaches have linearized the input graph as a sequence of tokens to fit the
PLM tokenization requirements. Nevertheless, this transformation jeopardizes
the structural integrity of the graph and is therefore detrimental to its
resulting representation. To overcome this issue, Ribeiro et al. have recently
proposed StructAdapt, a structure-aware adapter which injects the input graph
connectivity within PLMs using Graph Neural Networks (GNNs). In this paper, we
investigate the influence of Relative Position Embeddings (RPE) on AMR-to-Text,
and, in parallel, we examine the robustness of StructAdapt. Through ablation
studies, graph attack and link prediction, we reveal that RPE might be
partially encoding input graphs. We suggest further research regarding the role
of RPE will provide valuable insights for Graph-to-Text generation.",2023-02-12
TextDefense: Adversarial Text Detection based on Word Importance Entropy,2023-02-12 11:12:44+00:00,http://arxiv.org/abs/2302.05892v1,"Lujia Shen, Xuhong Zhang, Shouling Ji, Yuwen Pu, Chunpeng Ge, Xing Yang, Yanghe Feng","cs.CL, cs.AI, cs.CR",knowledge,"Currently, natural language processing (NLP) models are wildly used in
various scenarios. However, NLP models, like all deep models, are vulnerable to
adversarially generated text. Numerous works have been working on mitigating
the vulnerability from adversarial attacks. Nevertheless, there is no
comprehensive defense in existing works where each work targets a specific
attack category or suffers from the limitation of computation overhead,
irresistible to adaptive attack, etc.
  In this paper, we exhaustively investigate the adversarial attack algorithms
in NLP, and our empirical studies have discovered that the attack algorithms
mainly disrupt the importance distribution of words in a text. A well-trained
model can distinguish subtle importance distribution differences between clean
and adversarial texts. Based on this intuition, we propose TextDefense, a new
adversarial example detection framework that utilizes the target model's
capability to defend against adversarial attacks while requiring no prior
knowledge. TextDefense differs from previous approaches, where it utilizes the
target model for detection and thus is attack type agnostic. Our extensive
experiments show that TextDefense can be applied to different architectures,
datasets, and attack methods and outperforms existing methods. We also discover
that the leading factor influencing the performance of TextDefense is the
target model's generalizability. By analyzing the property of the target model
and the property of the adversarial example, we provide our insights into the
adversarial attacks in NLP and the principles of our defense method.",2023-02-12
"Re-ViLM: Retrieval-Augmented Visual Language Model for Zero and Few-Shot
  Image Captioning",2023-02-09 18:57:56+00:00,http://arxiv.org/abs/2302.04858v1,"Zhuolin Yang, Wei Ping, Zihan Liu, Vijay Korthikanti, Weili Nie, De-An Huang, Linxi Fan, Zhiding Yu, Shiyi Lan, Bo Li, Ming-Yu Liu, Yuke Zhu, Mohammad Shoeybi, Bryan Catanzaro, Chaowei Xiao, Anima Anandkumar","cs.CV, cs.AI, cs.CL, cs.IR, cs.LG",knowledge,"Augmenting pretrained language models (LMs) with a vision encoder (e.g.,
Flamingo) has obtained state-of-the-art results in image-to-text generation.
However, these models store all the knowledge within their parameters, thus
often requiring enormous model parameters to model the abundant visual concepts
and very rich textual descriptions. Additionally, they are inefficient in
incorporating new data, requiring a computational-expensive fine-tuning
process. In this work, we introduce a Retrieval-augmented Visual Language
Model, Re-ViLM, built upon the Flamingo, that supports retrieving the relevant
knowledge from the external database for zero and in-context few-shot
image-to-text generations. By storing certain knowledge explicitly in the
external database, our approach reduces the number of model parameters and can
easily accommodate new data during evaluation by simply updating the database.
We also construct an interleaved image and text data that facilitates
in-context few-shot learning capabilities. We demonstrate that Re-ViLM
significantly boosts performance for image-to-text generation tasks, especially
for zero-shot and few-shot generation in out-of-domain settings with 4 times
less parameters compared with baseline methods.",2023-02-09
Lightweight Transformers for Clinical Natural Language Processing,2023-02-09 16:07:31+00:00,http://arxiv.org/abs/2302.04725v1,"Omid Rohanian, Mohammadmahdi Nouriborji, Hannah Jauncey, Samaneh Kouchaki, ISARIC Clinical Characterisation Group, Lei Clifton, Laura Merson, David A. Clifton","cs.CL, cs.AI, cs.LG, 68T50, I.2.7",knowledge,"Specialised pre-trained language models are becoming more frequent in NLP
since they can potentially outperform models trained on generic texts. BioBERT
and BioClinicalBERT are two examples of such models that have shown promise in
medical NLP tasks. Many of these models are overparametrised and
resource-intensive, but thanks to techniques like Knowledge Distillation (KD),
it is possible to create smaller versions that perform almost as well as their
larger counterparts. In this work, we specifically focus on development of
compact language models for processing clinical texts (i.e. progress notes,
discharge summaries etc). We developed a number of efficient lightweight
clinical transformers using knowledge distillation and continual learning, with
the number of parameters ranging from 15 million to 65 million. These models
performed comparably to larger models such as BioBERT and ClinicalBioBERT and
significantly outperformed other compact models trained on general or
biomedical data. Our extensive evaluation was done across several standard
datasets and covered a wide range of clinical text-mining tasks, including
Natural Language Inference, Relation Extraction, Named Entity Recognition, and
Sequence Classification. To our knowledge, this is the first comprehensive
study specifically focused on creating efficient and compact transformers for
clinical NLP tasks. The models and code used in this study can be found on our
Huggingface profile at https://huggingface.co/nlpie and Github page at
https://github.com/nlpie-research/Lightweight-Clinical-Transformers,
respectively, promoting reproducibility of our results.",2023-02-09
"Few-Shot Table-to-Text Generation with Prompt Planning and Knowledge
  Memorization",2023-02-09 03:04:11+00:00,http://arxiv.org/abs/2302.04415v1,"Zhixin Guo, Minyxuan Yan, Jiexing Qi, Jianping Zhou, Ziwei He, Zhouhan Lin, Guanjie Zheng, Xinbing Wang","cs.CL, cs.AI",knowledge,"Pre-trained language models (PLM) have achieved remarkable advancement in
table-to-text generation tasks. However, the lack of labeled domain-specific
knowledge and the topology gap between tabular data and text make it difficult
for PLMs to yield faithful text. Low-resource generation likewise faces unique
challenges in this domain. Inspired by how humans descript tabular data with
prior knowledge, we suggest a new framework: PromptMize, which targets
table-to-text generation under few-shot settings. The design of our framework
consists of two aspects: a prompt planner and a knowledge adapter. The prompt
planner aims to generate a prompt signal that provides instance guidance for
PLMs to bridge the topology gap between tabular data and text. Moreover, the
knowledge adapter memorizes domain-specific knowledge from the unlabelled
corpus to supply essential information during generation. Extensive experiments
and analyses are investigated on three open domain few-shot NLG datasets:
human, song, and book. Compared with previous state-of-the-art approaches, our
model achieves remarkable performance in generating quality as judged by human
and automatic evaluations.",2023-02-09
