title,pubdate,id,authors,categories,search,abstract,displaydate
"AI-generated stories favour stability over change: homogeneity and
  cultural stereotyping in narratives generated by gpt-4o-mini",2025-07-30 07:44:28+00:00,http://arxiv.org/abs/2507.22445v1,"Jill Walker Rettberg, Hermann Wigers","cs.CL, cs.AI, H.1.2; I.2.4; I.2.0; I.2.7",story,"Can a language model trained largely on Anglo-American texts generate stories
that are culturally relevant to other nationalities? To find out, we generated
11,800 stories - 50 for each of 236 countries - by sending the prompt ""Write a
1500 word potential {demonym} story"" to OpenAI's model gpt-4o-mini. Although
the stories do include surface-level national symbols and themes, they
overwhelmingly conform to a single narrative plot structure across countries: a
protagonist lives in or returns home to a small town and resolves a minor
conflict by reconnecting with tradition and organising community events.
Real-world conflicts are sanitised, romance is almost absent, and narrative
tension is downplayed in favour of nostalgia and reconciliation. The result is
a narrative homogenisation: an AI-generated synthetic imaginary that
prioritises stability above change and tradition above growth. We argue that
the structural homogeneity of AI-generated narratives constitutes a distinct
form of AI bias, a narrative standardisation that should be acknowledged
alongside the more familiar representational bias. These findings are relevant
to literary studies, narratology, critical AI studies, NLP research, and
efforts to improve the cultural alignment of generative AI.",2025-07-30
Ta-G-T: Subjectivity Capture in Table to Text Generation via RDF Graphs,2025-07-25 23:06:00+00:00,http://arxiv.org/abs/2507.19710v1,"Ronak Upasham, Tathagata Dey, Pushpak Bhattacharyya",cs.CL,story,"In Table-to-Text (T2T) generation, existing approaches predominantly focus on
providing objective descriptions of tabular data. However, generating text that
incorporates subjectivity, where subjectivity refers to interpretations beyond
raw numerical data, remains underexplored. To address this, we introduce a
novel pipeline that leverages intermediate representations to generate both
objective and subjective text from tables. Our three-stage pipeline consists
of: 1) extraction of Resource Description Framework (RDF) triples, 2)
aggregation of text into coherent narratives, and 3) infusion of subjectivity
to enrich the generated text. By incorporating RDFs, our approach enhances
factual accuracy while maintaining interpretability. Unlike large language
models (LLMs) such as GPT-3.5, Mistral-7B, and Llama-2, our pipeline employs
smaller, fine-tuned T5 models while achieving comparable performance to GPT-3.5
and outperforming Mistral-7B and Llama-2 in several metrics. We evaluate our
approach through quantitative and qualitative analyses, demonstrating its
effectiveness in balancing factual accuracy with subjective interpretation. To
the best of our knowledge, this is the first work to propose a structured
pipeline for T2T generation that integrates intermediate representations to
enhance both factual correctness and subjectivity.",2025-07-25
Modeling Fair Play in Detective Stories with Language Models,2025-07-18 11:55:18+00:00,http://arxiv.org/abs/2507.13841v1,"Eitan Wagner, Renana Keydar, Omri Abend",cs.CL,story,"Effective storytelling relies on a delicate balance between meeting the
reader's prior expectations and introducing unexpected developments. In the
domain of detective fiction, this tension is known as fair play, which includes
the implicit agreement between the writer and the reader as to the range of
possible resolutions the mystery story may have. In this work, we present a
probabilistic framework for detective fiction that allows us to define desired
qualities. Using this framework, we formally define fair play and design
appropriate metrics for it. Stemming from these definitions is an inherent
tension between the coherence of the story, which measures how much it ``makes
sense'', and the surprise it induces. We validate the framework by applying it
to LLM-generated detective stories. This domain is appealing since we have an
abundance of data, we can sample from the distribution generating the story,
and the story-writing capabilities of LLMs are interesting in their own right.
Results show that while LLM-generated stories may be unpredictable, they
generally fail to balance the trade-off between surprise and fair play, which
greatly contributes to their poor quality.",2025-07-18
"Enhancing Essay Cohesion Assessment: A Novel Item Response Theory
  Approach",2025-07-11 11:05:27+00:00,http://arxiv.org/abs/2507.08487v1,"Bruno Alexandre Rosa, Hilário Oliveira, Luiz Rodrigues, Eduardo Araujo Oliveira, Rafael Ferreira Mello","cs.CL, cs.AI",story,"Essays are considered a valuable mechanism for evaluating learning outcomes
in writing. Textual cohesion is an essential characteristic of a text, as it
facilitates the establishment of meaning between its parts. Automatically
scoring cohesion in essays presents a challenge in the field of educational
artificial intelligence. The machine learning algorithms used to evaluate texts
generally do not consider the individual characteristics of the instances that
comprise the analysed corpus. In this meaning, item response theory can be
adapted to the context of machine learning, characterising the ability,
difficulty and discrimination of the models used. This work proposes and
analyses the performance of a cohesion score prediction approach based on item
response theory to adjust the scores generated by machine learning models. In
this study, the corpus selected for the experiments consisted of the extended
Essay-BR, which includes 6,563 essays in the style of the National High School
Exam (ENEM), and the Brazilian Portuguese Narrative Essays, comprising 1,235
essays written by 5th to 9th grade students from public schools. We extracted
325 linguistic features and treated the problem as a machine learning
regression task. The experimental results indicate that the proposed approach
outperforms conventional machine learning models and ensemble methods in
several evaluation metrics. This research explores a potential approach for
improving the automatic evaluation of cohesion in educational essays.",2025-07-11
"LitBench: A Benchmark and Dataset for Reliable Evaluation of Creative
  Writing",2025-07-01 14:10:36+00:00,http://arxiv.org/abs/2507.00769v1,"Daniel Fein, Sebastian Russo, Violet Xiang, Kabir Jolly, Rafael Rafailov, Nick Haber","cs.CL, cs.AI",story,"Evaluating creative writing generated by large language models (LLMs) remains
challenging because open-ended narratives lack ground truths. Without
performant automated evaluation methods, off-the-shelf (OTS) language models
are employed as zero-shot judges, yet their reliability is unclear in this
context. In pursuit of robust evaluation for creative writing, we introduce
LitBench, the first standardized benchmark and paired dataset for creative
writing verification, comprising a held-out test set of 2,480 debiased,
human-labeled story comparisons drawn from Reddit and a 43,827-pair training
corpus of human preference labels. Using LitBench, we (i) benchmark zero-shot
LLM judges, (ii) train Bradley Terry and generative reward models, and (iii)
conduct an online human study to validate reward model rankings on newly
LLM-generated stories. Our benchmark identifies Claude-3.7-Sonnet as the
strongest off-the-shelf judge, reaching 73% agreement with human preferences;
among trained reward models, Bradley-Terry and Generative reward models both
attain an accuracy of 78%, outperforming all off-the-shelf judges. An online
human study further confirms that our trained reward models consistently align
with human preferences in novel LLM-generated stories. We release LitBench and
reward models at
https://huggingface.co/collections/SAA-Lab/litbench-68267b5da3aafe58f9e43461,
providing a vetted resource for reliable, automated evaluation and optimization
of creative writing systems.",2025-07-01
Perspective Dial: Measuring Perspective of Text and Guiding LLM Outputs,2025-06-29 19:26:37+00:00,http://arxiv.org/abs/2506.23377v1,"Taejin Kim, Siun-Chuon Mau, Konrad Vesey","cs.CL, cs.AI",story,"Large language models (LLMs) are used in a variety of mission-critical roles.
Due to the rapidly developing nature of LLMs, there is a lack of quantifiable
understanding of the bias and perspective associated with LLM output. Inspired
by this need, this paper considers the broader issue of perspective or
viewpoint of general text and perspective control of large-language model (LLM)
output. Perspective-Dial consists of two main components: a (1) metric space,
dubbed Perspective Space, that enables quantitative measurements of different
perspectives regarding a topic, and the use of (2) Systematic Prompt
Engineering that utilizes greedy-coordinate descent to control LLM output
perspective based on measurement feedback from the Perspective Space. The
empirical nature of the approach allows progress to side step a principled
understanding of perspective or bias -- effectively quantifying and adjusting
outputs for a variety of topics. Potential applications include detection,
tracking and mitigation of LLM bias, narrative detection, sense making and
tracking in public discourse, and debate bot advocating given perspective.",2025-06-29
"Structuralist Approach to AI Literary Criticism: Leveraging Greimas
  Semiotic Square for Large Language Models",2025-06-26 15:10:24+00:00,http://arxiv.org/abs/2506.21360v1,"Fangzhou Dong, Yifan Zeng, Yingpeng Sang, Hong Shen",cs.CL,story,"Large Language Models (LLMs) excel in understanding and generating text but
struggle with providing professional literary criticism for works with profound
thoughts and complex narratives. This paper proposes GLASS (Greimas Literary
Analysis via Semiotic Square), a structured analytical framework based on
Greimas Semiotic Square (GSS), to enhance LLMs' ability to conduct in-depth
literary analysis. GLASS facilitates the rapid dissection of narrative
structures and deep meanings in narrative works. We propose the first dataset
for GSS-based literary criticism, featuring detailed analyses of 48 works. Then
we propose quantitative metrics for GSS-based literary criticism using the
LLM-as-a-judge paradigm. Our framework's results, compared with expert
criticism across multiple works and LLMs, show high performance. Finally, we
applied GLASS to 39 classic works, producing original and high-quality analyses
that address existing research gaps. This research provides an AI-based tool
for literary research and education, offering insights into the cognitive
mechanisms underlying literary engagement.",2025-06-26
Cat and Mouse -- Can Fake Text Generation Outpace Detector Systems?,2025-06-26 13:58:43+00:00,http://arxiv.org/abs/2506.21274v1,"Andrea McGlinchey, Peter J Barclay",cs.CL,story,"Large language models can produce convincing ""fake text"" in domains such as
academic writing, product reviews, and political news. Many approaches have
been investigated for the detection of artificially generated text. While this
may seem to presage an endless ""arms race"", we note that newer LLMs use ever
more parameters, training data, and energy, while relatively simple classifiers
demonstrate a good level of detection accuracy with modest resources. To
approach the question of whether the models' ability to beat the detectors may
therefore reach a plateau, we examine the ability of statistical classifiers to
identify ""fake text"" in the style of classical detective fiction. Over a 0.5
version increase, we found that Gemini showed an increased ability to generate
deceptive text, while GPT did not. This suggests that reliable detection of
fake text may remain feasible even for ever-larger models, though new model
architectures may improve their deceptiveness",2025-06-26
FairyGen: Storied Cartoon Video from a Single Child-Drawn Character,2025-06-26 13:58:16+00:00,http://arxiv.org/abs/2506.21272v2,"Jiayi Zheng, Xiaodong Cun","cs.GR, cs.CV, cs.MM",story,"We propose FairyGen, an automatic system for generating story-driven cartoon
videos from a single child's drawing, while faithfully preserving its unique
artistic style. Unlike previous storytelling methods that primarily focus on
character consistency and basic motion, FairyGen explicitly disentangles
character modeling from stylized background generation and incorporates
cinematic shot design to support expressive and coherent storytelling. Given a
single character sketch, we first employ an MLLM to generate a structured
storyboard with shot-level descriptions that specify environment settings,
character actions, and camera perspectives. To ensure visual consistency, we
introduce a style propagation adapter that captures the character's visual
style and applies it to the background, faithfully retaining the character's
full visual identity while synthesizing style-consistent scenes. A shot design
module further enhances visual diversity and cinematic quality through frame
cropping and multi-view synthesis based on the storyboard. To animate the
story, we reconstruct a 3D proxy of the character to derive physically
plausible motion sequences, which are then used to fine-tune an MMDiT-based
image-to-video diffusion model. We further propose a two-stage motion
customization adapter: the first stage learns appearance features from
temporally unordered frames, disentangling identity from motion; the second
stage models temporal dynamics using a timestep-shift strategy with frozen
identity weights. Once trained, FairyGen directly renders diverse and coherent
video scenes aligned with the storyboard. Extensive experiments demonstrate
that our system produces animations that are stylistically faithful,
narratively structured natural motion, highlighting its potential for
personalized and engaging story animation. The code will be available at
https://github.com/GVCLab/FairyGen",2025-06-26
Compressed and Smooth Latent Space for Text Diffusion Modeling,2025-06-26 12:05:13+00:00,http://arxiv.org/abs/2506.21170v1,"Viacheslav Meshchaninov, Egor Chimbulatov, Alexander Shabalin, Aleksandr Abramov, Dmitry Vetrov",cs.CL,story,"Autoregressive language models dominate modern text generation, yet their
sequential nature introduces fundamental limitations: decoding is slow, and
maintaining global coherence remains challenging. Diffusion models offer a
promising alternative by enabling parallel generation and flexible control;
however, their application to text generation is hindered by the high
dimensionality of token-level representations. We introduce Cosmos, a novel
approach to text generation that operates entirely in a compressed, smooth
latent space tailored specifically for diffusion. This space is learned using
an autoencoder trained simultaneously for token-level reconstruction and
alignment with frozen activations from a pretrained language encoder, providing
robust semantic grounding and enabling effective perturbation-based
augmentations. Empirically, we demonstrate that text representations can be
compressed by $8\times$ while maintaining generation quality comparable to
token-level diffusion models. Furthermore, increasing the latent sequence
length allows Cosmos to surpass both diffusion-based and autoregressive
baselines. We evaluate Cosmos on four diverse generative tasks including story
generation, question generation, summarization, and detoxification and compare
it with various generative paradigms. Cosmos achieves comparable or superior
generation quality while offering more than $2\times$ faster inference.",2025-06-26
"Language Models Might Not Understand You: Evaluating Theory of Mind via
  Story Prompting",2025-06-23 20:06:53+00:00,http://arxiv.org/abs/2506.19089v2,"Nathaniel Getachew, Abulhair Saparov","cs.CL, cs.AI",story,"We introduce $\texttt{StorySim}$, a programmable framework for synthetically
generating stories to evaluate the theory of mind (ToM) and world modeling (WM)
capabilities of large language models (LLMs). Unlike prior benchmarks that may
suffer from contamination in pretraining data, $\texttt{StorySim}$ produces
novel, compositional story prompts anchored by a highly controllable
$\texttt{Storyboard}$, enabling precise manipulation of character perspectives
and events. We use this framework to design first- and second-order ToM tasks
alongside WM tasks that control for the ability to track and model mental
states. Our experiments across a suite of state-of-the-art LLMs reveal that
most models perform better on WM tasks than ToM tasks, and that models tend to
perform better reasoning with humans compared to inanimate objects.
Additionally, our framework enabled us to find evidence of heuristic behavior
such as recency bias and an over-reliance on earlier events in the story. All
code for generating data and evaluations is freely available.",2025-06-23
"How Large Language Models play humans in online conversations: a
  simulated study of the 2016 US politics on Reddit",2025-06-23 08:54:32+00:00,http://arxiv.org/abs/2506.21620v1,"Daniele Cirulli, Giulio Cimini, Giovanni Palermo","cs.CL, cs.AI, cs.CY, cs.SI, physics.soc-ph",story,"Large Language Models (LLMs) have recently emerged as powerful tools for
natural language generation, with applications spanning from content creation
to social simulations. Their ability to mimic human interactions raises both
opportunities and concerns, particularly in the context of politically relevant
online discussions. In this study, we evaluate the performance of LLMs in
replicating user-generated content within a real-world, divisive scenario:
Reddit conversations during the 2016 US Presidential election. In particular,
we conduct three different experiments, asking GPT-4 to generate comments by
impersonating either real or artificial partisan users. We analyze the
generated comments in terms of political alignment, sentiment, and linguistic
features, comparing them against real user contributions and benchmarking
against a null model. We find that GPT-4 is able to produce realistic comments,
both in favor of or against the candidate supported by the community, yet
tending to create consensus more easily than dissent. In addition we show that
real and artificial comments are well separated in a semantically embedded
space, although they are indistinguishable by manual inspection. Our findings
provide insights on the potential use of LLMs to sneak into online discussions,
influence political debate and shape political narratives, bearing broader
implications of AI-driven discourse manipulation.",2025-06-23
StoryWriter: A Multi-Agent Framework for Long Story Generation,2025-06-19 16:26:58+00:00,http://arxiv.org/abs/2506.16445v1,"Haotian Xia, Hao Peng, Yunjia Qi, Xiaozhi Wang, Bin Xu, Lei Hou, Juanzi Li","cs.CL, cs.AI",story,"Long story generation remains a challenge for existing large language models
(LLMs), primarily due to two main factors: (1) discourse coherence, which
requires plot consistency, logical coherence, and completeness in the long-form
generation, and (2) narrative complexity, which requires an interwoven and
engaging narrative. To address these challenges, we propose StoryWriter, a
multi-agent story generation framework, which consists of three main modules:
(1) outline agent, which generates event-based outlines containing rich event
plots, character, and event-event relationships. (2) planning agent, which
further details events and plans which events should be written in each chapter
to maintain an interwoven and engaging story. (3) writing agent, which
dynamically compresses the story history based on the current event to generate
and reflect new plots, ensuring the coherence of the generated story. We
conduct both human and automated evaluation, and StoryWriter significantly
outperforms existing story generation baselines in both story quality and
length. Furthermore, we use StoryWriter to generate a dataset, which contains
about $6,000$ high-quality long stories, with an average length of $8,000$
words. We train the model Llama3.1-8B and GLM4-9B using supervised fine-tuning
on LongStory and develop StoryWriter_GLM and StoryWriter_GLM, which
demonstrates advanced performance in long story generation.",2025-06-19
Curriculum-Guided Layer Scaling for Language Model Pretraining,2025-06-13 01:22:16+00:00,http://arxiv.org/abs/2506.11389v1,"Karanpartap Singh, Neil Band, Ehsan Adeli",cs.CL,story,"As the cost of pretraining large language models grows, there is continued
interest in strategies to improve learning efficiency during this core training
stage. Motivated by cognitive development, where humans gradually build
knowledge as their brains mature, we propose Curriculum-Guided Layer Scaling
(CGLS), a framework for compute-efficient pretraining that synchronizes
increasing data difficulty with model growth through progressive layer stacking
(i.e. gradually adding layers during training). At the 100M parameter scale,
using a curriculum transitioning from synthetic short stories to general web
data, CGLS outperforms baseline methods on the question-answering benchmarks
PIQA and ARC. Pretraining at the 1.2B scale, we stratify the DataComp-LM corpus
with a DistilBERT-based classifier and progress from general text to highly
technical or specialized content. Our results show that progressively
increasing model depth alongside sample difficulty leads to better
generalization and zero-shot performance on various downstream benchmarks.
Altogether, our findings demonstrate that CGLS unlocks the potential of
progressive stacking, offering a simple yet effective strategy for improving
generalization on knowledge-intensive and reasoning tasks.",2025-06-13
VINCIE: Unlocking In-context Image Editing from Video,2025-06-12 17:46:54+00:00,http://arxiv.org/abs/2506.10941v1,"Leigang Qu, Feng Cheng, Ziyan Yang, Qi Zhao, Shanchuan Lin, Yichun Shi, Yicong Li, Wenjie Wang, Tat-Seng Chua, Lu Jiang","cs.CV, cs.AI, cs.CL, cs.LG, cs.MM",story,"In-context image editing aims to modify images based on a contextual sequence
comprising text and previously generated images. Existing methods typically
depend on task-specific pipelines and expert models (e.g., segmentation and
inpainting) to curate training data. In this work, we explore whether an
in-context image editing model can be learned directly from videos. We
introduce a scalable approach to annotate videos as interleaved multimodal
sequences. To effectively learn from this data, we design a block-causal
diffusion transformer trained on three proxy tasks: next-image prediction,
current segmentation prediction, and next-segmentation prediction.
Additionally, we propose a novel multi-turn image editing benchmark to advance
research in this area. Extensive experiments demonstrate that our model
exhibits strong in-context image editing capabilities and achieves
state-of-the-art results on two multi-turn image editing benchmarks. Despite
being trained exclusively on videos, our model also shows promising abilities
in multi-concept composition, story generation, and chain-of-editing
applications.",2025-06-12
"Can LLMs Generate Good Stories? Insights and Challenges from a Narrative
  Planning Perspective",2025-06-11 20:27:08+00:00,http://arxiv.org/abs/2506.10161v1,"Yi Wang, Max Kreminski","cs.CL, cs.AI",story,"Story generation has been a prominent application of Large Language Models
(LLMs). However, understanding LLMs' ability to produce high-quality stories
remains limited due to challenges in automatic evaluation methods and the high
cost and subjectivity of manual evaluation. Computational narratology offers
valuable insights into what constitutes a good story, which has been applied in
the symbolic narrative planning approach to story generation. This work aims to
deepen the understanding of LLMs' story generation capabilities by using them
to solve narrative planning problems. We present a benchmark for evaluating
LLMs on narrative planning based on literature examples, focusing on causal
soundness, character intentionality, and dramatic conflict. Our experiments
show that GPT-4 tier LLMs can generate causally sound stories at small scales,
but planning with character intentionality and dramatic conflict remains
challenging, requiring LLMs trained with reinforcement learning for complex
reasoning. The results offer insights on the scale of stories that LLMs can
generate while maintaining quality from different aspects. Our findings also
highlight interesting problem solving behaviors and shed lights on challenges
and considerations for applying LLM narrative planning in game environments.",2025-06-11
