title,pubdate,id,authors,categories,search,abstract,displaydate
LibertyMFD: A Lexicon to Assess the Moral Foundation of Liberty,2022-09-14 16:14:54+00:00,http://arxiv.org/abs/2209.06750v1,"Oscar Araque, Lorenzo Gatti, Kyriaki Kalimeri",cs.CL,story,"Quantifying the moral narratives expressed in the user-generated text, news,
or public discourses is fundamental for understanding individuals' concerns and
viewpoints and preventing violent protests and social polarisation. The Moral
Foundation Theory (MFT) was developed to operationalise morality in a
five-dimensional scale system. Recent developments of the theory urged for the
introduction of a new foundation, the Liberty Foundation. Being only recently
added to the theory, there are no available linguistic resources to assess
whether liberty is present in text corpora. Given its importance to current
social issues such as the vaccination debate, we propose two data-driven
approaches, deriving two candidate lexicons generated based on aligned
documents from online news sources with different worldviews. After extensive
experimentation, we contribute to the research community a novel lexicon that
assesses the liberty moral foundation in the way individuals with contrasting
viewpoints express themselves through written text. The LibertyMFD dictionary
can be a valuable tool for policymakers to understand diverse viewpoints on
controversial social issues such as vaccination, abortion, or even uprisings,
as they happen and on a large scale.",2022-09-14
"Every picture tells a story: Image-grounded controllable stylistic story
  generation",2022-09-04 15:07:53+00:00,http://arxiv.org/abs/2209.01638v1,"Holy Lovenia, Bryan Wilie, Romain Barraud, Samuel Cahyawijaya, Willy Chung, Pascale Fung",cs.CL,story,"Generating a short story out of an image is arduous. Unlike image captioning,
story generation from an image poses multiple challenges: preserving the story
coherence, appropriately assessing the quality of the story, steering the
generated story into a certain style, and addressing the scarcity of
image-story pair reference datasets limiting supervision during training. In
this work, we introduce Plug-and-Play Story Teller (PPST) and improve
image-to-story generation by: 1) alleviating the data scarcity problem by
incorporating large pre-trained models, namely CLIP and GPT-2, to facilitate a
fluent image-to-text generation with minimal supervision, and 2) enabling a
more style-relevant generation by incorporating stylistic adapters to control
the story generation. We conduct image-to-story generation experiments with
non-styled, romance-styled, and action-styled PPST approaches and compare our
generated stories with those of previous work over three aspects, i.e., story
coherence, image-story relevance, and style fitness, using both automatic and
human evaluation. The results show that PPST improves story coherence and has
better image-story relevance, but has yet to be adequately stylistic.",2022-09-04
"StoryTrans: Non-Parallel Story Author-Style Transfer with Discourse
  Representations and Content Enhancing",2022-08-29 08:47:49+00:00,http://arxiv.org/abs/2208.13423v1,"Xuekai Zhu, Jian Guan, Minlie Huang, Juan Liu",cs.CL,story,"Non-parallel text style transfer is an important task in natural language
generation. However, previous studies concentrate on the token or sentence
level, such as sentence sentiment and formality transfer, but neglect long
style transfer at the discourse level. Long texts usually involve more
complicated author linguistic preferences such as discourse structures than
sentences. In this paper, we formulate the task of non-parallel story
author-style transfer, which requires transferring an input story into a
specified author style while maintaining source semantics. To tackle this
problem, we propose a generation model, named StoryTrans, which leverages
discourse representations to capture source content information and transfer
them to target styles with learnable style embeddings. We use an additional
training objective to disentangle stylistic features from the learned discourse
representation to prevent the model from degenerating to an auto-encoder.
Moreover, to enhance content preservation, we design a mask-and-fill framework
to explicitly fuse style-specific keywords of source texts into generation.
Furthermore, we constructed new datasets for this task in Chinese and English,
respectively. Extensive experiments show that our model outperforms strong
baselines in overall performance of style transfer and content preservation.",2022-08-29
"Of Human Criteria and Automatic Metrics: A Benchmark of the Evaluation
  of Story Generation",2022-08-24 16:35:32+00:00,http://arxiv.org/abs/2208.11646v1,"Cyril Chhun, Pierre Colombo, Chloé Clavel, Fabian M. Suchanek",cs.CL,story,"Research on Automatic Story Generation (ASG) relies heavily on human and
automatic evaluation. However, there is no consensus on which human evaluation
criteria to use, and no analysis of how well automatic criteria correlate with
them. In this paper, we propose to re-evaluate ASG evaluation. We introduce a
set of 6 orthogonal and comprehensive human criteria, carefully motivated by
the social sciences literature. We also present HANNA, an annotated dataset of
1,056 stories produced by 10 different ASG systems. HANNA allows us to
quantitatively evaluate the correlations of 72 automatic metrics with human
criteria. Our analysis highlights the weaknesses of current metrics for ASG and
allows us to formulate practical recommendations for ASG evaluation.",2022-08-24
"Leveraging Natural Supervision for Language Representation Learning and
  Generation",2022-07-21 17:26:03+00:00,http://arxiv.org/abs/2207.10617v1,Mingda Chen,cs.CL,story,"Recent breakthroughs in Natural Language Processing (NLP) have been driven by
language models trained on a massive amount of plain text. While powerful,
deriving supervision from textual resources is still an open question. For
example, language model pretraining often neglects the rich, freely-available
structures in textual data. In this thesis, we describe three lines of work
that seek to improve the training and evaluation of neural models using
naturally-occurring supervision.
  We first investigate self-supervised training losses to help enhance the
performance of pretrained language models for various NLP tasks. Specifically,
we alter the sentence prediction loss to make it better suited to other
pretraining losses and more challenging to solve. We design an intermediate
finetuning step that uses self-supervised training to promote models' ability
in cross-task generalization.
  Then we describe methods to leverage the structures in Wikipedia and
paraphrases. In particular, we propose training losses to exploit hyperlinks,
article structures, and article category graphs for entity-, discourse-,
entailment-related knowledge. We propose a framework that uses paraphrase pairs
to disentangle semantics and syntax in sentence representations. We extend the
framework for a novel generation task that controls the syntax of output text
with a sentential exemplar.
  Lastly, we discuss our work on tailoring textual resources for establishing
challenging evaluation tasks. We introduce three datasets by defining novel
tasks using various fan-contributed websites, including a long-form
data-to-text generation dataset, a screenplay summarization dataset, and a
long-form story generation dataset. These datasets have unique characteristics
offering challenges to future work in their respective task settings.",2022-07-21
"Collocation2Text: Controllable Text Generation from Guide Phrases in
  Russian",2022-06-18 17:10:08+00:00,http://arxiv.org/abs/2206.09248v1,"Sergey Vychegzhanin, Evgeny Kotelnikov",cs.CL,story,"Large pre-trained language models are capable of generating varied and fluent
texts. Starting from the prompt, these models generate a narrative that can
develop unpredictably. The existing methods of controllable text generation,
which guide the narrative in the text in the user-specified direction, require
creating a training corpus and an additional time-consuming training procedure.
The paper proposes and investigates Collocation2Text, a plug-and-play method
for automatic controllable text generation in Russian, which does not require
fine-tuning. The method is based on two interacting models: the autoregressive
language ruGPT-3 model and the autoencoding language ruRoBERTa model. The idea
of the method is to shift the output distribution of the autoregressive model
according to the output distribution of the autoencoding model in order to
ensure a coherent transition of the narrative in the text towards the guide
phrase, which can contain single words or collocations. The autoencoding model,
which is able to take into account the left and right contexts of the token,
""tells"" the autoregressive model which tokens are the most and least logical at
the current generation step, increasing or decreasing the probabilities of the
corresponding tokens. The experiments on generating news articles using the
proposed method showed its effectiveness for automatically generated fluent
texts which contain coherent transitions between user-specified phrases.",2022-06-18
Plot Writing From Pre-Trained Language Models,2022-06-07 05:30:46+00:00,http://arxiv.org/abs/2206.03021v1,"Yiping Jin, Vishakha Kadam, Dittaya Wanvarie",cs.CL,story,"Pre-trained language models (PLMs) fail to generate long-form narrative text
because they do not consider global structure. As a result, the generated texts
are often incohesive, repetitive, or lack content. Recent work in story
generation reintroduced explicit content planning in the form of prompts,
keywords, or semantic frames. Trained on large parallel corpora, these models
can generate more logical event sequences and thus more contentful stories.
However, these intermediate representations are often not in natural language
and cannot be utilized by PLMs without fine-tuning. We propose generating story
plots using off-the-shelf PLMs while maintaining the benefit of content
planning to generate cohesive and contentful stories. Our proposed method,
ScratchPlot, first prompts a PLM to compose a content plan. Then, we generate
the story's body and ending conditioned on the content plan. Furthermore, we
take a generate-and-rank approach by using additional PLMs to rank the
generated (story, ending) pairs. We benchmark our method with various baselines
and achieved superior results in both human and automatic evaluation.",2022-06-07
"RSTGen: Imbuing Fine-Grained Interpretable Control into Long-FormText
  Generators",2022-05-25 09:06:04+00:00,http://arxiv.org/abs/2205.12590v1,"Rilwan A. Adewoyin, Ritabrata Dutta, Yulan He",cs.CL,story,"In this paper, we study the task of improving the cohesion and coherence of
long-form text generated by language models. To this end, we propose RSTGen, a
framework that utilises Rhetorical Structure Theory (RST), a classical language
theory, to control the discourse structure, semantics and topics of generated
text. Firstly, we demonstrate our model's ability to control structural
discourse and semantic features of generated text in open generation
evaluation. Then we experiment on the two challenging long-form text tasks of
argument generation and story generation. Evaluation using automated metrics
and a metric with high correlation to human evaluation, shows that our model
performs competitively against existing models, while offering significantly
more controls over generated text than alternative methods.",2022-05-25
"How Human is Human Evaluation? Improving the Gold Standard for NLG with
  Utility Theory",2022-05-24 09:51:27+00:00,http://arxiv.org/abs/2205.11930v1,"Kawin Ethayarajh, Dan Jurafsky","cs.CL, cs.AI, cs.LG",story,"Human ratings are treated as the gold standard in NLG evaluation. The
standard protocol is to collect ratings of generated text, average across
annotators, and then rank NLG systems by their average scores. However, little
consideration has been given as to whether this approach faithfully captures
human preferences. In this work, we analyze this standard protocol through the
lens of utility theory in economics. We first identify the implicit assumptions
it makes about annotators and find that these assumptions are often violated in
practice, in which case annotator ratings become an unfaithful reflection of
their preferences. The most egregious violations come from using Likert scales,
which provably reverse the direction of the true preference in certain cases.
We suggest improvements to the standard protocol to make it more theoretically
sound, but even in its improved form, it cannot be used to evaluate open-ended
tasks like story generation. For the latter, we propose a new evaluation
protocol called $\textit{system-level probabilistic assessment}$ (SPA). In our
experiments, we find that according to SPA, annotators prefer larger GPT-3
variants to smaller ones -- as expected -- with all comparisons being
statistically significant. In contrast, the standard protocol only yields
significant results half the time.",2022-05-24
RoViST:Learning Robust Metrics for Visual Storytelling,2022-05-08 03:51:22+00:00,http://arxiv.org/abs/2205.03774v1,"Eileen Wang, Caren Han, Josiah Poon","cs.CV, cs.AI",story,"Visual storytelling (VST) is the task of generating a story paragraph that
describes a given image sequence. Most existing storytelling approaches have
evaluated their models using traditional natural language generation metrics
like BLEU or CIDEr. However, such metrics based on n-gram matching tend to have
poor correlation with human evaluation scores and do not explicitly consider
other criteria necessary for storytelling such as sentence structure or topic
coherence. Moreover, a single score is not enough to assess a story as it does
not inform us about what specific errors were made by the model. In this paper,
we propose 3 evaluation metrics sets that analyses which aspects we would look
for in a good story: 1) visual grounding, 2) coherence, and 3) non-redundancy.
We measure the reliability of our metric sets by analysing its correlation with
human judgement scores on a sample of machine stories obtained from 4
state-of-the-arts models trained on the Visual Storytelling Dataset (VIST). Our
metric sets outperforms other metrics on human correlation, and could be served
as a learning based evaluation metric set that is complementary to existing
rule-based metrics.",2022-05-08
Language Models Can See: Plugging Visual Controls in Text Generation,2022-05-05 13:56:18+00:00,http://arxiv.org/abs/2205.02655v1,"Yixuan Su, Tian Lan, Yahui Liu, Fangyu Liu, Dani Yogatama, Yan Wang, Lingpeng Kong, Nigel Collier","cs.CV, cs.CL",story,"Generative language models (LMs) such as GPT-2/3 can be prompted to generate
text with remarkable quality. While they are designed for text-prompted
generation, it remains an open question how the generation process could be
guided by modalities beyond text such as images. In this work, we propose a
training-free framework, called MAGIC (iMAge-Guided text generatIon with CLIP),
for plugging in visual controls in the generation process and enabling LMs to
perform multimodal tasks (e.g., image captioning) in a zero-shot manner. MAGIC
is a simple yet efficient plug-and-play framework, which directly combines an
off-the-shelf LM (i.e., GPT-2) and an image-text matching model (i.e., CLIP)
for image-grounded text generation. During decoding, MAGIC influences the
generation of the LM by introducing a CLIP-induced score, called magic score,
which regularizes the generated result to be semantically related to a given
image while being coherent to the previously generated context. Notably, the
proposed decoding scheme does not involve any gradient update operation,
therefore being computationally efficient. On the challenging task of zero-shot
image captioning, MAGIC outperforms the state-of-the-art method by notable
margins with a nearly 27 times decoding speedup. MAGIC is a flexible framework
and is theoretically compatible with any text generation tasks that incorporate
image grounding. In the experiments, we showcase that it is also capable of
performing visually grounded story generation given both an image and a text
prompt.",2022-05-05
"Persona-Guided Planning for Controlling the Protagonist's Persona in
  Story Generation",2022-04-22 13:45:02+00:00,http://arxiv.org/abs/2204.10703v1,"Zhexin Zhang, Jiaxin Wen, Jian Guan, Minlie Huang",cs.CL,story,"Endowing the protagonist with a specific personality is essential for writing
an engaging story. In this paper, we aim to control the protagonist's persona
in story generation, i.e., generating a story from a leading context and a
persona description, where the protagonist should exhibit the specified
personality through a coherent event sequence. Considering that personas are
usually embodied implicitly and sparsely in stories, we propose a
planning-based generation model named CONPER to explicitly model the
relationship between personas and events. CONPER first plans events of the
protagonist's behavior which are motivated by the specified persona through
predicting one target sentence, then plans the plot as a sequence of keywords
with the guidance of the predicted persona-related events and commonsense
knowledge, and finally generates the whole story. Both automatic and manual
evaluation results demonstrate that CONPER outperforms state-of-the-art
baselines for generating more coherent and persona-controllable stories.",2022-04-22
"Recovering Patient Journeys: A Corpus of Biomedical Entities and
  Relations on Twitter (BEAR)",2022-04-21 08:18:44+00:00,http://arxiv.org/abs/2204.09952v1,"Amelie Wührl, Roman Klinger","cs.CL, cs.IR",story,"Text mining and information extraction for the medical domain has focused on
scientific text generated by researchers. However, their direct access to
individual patient experiences or patient-doctor interactions can be limited.
Information provided on social media, e.g., by patients and their relatives,
complements the knowledge in scientific text. It reflects the patient's journey
and their subjective perspective on the process of developing symptoms, being
diagnosed and offered a treatment, being cured or learning to live with a
medical condition. The value of this type of data is therefore twofold:
Firstly, it offers direct access to people's perspectives. Secondly, it might
cover information that is not available elsewhere, including self-treatment or
self-diagnoses. Named entity recognition and relation extraction are methods to
structure information that is available in unstructured text. However, existing
medical social media corpora focused on a comparably small set of entities and
relations and particular domains, rather than putting the patient into the
center of analyses. With this paper we contribute a corpus with a rich set of
annotation layers following the motivation to uncover and model patients'
journeys and experiences in more detail. We label 14 entity classes (incl.
environmental factors, diagnostics, biochemical processes, patients'
quality-of-life descriptions, pathogens, medical conditions, and treatments)
and 20 relation classes (e.g., prevents, influences, interactions, causes) most
of which have not been considered before for social media data. The publicly
available dataset consists of 2,100 tweets with approx. 6,000 entity and 3,000
relation annotations. In a corpus analysis we find that over 80 % of documents
contain relevant entities. Over 50 % of tweets express relations which we
consider essential for uncovering patients' narratives about their journeys.",2022-04-21
Event Transition Planning for Open-ended Text Generation,2022-04-20 13:37:51+00:00,http://arxiv.org/abs/2204.09453v1,"Qintong Li, Piji Li, Wei Bi, Zhaochun Ren, Yuxuan Lai, Lingpeng Kong",cs.CL,story,"Open-ended text generation tasks, such as dialogue generation and story
completion, require models to generate a coherent continuation given limited
preceding context. The open-ended nature of these tasks brings new challenges
to the neural auto-regressive text generators nowadays. Despite these neural
models are good at producing human-like text, it is difficult for them to
arrange causalities and relations between given facts and possible ensuing
events. To bridge this gap, we propose a novel two-stage method which
explicitly arranges the ensuing events in open-ended text generation. Our
approach can be understood as a specially-trained coarse-to-fine algorithm,
where an event transition planner provides a ""coarse"" plot skeleton and a text
generator in the second stage refines the skeleton. Experiments on two
open-ended text generation tasks demonstrate that our proposed method
effectively improves the quality of the generated text, especially in coherence
and diversity. The code is available at:
\url{https://github.com/qtli/EventPlanforTextGen}.",2022-04-20
Probing Script Knowledge from Pre-Trained Models,2022-04-16 05:13:39+00:00,http://arxiv.org/abs/2204.10176v1,"Zijian Jin, Xingyu Zhang, Mo Yu, Lifu Huang","cs.CL, cs.AI",story,"Script knowledge is critical for humans to understand the broad daily tasks
and routine activities in the world. Recently researchers have explored the
large-scale pre-trained language models (PLMs) to perform various script
related tasks, such as story generation, temporal ordering of event, future
event prediction and so on. However, it's still not well studied in terms of
how well the PLMs capture the script knowledge. To answer this question, we
design three probing tasks: inclusive sub-event selection, starting sub-event
selection and temporal ordering to investigate the capabilities of PLMs with
and without fine-tuning. The three probing tasks can be further used to
automatically induce a script for each main event given all the possible
sub-events. Taking BERT as a case study, by analyzing its performance on script
induction as well as each individual probing task, we conclude that the
stereotypical temporal knowledge among the sub-events is well captured in BERT,
however the inclusive or starting sub-event knowledge is barely encoded.",2022-04-16
Uniform Complexity for Text Generation,2022-04-11 15:19:47+00:00,http://arxiv.org/abs/2204.05185v1,Joseph Marvin Imperial,"cs.CL, cs.LG",story,"Powerful language models such as GPT-2 have shown promising results in tasks
such as narrative generation which can be useful in an educational setup. These
models, however, should be consistent with the linguistic properties of
triggers used. For example, if the reading level of an input text prompt is
appropriate for low-leveled learners (ex. A2 in the CEFR), then the generated
continuation should also assume this particular level. Thus, we propose the
task of uniform complexity for text generation which serves as a call to make
existing language generators uniformly complex with respect to prompts used.
Our study surveyed over 160 linguistic properties for evaluating text
complexity and found out that both humans and GPT-2 models struggle in
preserving the complexity of prompts in a narrative generation setting.",2022-04-11
On Decoding Strategies for Neural Text Generators,2022-03-29 16:25:30+00:00,http://arxiv.org/abs/2203.15721v1,"Gian Wiher, Clara Meister, Ryan Cotterell","cs.CL, cs.AI",story,"When generating text from probabilistic models, the chosen decoding strategy
has a profound effect on the resulting text. Yet the properties elicited by
various decoding strategies do not always transfer across natural language
generation tasks. For example, while mode-seeking methods like beam search
perform remarkably well for machine translation, they have been observed to
lead to incoherent and repetitive text in story generation. Despite such
observations, the effectiveness of decoding strategies is often assessed with
respect to only a single task. This work -- in contrast -- provides a
comprehensive analysis of the interaction between language generation tasks and
decoding strategies. Specifically, we measure changes in attributes of
generated text as a function of both decoding strategy and task using human and
automatic evaluation. Our results reveal both previously-observed and
surprising findings. For example, the nature of the diversity-quality trade-off
in language generation is very task-specific; the length bias often attributed
to beam search is not constant across tasks.",2022-03-29
Immersive Text Game and Personality Classification,2022-03-20 18:37:03+00:00,http://arxiv.org/abs/2203.10621v1,"Wanshui Li, Yifan Bai, Jiaxuan Lu, Kexin Yi","cs.CL, cs.AI, cs.LG",story,"We designed and built a game called \textit{Immersive Text Game}, which
allows the player to choose a story and a character, and interact with other
characters in the story in an immersive manner of dialogues. The game is based
on several latest models, including text generation language model, information
extraction model, commonsense reasoning model, and psychology evaluation model.
In the past, similar text games usually let players choose from limited actions
instead of answering on their own, and not every time what characters said are
determined by the player. Through the combination of these models and elaborate
game mechanics and modes, the player will find some novel experiences as driven
through the storyline.",2022-03-20
