title,pubdate,id,authors,categories,search,abstract,displaydate
"LongStory: Coherent, Complete and Length Controlled Long story
  Generation",2023-11-26 06:24:25+00:00,http://arxiv.org/abs/2311.15208v1,"Kyeongman Park, Nakyeong Yang, Kyomin Jung","cs.CL, cs.AI",story,"A human author can write any length of story without losing coherence. Also,
they always bring the story to a proper ending, an ability that current
language models lack. In this work, we present the LongStory for coherent,
complete, and length-controlled long story generation. LongStory introduces two
novel methodologies: (1) the long and short-term contexts weight calibrator
(CWC) and (2) long story structural positions (LSP). The CWC adjusts weights
for long-term context Memory and short-term context Cheating, acknowledging
their distinct roles. The LSP employs discourse tokens to convey the structural
positions of a long story. Trained on three datasets with varied average story
lengths, LongStory outperforms other baselines, including the strong story
generator Plotmachine, in coherence, completeness, relevance, and
repetitiveness. We also perform zero-shot tests on each dataset to assess the
model's ability to predict outcomes beyond its training data and validate our
methodology by comparing its performance with variants of our model.",2023-11-26
"A Cross-Attention Augmented Model for Event-Triggered Context-Aware
  Story Generation",2023-11-19 08:54:47+00:00,http://arxiv.org/abs/2311.11271v1,"Chen Tang, Tyler Loakman, Chenghua Lin",cs.CL,story,"Despite recent advancements, existing story generation systems continue to
encounter difficulties in effectively incorporating contextual and event
features, which greatly influence the quality of generated narratives. To
tackle these challenges, we introduce a novel neural generation model, EtriCA,
that enhances the relevance and coherence of generated stories by employing a
cross-attention mechanism to map context features onto event sequences through
residual mapping. This feature capturing mechanism enables our model to exploit
logical relationships between events more effectively during the story
generation process. To further enhance our proposed model, we employ a
post-training framework for knowledge enhancement (KeEtriCA) on a large-scale
book corpus. This allows EtriCA to adapt to a wider range of data samples. This
results in approximately 5\% improvement in automatic metrics and over 10\%
improvement in human evaluation. We conduct extensive experiments, including
comparisons with state-of-the-art (SOTA) baseline models, to evaluate the
performance of our framework on story generation. The experimental results,
encompassing both automated metrics and human assessments, demonstrate the
superiority of our model over existing state-of-the-art baselines. These
results underscore the effectiveness of our model in leveraging context and
event features to improve the quality of generated narratives.",2023-11-19
Event Causality Is Key to Computational Story Understanding,2023-11-16 07:59:12+00:00,http://arxiv.org/abs/2311.09648v1,"Yidan Sun, Qin Chao, Boyang Li",cs.CL,story,"Psychological research suggests the central role of event causality in human
story understanding. Further, event causality has been heavily utilized in
symbolic story generation. However, few machine learning systems for story
understanding employ event causality, partially due to the lack of reliable
methods for identifying open-world causal event relations. Leveraging recent
progress in large language models (LLMs), we present the first method for event
causality identification that leads to material improvements in computational
story understanding. We design specific prompts for extracting event causal
relations from GPT. Against human-annotated event causal relations in the
GLUCOSE dataset, our technique performs on par with supervised models, while
being easily generalizable to stories of different types and lengths. The
extracted causal relations lead to 5.7\% improvements on story quality
evaluation and 8.7\% on story video-text alignment. Our findings indicate
enormous untapped potential for event causality in computational story
understanding.",2023-11-16
GRIM: GRaph-based Interactive narrative visualization for gaMes,2023-11-15 18:55:45+00:00,http://arxiv.org/abs/2311.09213v1,"Jorge Leandro, Sudha Rao, Michael Xu, Weijia Xu, Nebosja Jojic, Chris Brockett, Bill Dolan",cs.CL,story,"Dialogue-based Role Playing Games (RPGs) require powerful storytelling. The
narratives of these may take years to write and typically involve a large
creative team. In this work, we demonstrate the potential of large generative
text models to assist this process. \textbf{GRIM}, a prototype
\textbf{GR}aph-based \textbf{I}nteractive narrative visualization system for
ga\textbf{M}es, generates a rich narrative graph with branching storylines that
match a high-level narrative description and constraints provided by the
designer. Game designers can interactively edit the graph by automatically
generating new sub-graphs that fit the edits within the original narrative and
constraints. We illustrate the use of \textbf{GRIM} in conjunction with GPT-4,
generating branching narratives for four well-known stories with different
contextual constraints.",2023-11-15
Improving Pacing in Long-Form Story Planning,2023-11-08 04:58:29+00:00,http://arxiv.org/abs/2311.04459v1,"Yichen Wang, Kevin Yang, Xiaoming Liu, Dan Klein","cs.CL, cs.AI",story,"Existing LLM-based systems for writing long-form stories or story outlines
frequently suffer from unnatural pacing, whether glossing over important events
or over-elaborating on insignificant details, resulting in a jarring experience
for the reader. We propose a CONCrete Outline ConTrol (CONCOCT) system to
improve pacing when automatically generating story outlines. We first train a
concreteness evaluator to judge which of two events is more concrete
(low-level-detailed). This evaluator can then be used to control pacing in
hierarchical outline generation; in this work, we explore a vaguest-first
expansion procedure that aims for uniform pacing. We further use the evaluator
to filter new outline items based on predicted concreteness. Compared to a
baseline hierarchical outline generator, humans judge CONCOCT's pacing to be
more consistent over 57% of the time across multiple outline lengths; the gains
also translate to downstream stories. All code, data, and models are
open-sourced.",2023-11-08
Aspects of human memory and Large Language Models,2023-11-07 09:39:12+00:00,http://arxiv.org/abs/2311.03839v2,Romuald A. Janik,"cs.CL, cs.AI, cs.LG, q-bio.NC",story,"Large Language Models (LLMs) are huge artificial neural networks which
primarily serve to generate text, but also provide a very sophisticated
probabilistic model of language use. Since generating a semantically consistent
text requires a form of effective memory, we investigate the memory properties
of LLMs and find surprising similarities with key characteristics of human
memory. We argue that the human-like memory properties of the Large Language
Model do not follow automatically from the LLM architecture but are rather
learned from the statistics of the training textual data. These results
strongly suggest that the biological features of human memory leave an imprint
on the way that we structure our textual narratives.",2023-11-07
On the Automatic Generation and Simplification of Children's Stories,2023-10-27 21:31:34+00:00,http://arxiv.org/abs/2310.18502v1,"Maria Valentini, Jennifer Weber, Jesus Salcido, Téa Wright, Eliana Colunga, Katharina Kann",cs.CL,story,"With recent advances in large language models (LLMs), the concept of
automatically generating children's educational materials has become
increasingly realistic. Working toward the goal of age-appropriate simplicity
in generated educational texts, we first examine the ability of several popular
LLMs to generate stories with properly adjusted lexical and readability levels.
We find that, in spite of the growing capabilities of LLMs, they do not yet
possess the ability to limit their vocabulary to levels appropriate for younger
age groups. As a second experiment, we explore the ability of state-of-the-art
lexical simplification models to generalize to the domain of children's stories
and, thus, create an efficient pipeline for their automatic generation. In
order to test these models, we develop a dataset of child-directed lexical
simplification instances, with examples taken from the LLM-generated stories in
our first experiment. We find that, while the strongest-performing current
lexical simplification models do not perform as well on material designed for
children due to their reliance on large language models behind the scenes, some
models that still achieve fairly strong results on general data can mimic or
even improve their performance on children-directed data with proper
fine-tuning, which we conduct using our newly created child-directed
simplification dataset.",2023-10-27
GROOViST: A Metric for Grounding Objects in Visual Storytelling,2023-10-26 20:27:16+00:00,http://arxiv.org/abs/2310.17770v1,"Aditya K Surikuchi, Sandro Pezzelle, Raquel Fernández","cs.AI, cs.CL, cs.CV, cs.LG",story,"A proper evaluation of stories generated for a sequence of images -- the task
commonly referred to as visual storytelling -- must consider multiple aspects,
such as coherence, grammatical correctness, and visual grounding. In this work,
we focus on evaluating the degree of grounding, that is, the extent to which a
story is about the entities shown in the images. We analyze current metrics,
both designed for this purpose and for general vision-text alignment. Given
their observed shortcomings, we propose a novel evaluation tool, GROOViST, that
accounts for cross-modal dependencies, temporal misalignments (the fact that
the order in which entities appear in the story and the image sequence may not
match), and human intuitions on visual grounding. An additional advantage of
GROOViST is its modular design, where the contribution of each component can be
assessed and interpreted individually.",2023-10-26
"Branch-Solve-Merge Improves Large Language Model Evaluation and
  Generation",2023-10-23 17:29:48+00:00,http://arxiv.org/abs/2310.15123v1,"Swarnadeep Saha, Omer Levy, Asli Celikyilmaz, Mohit Bansal, Jason Weston, Xian Li","cs.CL, cs.AI, cs.LG",story,"Large Language Models (LLMs) are frequently used for multi-faceted language
generation and evaluation tasks that involve satisfying intricate user
constraints or taking into account multiple aspects and criteria. However,
their performance can fall short, due to the model's lack of coherence and
inability to plan and decompose the problem. We propose Branch-Solve-Merge
(BSM), a Large Language Model program (Schlag et al., 2023) for tackling such
challenging natural language tasks. It consists of branch, solve, and merge
modules that are parameterized with specific prompts to the base LLM. These
three modules plan a decomposition of the task into multiple parallel
sub-tasks, independently solve them, and fuse the solutions to the sub-tasks.
We apply our method to the tasks of LLM response evaluation and constrained
text generation and evaluate its effectiveness with multiple LLMs, including
Vicuna, LLaMA-2-chat, and GPT-4. BSM improves the evaluation correctness and
consistency for each LLM by enhancing human-LLM agreement by up to 26%,
reducing length and pairwise position biases by up to 50%, and allowing
LLaMA-2-chat to match or outperform GPT-4 on most domains. On the constraint
story generation task, BSM improves the coherence of the stories while also
improving constraint satisfaction by 12%.",2023-10-23
Affective and Dynamic Beam Search for Story Generation,2023-10-23 16:37:14+00:00,http://arxiv.org/abs/2310.15079v1,"Tenghao Huang, Ehsan Qasemi, Bangzheng Li, He Wang, Faeze Brahman, Muhao Chen, Snigdha Chaturvedi",cs.CL,story,"Storytelling's captivating potential makes it a fascinating research area,
with implications for entertainment, education, therapy, and cognitive studies.
In this paper, we propose Affective Story Generator (AffGen) for generating
interesting narratives. AffGen introduces ""intriguing twists"" in narratives by
employing two novel techniques-Dynamic Beam Sizing and Affective Reranking.
Dynamic Beam Sizing encourages less predictable, more captivating word choices
using a contextual multi-arm bandit model. Affective Reranking prioritizes
sentence candidates based on affect intensity. Our empirical evaluations, both
automatic and human, demonstrate AffGen's superior performance over existing
baselines in generating affectively charged and interesting narratives. Our
ablation study and analysis provide insights into the strengths and weaknesses
of AffGen.",2023-10-23
"Experimental Narratives: A Comparison of Human Crowdsourced Storytelling
  and AI Storytelling",2023-10-19 16:54:38+00:00,http://arxiv.org/abs/2310.12902v1,Nina Begus,"cs.CL, cs.AI",story,"The paper proposes a framework that combines behavioral and computational
experiments employing fictional prompts as a novel tool for investigating
cultural artifacts and social biases in storytelling both by humans and
generative AI. The study analyzes 250 stories authored by crowdworkers in June
2019 and 80 stories generated by GPT-3.5 and GPT-4 in March 2023 by merging
methods from narratology and inferential statistics. Both crowdworkers and
large language models responded to identical prompts about creating and falling
in love with an artificial human. The proposed experimental paradigm allows a
direct comparison between human and LLM-generated storytelling. Responses to
the Pygmalionesque prompts confirm the pervasive presence of the Pygmalion myth
in the collective imaginary of both humans and large language models. All
solicited narratives present a scientific or technological pursuit. The
analysis reveals that narratives from GPT-3.5 and particularly GPT-4 are more
more progressive in terms of gender roles and sexuality than those written by
humans. While AI narratives can occasionally provide innovative plot twists,
they offer less imaginative scenarios and rhetoric than human-authored texts.
The proposed framework argues that fiction can be used as a window into human
and AI-based collective imaginary and social dimensions.",2023-10-19
End-to-end Story Plot Generator,2023-10-13 00:49:59+00:00,http://arxiv.org/abs/2310.08796v1,"Hanlin Zhu, Andrew Cohen, Danqing Wang, Kevin Yang, Xiaomeng Yang, Jiantao Jiao, Yuandong Tian",cs.CL,story,"Story plots, while short, carry most of the essential information of a full
story that may contain tens of thousands of words. We study the problem of
automatic generation of story plots, which includes story premise, character
descriptions, plot outlines, etc. To generate a single engaging plot, existing
plot generators (e.g., DOC (Yang et al., 2022a)) require hundreds to thousands
of calls to LLMs (e.g., OpenAI API) in the planning stage of the story plot,
which is costly and takes at least several minutes. Moreover, the hard-wired
nature of the method makes the pipeline non-differentiable, blocking fast
specialization and personalization of the plot generator. In this paper, we
propose three models, $\texttt{OpenPlot}$, $\texttt{E2EPlot}$ and
$\texttt{RLPlot}$, to address these challenges. $\texttt{OpenPlot}$ replaces
expensive OpenAI API calls with LLaMA2 (Touvron et al., 2023) calls via careful
prompt designs, which leads to inexpensive generation of high-quality training
datasets of story plots. We then train an end-to-end story plot generator,
$\texttt{E2EPlot}$, by supervised fine-tuning (SFT) using approximately 13000
story plots generated by $\texttt{OpenPlot}$. $\texttt{E2EPlot}$ generates
story plots of comparable quality to $\texttt{OpenPlot}$, and is > 10$\times$
faster (1k tokens in only 30 seconds on average). Finally, we obtain
$\texttt{RLPlot}$ that is further fine-tuned with RLHF on several different
reward models for different aspects of story quality, which yields 60.0$\%$
winning rate against $\texttt{E2EPlot}$ along the aspect of suspense and
surprise.",2023-10-13
"EIPE-text: Evaluation-Guided Iterative Plan Extraction for Long-Form
  Narrative Text Generation",2023-10-12 10:21:37+00:00,http://arxiv.org/abs/2310.08185v1,"Wang You, Wenshan Wu, Yaobo Liang, Shaoguang Mao, Chenfei Wu, Maosong Cao, Yuzhe Cai, Yiduo Guo, Yan Xia, Furu Wei, Nan Duan","cs.CL, cs.AI",story,"Plan-and-Write is a common hierarchical approach in long-form narrative text
generation, which first creates a plan to guide the narrative writing.
Following this approach, several studies rely on simply prompting large
language models for planning, which often yields suboptimal results. In this
paper, we propose a new framework called Evaluation-guided Iterative Plan
Extraction for long-form narrative text generation (EIPE-text), which extracts
plans from the corpus of narratives and utilizes the extracted plans to
construct a better planner. EIPE-text has three stages: plan extraction,
learning, and inference. In the plan extraction stage, it iteratively extracts
and improves plans from the narrative corpus and constructs a plan corpus. We
propose a question answer (QA) based evaluation mechanism to automatically
evaluate the plans and generate detailed plan refinement instructions to guide
the iterative improvement. In the learning stage, we build a better planner by
fine-tuning with the plan corpus or in-context learning with examples in the
plan corpus. Finally, we leverage a hierarchical approach to generate long-form
narratives. We evaluate the effectiveness of EIPE-text in the domains of novels
and storytelling. Both GPT-4-based evaluations and human evaluations
demonstrate that our method can generate more coherent and relevant long-form
narratives. Our code will be released in the future.",2023-10-12
"The Temporal Structure of Language Processing in the Human Brain
  Corresponds to The Layered Hierarchy of Deep Language Models",2023-10-11 01:03:42+00:00,http://arxiv.org/abs/2310.07106v1,"Ariel Goldstein, Eric Ham, Mariano Schain, Samuel Nastase, Zaid Zada, Avigail Dabush, Bobbi Aubrey, Harshvardhan Gazula, Amir Feder, Werner K Doyle, Sasha Devore, Patricia Dugan, Daniel Friedman, Roi Reichart, Michael Brenner, Avinatan Hassidim, Orrin Devinsky, Adeen Flinker, Omer Levy, Uri Hasson","cs.CL, cs.AI, cs.LG, q-bio.NC",story,"Deep Language Models (DLMs) provide a novel computational paradigm for
understanding the mechanisms of natural language processing in the human brain.
Unlike traditional psycholinguistic models, DLMs use layered sequences of
continuous numerical vectors to represent words and context, allowing a
plethora of emerging applications such as human-like text generation. In this
paper we show evidence that the layered hierarchy of DLMs may be used to model
the temporal dynamics of language comprehension in the brain by demonstrating a
strong correlation between DLM layer depth and the time at which layers are
most predictive of the human brain. Our ability to temporally resolve
individual layers benefits from our use of electrocorticography (ECoG) data,
which has a much higher temporal resolution than noninvasive methods like fMRI.
Using ECoG, we record neural activity from participants listening to a
30-minute narrative while also feeding the same narrative to a high-performing
DLM (GPT2-XL). We then extract contextual embeddings from the different layers
of the DLM and use linear encoding models to predict neural activity. We first
focus on the Inferior Frontal Gyrus (IFG, or Broca's area) and then extend our
model to track the increasing temporal receptive window along the linguistic
processing hierarchy from auditory to syntactic and semantic areas. Our results
reveal a connection between human language processing and DLMs, with the DLM's
layer-by-layer accumulation of contextual information mirroring the timing of
neural activity in high-order language areas.",2023-10-11
"RAUCG: Retrieval-Augmented Unsupervised Counter Narrative Generation for
  Hate Speech",2023-10-09 12:01:26+00:00,http://arxiv.org/abs/2310.05650v1,"Shuyu Jiang, Wenyi Tang, Xingshu Chen, Rui Tanga, Haizhou Wang, Wenxian Wang",cs.CL,story,"The Counter Narrative (CN) is a promising approach to combat online hate
speech (HS) without infringing on freedom of speech. In recent years, there has
been a growing interest in automatically generating CNs using natural language
generation techniques. However, current automatic CN generation methods mainly
rely on expert-authored datasets for training, which are time-consuming and
labor-intensive to acquire. Furthermore, these methods cannot directly obtain
and extend counter-knowledge from external statistics, facts, or examples. To
address these limitations, we propose Retrieval-Augmented Unsupervised Counter
Narrative Generation (RAUCG) to automatically expand external counter-knowledge
and map it into CNs in an unsupervised paradigm. Specifically, we first
introduce an SSF retrieval method to retrieve counter-knowledge from the
multiple perspectives of stance consistency, semantic overlap rate, and fitness
for HS. Then we design an energy-based decoding mechanism by quantizing
knowledge injection, countering and fluency constraints into differentiable
functions, to enable the model to build mappings from counter-knowledge to CNs
without expert-authored CN data. Lastly, we comprehensively evaluate model
performance in terms of language quality, toxicity, persuasiveness, relevance,
and success rate of countering HS, etc. Experimental results show that RAUCG
outperforms strong baselines on all metrics and exhibits stronger
generalization capabilities, achieving significant improvements of +2.0% in
relevance and +4.5% in success rate of countering metrics. Moreover, RAUCG
enabled GPT2 to outperform T0 in all metrics, despite the latter being
approximately eight times larger than the former. Warning: This paper may
contain offensive or upsetting content!",2023-10-09
"GROVE: A Retrieval-augmented Complex Story Generation Framework with A
  Forest of Evidence",2023-10-09 03:55:55+00:00,http://arxiv.org/abs/2310.05388v1,"Zhihua Wen, Zhiliang Tian, Wei Wu, Yuxin Yang, Yanqi Shi, Zhen Huang, Dongsheng Li",cs.CL,story,"Conditional story generation is significant in human-machine interaction,
particularly in producing stories with complex plots. While Large language
models (LLMs) perform well on multiple NLP tasks, including story generation,
it is challenging to generate stories with both complex and creative plots.
Existing methods often rely on detailed prompts to guide LLMs to meet target
conditions, which inadvertently restrict the creative potential of the
generated stories. We argue that leveraging information from exemplary
human-written stories facilitates generating more diverse plotlines. Delving
deeper into story details helps build complex and credible plots. In this
paper, we propose a retrieval-au\textbf{G}mented sto\textbf{R}y generation
framework with a f\textbf{O}rest of e\textbf{V}id\textbf{E}nce (GROVE) to
enhance stories' complexity. We build a retrieval repository for target
conditions to produce few-shot examples to prompt LLMs. Additionally, we design
an ``asking-why'' prompting scheme that extracts a forest of evidence,
providing compensation for the ambiguities that may occur in the generated
story. This iterative process uncovers underlying story backgrounds. Finally,
we select the most fitting chains of evidence from the evidence forest and
integrate them into the generated story, thereby enhancing the narrative's
complexity and credibility. Experimental results and numerous examples verify
the effectiveness of our method.",2023-10-09
Visual Storytelling with Question-Answer Plans,2023-10-08 21:45:34+00:00,http://arxiv.org/abs/2310.05295v1,"Danyang Liu, Mirella Lapata, Frank Keller",cs.CL,story,"Visual storytelling aims to generate compelling narratives from image
sequences. Existing models often focus on enhancing the representation of the
image sequence, e.g., with external knowledge sources or advanced graph
structures. Despite recent progress, the stories are often repetitive,
illogical, and lacking in detail. To mitigate these issues, we present a novel
framework which integrates visual representations with pretrained language
models and planning. Our model translates the image sequence into a visual
prefix, a sequence of continuous embeddings which language models can
interpret. It also leverages a sequence of question-answer pairs as a blueprint
plan for selecting salient visual concepts and determining how they should be
assembled into a narrative. Automatic and human evaluation on the VIST
benchmark (Huang et al., 2016) demonstrates that blueprint-based models
generate stories that are more coherent, interesting, and natural compared to
competitive baselines and state-of-the-art systems.",2023-10-08
