title,pubdate,id,authors,categories,search,abstract,displaydate
"Towards More Effective Table-to-Text Generation: Assessing In-Context
  Learning and Self-Evaluation with Open-Source Models",2024-10-15 09:19:42+00:00,http://arxiv.org/abs/2410.12878v1,"Sahar Iravani, Tim . O . F Conrad","cs.CL, cs.AI, cs.LG",story,"Table processing, a key task in natural language processing, has
significantly benefited from recent advancements in language models (LMs).
However, the capabilities of LMs in table-to-text generation, which transforms
structured data into coherent narrative text, require an in-depth
investigation, especially with current open-source models. This study explores
the effectiveness of various in-context learning strategies in LMs across
benchmark datasets, focusing on the impact of providing examples to the model.
More importantly, we examine a real-world use case, offering valuable insights
into practical applications. To complement traditional evaluation metrics, we
employ a large language model (LLM) self-evaluation approach using
chain-of-thought reasoning and assess its correlation with human-aligned
metrics like BERTScore. Our findings highlight the significant impact of
examples in improving table-to-text generation and suggest that, while LLM
self-evaluation has potential, its current alignment with human judgment could
be enhanced. This points to the need for more reliable evaluation methods.",2024-10-15
"More than Memes: A Multimodal Topic Modeling Approach to Conspiracy
  Theories on Telegram",2024-10-11 09:10:26+00:00,http://arxiv.org/abs/2410.08642v1,Elisabeth Steffen,"cs.SI, cs.CL, cs.CV, cs.MM",story,"Research on conspiracy theories and related content online has traditionally
focused on textual data. To address the increasing prevalence of (audio-)visual
data on social media, and to capture the evolving and dynamic nature of this
communication, researchers have begun to explore the potential of unsupervised
approaches for analyzing multimodal online content. Our research contributes to
this field by exploring the potential of multimodal topic modeling for
analyzing conspiracy theories in German-language Telegram channels. Our work
uses the BERTopic topic modeling approach in combination with CLIP for the
analysis of textual and visual data. We analyze a corpus of ~40, 000 Telegram
messages posted in October 2023 in 571 German-language Telegram channels known
for disseminating conspiracy theories and other deceptive content. We explore
the potentials and challenges of this approach for studying a medium-sized
corpus of user-generated, text-image online content. We offer insights into the
dominant topics across modalities, different text and image genres discovered
during the analysis, quantitative inter-modal topic analyses, and a qualitative
case study of textual, visual, and multimodal narrative strategies in the
communication of conspiracy theories.",2024-10-11
Constraint representation towards precise data-driven storytelling,2024-10-10 02:03:46+00:00,http://arxiv.org/abs/2410.07535v1,"Yu-Zhe Shi, Haotian Li, Lecheng Ruan, Huamin Qu",cs.HC,story,"Data-driven storytelling serves as a crucial bridge for communicating ideas
in a persuasive way. However, the manual creation of data stories is a
multifaceted, labor-intensive, and case-specific effort, limiting their broader
application. As a result, automating the creation of data stories has emerged
as a significant research thrust. Despite advances in Artificial Intelligence,
the systematic generation of data stories remains challenging due to their
hybrid nature: they must frame a perspective based on a seed idea in a top-down
manner, similar to traditional storytelling, while coherently grounding
insights of given evidence in a bottom-up fashion, akin to data analysis. These
dual requirements necessitate precise constraints on the permissible space of a
data story. In this viewpoint, we propose integrating constraints into the data
story generation process. Defined upon the hierarchies of interpretation and
articulation, constraints shape both narrations and illustrations to align with
seed ideas and contextualized evidence. We identify the taxonomy and required
functionalities of these constraints. Although constraints can be heterogeneous
and latent, we explore the potential to represent them in a
computation-friendly fashion via Domain-Specific Languages. We believe that
leveraging constraints will facilitate both artistic and scientific aspects of
data story generation.",2024-10-10
"Decoding Decoded: Understanding Hyperparameter Effects in Open-Ended
  Text Generation",2024-10-08 14:51:03+00:00,http://arxiv.org/abs/2410.06097v1,"Esteban Garces Arias, Meimingwei Li, Christian Heumann, Matthias Aßenmacher","cs.CL, cs.LG",story,"Decoding strategies for large language models (LLMs) are a critical but often
underexplored aspect of text generation tasks. Since LLMs produce probability
distributions over the entire vocabulary, various decoding methods have been
developed to transform these probabilities into coherent and fluent text, each
with its own set of hyperparameters. In this study, we present a large-scale,
comprehensive analysis of how hyperparameter selection affects text quality in
open-ended text generation across multiple LLMs, datasets, and evaluation
metrics. Through an extensive sensitivity analysis, we provide practical
guidelines for hyperparameter tuning and demonstrate the substantial influence
of these choices on text quality. Using three established datasets, spanning
factual domains (e.g., news) and creative domains (e.g., fiction), we show that
hyperparameter tuning significantly impacts generation quality, though its
effects vary across models and tasks. We offer in-depth insights into these
effects, supported by both human evaluations and a synthesis of widely-used
automatic evaluation metrics.",2024-10-08
"ACDC: Autoregressive Coherent Multimodal Generation using Diffusion
  Correction",2024-10-07 03:22:51+00:00,http://arxiv.org/abs/2410.04721v1,"Hyungjin Chung, Dohun Lee, Jong Chul Ye","cs.LG, cs.CV",story,"Autoregressive models (ARMs) and diffusion models (DMs) represent two leading
paradigms in generative modeling, each excelling in distinct areas: ARMs in
global context modeling and long-sequence generation, and DMs in generating
high-quality local contexts, especially for continuous data such as images and
short videos. However, ARMs often suffer from exponential error accumulation
over long sequences, leading to physically implausible results, while DMs are
limited by their local context generation capabilities. In this work, we
introduce Autoregressive Coherent multimodal generation with Diffusion
Correction (ACDC), a zero-shot approach that combines the strengths of both
ARMs and DMs at the inference stage without the need for additional
fine-tuning. ACDC leverages ARMs for global context generation and
memory-conditioned DMs for local correction, ensuring high-quality outputs by
correcting artifacts in generated multimodal tokens. In particular, we propose
a memory module based on large language models (LLMs) that dynamically adjusts
the conditioning texts for the DMs, preserving crucial global context
information. Our experiments on multimodal tasks, including coherent
multi-frame story generation and autoregressive video generation, demonstrate
that ACDC effectively mitigates the accumulation of errors and significantly
enhances the quality of generated outputs, achieving superior performance while
remaining agnostic to specific ARM and DM architectures. Project page:
https://acdc2025.github.io/",2024-10-07
"Evaluation of Large Language Models for Summarization Tasks in the
  Medical Domain: A Narrative Review",2024-09-26 17:58:26+00:00,http://arxiv.org/abs/2409.18170v1,"Emma Croxford, Yanjun Gao, Nicholas Pellegrino, Karen K. Wong, Graham Wills, Elliot First, Frank J. Liao, Cherodeep Goswami, Brian Patterson, Majid Afshar","cs.CL, cs.AI",story,"Large Language Models have advanced clinical Natural Language Generation,
creating opportunities to manage the volume of medical text. However, the
high-stakes nature of medicine requires reliable evaluation, which remains a
challenge. In this narrative review, we assess the current evaluation state for
clinical summarization tasks and propose future directions to address the
resource constraints of expert human evaluation.",2024-09-26
Counterfactual Token Generation in Large Language Models,2024-09-25 15:30:24+00:00,http://arxiv.org/abs/2409.17027v1,"Ivi Chatzi, Nina Corvelo Benz, Eleni Straitouri, Stratis Tsirtsis, Manuel Gomez-Rodriguez","cs.LG, cs.AI, cs.CL",story,"""Sure, I am happy to generate a story for you: Captain Lyra stood at the helm
of her trusty ship, the Maelstrom's Fury, gazing out at the endless sea. [...]
Lyra's eyes welled up with tears as she realized the bitter truth - she had
sacrificed everything for fleeting riches, and lost the love of her crew, her
family, and herself."" Although this story, generated by a large language model,
is captivating, one may wonder -- how would the story have unfolded if the
model had chosen ""Captain Maeve"" as the protagonist instead? We cannot know.
State-of-the-art large language models are stateless -- they maintain no
internal memory or state. Given a prompt, they generate a sequence of tokens as
an output using an autoregressive process. As a consequence, they cannot reason
about counterfactual alternatives to tokens they have generated in the past. In
this work, our goal is to enhance them with this functionality. To this end, we
develop a causal model of token generation that builds upon the Gumbel-Max
structural causal model. Our model allows any large language model to perform
counterfactual token generation at almost no cost in comparison with vanilla
token generation, it is embarrassingly simple to implement, and it does not
require any fine-tuning nor prompt engineering. We implement our model on Llama
3 8B-instruct and conduct both qualitative and quantitative analyses of
counterfactually generated text. We conclude with a demonstrative application
of counterfactual token generation for bias detection, unveiling interesting
insights about the model of the world constructed by large language models.",2024-09-25
A Character-Centric Creative Story Generation via Imagination,2024-09-25 06:54:29+00:00,http://arxiv.org/abs/2409.16667v1,"Kyeongman Park, Minbeom Kim, Kyomin Jung",cs.CL,story,"Creative story generation with diverse and detailed story elements is a
long-standing goal for large language models. While existing methodologies
generate long and coherent stories, they fall significantly short of human
capabilities in terms of diversity and character detail. To address this, we
introduce a novel story generation framework called CCI (Character-centric
Creative story generation via Imagination). CCI features two innovative modules
for creative story generation: IG (Image-Guided Imagination) and MW
(Multi-Writer model). In the IG module, we utilize DALL-E 3 to create visual
representations of key story elements. The IG generates more novel and concrete
characters, backgrounds, and main plots than text-only methods. The MW module
uses these story elements created by IG to generate multiple description
candidates for the protagonist and select the best one. This method
incorporates vivid and rich character descriptions into the story. We compared
the stories generated by CCI and baseline models through human evaluation and
statistical analysis. The results showed significant improvements in the
creativity. Furthermore, by enabling interactive multi-modal story generation
with users, we have opened up possibilities for human-LLM integration in
cultural development.",2024-09-25
"MirrorStories: Reflecting Diversity through Personalized Narrative
  Generation with Large Language Models",2024-09-20 22:43:13+00:00,http://arxiv.org/abs/2409.13935v2,"Sarfaroz Yunusov, Hamza Sidat, Ali Emami","cs.CL, cs.AI, cs.CY",story,"This study explores the effectiveness of Large Language Models (LLMs) in
creating personalized ""mirror stories"" that reflect and resonate with
individual readers' identities, addressing the significant lack of diversity in
literature. We present MirrorStories, a corpus of 1,500 personalized short
stories generated by integrating elements such as name, gender, age, ethnicity,
reader interest, and story moral. We demonstrate that LLMs can effectively
incorporate diverse identity elements into narratives, with human evaluators
identifying personalized elements in the stories with high accuracy. Through a
comprehensive evaluation involving 26 diverse human judges, we compare the
effectiveness of MirrorStories against generic narratives. We find that
personalized LLM-generated stories not only outscore generic human-written and
LLM-generated ones across all metrics of engagement (with average ratings of
4.22 versus 3.37 on a 5-point scale), but also achieve higher textual diversity
while preserving the intended moral. We also provide analyses that include bias
assessments and a study on the potential for integrating images into
personalized stories.",2024-09-20
Generating Visual Stories with Grounded and Coreferent Characters,2024-09-20 14:56:33+00:00,http://arxiv.org/abs/2409.13555v1,"Danyang Liu, Mirella Lapata, Frank Keller","cs.CL, cs.AI",story,"Characters are important in narratives. They move the plot forward, create
emotional connections, and embody the story's themes. Visual storytelling
methods focus more on the plot and events relating to it, without building the
narrative around specific characters. As a result, the generated stories feel
generic, with character mentions being absent, vague, or incorrect. To mitigate
these issues, we introduce the new task of character-centric story generation
and present the first model capable of predicting visual stories with
consistently grounded and coreferent character mentions. Our model is finetuned
on a new dataset which we build on top of the widely used VIST benchmark.
Specifically, we develop an automated pipeline to enrich VIST with visual and
textual character coreference chains. We also propose new evaluation metrics to
measure the richness of characters and coreference in stories. Experimental
results show that our model generates stories with recurring characters which
are consistent and coreferent to larger extent compared to baselines and
state-of-the-art systems.",2024-09-20
"Small Language Models can Outperform Humans in Short Creative Writing: A
  Study Comparing SLMs with Humans and LLMs",2024-09-17 20:40:02+00:00,http://arxiv.org/abs/2409.11547v1,"Guillermo Marco, Luz Rello, Julio Gonzalo","cs.CL, cs.AI",story,"In this paper, we evaluate the creative fiction writing abilities of a
fine-tuned small language model (SLM), BART Large, and compare its performance
to humans and two large language models (LLMs): GPT-3.5 and GPT-4o. Our
evaluation consists of two experiments: (i) a human evaluation where readers
assess the stories generated by the SLM compared to human-written stories, and
(ii) a qualitative linguistic analysis comparing the textual characteristics of
the stories generated by the different models. In the first experiment, we
asked 68 participants to rate short stories generated by the models and humans
along dimensions such as grammaticality, relevance, creativity, and
attractiveness. BART Large outperformed human writers in most aspects, except
creativity, with an overall score of 2.11 compared to 1.85 for human-written
texts -- a 14% improvement. In the second experiment, the qualitative analysis
revealed that, while GPT-4o exhibited near-perfect internal and external
coherence, it tended to produce more predictable narratives, with only 3% of
its stories seen as novel. In contrast, 15% of BART's stories were considered
novel, indicating a higher degree of creativity despite its smaller model size.
This study provides both quantitative and qualitative insights into how model
size and fine-tuning influence the balance between creativity, fluency, and
coherence in creative writing tasks.",2024-09-17
"The Art of Storytelling: Multi-Agent Generative AI for Dynamic
  Multimodal Narratives",2024-09-17 15:10:23+00:00,http://arxiv.org/abs/2409.11261v3,"Samee Arif, Taimoor Arif, Muhammad Saad Haroon, Aamina Jamal Khan, Agha Ali Raza, Awais Athar",cs.CL,story,"This paper introduces the concept of an education tool that utilizes
Generative Artificial Intelligence (GenAI) to enhance storytelling for
children. The system combines GenAI-driven narrative co-creation,
text-to-speech conversion, and text-to-video generation to produce an engaging
experience for learners. We describe the co-creation process, the adaptation of
narratives into spoken words using text-to-speech models, and the
transformation of these narratives into contextually relevant visuals through
text-to-video technology. Our evaluation covers the linguistics of the
generated stories, the text-to-speech conversion quality, and the accuracy of
the generated visuals.",2024-09-17
Identity-related Speech Suppression in Generative AI Content Moderation,2024-09-09 14:34:51+00:00,http://arxiv.org/abs/2409.13725v1,"Oghenefejiro Isaacs Anigboro, Charlie M. Crawford, Danaë Metaxa, Sorelle A. Friedler","cs.CL, cs.CY, cs.HC",story,"Automated content moderation has long been used to help identify and filter
undesired user-generated content online. Generative AI systems now use such
filters to keep undesired generated content from being created by or shown to
users. From classrooms to Hollywood, as generative AI is increasingly used for
creative or expressive text generation, whose stories will these technologies
allow to be told, and whose will they suppress? In this paper, we define and
introduce measures of speech suppression, focusing on speech related to
different identity groups incorrectly filtered by a range of content moderation
APIs. Using both short-form, user-generated datasets traditional in content
moderation and longer generative AI-focused data, including two datasets we
introduce in this work, we create a benchmark for measurement of speech
suppression for nine identity groups. Across one traditional and four
generative AI-focused automated content moderation services tested, we find
that identity-related speech is more likely to be incorrectly suppressed than
other speech except in the cases of a few non-marginalized groups.
Additionally, we find differences between APIs in their abilities to correctly
moderate generative AI content.",2024-09-09
CLUE: Concept-Level Uncertainty Estimation for Large Language Models,2024-09-04 18:27:12+00:00,http://arxiv.org/abs/2409.03021v1,"Yu-Hsiang Wang, Andrew Bai, Che-Ping Tsai, Cho-Jui Hsieh","cs.CL, cs.LG",story,"Large Language Models (LLMs) have demonstrated remarkable proficiency in
various natural language generation (NLG) tasks. Previous studies suggest that
LLMs' generation process involves uncertainty. However, existing approaches to
uncertainty estimation mainly focus on sequence-level uncertainty, overlooking
individual pieces of information within sequences. These methods fall short in
separately assessing the uncertainty of each component in a sequence. In
response, we propose a novel framework for Concept-Level Uncertainty Estimation
(CLUE) for LLMs. We leverage LLMs to convert output sequences into
concept-level representations, breaking down sequences into individual concepts
and measuring the uncertainty of each concept separately. We conduct
experiments to demonstrate that CLUE can provide more interpretable uncertainty
estimation results compared with sentence-level uncertainty, and could be a
useful tool for various tasks such as hallucination detection and story
generation.",2024-09-04
"It is Time to Develop an Auditing Framework to Promote Value Aware
  Chatbots",2024-09-03 02:15:34+00:00,http://arxiv.org/abs/2409.01539v1,"Yanchen Wang, Lisa Singh",cs.CL,story,"The launch of ChatGPT in November 2022 marked the beginning of a new era in
AI, the availability of generative AI tools for everyone to use. ChatGPT and
other similar chatbots boast a wide range of capabilities from answering
student homework questions to creating music and art. Given the large amounts
of human data chatbots are built on, it is inevitable that they will inherit
human errors and biases. These biases have the potential to inflict significant
harm or increase inequity on different subpopulations. Because chatbots do not
have an inherent understanding of societal values, they may create new content
that is contrary to established norms. Examples of concerning generated content
includes child pornography, inaccurate facts, and discriminatory posts. In this
position paper, we argue that the speed of advancement of this technology
requires us, as computer and data scientists, to mobilize and develop a
values-based auditing framework containing a community established standard set
of measurements to monitor the health of different chatbots and LLMs. To
support our argument, we use a simple audit template to share the results of
basic audits we conduct that are focused on measuring potential bias in search
engine style tasks, code generation, and story generation. We identify
responses from GPT 3.5 and GPT 4 that are both consistent and not consistent
with values derived from existing law. While the findings come as no surprise,
they do underscore the urgency of developing a robust auditing framework for
openly sharing results in a consistent way so that mitigation strategies can be
developed by the academic community, government agencies, and companies when
our values are not being adhered to. We conclude this paper with
recommendations for value-based strategies for improving the technologies.",2024-09-03
"What Makes a Good Story and How Can We Measure It? A Comprehensive
  Survey of Story Evaluation",2024-08-26 20:35:42+00:00,http://arxiv.org/abs/2408.14622v1,"Dingyi Yang, Qin Jin","cs.CL, A.1; I.2.7; I.2.10",story,"With the development of artificial intelligence, particularly the success of
Large Language Models (LLMs), the quantity and quality of automatically
generated stories have significantly increased. This has led to the need for
automatic story evaluation to assess the generative capabilities of computing
systems and analyze the quality of both automatic-generated and human-written
stories. Evaluating a story can be more challenging than other generation
evaluation tasks. While tasks like machine translation primarily focus on
assessing the aspects of fluency and accuracy, story evaluation demands complex
additional measures such as overall coherence, character development,
interestingness, etc. This requires a thorough review of relevant research. In
this survey, we first summarize existing storytelling tasks, including
text-to-text, visual-to-text, and text-to-visual. We highlight their evaluation
challenges, identify various human criteria to measure stories, and present
existing benchmark datasets. Then, we propose a taxonomy to organize evaluation
metrics that have been developed or can be adopted for story evaluation. We
also provide descriptions of these metrics, along with the discussion of their
merits and limitations. Later, we discuss the human-AI collaboration for story
evaluation and generation. Finally, we suggest potential future research
directions, extending from story evaluation to general evaluations.",2024-08-26
DHP Benchmark: Are LLMs Good NLG Evaluators?,2024-08-25 02:01:38+00:00,http://arxiv.org/abs/2408.13704v1,"Yicheng Wang, Jiayi Yuan, Yu-Neng Chuang, Zhuoer Wang, Yingchi Liu, Mark Cusick, Param Kulkarni, Zhengping Ji, Yasser Ibrahim, Xia Hu","cs.CL, cs.AI",story,"Large Language Models (LLMs) are increasingly serving as evaluators in
Natural Language Generation (NLG) tasks. However, the capabilities of LLMs in
scoring NLG quality remain inadequately explored. Current studies depend on
human assessments and simple metrics that fail to capture the discernment of
LLMs across diverse NLG tasks. To address this gap, we propose the Discernment
of Hierarchical Perturbation (DHP) benchmarking framework, which provides
quantitative discernment scores for LLMs utilizing hierarchically perturbed
text data and statistical tests to measure the NLG evaluation capabilities of
LLMs systematically. We have re-established six evaluation datasets for this
benchmark, covering four NLG tasks: Summarization, Story Completion, Question
Answering, and Translation. Our comprehensive benchmarking of five major LLM
series provides critical insight into their strengths and limitations as NLG
evaluators.",2024-08-25
