title,pubdate,id,authors,categories,search,abstract,displaydate
MVSS: A Unified Framework for Multi-View Structured Survey Generation,2026-01-14 14:11:39+00:00,http://arxiv.org/abs/2601.09504v1,"Yinqi Liu, Yueqi Zhu, Yongkang Zhang, Xinfeng Li, Feiran Liu, Yufei Sun, Xin Wang, Renzhao Liang, Yidong Wang, Cunxiang Wang",cs.CL,story,"Scientific surveys require not only summarizing large bodies of literature, but also organizing them into clear and coherent conceptual structures. Existing automatic survey generation methods typically focus on linear text generation and struggle to explicitly model hierarchical relations among research topics and structured methodological comparisons, resulting in gaps in structural organization compared to expert-written surveys. We propose MVSS, a multi-view structured survey generation framework that jointly generates and aligns citation-grounded hierarchical trees, structured comparison tables, and survey text. MVSS follows a structure-first paradigm: it first constructs a conceptual tree of the research domain, then generates comparison tables constrained by the tree, and finally uses both as structural constraints for text generation. This enables complementary multi-view representations across structure, comparison, and narrative. We introduce an evaluation framework assessing structural quality, comparative completeness, and citation fidelity. Experiments on 76 computer science topics show MVSS outperforms existing methods in organization and evidence grounding, achieving performance comparable to expert surveys.",2026-01-14
Interpretable Text Classification Applied to the Detection of LLM-generated Creative Writing,2026-01-12 09:50:15+00:00,http://arxiv.org/abs/2601.07368v1,"Minerva Suvanto, Andrea McGlinchey, Mattias Wahde, Peter J Barclay",cs.CL,story,"We consider the problem of distinguishing human-written creative fiction (excerpts from novels) from similar text generated by an LLM. Our results show that, while human observers perform poorly (near chance levels) on this binary classification task, a variety of machine-learning models achieve accuracy in the range 0.93 - 0.98 over a previously unseen test set, even using only short samples and single-token (unigram) features. We therefore employ an inherently interpretable (linear) classifier (with a test accuracy of 0.98), in order to elucidate the underlying reasons for this high accuracy. In our analysis, we identify specific unigram features indicative of LLM-generated text, one of the most important being that the LLM tends to use a larger variety of synonyms, thereby skewing the probability distributions in a manner that is easy to detect for a machine learning classifier, yet very difficult for a human observer. Four additional explanation categories were also identified, namely, temporal drift, Americanisms, foreign language usage, and colloquialisms. As identification of the AI-generated text depends on a constellation of such features, the classification appears robust, and therefore not easy to circumvent by malicious actors intent on misrepresenting AI-generated text as human work.",2026-01-12
Codified Foreshadowing-Payoff Text Generation,2026-01-11 19:05:37+00:00,http://arxiv.org/abs/2601.07033v1,"Longfei Yun, Kun Zhou, Yupeng Hou, Letian Peng, Jingbo Shang",cs.CL,story,"Foreshadowing and payoff are ubiquitous narrative devices through which authors introduce commitments early in a story and resolve them through concrete, observable outcomes. However, despite advances in story generation, large language models (LLMs) frequently fail to bridge these long-range narrative dependencies, often leaving ""Chekhov's guns"" unfired even when the necessary context is present. Existing evaluations largely overlook this structural failure, focusing on surface-level coherence rather than the logical fulfillment of narrative setups. In this paper, we introduce Codified Foreshadowing-Payoff Generation (CFPG), a novel framework that reframes narrative quality through the lens of payoff realization. Recognizing that LLMs struggle to intuitively grasp the ""triggering mechanism"" of a foreshadowed event, CFPG transforms narrative continuity into a set of executable causal predicates. By mining and encoding Foreshadow-Trigger-Payoff triples from the BookSum corpus, we provide structured supervision that ensures foreshadowed commitments are not only mentioned but also temporally and logically fulfilled. Experiments demonstrate that CFPG significantly outperforms standard prompting baselines in payoff accuracy and narrative alignment. Our findings suggest that explicitly codifying narrative mechanics is essential for moving LLMs from surface-level fluency to genuine narrative competence.",2026-01-11
AutoTour: Automatic Photo Tour Guide with Smartphones and LLMs,2026-01-11 05:13:39+00:00,http://arxiv.org/abs/2601.06781v1,"Huatao Xu, Zihe Liu, Zilin Zeng, Baichuan Li, Mo Li","cs.HC, cs.AI, cs.CV",story,"We present AutoTour, a system that enhances user exploration by automatically generating fine-grained landmark annotations and descriptive narratives for photos captured by users. The key idea of AutoTour is to fuse visual features extracted from photos with nearby geospatial features queried from open matching databases. Unlike existing tour applications that rely on pre-defined content or proprietary datasets, AutoTour leverages open and extensible data sources to provide scalable and context-aware photo-based guidance. To achieve this, we design a training-free pipeline that first extracts and filters relevant geospatial features around the user's GPS location. It then detects major landmarks in user photos through VLM-based feature detection and projects them into the horizontal spatial plane. A geometric matching algorithm aligns photo features with corresponding geospatial entities based on their estimated distance and direction. The matched features are subsequently grounded and annotated directly on the original photo, accompanied by large language model-generated textual and audio descriptions to provide an informative, tour-like experience. We demonstrate that AutoTour can deliver rich, interpretable annotations for both iconic and lesser-known landmarks, enabling a new form of interactive, context-aware exploration that bridges visual perception and geospatial understanding.",2026-01-11
Evaluation Framework for AI Creativity: A Case Study Based on Story Generation,2026-01-07 08:31:08+00:00,http://arxiv.org/abs/2601.03698v1,"Pharath Sathya, Yin Jou Huang, Fei Cheng",cs.CL,story,"Evaluating creative text generation remains a challenge because existing reference-based metrics fail to capture the subjective nature of creativity. We propose a structured evaluation framework for AI story generation comprising four components (Novelty, Value, Adherence, and Resonance) and eleven sub-components. Using controlled story generation via ``Spike Prompting'' and a crowdsourced study of 115 readers, we examine how different creative components shape both immediate and reflective human creativity judgments. Our findings show that creativity is evaluated hierarchically rather than cumulatively, with different dimensions becoming salient at different stages of judgment, and that reflective evaluation substantially alters both ratings and inter-rater agreement. Together, these results support the effectiveness of our framework in revealing dimensions of creativity that are obscured by reference-based evaluation.",2026-01-07
Web World Models,2025-12-29 18:31:45+00:00,http://arxiv.org/abs/2512.23676v1,"Jichen Feng, Yifan Zhang, Chenggong Zhang, Yifu Lu, Shilong Liu, Mengdi Wang","cs.AI, cs.CL, cs.CV",story,"Language agents increasingly require persistent worlds in which they can act, remember, and learn. Existing approaches sit at two extremes: conventional web frameworks provide reliable but fixed contexts backed by databases, while fully generative world models aim for unlimited environments at the expense of controllability and practical engineering. In this work, we introduce the Web World Model (WWM), a middle ground where world state and ``physics'' are implemented in ordinary web code to ensure logical consistency, while large language models generate context, narratives, and high-level decisions on top of this structured latent state. We build a suite of WWMs on a realistic web stack, including an infinite travel atlas grounded in real geography, fictional galaxy explorers, web-scale encyclopedic and narrative worlds, and simulation- and game-like environments. Across these systems, we identify practical design principles for WWMs: separating code-defined rules from model-driven imagination, representing latent state as typed web interfaces, and utilizing deterministic generation to achieve unlimited but structured exploration. Our results suggest that web stacks themselves can serve as a scalable substrate for world models, enabling controllable yet open-ended environments. Project Page: https://github.com/Princeton-AI2-Lab/Web-World-Models.",2025-12-29
Scaling Unverifiable Rewards: A Case Study on Visual Insights,2025-12-27 17:01:38+00:00,http://arxiv.org/abs/2512.22650v1,"Shuyu Gan, James Mooney, Pan Hao, Renxiang Wang, Mingyi Hong, Qianwen Wang, Dongyeop Kang","cs.LG, cs.AI, cs.CL",story,"Large Language Model (LLM) agents can increasingly automate complex reasoning through Test-Time Scaling (TTS), iterative refinement guided by reward signals. However, many real-world tasks involve multi-stage pipeline whose final outcomes lack verifiable rewards or sufficient data to train robust reward models, making judge-based refinement prone to accumulate error over stages. We propose Selective TTS, a process-based refinement framework that scales inference across different stages in multi-agent pipeline, instead of repeated refinement over time by prior work. By distributing compute across stages and pruning low-quality branches early using process-specific judges, Selective TTS mitigates the judge drift and stabilizes refinement. Grounded in the data science pipeline, we build an end-to-end multi-agent pipeline for generating visually insightful charts and report of given dataset, and design a reliable LLM-based judge model, aligned with human experts (Kendall's τ=0.55). Our proposed selective TTS then improves insight quality under a fixed compute budget, increasing mean scores from 61.64 to 65.86 while reducing variance. We hope our findings serve as the first step toward to scaling complex, open-ended tasks with unverifiable rewards, such as scientific discovery and story generation.",2025-12-27
SRS-Stories: Vocabulary-constrained multilingual story generation for language learning,2025-12-20 13:24:59+00:00,http://arxiv.org/abs/2512.18362v1,"Wiktor Kamzela, Mateusz Lango, Ondrej Dusek",cs.CL,story,"In this paper, we use large language models to generate personalized stories for language learners, using only the vocabulary they know. The generated texts are specifically written to teach the user new vocabulary by simply reading stories where it appears in context, while at the same time seamlessly reviewing recently learned vocabulary. The generated stories are enjoyable to read and the vocabulary reviewing/learning is optimized by a Spaced Repetition System. The experiments are conducted in three languages: English, Chinese and Polish, evaluating three story generation methods and three strategies for enforcing lexical constraints. The results show that the generated stories are more grammatical, coherent, and provide better examples of word usage than texts generated by the standard constrained beam search approach",2025-12-20
"Workflow is All You Need: Escaping the ""Statistical Smoothing Trap"" via High-Entropy Information Foraging and Adversarial Pacing",2025-12-10 22:13:55+00:00,http://arxiv.org/abs/2512.10121v1,Zhongjie Jiang,"cs.CL, cs.AI, cs.CY, q-fin.GN",story,"Central to long-form text generation in vertical domains is the ""impossible trinity"" confronting current large language models (LLMs): the simultaneous achievement of low hallucination, deep logical coherence, and personalized expression. This study establishes that this bottleneck arises from existing generative paradigms succumbing to the Statistical Smoothing Trap, a phenomenon that overlooks the high-entropy information acquisition and structured cognitive processes integral to expert-level writing. To address this limitation, we propose the DeepNews Framework, an agentic workflow that explicitly models the implicit cognitive processes of seasoned financial journalists. The framework integrates three core modules: first, a dual-granularity retrieval mechanism grounded in information foraging theory, which enforces a 10:1 saturated information input ratio to mitigate hallucinatory outputs; second, schema-guided strategic planning, a process leveraging domain expert knowledge bases (narrative schemas) and Atomic Blocks to forge a robust logical skeleton; third, adversarial constraint prompting, a technique deploying tactics including Rhythm Break and Logic Fog to disrupt the probabilistic smoothness inherent in model-generated text. Experiments delineate a salient Knowledge Cliff in deep financial reporting: content truthfulness collapses when retrieved context falls below 15,000 characters, while a high-redundancy input exceeding 30,000 characters stabilizes the Hallucination-Free Rate (HFR) above 85%. In an ecological validity blind test conducted with a top-tier Chinese technology media outlet, the DeepNews system--built on a previous-generation model (DeepSeek-V3-0324)-achieved a 25% submission acceptance rate, significantly outperforming the 0% acceptance rate of zero-shot generation by a state-of-the-art (SOTA) model (GPT-5).",2025-12-10
Generating Storytelling Images with Rich Chains-of-Reasoning,2025-12-08 06:18:44+00:00,http://arxiv.org/abs/2512.07198v1,"Xiujie Song, Qi Jia, Shota Watanabe, Xiaoyi Pang, Ruijie Chen, Mengyue Wu, Kenny Q. Zhu","cs.CV, cs.CL",story,"An image can convey a compelling story by presenting rich, logically connected visual clues. These connections form Chains-of-Reasoning (CoRs) within the image, enabling viewers to infer events, causal relationships, and other information, thereby understanding the underlying story. In this paper, we focus on these semantically rich images and define them as Storytelling Images. Such images have diverse applications beyond illustration creation and cognitive screening, leveraging their ability to convey multi-layered information visually and inspire active interpretation. However, due to their complex semantic nature, Storytelling Images are inherently challenging to create, and thus remain relatively scarce. To address this challenge, we introduce the Storytelling Image Generation task, which explores how generative AI models can be leveraged to create such images. Specifically, we propose a two-stage pipeline, StorytellingPainter, which combines the creative reasoning abilities of Large Language Models (LLMs) with the visual synthesis capabilities of Text-to-Image (T2I) models to generate Storytelling Images. Alongside this pipeline, we develop a dedicated evaluation framework comprising three main evaluators: a Semantic Complexity Evaluator, a KNN-based Diversity Evaluator and a Story-Image Alignment Evaluator. Given the critical role of story generation in the Storytelling Image Generation task and the performance disparity between open-source and proprietary LLMs, we further explore tailored training strategies to reduce this gap, resulting in a series of lightweight yet effective models named Mini-Storytellers. Experimental results demonstrate the feasibility and effectiveness of our approaches. The code is available at https://github.com/xiujiesong/StorytellingImageGeneration.",2025-12-08
Capturing Classic Authorial Style in Long-Form Story Generation with GRPO Fine-Tuning,2025-12-05 14:29:27+00:00,http://arxiv.org/abs/2512.05747v1,"Jinlong Liu, Mohammed Bahja, Venelin Kovatchev, Mark Lee",cs.CL,story,"Recent advances in large language models (LLMs) show impressive performance in open-ended story generation, but fine-grained stylistic control remains limited. Existing methods often rely on shallow cues (e.g., names or topics) to simulate authorial style, without robust evaluation. In this work, we present a training framework for style-conditioned story generation using Group Relative Policy Optimization (GRPO) and a custom multi-reward setup. The style reward is derived from a fine-tuned sentence transformer using authorship verification (AV) signals, combined with content and completeness scores to stabilize long-form narrative generation. We conduct experiments using fiction by Mark Twain, a prominent 19th-century American author, with The Adventures of Huckleberry Finn serving as the reference style exemplar. Our 8B model outperforms larger baselines such as GPT-4o and Claude Sonnet 4 in AV-style metrics, achieving a style score of 0.628 and competitive content quality. Results demonstrate the feasibility of agentic stylistic generation with moderate model size and task-specific training. While the output is clearly style-aligned, narrative completeness remains a challenge, indicating future work is needed to better model global coherence and story resolution.",2025-12-05
TaleFrame: An Interactive Story Generation System with Fine-Grained Control and Large Language Models,2025-12-02 04:27:10+00:00,http://arxiv.org/abs/2512.02402v1,"Yunchao Wang, Guodao Sun, Zihang Fu, Zhehao Liu, Kaixing Du, Haidong Gao, Ronghua Liang","cs.CL, cs.HC",story,"With the advancement of natural language generation (NLG) technologies, creative story generation systems have gained increasing attention. However, current systems often fail to accurately translate user intent into satisfactory story outputs due to a lack of fine-grained control and unclear input specifications, limiting their applicability. To address this, we propose TaleFrame, a system that combines large language models (LLMs) with human-computer interaction (HCI) to generate stories through structured information, enabling precise control over the generation process. The innovation of TaleFrame lies in decomposing the story structure into four basic units: entities, events, relationships, and story outline. We leverage the Tinystories dataset, parsing and constructing a preference dataset consisting of 9,851 JSON-formatted entries, which is then used to fine-tune a local Llama model. By employing this JSON2Story approach, structured data is transformed into coherent stories. TaleFrame also offers an intuitive interface that supports users in creating and editing entities and events and generates stories through the structured framework. Users can control these units through simple interactions (e.g., drag-and-drop, attach, and connect), thus influencing the details and progression of the story. The generated stories can be evaluated across seven dimensions (e.g., creativity, structural integrity), with the system providing suggestions for refinement based on these evaluations. Users can iteratively adjust the story until a satisfactory result is achieved. Finally, we conduct quantitative evaluation and user studies that demonstrate the usefulness of TaleFrame. Dataset available at https://huggingface.co/datasets/guodaosun/tale-frame.",2025-12-02
A Progressive Evaluation Framework for Multicultural Analysis of Story Visualization,2025-11-27 16:05:19+00:00,http://arxiv.org/abs/2511.22576v1,"Janak Kapuriya, Ali Hatami, Paul Buitelaar",cs.MM,story,"Recent advancements in text-to-image generative models have improved narrative consistency in story visualization. However, current story visualization models often overlook cultural dimensions, resulting in visuals that lack authenticity and cultural fidelity. In this study, we conduct a comprehensive multicultural analysis of story visualization using current text-to-image models across multilingual settings on two datasets: FlintstonesSV and VIST. To assess cultural dimensions rigorously, we propose a Progressive Multicultural Evaluation Framework and introduce five story visualization metrics, Cultural Appropriateness, Visual Aesthetics, Cohesion, Semantic Consistency, and Object Presence, that are not addressed by existing metrics. We further automate assessment through an MLLM-as-Jury framework that approximates human judgment. Human evaluations show that models generate more coherent, visually appealing, and culturally appropriate stories for real-world datasets than for animated ones. The generated stories exhibit a stronger alignment with English-speaking cultures across all metrics except Cohesion, where Chinese performs better. In contrast, Hindi ranks lowest on all metrics except Visual Aesthetics, reflecting real-world cultural biases embedded in current models. This multicultural analysis provides a foundation for future research aimed at generating culturally appropriate and inclusive visual stories across diverse linguistic and cultural settings.",2025-11-27
TALES: A Taxonomy and Analysis of Cultural Representations in LLM-generated Stories,2025-11-26 12:07:32+00:00,http://arxiv.org/abs/2511.21322v1,"Kirti Bhagat, Shaily Bhatt, Athul Velagapudi, Aditya Vashistha, Shachi Dave, Danish Pruthi","cs.HC, cs.AI, cs.CL, cs.CY",story,"Millions of users across the globe turn to AI chatbots for their creative needs, inviting widespread interest in understanding how such chatbots represent diverse cultures. At the same time, evaluating cultural representations in open-ended tasks remains challenging and underexplored. In this work, we present TALES, an evaluation of cultural misrepresentations in LLM-generated stories for diverse Indian cultural identities. First, we develop TALES-Tax, a taxonomy of cultural misrepresentations by collating insights from participants with lived experiences in India through focus groups (N=9) and individual surveys (N=15). Using TALES-Tax, we evaluate 6 models through a large-scale annotation study spanning 2,925 annotations from 108 annotators with lived cultural experience from across 71 regions in India and 14 languages. Concerningly, we find that 88\% of the generated stories contain one or more cultural inaccuracies, and such errors are more prevalent in mid- and low-resourced languages and stories based in peri-urban regions in India. Lastly, we transform the annotations into TALES-QA, a standalone question bank to evaluate the cultural knowledge of foundational models. Through this evaluation, we surprisingly discover that models often possess the requisite cultural knowledge despite generating stories rife with cultural misrepresentations.",2025-11-26
Enhancing Multimodal Misinformation Detection by Replaying the Whole Story from Image Modality Perspective,2025-11-09 08:37:46+00:00,http://arxiv.org/abs/2511.06284v1,"Bing Wang, Ximing Li, Yanjun Wang, Changchun Li, Lin Yuanbo Wu, Buyu Wang, Shengsheng Wang","cs.CV, cs.CL, cs.MM",story,"Multimodal Misinformation Detection (MMD) refers to the task of detecting social media posts involving misinformation, where the post often contains text and image modalities. However, by observing the MMD posts, we hold that the text modality may be much more informative than the image modality because the text generally describes the whole event/story of the current post but the image often presents partial scenes only. Our preliminary empirical results indicate that the image modality exactly contributes less to MMD. Upon this idea, we propose a new MMD method named RETSIMD. Specifically, we suppose that each text can be divided into several segments, and each text segment describes a partial scene that can be presented by an image. Accordingly, we split the text into a sequence of segments, and feed these segments into a pre-trained text-to-image generator to augment a sequence of images. We further incorporate two auxiliary objectives concerning text-image and image-label mutual information, and further post-train the generator over an auxiliary text-to-image generation benchmark dataset. Additionally, we propose a graph structure by defining three heuristic relationships between images, and use a graph neural network to generate the fused features. Extensive empirical results validate the effectiveness of RETSIMD.",2025-11-09
"Node-Based Editing for Multimodal Generation of Text, Audio, Image, and Video",2025-11-05 06:35:10+00:00,http://arxiv.org/abs/2511.03227v2,"Alexander Htet Kyaw, Lenin Ravindranath Sivalingam","cs.HC, cs.AI, cs.MM",story,"We present a node-based storytelling system for multimodal content generation. The system represents stories as graphs of nodes that can be expanded, edited, and iteratively refined through direct user edits and natural-language prompts. Each node can integrate text, images, audio, and video, allowing creators to compose multimodal narratives. A task selection agent routes between specialized generative tasks that handle story generation, node structure reasoning, node diagram formatting, and context generation. The interface supports targeted editing of individual nodes, automatic branching for parallel storylines, and node-based iterative refinement. Our results demonstrate that node-based editing supports control over narrative structure and iterative generation of text, images, audio, and video. We report quantitative outcomes on automatic story outline generation and qualitative observations of editing workflows. Finally, we discuss current limitations such as scalability to longer narratives and consistency across multiple nodes, and outline future work toward human-in-the-loop and user-centered creative AI tools.",2025-11-05
