title,pubdate,id,authors,categories,search,abstract,displaydate
Cat and Mouse -- Can Fake Text Generation Outpace Detector Systems?,2025-06-26 13:58:43+00:00,http://arxiv.org/abs/2506.21274v1,"Andrea McGlinchey, Peter J Barclay",cs.CL,story,"Large language models can produce convincing ""fake text"" in domains such as
academic writing, product reviews, and political news. Many approaches have
been investigated for the detection of artificially generated text. While this
may seem to presage an endless ""arms race"", we note that newer LLMs use ever
more parameters, training data, and energy, while relatively simple classifiers
demonstrate a good level of detection accuracy with modest resources. To
approach the question of whether the models' ability to beat the detectors may
therefore reach a plateau, we examine the ability of statistical classifiers to
identify ""fake text"" in the style of classical detective fiction. Over a 0.5
version increase, we found that Gemini showed an increased ability to generate
deceptive text, while GPT did not. This suggests that reliable detection of
fake text may remain feasible even for ever-larger models, though new model
architectures may improve their deceptiveness",2025-06-26
FairyGen: Storied Cartoon Video from a Single Child-Drawn Character,2025-06-26 13:58:16+00:00,http://arxiv.org/abs/2506.21272v2,"Jiayi Zheng, Xiaodong Cun","cs.GR, cs.CV, cs.MM",story,"We propose FairyGen, an automatic system for generating story-driven cartoon
videos from a single child's drawing, while faithfully preserving its unique
artistic style. Unlike previous storytelling methods that primarily focus on
character consistency and basic motion, FairyGen explicitly disentangles
character modeling from stylized background generation and incorporates
cinematic shot design to support expressive and coherent storytelling. Given a
single character sketch, we first employ an MLLM to generate a structured
storyboard with shot-level descriptions that specify environment settings,
character actions, and camera perspectives. To ensure visual consistency, we
introduce a style propagation adapter that captures the character's visual
style and applies it to the background, faithfully retaining the character's
full visual identity while synthesizing style-consistent scenes. A shot design
module further enhances visual diversity and cinematic quality through frame
cropping and multi-view synthesis based on the storyboard. To animate the
story, we reconstruct a 3D proxy of the character to derive physically
plausible motion sequences, which are then used to fine-tune an MMDiT-based
image-to-video diffusion model. We further propose a two-stage motion
customization adapter: the first stage learns appearance features from
temporally unordered frames, disentangling identity from motion; the second
stage models temporal dynamics using a timestep-shift strategy with frozen
identity weights. Once trained, FairyGen directly renders diverse and coherent
video scenes aligned with the storyboard. Extensive experiments demonstrate
that our system produces animations that are stylistically faithful,
narratively structured natural motion, highlighting its potential for
personalized and engaging story animation. The code will be available at
https://github.com/GVCLab/FairyGen",2025-06-26
Compressed and Smooth Latent Space for Text Diffusion Modeling,2025-06-26 12:05:13+00:00,http://arxiv.org/abs/2506.21170v1,"Viacheslav Meshchaninov, Egor Chimbulatov, Alexander Shabalin, Aleksandr Abramov, Dmitry Vetrov",cs.CL,story,"Autoregressive language models dominate modern text generation, yet their
sequential nature introduces fundamental limitations: decoding is slow, and
maintaining global coherence remains challenging. Diffusion models offer a
promising alternative by enabling parallel generation and flexible control;
however, their application to text generation is hindered by the high
dimensionality of token-level representations. We introduce Cosmos, a novel
approach to text generation that operates entirely in a compressed, smooth
latent space tailored specifically for diffusion. This space is learned using
an autoencoder trained simultaneously for token-level reconstruction and
alignment with frozen activations from a pretrained language encoder, providing
robust semantic grounding and enabling effective perturbation-based
augmentations. Empirically, we demonstrate that text representations can be
compressed by $8\times$ while maintaining generation quality comparable to
token-level diffusion models. Furthermore, increasing the latent sequence
length allows Cosmos to surpass both diffusion-based and autoregressive
baselines. We evaluate Cosmos on four diverse generative tasks including story
generation, question generation, summarization, and detoxification and compare
it with various generative paradigms. Cosmos achieves comparable or superior
generation quality while offering more than $2\times$ faster inference.",2025-06-26
"Language Models Might Not Understand You: Evaluating Theory of Mind via
  Story Prompting",2025-06-23 20:06:53+00:00,http://arxiv.org/abs/2506.19089v2,"Nathaniel Getachew, Abulhair Saparov","cs.CL, cs.AI",story,"We introduce $\texttt{StorySim}$, a programmable framework for synthetically
generating stories to evaluate the theory of mind (ToM) and world modeling (WM)
capabilities of large language models (LLMs). Unlike prior benchmarks that may
suffer from contamination in pretraining data, $\texttt{StorySim}$ produces
novel, compositional story prompts anchored by a highly controllable
$\texttt{Storyboard}$, enabling precise manipulation of character perspectives
and events. We use this framework to design first- and second-order ToM tasks
alongside WM tasks that control for the ability to track and model mental
states. Our experiments across a suite of state-of-the-art LLMs reveal that
most models perform better on WM tasks than ToM tasks, and that models tend to
perform better reasoning with humans compared to inanimate objects.
Additionally, our framework enabled us to find evidence of heuristic behavior
such as recency bias and an over-reliance on earlier events in the story. All
code for generating data and evaluations is freely available.",2025-06-23
"How Large Language Models play humans in online conversations: a
  simulated study of the 2016 US politics on Reddit",2025-06-23 08:54:32+00:00,http://arxiv.org/abs/2506.21620v1,"Daniele Cirulli, Giulio Cimini, Giovanni Palermo","cs.CL, cs.AI, cs.CY, cs.SI, physics.soc-ph",story,"Large Language Models (LLMs) have recently emerged as powerful tools for
natural language generation, with applications spanning from content creation
to social simulations. Their ability to mimic human interactions raises both
opportunities and concerns, particularly in the context of politically relevant
online discussions. In this study, we evaluate the performance of LLMs in
replicating user-generated content within a real-world, divisive scenario:
Reddit conversations during the 2016 US Presidential election. In particular,
we conduct three different experiments, asking GPT-4 to generate comments by
impersonating either real or artificial partisan users. We analyze the
generated comments in terms of political alignment, sentiment, and linguistic
features, comparing them against real user contributions and benchmarking
against a null model. We find that GPT-4 is able to produce realistic comments,
both in favor of or against the candidate supported by the community, yet
tending to create consensus more easily than dissent. In addition we show that
real and artificial comments are well separated in a semantically embedded
space, although they are indistinguishable by manual inspection. Our findings
provide insights on the potential use of LLMs to sneak into online discussions,
influence political debate and shape political narratives, bearing broader
implications of AI-driven discourse manipulation.",2025-06-23
StoryWriter: A Multi-Agent Framework for Long Story Generation,2025-06-19 16:26:58+00:00,http://arxiv.org/abs/2506.16445v1,"Haotian Xia, Hao Peng, Yunjia Qi, Xiaozhi Wang, Bin Xu, Lei Hou, Juanzi Li","cs.CL, cs.AI",story,"Long story generation remains a challenge for existing large language models
(LLMs), primarily due to two main factors: (1) discourse coherence, which
requires plot consistency, logical coherence, and completeness in the long-form
generation, and (2) narrative complexity, which requires an interwoven and
engaging narrative. To address these challenges, we propose StoryWriter, a
multi-agent story generation framework, which consists of three main modules:
(1) outline agent, which generates event-based outlines containing rich event
plots, character, and event-event relationships. (2) planning agent, which
further details events and plans which events should be written in each chapter
to maintain an interwoven and engaging story. (3) writing agent, which
dynamically compresses the story history based on the current event to generate
and reflect new plots, ensuring the coherence of the generated story. We
conduct both human and automated evaluation, and StoryWriter significantly
outperforms existing story generation baselines in both story quality and
length. Furthermore, we use StoryWriter to generate a dataset, which contains
about $6,000$ high-quality long stories, with an average length of $8,000$
words. We train the model Llama3.1-8B and GLM4-9B using supervised fine-tuning
on LongStory and develop StoryWriter_GLM and StoryWriter_GLM, which
demonstrates advanced performance in long story generation.",2025-06-19
Curriculum-Guided Layer Scaling for Language Model Pretraining,2025-06-13 01:22:16+00:00,http://arxiv.org/abs/2506.11389v1,"Karanpartap Singh, Neil Band, Ehsan Adeli",cs.CL,story,"As the cost of pretraining large language models grows, there is continued
interest in strategies to improve learning efficiency during this core training
stage. Motivated by cognitive development, where humans gradually build
knowledge as their brains mature, we propose Curriculum-Guided Layer Scaling
(CGLS), a framework for compute-efficient pretraining that synchronizes
increasing data difficulty with model growth through progressive layer stacking
(i.e. gradually adding layers during training). At the 100M parameter scale,
using a curriculum transitioning from synthetic short stories to general web
data, CGLS outperforms baseline methods on the question-answering benchmarks
PIQA and ARC. Pretraining at the 1.2B scale, we stratify the DataComp-LM corpus
with a DistilBERT-based classifier and progress from general text to highly
technical or specialized content. Our results show that progressively
increasing model depth alongside sample difficulty leads to better
generalization and zero-shot performance on various downstream benchmarks.
Altogether, our findings demonstrate that CGLS unlocks the potential of
progressive stacking, offering a simple yet effective strategy for improving
generalization on knowledge-intensive and reasoning tasks.",2025-06-13
VINCIE: Unlocking In-context Image Editing from Video,2025-06-12 17:46:54+00:00,http://arxiv.org/abs/2506.10941v1,"Leigang Qu, Feng Cheng, Ziyan Yang, Qi Zhao, Shanchuan Lin, Yichun Shi, Yicong Li, Wenjie Wang, Tat-Seng Chua, Lu Jiang","cs.CV, cs.AI, cs.CL, cs.LG, cs.MM",story,"In-context image editing aims to modify images based on a contextual sequence
comprising text and previously generated images. Existing methods typically
depend on task-specific pipelines and expert models (e.g., segmentation and
inpainting) to curate training data. In this work, we explore whether an
in-context image editing model can be learned directly from videos. We
introduce a scalable approach to annotate videos as interleaved multimodal
sequences. To effectively learn from this data, we design a block-causal
diffusion transformer trained on three proxy tasks: next-image prediction,
current segmentation prediction, and next-segmentation prediction.
Additionally, we propose a novel multi-turn image editing benchmark to advance
research in this area. Extensive experiments demonstrate that our model
exhibits strong in-context image editing capabilities and achieves
state-of-the-art results on two multi-turn image editing benchmarks. Despite
being trained exclusively on videos, our model also shows promising abilities
in multi-concept composition, story generation, and chain-of-editing
applications.",2025-06-12
"Can LLMs Generate Good Stories? Insights and Challenges from a Narrative
  Planning Perspective",2025-06-11 20:27:08+00:00,http://arxiv.org/abs/2506.10161v1,"Yi Wang, Max Kreminski","cs.CL, cs.AI",story,"Story generation has been a prominent application of Large Language Models
(LLMs). However, understanding LLMs' ability to produce high-quality stories
remains limited due to challenges in automatic evaluation methods and the high
cost and subjectivity of manual evaluation. Computational narratology offers
valuable insights into what constitutes a good story, which has been applied in
the symbolic narrative planning approach to story generation. This work aims to
deepen the understanding of LLMs' story generation capabilities by using them
to solve narrative planning problems. We present a benchmark for evaluating
LLMs on narrative planning based on literature examples, focusing on causal
soundness, character intentionality, and dramatic conflict. Our experiments
show that GPT-4 tier LLMs can generate causally sound stories at small scales,
but planning with character intentionality and dramatic conflict remains
challenging, requiring LLMs trained with reinforcement learning for complex
reasoning. The results offer insights on the scale of stories that LLMs can
generate while maintaining quality from different aspects. Our findings also
highlight interesting problem solving behaviors and shed lights on challenges
and considerations for applying LLM narrative planning in game environments.",2025-06-11
"Advancing Decoding Strategies: Enhancements in Locally Typical Sampling
  for LLMs",2025-06-03 14:25:23+00:00,http://arxiv.org/abs/2506.05387v2,"Jaydip Sen, Saptarshi Sengupta, Subhasis Dasgupta","cs.CL, cs.AI",story,"This chapter explores advancements in decoding strategies for large language
models (LLMs), focusing on enhancing the Locally Typical Sampling (LTS)
algorithm. Traditional decoding methods, such as top-k and nucleus sampling,
often struggle to balance fluency, diversity, and coherence in text generation.
To address these challenges, Adaptive Semantic-Aware Typicality Sampling (ASTS)
is proposed as an improved version of LTS, incorporating dynamic entropy
thresholding, multi-objective scoring, and reward-penalty adjustments. ASTS
ensures contextually coherent and diverse text generation while maintaining
computational efficiency. Its performance is evaluated across multiple
benchmarks, including story generation and abstractive summarization, using
metrics such as perplexity, MAUVE, and diversity scores. Experimental results
demonstrate that ASTS outperforms existing sampling techniques by reducing
repetition, enhancing semantic alignment, and improving fluency.",2025-06-03
"Object-Driven Narrative in AR: A Scenario-Metaphor Framework with VLM
  Integration",2025-04-17 17:37:49+00:00,http://arxiv.org/abs/2504.13119v1,"Yusi Sun, Haoyan Guan, leith Kin Yep Chan, Yong Hong Kuo",cs.HC,story,"Most adaptive AR storytelling systems define environmental semantics using
simple object labels and spatial coordinates, limiting narratives to rigid,
pre-defined logic. This oversimplification overlooks the contextual
significance of object relationships-for example, a wedding ring on a
nightstand might suggest marital conflict, yet is treated as just ""two objects""
in space. To address this, we explored integrating Vision Language Models
(VLMs) into AR pipelines. However, several challenges emerged: First, stories
generated with simple prompt guidance lacked narrative depth and spatial usage.
Second, spatial semantics were underutilized, failing to support meaningful
storytelling. Third, pre-generated scripts struggled to align with AR
Foundation's object naming and coordinate systems. We propose a scene-driven AR
storytelling framework that reimagines environments as active narrative agents,
built on three innovations: 1. State-aware object semantics: We decompose
object meaning into physical, functional, and metaphorical layers, allowing
VLMs to distinguish subtle narrative cues between similar objects. 2.
Structured narrative interface: A bidirectional JSON layer maps VLM-generated
metaphors to AR anchors, maintaining spatial and semantic coherence. 3. STAM
evaluation framework: A three-part experimental design evaluates narrative
quality, highlighting both strengths and limitations of VLM-AR integration. Our
findings show that the system can generate stories from the environment itself,
not just place them on top of it. In user studies, 70% of participants reported
seeing real-world objects differently when narratives were grounded in
environmental symbolism. By merging VLMs' generative creativity with AR's
spatial precision, this framework introduces a novel object-driven storytelling
paradigm, transforming passive spaces into active narrative landscapes.",2025-04-17
"Finding Flawed Fictions: Evaluating Complex Reasoning in Language Models
  via Plot Hole Detection",2025-04-16 09:25:54+00:00,http://arxiv.org/abs/2504.11900v2,"Kabir Ahuja, Melanie Sclar, Yulia Tsvetkov",cs.CL,story,"Stories are a fundamental aspect of human experience. Engaging deeply with
stories and spotting plot holes -- inconsistencies in a storyline that break
the internal logic or rules of a story's world -- requires nuanced reasoning
skills, including tracking entities and events and their interplay, abstract
thinking, pragmatic narrative understanding, commonsense and social reasoning,
and theory of mind. As Large Language Models (LLMs) increasingly generate,
interpret, and modify text, rigorously assessing their narrative consistency
and deeper language understanding becomes critical. However, existing
benchmarks focus mainly on surface-level comprehension. In this work, we
propose plot hole detection in stories as a proxy to evaluate language
understanding and reasoning in LLMs. We introduce FlawedFictionsMaker, a novel
algorithm to controllably and carefully synthesize plot holes in human-written
stories. Using this algorithm, we construct a benchmark to evaluate LLMs' plot
hole detection abilities in stories -- FlawedFictions -- , which is robust to
contamination, with human filtering ensuring high quality. We find that
state-of-the-art LLMs struggle in accurately solving FlawedFictions regardless
of the reasoning effort allowed, with performance significantly degrading as
story length increases. Finally, we show that LLM-based story summarization and
story generation are prone to introducing plot holes, with more than 50% and
100% increases in plot hole detection rates with respect to human-written
originals.",2025-04-16
Looking beyond the next token,2025-04-15 16:09:06+00:00,http://arxiv.org/abs/2504.11336v1,"Abitha Thankaraj, Yiding Jiang, J. Zico Kolter, Yonatan Bisk","cs.LG, cs.AI, cs.CL",story,"The structure of causal language model training assumes that each token can
be accurately predicted from the previous context. This contrasts with humans'
natural writing and reasoning process, where goals are typically known before
the exact argument or phrasings. While this mismatch has been well studied in
the literature, the working assumption has been that architectural changes are
needed to address this mismatch. We argue that rearranging and processing the
training data sequences can allow models to more accurately imitate the true
data-generating process, and does not require any other changes to the
architecture or training infrastructure. We demonstrate that this technique,
Trelawney, and the inference algorithms derived from it allow us to improve
performance on several key benchmarks that span planning, algorithmic
reasoning, and story generation tasks. Finally, our method naturally enables
the generation of long-term goals at no additional cost. We investigate how
using the model's goal-generation capability can further improve planning and
reasoning. Additionally, we believe Trelawney could potentially open doors to
new capabilities beyond the current language modeling paradigm.",2025-04-15
"Beyond Memorization: Mapping the Originality-Quality Frontier of
  Language Models",2025-04-13 00:48:58+00:00,http://arxiv.org/abs/2504.09389v1,"Vishakh Padmakumar, Chen Yueh-Han, Jane Pan, Valerie Chen, He He",cs.CL,story,"As large language models (LLMs) are increasingly used for ideation and
scientific discovery, it is important to evaluate their ability to generate
novel output. Prior work evaluates novelty as the originality with respect to
training data, but original outputs can be low quality. In contrast, non-expert
judges may favor high-quality but memorized outputs, limiting the reliability
of human preference as a metric. We propose a new novelty metric for LLM
generations that balances originality and quality -- the harmonic mean of the
fraction of \ngrams unseen during training and a task-specific quality score.
We evaluate the novelty of generations from two families of open-data models
(OLMo and Pythia) on three creative tasks: story completion, poetry writing,
and creative tool use. We find that LLM generated text is less novel than human
written text. To elicit more novel outputs, we experiment with various
inference-time methods, which reveals a trade-off between originality and
quality. While these methods can boost novelty, they do so by increasing
originality at the expense of quality. In contrast, increasing model size or
applying post-training reliably shifts the Pareto frontier, highlighting that
starting with a stronger base model is a more effective way to improve novelty.",2025-04-13
Parameterized Synthetic Text Generation with SimpleStories,2025-04-12 11:44:47+00:00,http://arxiv.org/abs/2504.09184v1,"Lennart Finke, Thomas Dooms, Mat Allen, Juan Diego Rodriguez, Noa Nabeshima, Dan Braun","cs.CL, cs.AI",story,"We present SimpleStories, a large synthetic story dataset in simple language,
consisting of 2 million stories each in English and Japanese. Our method
employs parametrization of prompts with features at multiple levels of
abstraction, allowing for systematic control over story characteristics to
ensure broad syntactic and semantic diversity. Building on and addressing
limitations in the TinyStories dataset, our approach demonstrates that
simplicity and variety can be achieved simultaneously in synthetic text
generation at scale.",2025-04-12
"ELSA: A Style Aligned Dataset for Emotionally Intelligent Language
  Generation",2025-04-11 06:30:16+00:00,http://arxiv.org/abs/2504.08281v1,"Vishal Gandhi, Sagar Gandhi","cs.CL, cs.AI, cs.LG",story,"Advancements in emotion aware language processing increasingly shape vital
NLP applications ranging from conversational AI and affective computing to
computational psychology and creative content generation. Existing emotion
datasets either lack emotional granularity or fail to capture necessary
stylistic diversity, limiting the advancement of effective emotion conditioned
text generation systems. Seeking to bridge this crucial gap between granularity
and style diversity, this paper introduces a novel systematically constructed
dataset named ELSA Emotion and Language Style Alignment Dataset leveraging fine
grained emotion taxonomies adapted from existing sources such as dair ai
emotion dataset and GoEmotions taxonomy. This dataset comprises multiple
emotionally nuanced variations of original sentences regenerated across
distinct contextual styles such as conversational, formal, poetic, and
narrative, using advanced Large Language Models LLMs. Rigorous computational
evaluation using metrics such as perplexity, embedding variance, readability,
lexical diversity, and semantic coherence measures validates the datasets
emotional authenticity, linguistic fluency, and textual diversity.
Comprehensive metric analyses affirm its potential to support deeper
explorations into emotion conditioned style adaptive text generation. By
enabling precision tuned emotionally nuanced language modeling, our dataset
creates fertile ground for research on fine grained emotional control, prompt
driven explanation, interpretability, and style adaptive expressive language
generation with LLMs.",2025-04-11
