title,pubdate,id,authors,categories,search,abstract,displaydate
Context-Aware Semantic Recomposition Mechanism for Large Language Models,2025-01-29 02:38:28+00:00,http://arxiv.org/abs/2501.17386v1,"Richard Katrix, Quentin Carroway, Rowan Hawkesbury, Matthias Heathfield","cs.CL, cs.AI",story,"Context-aware processing mechanisms have increasingly become a critical area
of exploration for improving the semantic and contextual capabilities of
language generation models. The Context-Aware Semantic Recomposition Mechanism
(CASRM) was introduced as a novel framework designed to address limitations in
coherence, contextual adaptability, and error propagation in large-scale text
generation tasks. Through the integration of dynamically generated context
vectors and attention modulation layers, CASRM enhances the alignment between
token-level representations and broader contextual dependencies. Experimental
evaluations demonstrated significant improvements in semantic coherence across
multiple domains, including technical, conversational, and narrative text. The
ability to adapt to unseen domains and ambiguous inputs was evaluated using a
diverse set of test scenarios, highlighting the robustness of the proposed
mechanism. A detailed computational analysis revealed that while CASRM
introduces additional processing overhead, the gains in linguistic precision
and contextual relevance outweigh the marginal increase in complexity. The
framework also successfully mitigates error propagation in sequential tasks,
improving performance in dialogue continuation and multi-step text synthesis.
Additional investigations into token-level attention distribution emphasized
the dynamic focus shifts enabled through context-aware enhancements. The
findings suggest that CASRM offers a scalable and flexible solution for
integrating contextual intelligence into existing language model architectures.",2025-01-29
"VeriFact: Verifying Facts in LLM-Generated Clinical Text with Electronic
  Health Records",2025-01-28 03:13:16+00:00,http://arxiv.org/abs/2501.16672v1,"Philip Chung, Akshay Swaminathan, Alex J. Goodell, Yeasul Kim, S. Momsen Reincke, Lichy Han, Ben Deverett, Mohammad Amin Sadeghi, Abdel-Badih Ariss, Marc Ghanem, David Seong, Andrew A. Lee, Caitlin E. Coombes, Brad Bradshaw, Mahir A. Sufian, Hyo Jung Hong, Teresa P. Nguyen, Mohammad R. Rasouli, Komal Kamra, Mark A. Burbridge, James C. McAvoy, Roya Saffary, Stephen P. Ma, Dev Dash, James Xie, Ellen Y. Wang, Clifford A. Schmiesing, Nigam Shah, Nima Aghaeepour","cs.AI, cs.CL, cs.IR, cs.LO",story,"Methods to ensure factual accuracy of text generated by large language models
(LLM) in clinical medicine are lacking. VeriFact is an artificial intelligence
system that combines retrieval-augmented generation and LLM-as-a-Judge to
verify whether LLM-generated text is factually supported by a patient's medical
history based on their electronic health record (EHR). To evaluate this system,
we introduce VeriFact-BHC, a new dataset that decomposes Brief Hospital Course
narratives from discharge summaries into a set of simple statements with
clinician annotations for whether each statement is supported by the patient's
EHR clinical notes. Whereas highest agreement between clinicians was 88.5%,
VeriFact achieves up to 92.7% agreement when compared to a denoised and
adjudicated average human clinican ground truth, suggesting that VeriFact
exceeds the average clinician's ability to fact-check text against a patient's
medical record. VeriFact may accelerate the development of LLM-based EHR
applications by removing current evaluation bottlenecks.",2025-01-28
"People who frequently use ChatGPT for writing tasks are accurate and
  robust detectors of AI-generated text",2025-01-26 19:31:34+00:00,http://arxiv.org/abs/2501.15654v1,"Jenna Russell, Marzena Karpinska, Mohit Iyyer","cs.CL, cs.AI",story,"In this paper, we study how well humans can detect text generated by
commercial LLMs (GPT-4o, Claude, o1). We hire annotators to read 300
non-fiction English articles, label them as either human-written or
AI-generated, and provide paragraph-length explanations for their decisions.
Our experiments show that annotators who frequently use LLMs for writing tasks
excel at detecting AI-generated text, even without any specialized training or
feedback. In fact, the majority vote among five such ""expert"" annotators
misclassifies only 1 of 300 articles, significantly outperforming most
commercial and open-source detectors we evaluated even in the presence of
evasion tactics like paraphrasing and humanization. Qualitative analysis of the
experts' free-form explanations shows that while they rely heavily on specific
lexical clues ('AI vocabulary'), they also pick up on more complex phenomena
within the text (e.g., formality, originality, clarity) that are challenging to
assess for automatic detectors. We release our annotated dataset and code to
spur future research into both human and automated detection of AI-generated
text.",2025-01-26
"Instruction Tuning for Story Understanding and Generation with Weak
  Supervision",2025-01-26 15:59:31+00:00,http://arxiv.org/abs/2501.15574v1,"Yangshu Yuan, Heng Chen, Christian Ng",cs.CL,story,"Story understanding and generation have long been a challenging task in
natural language processing (NLP), especially when dealing with various levels
of instruction specificity. In this paper, we propose a novel approach called
""Weak to Strong Instruction Tuning"" for improving story generation by tuning
models with instructions of varying clarity. We explore the potential of large
language models (LLMs) to adapt to different types of instructions, weak and
strong, and show that our method significantly enhances performance in story
comprehension and generation. By leveraging the strength of instruction tuning,
we train models to understand the nuances of story plots, characters, and
themes while generating coherent and engaging narratives. Through extensive
experiments on several benchmark datasets and comparison with state-of-the-art
baselines, we demonstrate that our method outperforms existing techniques,
yielding substantial improvements in both automatic evaluation metrics and
human evaluations. Our work shows that adaptive instruction tuning can be a
powerful tool in refining generative models for complex narrative tasks.",2025-01-26
"Semantic Layered Embedding Diffusion in Large Language Models for
  Multi-Contextual Consistency",2025-01-26 05:17:04+00:00,http://arxiv.org/abs/2501.15405v1,"Irin Kabakum, Thomas Montgomery, Daniel Ravenwood, Genevieve Harrington","cs.CL, cs.AI",story,"The Semantic Layered Embedding Diffusion (SLED) mechanism redefines the
representation of hierarchical semantics within transformer-based
architectures, enabling enhanced contextual consistency across a wide array of
linguistic tasks. By introducing a multi-layered diffusion process grounded in
spectral analysis, it achieves a complex balance between global and local
semantic coherence. Experimental results demonstrate significant improvements
in perplexity and BLEU scores, emphasizing the mechanism's ability to adapt
effectively across diverse domains, including multilingual and cross-domain
text generation. A rigorous mathematical framework underpins the embedding
diffusion process, incorporating weighted adjacency matrices, kernel-based
refinements, and dynamic layer-wise normalization. Error distribution analysis
reveals that SLED addresses challenges in semantic alignment and coherence,
outperforming baseline approaches across varied benchmarks. Scalability studies
illustrate that its performance gains are maintained consistently across
different model sizes, reflecting a practical balance between computational
efficiency and linguistic precision. The implementation also achieves energy
efficiency, reducing resource consumption during training and inference phases
without compromising accuracy. Qualitative case studies further validate its
adaptability to extended narratives and context-intensive scenarios,
highlighting the mechanism's potential for real-world applications. SLED offers
a different perspective on embedding design and its implications for advancing
language modeling.",2025-01-26
"Toyteller: AI-powered Visual Storytelling Through Toy-Playing with
  Character Symbols",2025-01-23 00:20:38+00:00,http://arxiv.org/abs/2501.13284v1,"John Joon Young Chung, Melissa Roemmele, Max Kreminski","cs.HC, cs.AI, cs.CL",story,"We introduce Toyteller, an AI-powered storytelling system where users
generate a mix of story text and visuals by directly manipulating character
symbols like they are toy-playing. Anthropomorphized symbol motions can convey
rich and nuanced social interactions; Toyteller leverages these motions (1) to
let users steer story text generation and (2) as a visual output format that
accompanies story text. We enabled motion-steered text generation and
text-steered motion generation by mapping motions and text onto a shared
semantic space so that large language models and motion generation models can
use it as a translational layer. Technical evaluations showed that Toyteller
outperforms a competitive baseline, GPT-4o. Our user study identified that
toy-playing helps express intentions difficult to verbalize. However, only
motions could not express all user intentions, suggesting combining it with
other modalities like language. We discuss the design space of toy-playing
interactions and implications for technical HCI research on human-AI
interaction.",2025-01-23
"Neural Contextual Reinforcement Framework for Logical Structure Language
  Generation",2025-01-20 11:34:28+00:00,http://arxiv.org/abs/2501.11417v1,"Marcus Irvin, William Cooper, Edward Hughes, Jessica Morgan, Christopher Hamilton","cs.CL, cs.AI",story,"The Neural Contextual Reinforcement Framework introduces an innovative
approach to enhancing the logical coherence and structural consistency of text
generated by large language models. Leveraging reinforcement learning
principles, the framework integrates custom reward functions and dynamic
context alignment mechanisms to address challenges inherent in maintaining
long-range dependencies across extended sequences. The architecture
incorporates multi-head attention layers and hierarchical encoding modules,
enabling the model to produce outputs that align closely with human
expectations of logical structure and semantic flow. Quantitative evaluations
across diverse datasets demonstrate substantial improvements in coherence
metrics, perplexity reduction, and semantic alignment, showcasing the
framework's ability to outperform baseline models in both general and
domain-specific tasks. Qualitative analyses further highlight the framework's
capacity to generate text with improved narrative clarity and reduced
redundancy, reflecting its effectiveness in balancing fluency with structural
precision. In addition to its performance gains, the framework exhibits
robustness in handling noisy input data and scalability across varying model
sizes, reinforcing its versatility in practical applications. Experimental
results reveal that optimal context window sizes significantly influence
coherence outcomes, showing the importance of architectural flexibility in
adapting to diverse linguistic structures. Cross-lingual performance
evaluations affirm the framework's adaptability to multiple languages,
extending its utility beyond monolingual contexts. Resource efficiency analyses
indicate a reduction in computational overhead compared to traditional
approaches, emphasizing the practicality of the framework for large-scale
deployment.",2025-01-20
"Why are we living the age of AI applications right now? The long
  innovation path from AI's birth to a child's bedtime magic",2025-01-12 20:50:24+00:00,http://arxiv.org/abs/2501.06929v1,Tapio Pitkäranta,"cs.CY, cs.AI",story,"Today a four-year-old child who does not know how to read or write can now
create bedtime stories with graphical illustrations and narrated audio, using
AI tools that seamlessly transform speech into text, generate visuals, and
convert text back into speech in a natural and engaging manner. This remarkable
example demonstrates why we are living in the age of AI applications. This
paper examines contemporary leading AI applications and traces their historical
development, highlighting the major advancements that have enabled their
realization. Five key factors are identified: 1) The evolution of computational
hardware (CPUs and GPUs), enabling the training of complex AI models 2) The
vast digital archives provided by the World Wide Web, which serve as a
foundational data resource for AI systems 3) The ubiquity of mobile computing,
with smartphones acting as powerful, accessible small computers in the hands of
billions 4) The rise of industrial-scale cloud infrastructures, offering
elastic computational power for AI training and deployment 5) Breakthroughs in
AI research, including neural networks, backpropagation, and the ""Attention is
All You Need"" framework, which underpin modern AI capabilities. These
innovations have elevated AI from solving narrow tasks to enabling applications
like ChatGPT that are adaptable for numerous use cases, redefining
human-computer interaction. By situating these developments within a historical
context, the paper highlights the critical milestones that have made AI's
current capabilities both possible and widely accessible, offering profound
implications for society.",2025-01-12
"Examining the Robustness of Homogeneity Bias to Hyperparameter
  Adjustments in GPT-4",2025-01-04 06:51:49+00:00,http://arxiv.org/abs/2501.02211v1,Messi H. J. Lee,"cs.CV, cs.CL, cs.LG",story,"Vision-Language Models trained on massive collections of human-generated data
often reproduce and amplify societal stereotypes. One critical form of
stereotyping reproduced by these models is homogeneity bias-the tendency to
represent certain groups as more homogeneous than others. We investigate how
this bias responds to hyperparameter adjustments in GPT-4, specifically
examining sampling temperature and top p which control the randomness of model
outputs. By generating stories about individuals from different racial and
gender groups and comparing their similarities using vector representations, we
assess both bias robustness and its relationship with hyperparameter values. We
find that (1) homogeneity bias persists across most hyperparameter
configurations, with Black Americans and women being represented more
homogeneously than White Americans and men, (2) the relationship between
hyperparameters and group representations shows unexpected non-linear patterns,
particularly at extreme values, and (3) hyperparameter adjustments affect
racial and gender homogeneity bias differently-while increasing temperature or
decreasing top p can reduce racial homogeneity bias, these changes show
different effects on gender homogeneity bias. Our findings suggest that while
hyperparameter tuning may mitigate certain biases to some extent, it cannot
serve as a universal solution for addressing homogeneity bias across different
social group dimensions.",2025-01-04
"An Investigation into Value Misalignment in LLM-Generated Texts for
  Cultural Heritage",2025-01-03 14:35:32+00:00,http://arxiv.org/abs/2501.02039v1,"Fan Bu, Zheng Wang, Siyi Wang, Ziyao Liu","cs.CL, cs.AI",story,"As Large Language Models (LLMs) become increasingly prevalent in tasks
related to cultural heritage, such as generating descriptions of historical
monuments, translating ancient texts, preserving oral traditions, and creating
educational content, their ability to produce accurate and culturally aligned
texts is being increasingly relied upon by users and researchers. However,
cultural value misalignments may exist in generated texts, such as the
misrepresentation of historical facts, the erosion of cultural identity, and
the oversimplification of complex cultural narratives, which may lead to severe
consequences. Therefore, investigating value misalignment in the context of LLM
for cultural heritage is crucial for mitigating these risks, yet there has been
a significant lack of systematic and comprehensive study and investigation in
this area. To fill this gap, we systematically assess the reliability of LLMs
in generating culturally aligned texts for cultural heritage-related tasks. We
conduct a comprehensive evaluation by compiling an extensive set of 1066 query
tasks covering 5 widely recognized categories with 17 aspects within the
knowledge framework of cultural heritage across 5 open-source LLMs, and examine
both the type and rate of cultural value misalignments in the generated texts.
Using both automated and manual approaches, we effectively detect and analyze
the cultural value misalignments in LLM-generated texts. Our findings are
concerning: over 65% of the generated texts exhibit notable cultural
misalignments, with certain tasks demonstrating almost complete misalignment
with key cultural values. Beyond these findings, this paper introduces a
benchmark dataset and a comprehensive evaluation workflow that can serve as a
valuable resource for future research aimed at enhancing the cultural
sensitivity and reliability of LLMs.",2025-01-03
Echoes in AI: Quantifying Lack of Plot Diversity in LLM Outputs,2024-12-31 04:54:48+00:00,http://arxiv.org/abs/2501.00273v1,"Weijia Xu, Nebojsa Jojic, Sudha Rao, Chris Brockett, Bill Dolan",cs.CL,story,"With rapid advances in large language models (LLMs), there has been an
increasing application of LLMs in creative content ideation and generation. A
critical question emerges: can current LLMs provide ideas that are diverse
enough to truly bolster the collective creativity? We examine two
state-of-the-art LLMs, GPT-4 and LLaMA-3, on story generation and discover that
LLM-generated stories often consist of plot elements that are echoed across a
number of generations. To quantify this phenomenon, we introduce the Sui
Generis score, which estimates how unlikely a plot element is to appear in
alternative storylines generated by the same LLM. Evaluating on 100 short
stories, we find that LLM-generated stories often contain combinations of
idiosyncratic plot elements echoed frequently across generations, while the
original human-written stories are rarely recreated or even echoed in pieces.
Moreover, our human evaluation shows that the ranking of Sui Generis scores
among story segments correlates moderately with human judgment of surprise
level, even though score computation is completely automatic without relying on
human judgment.",2024-12-31
"Are We in the AI-Generated Text World Already? Quantifying and
  Monitoring AIGT on Social Media",2024-12-24 04:04:54+00:00,http://arxiv.org/abs/2412.18148v1,"Zhen Sun, Zongmin Zhang, Xinyue Shen, Ziyi Zhang, Yule Liu, Michael Backes, Yang Zhang, Xinlei He","cs.AI, cs.CL, cs.CR, cs.SI",story,"Social media platforms are experiencing a growing presence of AI-Generated
Texts (AIGTs). However, the misuse of AIGTs could have profound implications
for public opinion, such as spreading misinformation and manipulating
narratives. Despite its importance, a systematic study to assess the prevalence
of AIGTs on social media is still lacking. To address this gap, this paper aims
to quantify, monitor, and analyze the AIGTs on online social media platforms.
We first collect a dataset (SM-D) with around 2.4M posts from 3 major social
media platforms: Medium, Quora, and Reddit. Then, we construct a diverse
dataset (AIGTBench) to train and evaluate AIGT detectors. AIGTBench combines
popular open-source datasets and our AIGT datasets generated from social media
texts by 12 LLMs, serving as a benchmark for evaluating mainstream detectors.
With this setup, we identify the best-performing detector (OSM-Det). We then
apply OSM-Det to SM-D to track AIGTs over time and observe different trends of
AI Attribution Rate (AAR) across social media platforms from January 2022 to
October 2024. Specifically, Medium and Quora exhibit marked increases in AAR,
rising from 1.77% to 37.03% and 2.06% to 38.95%, respectively. In contrast,
Reddit shows slower growth, with AAR increasing from 1.31% to 2.45% over the
same period. Our further analysis indicates that AIGTs differ from
human-written texts across several dimensions, including linguistic patterns,
topic distributions, engagement levels, and the follower distribution of
authors. We envision our analysis and findings on AIGTs in social media can
shed light on future research in this domain.",2024-12-24
"Chain-of-MetaWriting: Linguistic and Textual Analysis of How Small
  Language Models Write Young Students Texts",2024-12-19 15:58:53+00:00,http://arxiv.org/abs/2412.14986v1,"Ioana Buhnila, Georgeta Cislaru, Amalia Todirascu",cs.CL,story,"Large Language Models (LLMs) have been used to generate texts in response to
different writing tasks: reports, essays, story telling. However, language
models do not have a meta-representation of the text writing process, nor
inherent communication learning needs, comparable to those of young human
students. This paper introduces a fine-grained linguistic and textual analysis
of multilingual Small Language Models' (SLMs) writing. With our method,
Chain-of-MetaWriting, SLMs can imitate some steps of the human writing process,
such as planning and evaluation. We mainly focused on short story and essay
writing tasks in French for schoolchildren and undergraduate students
respectively. Our results show that SLMs encounter difficulties in assisting
young students on sensitive topics such as violence in the schoolyard, and they
sometimes use words too complex for the target audience. In particular, the
output is quite different from the human produced texts in term of text
cohesion and coherence regarding temporal connectors, topic progression,
reference.",2024-12-19
"Evaluation of LLM Vulnerabilities to Being Misused for Personalized
  Disinformation Generation",2024-12-18 09:48:53+00:00,http://arxiv.org/abs/2412.13666v1,"Aneta Zugecova, Dominik Macko, Ivan Srba, Robert Moro, Jakub Kopal, Katarina Marcincinova, Matus Mesarcik","cs.CL, cs.AI, cs.CY",story,"The capabilities of recent large language models (LLMs) to generate
high-quality content indistinguishable by humans from human-written texts rises
many concerns regarding their misuse. Previous research has shown that LLMs can
be effectively misused for generating disinformation news articles following
predefined narratives. Their capabilities to generate personalized (in various
aspects) content have also been evaluated and mostly found usable. However, a
combination of personalization and disinformation abilities of LLMs has not
been comprehensively studied yet. Such a dangerous combination should trigger
integrated safety filters of the LLMs, if there are some. This study fills this
gap by evaluation of vulnerabilities of recent open and closed LLMs, and their
willingness to generate personalized disinformation news articles in English.
We further explore whether the LLMs can reliably meta-evaluate the
personalization quality and whether the personalization affects the
generated-texts detectability. Our results demonstrate the need for stronger
safety-filters and disclaimers, as those are not properly functioning in most
of the evaluated LLMs. Additionally, our study revealed that the
personalization actually reduces the safety-filter activations; thus
effectively functioning as a jailbreak. Such behavior must be urgently
addressed by LLM developers and service providers.",2024-12-18
"Generating Long-form Story Using Dynamic Hierarchical Outlining with
  Memory-Enhancement",2024-12-18 07:50:54+00:00,http://arxiv.org/abs/2412.13575v1,"Qianyue Wang, Jinwu Hu, Zhengping Li, Yufeng Wang, daiyuan li, Yu Hu, Mingkui Tan",cs.CL,story,"Long-form story generation task aims to produce coherent and sufficiently
lengthy text, essential for applications such as novel writingand interactive
storytelling. However, existing methods, including LLMs, rely on rigid outlines
or lack macro-level planning, making it difficult to achieve both contextual
consistency and coherent plot development in long-form story generation. To
address this issues, we propose Dynamic Hierarchical Outlining with
Memory-Enhancement long-form story generation method, named DOME, to generate
the long-form story with coherent content and plot. Specifically, the Dynamic
Hierarchical Outline(DHO) mechanism incorporates the novel writing theory into
outline planning and fuses the plan and writing stages together, improving the
coherence of the plot by ensuring the plot completeness and adapting to the
uncertainty during story generation. A Memory-Enhancement Module (MEM) based on
temporal knowledge graphs is introduced to store and access the generated
content, reducing contextual conflicts and improving story coherence. Finally,
we propose a Temporal Conflict Analyzer leveraging temporal knowledge graphs to
automatically evaluate the contextual consistency of long-form story.
Experiments demonstrate that DOME significantly improves the fluency,
coherence, and overall quality of generated long stories compared to
state-of-the-art methods.",2024-12-18
