title,pubdate,id,authors,categories,search,abstract,displaydate
Automating Direct Speech Variations in Stories and Games,2017-08-30 02:19:39+00:00,http://arxiv.org/abs/1708.09090v1,"Stephanie M. Lukin, James O. Ryan, Marilyn A. Walker",cs.CL,dialogue,"Dialogue authoring in large games requires not only content creation but the
subtlety of its delivery, which can vary from character to character. Manually
authoring this dialogue can be tedious, time-consuming, or even altogether
infeasible. This paper utilizes a rich narrative representation for modeling
dialogue and an expressive natural language generation engine for realizing it,
and expands upon a translation tool that bridges the two. We add functionality
to the translator to allow direct speech to be modeled by the narrative
representation, whereas the original translator supports only narratives told
by a third person narrator. We show that we can perform character substitution
in dialogues. We implement and evaluate a potential application to dialogue
implementation: generating dialogue for games with big, dynamic, or
procedurally-generated open worlds. We present a pilot study on human
perceptions of the personalities of characters using direct speech, assuming
unknown personality types at the time of authoring.",2017-08-30
Generating Sentence Planning Variations for Story Telling,2017-08-29 03:11:20+00:00,http://arxiv.org/abs/1708.08580v1,"Stephanie M. Lukin, Lena I. Reed, Marilyn A. Walker",cs.CL,dialogue,"There has been a recent explosion in applications for dialogue interaction
ranging from direction-giving and tourist information to interactive story
systems. Yet the natural language generation (NLG) component for many of these
systems remains largely handcrafted. This limitation greatly restricts the
range of applications; it also means that it is impossible to take advantage of
recent work in expressive and statistical language generation that can
dynamically and automatically produce a large number of variations of given
content. We propose that a solution to this problem lies in new methods for
developing language generation resources. We describe the ES-Translator, a
computational language generator that has previously been applied only to
fables, and quantitatively evaluate the domain independence of the EST by
applying it to personal narratives from weblogs. We then take advantage of
recent work on language generation to create a parameterized sentence planner
for story generation that provides aggregation operations, variations in
discourse and in point of view. Finally, we present a user evaluation of
different personal narrative retellings.",2017-08-29
"Generating Different Story Tellings from Semantic Representations of
  Narrative",2017-08-29 02:05:56+00:00,http://arxiv.org/abs/1708.08573v1,"Elena Rishes, Stephanie M. Lukin, David K. Elson, Marilyn A. Walker",cs.CL,dialogue,"In order to tell stories in different voices for different audiences,
interactive story systems require: (1) a semantic representation of story
structure, and (2) the ability to automatically generate story and dialogue
from this semantic representation using some form of Natural Language
Generation (NLG). However, there has been limited research on methods for
linking story structures to narrative descriptions of scenes and story events.
In this paper we present an automatic method for converting from Scheherazade's
story intention graph, a semantic representation, to the input required by the
Personage NLG engine. Using 36 Aesop Fables distributed in DramaBank, a
collection of story encodings, we train translation rules on one story and then
test these rules by generating text for the remaining 35. The results are
measured in terms of the string similarity metrics Levenshtein Distance and
BLEU score. The results show that we can generate the 35 stories with correct
content: the test set stories on average are close to the output of the
Scheherazade realizer, which was customized to this semantic representation. We
provide some examples of story variations generated by personage. In future
work, we will experiment with measuring the quality of the same stories
generated in different voices, and with techniques for making storytelling
interactive.",2017-08-29
"Relevance of Unsupervised Metrics in Task-Oriented Dialogue for
  Evaluating Natural Language Generation",2017-06-29 15:14:07+00:00,http://arxiv.org/abs/1706.09799v1,"Shikhar Sharma, Layla El Asri, Hannes Schulz, Jeremie Zumer",cs.CL,dialogue,"Automated metrics such as BLEU are widely used in the machine translation
literature. They have also been used recently in the dialogue community for
evaluating dialogue response generation. However, previous work in dialogue
response generation has shown that these metrics do not correlate strongly with
human judgment in the non task-oriented dialogue setting. Task-oriented
dialogue responses are expressed on narrower domains and exhibit lower
diversity. It is thus reasonable to think that these automated metrics would
correlate well with human judgment in the task-oriented setting where the
generation task consists of translating dialogue acts into a sentence. We
conduct an empirical study to confirm whether this is the case. Our findings
indicate that these automated metrics have stronger correlation with human
judgments in the task-oriented setting compared to what has been observed in
the non task-oriented setting. We also observe that these metrics correlate
even better for datasets which provide multiple ground truth reference
sentences. In addition, we show that some of the currently available corpora
for task-oriented language generation can be solved with simple models and
advocate for more challenging datasets.",2017-06-29
"Neural-based Natural Language Generation in Dialogue using RNN
  Encoder-Decoder with Semantic Aggregation",2017-06-21 01:07:02+00:00,http://arxiv.org/abs/1706.06714v3,"Van-Khanh Tran, Le-Minh Nguyen","cs.CL, cs.LG",dialogue,"Natural language generation (NLG) is an important component in spoken
dialogue systems. This paper presents a model called Encoder-Aggregator-Decoder
which is an extension of an Recurrent Neural Network based Encoder-Decoder
architecture. The proposed Semantic Aggregator consists of two components: an
Aligner and a Refiner. The Aligner is a conventional attention calculated over
the encoded input information, while the Refiner is another attention or gating
mechanism stacked over the attentive Aligner in order to further select and
aggregate the semantic elements. The proposed model can be jointly trained both
sentence planning and surface realization to produce natural language
utterances. The model was extensively assessed on four different NLG domains,
in which the experimental results showed that the proposed generator
consistently outperforms the previous methods on all the NLG domains.",2017-06-21
"Natural Language Generation for Spoken Dialogue System using RNN
  Encoder-Decoder Networks",2017-06-01 01:06:17+00:00,http://arxiv.org/abs/1706.00139v3,"Van-Khanh Tran, Le-Minh Nguyen",cs.CL,dialogue,"Natural language generation (NLG) is a critical component in a spoken
dialogue system. This paper presents a Recurrent Neural Network based
Encoder-Decoder architecture, in which an LSTM-based decoder is introduced to
select, aggregate semantic elements produced by an attention mechanism over the
input elements, and to produce the required utterances. The proposed generator
can be jointly trained both sentence planning and surface realization to
produce natural language sentences. The proposed model was extensively
evaluated on four different NLG datasets. The experimental results showed that
the proposed generators not only consistently outperform the previous methods
across all the NLG domains but also show an ability to generalize from a new,
unseen domain and learn from multi-domain datasets.",2017-06-01
"Semantic Refinement GRU-based Neural Language Generation for Spoken
  Dialogue Systems",2017-06-01 00:37:46+00:00,http://arxiv.org/abs/1706.00134v4,"Van-Khanh Tran, Le-Minh Nguyen",cs.CL,dialogue,"Natural language generation (NLG) plays a critical role in spoken dialogue
systems. This paper presents a new approach to NLG by using recurrent neural
networks (RNN), in which a gating mechanism is applied before RNN computation.
This allows the proposed model to generate appropriate sentences. The RNN-based
generator can be learned from unaligned data by jointly training sentence
planning and surface realization to produce natural language responses. The
model was extensively evaluated on four different NLG domains. The results show
that the proposed generator achieved better performance on all the NLG domains
compared to previous generators.",2017-06-01
Frames: A Corpus for Adding Memory to Goal-Oriented Dialogue Systems,2017-03-31 21:03:58+00:00,http://arxiv.org/abs/1704.00057v2,"Layla El Asri, Hannes Schulz, Shikhar Sharma, Jeremie Zumer, Justin Harris, Emery Fine, Rahul Mehrotra, Kaheer Suleman",cs.CL,dialogue,"This paper presents the Frames dataset (Frames is available at
http://datasets.maluuba.com/Frames), a corpus of 1369 human-human dialogues
with an average of 15 turns per dialogue. We developed this dataset to study
the role of memory in goal-oriented dialogue systems. Based on Frames, we
introduce a task called frame tracking, which extends state tracking to a
setting where several states are tracked simultaneously. We propose a baseline
model for this task. We show that Frames can also be used to study memory in
dialogue management and information presentation through natural language
generation.",2017-03-31
Deep Reinforcement Learning: An Overview,2017-01-25 11:52:11+00:00,http://arxiv.org/abs/1701.07274v6,Yuxi Li,cs.LG,dialogue,"We give an overview of recent exciting achievements of deep reinforcement
learning (RL). We discuss six core elements, six important mechanisms, and
twelve applications. We start with background of machine learning, deep
learning and reinforcement learning. Next we discuss core RL elements,
including value function, in particular, Deep Q-Network (DQN), policy, reward,
model, planning, and exploration. After that, we discuss important mechanisms
for RL, including attention and memory, unsupervised learning, transfer
learning, multi-agent RL, hierarchical RL, and learning to learn. Then we
discuss various applications of RL, including games, in particular, AlphaGo,
robotics, natural language processing, including dialogue systems, machine
translation, and text generation, computer vision, neural architecture design,
business management, finance, healthcare, Industry 4.0, smart grid, intelligent
transportation systems, and computer systems. We mention topics not reviewed
yet, and list a collection of RL resources. After presenting a brief summary,
we close with discussions.
  Please see Deep Reinforcement Learning, arXiv:1810.06339, for a significant
update.",2017-01-25
Piecewise Latent Variables for Neural Variational Text Processing,2016-12-01 18:49:23+00:00,http://arxiv.org/abs/1612.00377v4,"Iulian V. Serban, Alexander G. Ororbia II, Joelle Pineau, Aaron Courville","cs.CL, cs.AI, cs.LG, cs.NE, I.5.1; I.2.7",dialogue,"Advances in neural variational inference have facilitated the learning of
powerful directed graphical models with continuous latent variables, such as
variational autoencoders. The hope is that such models will learn to represent
rich, multi-modal latent factors in real-world data, such as natural language
text. However, current models often assume simplistic priors on the latent
variables - such as the uni-modal Gaussian distribution - which are incapable
of representing complex latent factors efficiently. To overcome this
restriction, we propose the simple, but highly flexible, piecewise constant
distribution. This distribution has the capacity to represent an exponential
number of modes of a latent target distribution, while remaining mathematically
tractable. Our results demonstrate that incorporating this new latent
distribution into different models yields substantial improvements in natural
language processing tasks such as document modeling and natural language
generation for dialogue.",2016-12-01
A Context-aware Natural Language Generator for Dialogue Systems,2016-08-25 10:43:56+00:00,http://arxiv.org/abs/1608.07076v1,"Ondřej Dušek, Filip Jurčíček","cs.CL, I.2.7",dialogue,"We present a novel natural language generation system for spoken dialogue
systems capable of entraining (adapting) to users' way of speaking, providing
contextually appropriate responses. The generator is based on recurrent neural
networks and the sequence-to-sequence approach. It is fully trainable from data
which include preceding context along with responses to be generated. We show
that the context-aware generator yields significant improvements over the
baseline in both automatic metrics and a human pairwise preference test.",2016-08-25
An Actor-Critic Algorithm for Sequence Prediction,2016-07-24 20:05:07+00:00,http://arxiv.org/abs/1607.07086v3,"Dzmitry Bahdanau, Philemon Brakel, Kelvin Xu, Anirudh Goyal, Ryan Lowe, Joelle Pineau, Aaron Courville, Yoshua Bengio",cs.LG,dialogue,"We present an approach to training neural networks to generate sequences
using actor-critic methods from reinforcement learning (RL). Current
log-likelihood training methods are limited by the discrepancy between their
training and testing modes, as models must generate tokens conditioned on their
previous guesses rather than the ground-truth tokens. We address this problem
by introducing a \textit{critic} network that is trained to predict the value
of an output token, given the policy of an \textit{actor} network. This results
in a training procedure that is much closer to the test phase, and allows us to
directly optimize for a task-specific score such as BLEU. Crucially, since we
leverage these techniques in the supervised learning setting rather than the
traditional RL setting, we condition the critic network on the ground-truth
output. We show that our method leads to improved performance on both a
synthetic task, and for German-English machine translation. Our analysis paves
the way for such methods to be applied in natural language generation tasks,
such as machine translation, caption generation, and dialogue modelling.",2016-07-24
"Sequence-to-Sequence Generation for Spoken Dialogue via Deep Syntax
  Trees and Strings",2016-06-17 11:51:25+00:00,http://arxiv.org/abs/1606.05491v1,"Ondřej Dušek, Filip Jurčíček","cs.CL, I.2.7",dialogue,"We present a natural language generator based on the sequence-to-sequence
approach that can be trained to produce natural language strings as well as
deep syntax dependency trees from input dialogue acts, and we use it to
directly compare two-step generation with separate sentence planning and
surface realization stages to a joint, one-step approach. We were able to train
both setups successfully using very little training data. The joint setup
offers better performance, surpassing state-of-the-art with regards to
n-gram-based scores while providing more relevant outputs.",2016-06-17
"Natural Language Generation as Planning under Uncertainty Using
  Reinforcement Learning",2016-06-15 09:05:56+00:00,http://arxiv.org/abs/1606.04686v1,"Verena Rieser, Oliver Lemon","cs.CL, cs.AI",dialogue,"We present and evaluate a new model for Natural Language Generation (NLG) in
Spoken Dialogue Systems, based on statistical planning, given noisy feedback
from the current generation context (e.g. a user and a surface realiser). We
study its use in a standard NLG problem: how to present information (in this
case a set of search results) to users, given the complex trade- offs between
utterance length, amount of information conveyed, and cognitive load. We set
these trade-offs by analysing existing MATCH data. We then train a NLG pol- icy
using Reinforcement Learning (RL), which adapts its behaviour to noisy feed-
back from the current generation context. This policy is compared to several
base- lines derived from previous work in this area. The learned policy
significantly out- performs all the prior approaches.",2016-06-15
"Natural Language Generation in Dialogue using Lexicalized and
  Delexicalized Data",2016-06-11 21:24:43+00:00,http://arxiv.org/abs/1606.03632v3,"Shikhar Sharma, Jing He, Kaheer Suleman, Hannes Schulz, Philip Bachman",cs.CL,dialogue,"Natural language generation plays a critical role in spoken dialogue systems.
We present a new approach to natural language generation for task-oriented
dialogue using recurrent neural networks in an encoder-decoder framework. In
contrast to previous work, our model uses both lexicalized and delexicalized
components i.e. slot-value pairs for dialogue acts, with slots and
corresponding values aligned together. This allows our model to learn from all
available data including the slot-value pairing, rather than being restricted
to delexicalized slots. We show that this helps our model generate more natural
sentences with better grammar. We further improve our model's performance by
transferring weights learnt from a pretrained sentence auto-encoder. Human
evaluation of our best-performing model indicates that it generates sentences
which users find more appealing.",2016-06-11
"Multiresolution Recurrent Neural Networks: An Application to Dialogue
  Response Generation",2016-06-02 17:37:31+00:00,http://arxiv.org/abs/1606.00776v2,"Iulian Vlad Serban, Tim Klinger, Gerald Tesauro, Kartik Talamadupula, Bowen Zhou, Yoshua Bengio, Aaron Courville","cs.CL, cs.AI, cs.LG, cs.NE, stat.ML, I.5.1; I.2.7",dialogue,"We introduce the multiresolution recurrent neural network, which extends the
sequence-to-sequence framework to model natural language generation as two
parallel discrete stochastic processes: a sequence of high-level coarse tokens,
and a sequence of natural language tokens. There are many ways to estimate or
learn the high-level coarse tokens, but we argue that a simple extraction
procedure is sufficient to capture a wealth of high-level discourse semantics.
Such procedure allows training the multiresolution recurrent neural network by
maximizing the exact joint log-likelihood over both sequences. In contrast to
the standard log- likelihood objective w.r.t. natural language tokens (word
perplexity), optimizing the joint log-likelihood biases the model towards
modeling high-level abstractions. We apply the proposed model to the task of
dialogue response generation in two challenging domains: the Ubuntu technical
support domain, and Twitter conversations. On Ubuntu, the model outperforms
competing approaches by a substantial margin, achieving state-of-the-art
results according to both automatic evaluation metrics and a human evaluation
study. On Twitter, the model appears to generate more relevant and on-topic
responses according to automatic evaluation metrics. Finally, our experiments
demonstrate that the proposed model is more adept at overcoming the sparsity of
natural language and is better able to capture long-term structure.",2016-06-02
Learning in the Rational Speech Acts Model,2015-10-23 02:24:23+00:00,http://arxiv.org/abs/1510.06807v1,"Will Monroe, Christopher Potts",cs.CL,dialogue,"The Rational Speech Acts (RSA) model treats language use as a recursive
process in which probabilistic speaker and listener agents reason about each
other's intentions to enrich the literal semantics of their language along
broadly Gricean lines. RSA has been shown to capture many kinds of
conversational implicature, but it has been criticized as an unrealistic model
of speakers, and it has so far required the manual specification of a semantic
lexicon, preventing its use in natural language processing applications that
learn lexical knowledge from data. We address these concerns by showing how to
define and optimize a trained statistical classifier that uses the intermediate
agents of RSA as hidden layers of representation forming a non-linear
activation function. This treatment opens up new application domains and new
possibilities for learning effectively from data. We validate the model on a
referential expression generation task, showing that the best performance is
achieved by incorporating features approximating well-established insights
about natural language generation into RSA.",2015-10-23
"Stochastic Language Generation in Dialogue using Recurrent Neural
  Networks with Convolutional Sentence Reranking",2015-08-07 16:34:11+00:00,http://arxiv.org/abs/1508.01755v1,"Tsung-Hsien Wen, Milica Gasic, Dongho Kim, Nikola Mrksic, Pei-Hao Su, David Vandyke, Steve Young",cs.CL,dialogue,"The natural language generation (NLG) component of a spoken dialogue system
(SDS) usually needs a substantial amount of handcrafting or a well-labeled
dataset to be trained on. These limitations add significantly to development
costs and make cross-domain, multi-lingual dialogue systems intractable.
Moreover, human languages are context-aware. The most natural response should
be directly learned from data rather than depending on predefined syntaxes or
rules. This paper presents a statistical language generator based on a joint
recurrent and convolutional neural network structure which can be trained on
dialogue act-utterance pairs without any semantic alignments or predefined
grammar trees. Objective metrics suggest that this new model outperforms
previous methods under the same experimental conditions. Results of an
evaluation by human judges indicate that it produces not only high quality but
linguistically varied utterances which are preferred compared to n-gram and
rule-based systems.",2015-08-07
"Semantically Conditioned LSTM-based Natural Language Generation for
  Spoken Dialogue Systems",2015-08-07 16:16:44+00:00,http://arxiv.org/abs/1508.01745v2,"Tsung-Hsien Wen, Milica Gasic, Nikola Mrksic, Pei-Hao Su, David Vandyke, Steve Young",cs.CL,dialogue,"Natural language generation (NLG) is a critical component of spoken dialogue
and it has a significant impact both on usability and perceived quality. Most
NLG systems in common use employ rules and heuristics and tend to generate
rigid and stylised responses without the natural variation of human language.
They are also not easily scaled to systems covering multiple domains and
languages. This paper presents a statistical language generator based on a
semantically controlled Long Short-term Memory (LSTM) structure. The LSTM
generator can learn from unaligned data by jointly optimising sentence planning
and surface realisation using a simple cross entropy training criterion, and
language variation can be easily achieved by sampling from output candidates.
With fewer heuristics, an objective evaluation in two differing test domains
showed the proposed method improved performance compared to previous methods.
Human judges scored the LSTM system higher on informativeness and naturalness
and overall preferred it to the other systems.",2015-08-07
Considerations on Construction Ontologies,2009-05-28 10:19:02+00:00,http://arxiv.org/abs/0905.4601v1,"Alexandru Cicortas, Victoria Stana Iordan, Alexandra Emilia Fortis",cs.AI,dialogue,"The paper proposes an analysis on some existent ontologies, in order to point
out ways to resolve semantic heterogeneity in information systems. Authors are
highlighting the tasks in a Knowledge Acquisiton System and identifying aspects
related to the addition of new information to an intelligent system. A solution
is proposed, as a combination of ontology reasoning services and natural
languages generation. A multi-agent system will be conceived with an extractor
agent, a reasoner agent and a competence management agent.",2009-05-28
"Dialogue as Discourse: Controlling Global Properties of Scripted
  Dialogue",2003-12-22 17:07:31+00:00,http://arxiv.org/abs/cs/0312052v1,"Paul Piwek, Kees van Deemter","cs.CL, cs.AI, I.2.7",dialogue,"This paper explains why scripted dialogue shares some crucial properties with
discourse. In particular, when scripted dialogues are generated by a Natural
Language Generation system, the generator can apply revision strategies that
cannot normally be used when the dialogue results from an interaction between
autonomous agents (i.e., when the dialogue is not scripted). The paper explains
that the relevant revision operators are best applied at the level of a
dialogue plan and discusses how the generator may decide when to apply a given
revision operator.",2003-12-22
"Towards Automated Generation of Scripted Dialogue: Some Time-Honoured
  Strategies",2003-12-22 16:51:53+00:00,http://arxiv.org/abs/cs/0312051v1,"Paul Piwek, Kees van Deemter","cs.CL, cs.AI, I.2.7",dialogue,"The main aim of this paper is to introduce automated generation of scripted
dialogue as a worthwhile topic of investigation. In particular the fact that
scripted dialogue involves two layers of communication, i.e., uni-directional
communication between the author and the audience of a scripted dialogue and
bi-directional pretended communication between the characters featuring in the
dialogue, is argued to raise some interesting issues. Our hope is that the
combined study of the two layers will forge links between research in text
generation and dialogue processing. The paper presents a first attempt at
creating such links by studying three types of strategies for the automated
generation of scripted dialogue. The strategies are derived from examples of
human-authored and naturally occurring dialogue.",2003-12-22
