title,pubdate,id,authors,categories,search,abstract,displaydate
Robust Dialogue Utterance Rewriting as Sequence Tagging,2020-12-29 00:05:35+00:00,http://arxiv.org/abs/2012.14535v1,"Jie Hao, Linfeng Song, Liwei Wang, Kun Xu, Zhaopeng Tu, Dong Yu",cs.CL,dialogue,"The task of dialogue rewriting aims to reconstruct the latest dialogue
utterance by copying the missing content from the dialogue context. Until now,
the existing models for this task suffer from the robustness issue, i.e.,
performances drop dramatically when testing on a different domain. We address
this robustness issue by proposing a novel sequence-tagging-based model so that
the search space is significantly reduced, yet the core of this task is still
well covered. As a common issue of most tagging models for text generation, the
model's outputs may lack fluency. To alleviate this issue, we inject the loss
signal from BLEU or GPT-2 under a REINFORCE framework. Experiments show huge
improvements of our model over the current state-of-the-art systems on domain
transfer.",2020-12-29
"Conditioned Text Generation with Transfer for Closed-Domain Dialogue
  Systems",2020-11-03 14:06:10+00:00,http://arxiv.org/abs/2011.02143v1,"Stéphane d'Ascoli, Alice Coucke, Francesco Caltagirone, Alexandre Caulier, Marc Lelarge","cs.CL, cs.AI, cs.LG",dialogue,"Scarcity of training data for task-oriented dialogue systems is a well known
problem that is usually tackled with costly and time-consuming manual data
annotation. An alternative solution is to rely on automatic text generation
which, although less accurate than human supervision, has the advantage of
being cheap and fast. Our contribution is twofold. First we show how to
optimally train and control the generation of intent-specific sentences using a
conditional variational autoencoder. Then we introduce a new protocol called
query transfer that allows to leverage a large unlabelled dataset, possibly
containing irrelevant queries, to extract relevant information. Comparison with
two different baselines shows that this method, in the appropriate regime,
consistently improves the diversity of the generated queries without
compromising their quality. We also demonstrate the effectiveness of our
generation method as a data augmentation technique for language modelling
tasks.",2020-11-03
"Improving Variational Autoencoder for Text Modelling with Timestep-Wise
  Regularisation",2020-11-02 17:20:56+00:00,http://arxiv.org/abs/2011.01136v2,"Ruizhe Li, Xiao Li, Guanyi Chen, Chenghua Lin","cs.CL, cs.LG",dialogue,"The Variational Autoencoder (VAE) is a popular and powerful model applied to
text modelling to generate diverse sentences. However, an issue known as
posterior collapse (or KL loss vanishing) happens when the VAE is used in text
modelling, where the approximate posterior collapses to the prior, and the
model will totally ignore the latent variables and be degraded to a plain
language model during text generation. Such an issue is particularly prevalent
when RNN-based VAE models are employed for text modelling. In this paper, we
propose a simple, generic architecture called Timestep-Wise Regularisation VAE
(TWR-VAE), which can effectively avoid posterior collapse and can be applied to
any RNN-based VAE models. The effectiveness and versatility of our model are
demonstrated in different tasks, including language modelling and dialogue
response generation.",2020-11-02
Go Figure! A Meta Evaluation of Factuality in Summarization,2020-10-24 08:30:20+00:00,http://arxiv.org/abs/2010.12834v1,"Saadia Gabriel, Asli Celikyilmaz, Rahul Jha, Yejin Choi, Jianfeng Gao",cs.CL,dialogue,"Text generation models can generate factually inconsistent text containing
distorted or fabricated facts about the source text. Recent work has focused on
building evaluation models to verify the factual correctness of semantically
constrained text generation tasks such as document summarization. While the
field of factuality evaluation is growing fast, we don't have well-defined
criteria for measuring the effectiveness, generalizability, reliability, or
sensitivity of the factuality metrics. Focusing on these aspects, in this
paper, we introduce a meta-evaluation framework for evaluating factual
consistency metrics. We introduce five necessary, common-sense conditions for
effective factuality metrics and experiment with nine recent factuality metrics
using synthetic and human-labeled factuality data from short news, long news
and dialogue summarization domains. Our framework enables assessing the
efficiency of any new factual consistency metric on a variety of dimensions
over multiple summarization domains and can be easily extended with new
meta-evaluation criteria. We also present our conclusions towards standardizing
the factuality evaluation metrics.",2020-10-24
AI-lead Court Debate Case Investigation,2020-10-22 11:05:14+00:00,http://arxiv.org/abs/2010.11604v2,"Changzhen Ji, Xin Zhou, Conghui Zhu, Tiejun Zhao",cs.CL,dialogue,"The multi-role judicial debate composed of the plaintiff, defendant, and
judge is an important part of the judicial trial. Different from other types of
dialogue, questions are raised by the judge, The plaintiff, plaintiff's agent
defendant, and defendant's agent would be to debating so that the trial can
proceed in an orderly manner. Question generation is an important task in
Natural Language Generation. In the judicial trial, it can help the judge raise
efficient questions so that the judge has a clearer understanding of the case.
In this work, we propose an innovative end-to-end question generation
model-Trial Brain Model (TBM) to build a Trial Brain, it can generate the
questions the judge wants to ask through the historical dialogue between the
plaintiff and the defendant. Unlike prior efforts in natural language
generation, our model can learn the judge's questioning intention through
predefined knowledge. We do experiments on real-world datasets, the
experimental results show that our model can provide a more accurate question
in the multi-role court debate scene.",2020-10-22
"RiSAWOZ: A Large-Scale Multi-Domain Wizard-of-Oz Dataset with Rich
  Semantic Annotations for Task-Oriented Dialogue Modeling",2020-10-17 08:18:59+00:00,http://arxiv.org/abs/2010.08738v1,"Jun Quan, Shian Zhang, Qian Cao, Zizhong Li, Deyi Xiong",cs.CL,dialogue,"In order to alleviate the shortage of multi-domain data and to capture
discourse phenomena for task-oriented dialogue modeling, we propose RiSAWOZ, a
large-scale multi-domain Chinese Wizard-of-Oz dataset with Rich Semantic
Annotations. RiSAWOZ contains 11.2K human-to-human (H2H) multi-turn
semantically annotated dialogues, with more than 150K utterances spanning over
12 domains, which is larger than all previous annotated H2H conversational
datasets. Both single- and multi-domain dialogues are constructed, accounting
for 65% and 35%, respectively. Each dialogue is labeled with comprehensive
dialogue annotations, including dialogue goal in the form of natural language
description, domain, dialogue states and acts at both the user and system side.
In addition to traditional dialogue annotations, we especially provide
linguistic annotations on discourse phenomena, e.g., ellipsis and coreference,
in dialogues, which are useful for dialogue coreference and ellipsis resolution
tasks. Apart from the fully annotated dataset, we also present a detailed
description of the data collection procedure, statistics and analysis of the
dataset. A series of benchmark models and results are reported, including
natural language understanding (intent detection & slot filling), dialogue
state tracking and dialogue context-to-text generation, as well as coreference
and ellipsis resolution, which facilitate the baseline comparison for future
research on this corpus.",2020-10-17
Dissecting the components and factors of Neural Text Generation,2020-10-14 17:54:42+00:00,http://arxiv.org/abs/2010.07279v1,"Khyathi Raghavi Chandu, Alan W Black",cs.CL,dialogue,"Neural text generation metamorphosed into several critical natural language
applications ranging from text completion to free form narrative generation.
Generating natural language has fundamentally been a human attribute and the
advent of ubiquitous NLP applications and virtual agents marks the need to
impart this skill to machines. There has been a colossal research effort in
various frontiers of neural text generation including machine translation,
summarization, image captioning, storytelling etc., We believe that this is an
excellent juncture to retrospect on the directions of the field. Specifically,
this paper surveys the fundamental factors and components relaying task
agnostic impacts across various generation tasks such as storytelling,
summarization, translation etc., In specific, we present an abstraction of the
imperative techniques with respect to learning paradigms, pretraining, modeling
approaches, decoding and the key challenges. Thereby, we hope to deliver a
one-stop destination for researchers in the field to facilitate a perspective
on where to situate their work and how it impacts other closely related tasks.",2020-10-14
"DLGNet-Task: An End-to-end Neural Network Framework for Modeling
  Multi-turn Multi-domain Task-Oriented Dialogue",2020-10-04 21:43:17+00:00,http://arxiv.org/abs/2010.01693v2,"Oluwatobi O. Olabiyi, Prarthana Bhattarai, C. Bayan Bruss, Zachary Kulis","cs.CL, cs.AI, cs.HC, cs.LG, cs.NE",dialogue,"Task oriented dialogue (TOD) requires the complex interleaving of a number of
individually controllable components with strong guarantees for explainability
and verifiability. This has made it difficult to adopt the multi-turn
multi-domain dialogue generation capabilities of streamlined end-to-end
open-domain dialogue systems. In this paper, we present a new framework,
DLGNet-Task, a unified task-oriented dialogue system which employs
autoregressive transformer networks such as DLGNet and GPT-2/3 to complete user
tasks in multi-turn multi-domain conversations. Our framework enjoys the
controllable, verifiable, and explainable outputs of modular approaches, and
the low development, deployment and maintenance cost of end-to-end systems.
Treating open-domain system components as additional TOD system modules allows
DLGNet-Task to learn the joint distribution of the inputs and outputs of all
the functional blocks of existing modular approaches such as, natural language
understanding (NLU), state tracking, action policy, as well as natural language
generation (NLG). Rather than training the modules individually, as is common
in real-world systems, we trained them jointly with appropriate module
separations. When evaluated on the MultiWOZ2.1 dataset, DLGNet-Task shows
comparable performance to the existing state-of-the-art approaches.
Furthermore, using DLGNet-Task in conversational AI systems reduces the level
of effort required for developing, deploying, and maintaining intelligent
assistants at scale.",2020-10-04
"Learning from Mistakes: Combining Ontologies via Self-Training for
  Dialogue Generation",2020-09-30 23:54:38+00:00,http://arxiv.org/abs/2010.00150v1,"Lena Reed, Vrindavan Harrison, Shereen Oraby, Dilek Hakkani-Tur, Marilyn Walker",cs.CL,dialogue,"Natural language generators (NLGs) for task-oriented dialogue typically take
a meaning representation (MR) as input. They are trained end-to-end with a
corpus of MR/utterance pairs, where the MRs cover a specific set of dialogue
acts and domain attributes. Creation of such datasets is labor-intensive and
time-consuming. Therefore, dialogue systems for new domain ontologies would
benefit from using data for pre-existing ontologies. Here we explore, for the
first time, whether it is possible to train an NLG for a new larger ontology
using existing training sets for the restaurant domain, where each set is based
on a different ontology. We create a new, larger combined ontology, and then
train an NLG to produce utterances covering it. For example, if one dataset has
attributes for family-friendly and rating information, and the other has
attributes for decor and service, our aim is an NLG for the combined ontology
that can produce utterances that realize values for family-friendly, rating,
decor and service. Initial experiments with a baseline neural
sequence-to-sequence model show that this task is surprisingly challenging. We
then develop a novel self-training method that identifies (errorful) model
outputs, automatically constructs a corrected MR input to form a new (MR,
utterance) training pair, and then repeatedly adds these new instances back
into the training data. We then test the resulting model on a new test set. The
result is a self-trained model whose performance is an absolute 75.4%
improvement over the baseline model. We also report a human qualitative
evaluation of the final model showing that it achieves high naturalness,
semantic coherence and grammaticality",2020-09-30
Utterance-level Dialogue Understanding: An Empirical Study,2020-09-29 09:50:21+00:00,http://arxiv.org/abs/2009.13902v5,"Deepanway Ghosal, Navonil Majumder, Rada Mihalcea, Soujanya Poria",cs.CL,dialogue,"The recent abundance of conversational data on the Web and elsewhere calls
for effective NLP systems for dialog understanding. Complete utterance-level
understanding often requires context understanding, defined by nearby
utterances. In recent years, a number of approaches have been proposed for
various utterance-level dialogue understanding tasks. Most of these approaches
account for the context for effective understanding. In this paper, we explore
and quantify the role of context for different aspects of a dialogue, namely
emotion, intent, and dialogue act identification, using state-of-the-art dialog
understanding methods as baselines. Specifically, we employ various
perturbations to distort the context of a given utterance and study its impact
on the different tasks and baselines. This provides us with insights into the
fundamental contextual controlling factors of different aspects of a dialogue.
Such insights can inspire more effective dialogue understanding models, and
provide support for future text generation approaches. The implementation
pertaining to this work is available at
https://github.com/declare-lab/dialogue-understanding.",2020-09-29
Learning to Plan and Realize Separately for Open-Ended Dialogue Systems,2020-09-26 02:31:42+00:00,http://arxiv.org/abs/2009.12506v2,"Sashank Santhanam, Zhuo Cheng, Brodie Mather, Bonnie Dorr, Archna Bhatia, Bryanna Hebenstreit, Alan Zemel, Adam Dalton, Tomek Strzalkowski, Samira Shaikh",cs.CL,dialogue,"Achieving true human-like ability to conduct a conversation remains an
elusive goal for open-ended dialogue systems. We posit this is because extant
approaches towards natural language generation (NLG) are typically construed as
end-to-end architectures that do not adequately model human generation
processes. To investigate, we decouple generation into two separate phases:
planning and realization. In the planning phase, we train two planners to
generate plans for response utterances. The realization phase uses response
plans to produce an appropriate response. Through rigorous evaluations, both
automated and human, we demonstrate that decoupling the process into planning
and realization performs better than an end-to-end approach.",2020-09-26
Language Models as Few-Shot Learner for Task-Oriented Dialogue Systems,2020-08-14 08:23:21+00:00,http://arxiv.org/abs/2008.06239v2,"Andrea Madotto, Zihan Liu, Zhaojiang Lin, Pascale Fung","cs.CL, cs.LG",dialogue,"Task-oriented dialogue systems use four connected modules, namely, Natural
Language Understanding (NLU), a Dialogue State Tracking (DST), Dialogue Policy
(DP) and Natural Language Generation (NLG). A research challenge is to learn
each module with the least amount of samples (i.e., few-shots) given the high
cost related to the data collection. The most common and effective technique to
solve this problem is transfer learning, where large language models, either
pre-trained on text or task-specific data, are fine-tuned on the few samples.
These methods require fine-tuning steps and a set of parameters for each task.
Differently, language models, such as GPT-2 (Radford et al., 2019) and GPT-3
(Brown et al., 2020), allow few-shot learning by priming the model with few
examples. In this paper, we evaluate the priming few-shot ability of language
models in the NLU, DST, DP and NLG tasks. Importantly, we highlight the current
limitations of this approach, and we discuss the possible implication for
future work.",2020-08-14
Navigating Human Language Models with Synthetic Agents,2020-08-10 14:39:53+00:00,http://arxiv.org/abs/2008.04162v7,"Philip Feldman, Antonio Bucchiarone","cs.AI, cs.CL, cs.MA, I.2; I.6; J.4",dialogue,"Modern natural language models such as the GPT-2/GPT-3 contain tremendous
amounts of information about human belief in a consistently testable form. If
these models could be shown to accurately reflect the underlying beliefs of the
human beings that produced the data used to train these models, then such
models become a powerful sociological tool in ways that are distinct from
traditional methods, such as interviews and surveys. In this study, We train a
version of the GPT-2 on a corpora of historical chess games, and then ""launch""
clusters of synthetic agents into the model, using text strings to create
context and orientation. We compare the trajectories contained in the text
generated by the agents/model and compare that to the known ground truth of the
chess board, move legality, and historical patterns of play. We find that the
percentages of moves by piece using the model are substantially similar from
human patterns. We further find that the model creates an accurate latent
representation of the chessboard, and that it is possible to plot trajectories
of legal moves across the board using this knowledge.",2020-08-10
"SARG: A Novel Semi Autoregressive Generator for Multi-turn Incomplete
  Utterance Restoration",2020-08-04 11:52:20+00:00,http://arxiv.org/abs/2008.01474v3,"Mengzuo Huang, Feng Li, Wuhe Zou, Weidong Zhang",cs.CL,dialogue,"Dialogue systems in open domain have achieved great success due to the easily
obtained single-turn corpus and the development of deep learning, but the
multi-turn scenario is still a challenge because of the frequent coreference
and information omission. In this paper, we investigate the incomplete
utterance restoration which has brought general improvement over multi-turn
dialogue systems in recent studies. Meanwhile, jointly inspired by the
autoregression for text generation and the sequence labeling for text editing,
we propose a novel semi autoregressive generator (SARG) with the high
efficiency and flexibility. Moreover, experiments on two benchmarks show that
our proposed model significantly outperforms the state-of-the-art models in
terms of quality and inference speed.",2020-08-04
Multimodal Dialogue State Tracking By QA Approach with Data Augmentation,2020-07-20 06:23:18+00:00,http://arxiv.org/abs/2007.09903v1,"Xiangyang Mou, Brandyn Sigouin, Ian Steenstra, Hui Su",cs.CL,dialogue,"Recently, a more challenging state tracking task, Audio-Video Scene-Aware
Dialogue (AVSD), is catching an increasing amount of attention among
researchers. Different from purely text-based dialogue state tracking, the
dialogue in AVSD contains a sequence of question-answer pairs about a video and
the final answer to the given question requires additional understanding of the
video. This paper interprets the AVSD task from an open-domain Question
Answering (QA) point of view and proposes a multimodal open-domain QA system to
deal with the problem. The proposed QA system uses common encoder-decoder
framework with multimodal fusion and attention. Teacher forcing is applied to
train a natural language generator. We also propose a new data augmentation
approach specifically under QA assumption. Our experiments show that our model
and techniques bring significant improvements over the baseline model on the
DSTC7-AVSD dataset and demonstrate the potentials of our data augmentation
techniques.",2020-07-20
Toward Givenness Hierarchy Theoretic Natural Language Generation,2020-07-17 17:51:29+00:00,http://arxiv.org/abs/2007.16009v1,"Poulomi Pal, Tom Williams","cs.CL, cs.AI",dialogue,"Language-capable interactive robots participating in dialogues with human
interlocutors must be able to naturally and efficiently communicate about the
entities in their environment. A key aspect of such communication is the use of
anaphoric language. The linguistic theory of the Givenness Hierarchy(GH)
suggests that humans use anaphora based on the cognitive statuses their
referents have in the minds of their interlocutors. In previous work,
researchers presented GH-theoretic approaches to robot anaphora understanding.
In this paper we describe how the GH might need to be used quite differently to
facilitate robot anaphora generation.",2020-07-17
"A Generative Model for Joint Natural Language Understanding and
  Generation",2020-06-12 22:38:55+00:00,http://arxiv.org/abs/2006.07499v1,"Bo-Hsiang Tseng, Jianpeng Cheng, Yimai Fang, David Vandyke","cs.CL, cs.AI",dialogue,"Natural language understanding (NLU) and natural language generation (NLG)
are two fundamental and related tasks in building task-oriented dialogue
systems with opposite objectives: NLU tackles the transformation from natural
language to formal representations, whereas NLG does the reverse. A key to
success in either task is parallel training data which is expensive to obtain
at a large scale. In this work, we propose a generative model which couples NLU
and NLG through a shared latent variable. This approach allows us to explore
both spaces of natural language and formal representations, and facilitates
information sharing through the latent space to eventually benefit NLU and NLG.
Our model achieves state-of-the-art performance on two dialogue datasets with
both flat and tree-structured formal representations. We also show that the
model can be trained in a semi-supervised fashion by utilising unlabelled data
to boost its performance.",2020-06-12
"Modelling Hierarchical Structure between Dialogue Policy and Natural
  Language Generator with Option Framework for Task-oriented Dialogue System",2020-06-11 20:55:28+00:00,http://arxiv.org/abs/2006.06814v3,"Jianhong Wang, Yuan Zhang, Tae-Kyun Kim, Yunjie Gu","cs.CL, cs.AI, cs.LG",dialogue,"Designing task-oriented dialogue systems is a challenging research topic,
since it needs not only to generate utterances fulfilling user requests but
also to guarantee the comprehensibility. Many previous works trained end-to-end
(E2E) models with supervised learning (SL), however, the bias in annotated
system utterances remains as a bottleneck. Reinforcement learning (RL) deals
with the problem through using non-differentiable evaluation metrics (e.g., the
success rate) as rewards. Nonetheless, existing works with RL showed that the
comprehensibility of generated system utterances could be corrupted when
improving the performance on fulfilling user requests. In o gur work, we (1)
propose modelling the hierarchical structure between dialogue policy and
natural language generator (NLG) with the option framework, called HDNO, where
the latent dialogue act is applied to avoid designing specific dialogue act
representations; (2) train HDNO via hierarchical reinforcement learning (HRL),
as well as suggest the asynchronous updates between dialogue policy and NLG
during training to theoretically guarantee their convergence to a local
maximizer; and (3) propose using a discriminator modelled with language models
as an additional reward to further improve the comprehensibility. We test HDNO
on MultiWoz 2.0 and MultiWoz 2.1, the datasets on multi-domain dialogues, in
comparison with word-level E2E model trained with RL, LaRL and HDSA, showing
improvements on the performance evaluated by automatic evaluation metrics and
human evaluation. Finally, we demonstrate the semantic meanings of latent
dialogue acts to show the ability of explanation.",2020-06-11
"Improving Disentangled Text Representation Learning with
  Information-Theoretic Guidance",2020-06-01 03:36:01+00:00,http://arxiv.org/abs/2006.00693v2,"Pengyu Cheng, Martin Renqiang Min, Dinghan Shen, Christopher Malon, Yizhe Zhang, Yitong Li, Lawrence Carin","cs.LG, stat.ML",dialogue,"Learning disentangled representations of natural language is essential for
many NLP tasks, e.g., conditional text generation, style transfer, personalized
dialogue systems, etc. Similar problems have been studied extensively for other
forms of data, such as images and videos. However, the discrete nature of
natural language makes the disentangling of textual representations more
challenging (e.g., the manipulation over the data space cannot be easily
achieved). Inspired by information theory, we propose a novel method that
effectively manifests disentangled representations of text, without any
supervision on semantics. A new mutual information upper bound is derived and
leveraged to measure dependence between style and content. By minimizing this
upper bound, the proposed method induces style and content embeddings into two
independent low-dimensional spaces. Experiments on both conditional text
generation and text-style transfer demonstrate the high quality of our
disentangled representation in terms of content and style preservation.",2020-06-01
