title,pubdate,id,authors,categories,search,abstract,displaydate
"BART: Denoising Sequence-to-Sequence Pre-training for Natural Language
  Generation, Translation, and Comprehension",2019-10-29 18:01:00+00:00,http://arxiv.org/abs/1910.13461v1,"Mike Lewis, Yinhan Liu, Naman Goyal, Marjan Ghazvininejad, Abdelrahman Mohamed, Omer Levy, Ves Stoyanov, Luke Zettlemoyer","cs.CL, cs.LG, stat.ML",dialogue,"We present BART, a denoising autoencoder for pretraining sequence-to-sequence
models. BART is trained by (1) corrupting text with an arbitrary noising
function, and (2) learning a model to reconstruct the original text. It uses a
standard Tranformer-based neural machine translation architecture which,
despite its simplicity, can be seen as generalizing BERT (due to the
bidirectional encoder), GPT (with the left-to-right decoder), and many other
more recent pretraining schemes. We evaluate a number of noising approaches,
finding the best performance by both randomly shuffling the order of the
original sentences and using a novel in-filling scheme, where spans of text are
replaced with a single mask token. BART is particularly effective when fine
tuned for text generation but also works well for comprehension tasks. It
matches the performance of RoBERTa with comparable training resources on GLUE
and SQuAD, achieves new state-of-the-art results on a range of abstractive
dialogue, question answering, and summarization tasks, with gains of up to 6
ROUGE. BART also provides a 1.1 BLEU increase over a back-translation system
for machine translation, with only target language pretraining. We also report
ablation experiments that replicate other pretraining schemes within the BART
framework, to better measure which factors most influence end-task performance.",2019-10-29
"ViGGO: A Video Game Corpus for Data-To-Text Generation in Open-Domain
  Conversation",2019-10-26 20:18:59+00:00,http://arxiv.org/abs/1910.12129v1,"Juraj Juraska, Kevin K. Bowden, Marilyn Walker",cs.CL,dialogue,"The uptake of deep learning in natural language generation (NLG) led to the
release of both small and relatively large parallel corpora for training neural
models. The existing data-to-text datasets are, however, aimed at task-oriented
dialogue systems, and often thus limited in diversity and versatility. They are
typically crowdsourced, with much of the noise left in them. Moreover, current
neural NLG models do not take full advantage of large training data, and due to
their strong generalizing properties produce sentences that look template-like
regardless. We therefore present a new corpus of 7K samples, which (1) is clean
despite being crowdsourced, (2) has utterances of 9 generalizable and
conversational dialogue act types, making it more suitable for open-domain
dialogue systems, and (3) explores the domain of video games, which is new to
dialogue systems despite having excellent potential for supporting rich
conversations.",2019-10-26
"Controlled Text Generation for Data Augmentation in Intelligent
  Artificial Agents",2019-10-04 20:44:21+00:00,http://arxiv.org/abs/1910.03487v1,"Nikolaos Malandrakis, Minmin Shen, Anuj Goyal, Shuyang Gao, Abhishek Sethi, Angeliki Metallinou","cs.CL, cs.LG, stat.ML",dialogue,"Data availability is a bottleneck during early stages of development of new
capabilities for intelligent artificial agents. We investigate the use of text
generation techniques to augment the training data of a popular commercial
artificial agent across categories of functionality, with the goal of faster
development of new functionality. We explore a variety of encoder-decoder
generative models for synthetic training data generation and propose using
conditional variational auto-encoders. Our approach requires only direct
optimization, works well with limited data and significantly outperforms the
previous controlled text generation techniques. Further, the generated data are
used as additional training samples in an extrinsic intent classification task,
leading to improved performance by up to 5\% absolute f-score in low-resource
cases, validating the usefulness of our approach.",2019-10-04
"Tree-Structured Semantic Encoder with Knowledge Sharing for Domain
  Adaptation in Natural Language Generation",2019-10-02 14:27:11+00:00,http://arxiv.org/abs/1910.06719v1,"Bo-Hsiang Tseng, Paweł Budzianowski, Yen-Chen Wu, Milica Gašić","cs.CL, cs.LG",dialogue,"Domain adaptation in natural language generation (NLG) remains challenging
because of the high complexity of input semantics across domains and limited
data of a target domain. This is particularly the case for dialogue systems,
where we want to be able to seamlessly include new domains into the
conversation. Therefore, it is crucial for generation models to share knowledge
across domains for the effective adaptation from one domain to another. In this
study, we exploit a tree-structured semantic encoder to capture the internal
structure of complex semantic representations required for multi-domain
dialogues in order to facilitate knowledge sharing across domains. In addition,
a layer-wise attention mechanism between the tree encoder and the decoder is
adopted to further improve the model's capability. The automatic evaluation
results show that our model outperforms previous methods in terms of the BLEU
score and the slot error rate, in particular when the adaptation data is
limited. In subjective evaluation, human judges tend to prefer the sentences
generated by our model, rating them more highly on informativeness and
naturalness than other systems.",2019-10-02
"Towards a Metric for Automated Conversational Dialogue System Evaluation
  and Improvement",2019-09-26 12:55:14+00:00,http://arxiv.org/abs/1909.12066v2,"Jan Deriu, Mark Cieliebak","cs.AI, cs.CL, cs.LG",dialogue,"We present ""AutoJudge"", an automated evaluation method for conversational
dialogue systems. The method works by first generating dialogues based on
self-talk, i.e. dialogue systems talking to itself. Then, it uses human ratings
on these dialogues to train an automated judgement model. Our experiments show
that AutoJudge correlates well with the human ratings and can be used to
automatically evaluate dialogue systems, even in deployed systems. In a second
part, we attempt to apply AutoJudge to improve existing systems. This works
well for re-ranking a set of candidate utterances. However, our experiments
show that AutoJudge cannot be applied as reward for reinforcement learning,
although the metric can distinguish good from bad dialogues. We discuss
potential reasons, but state here already that this is still an open question
for further research.",2019-09-26
MOSS: End-to-End Dialog System Framework with Modular Supervision,2019-09-12 09:27:37+00:00,http://arxiv.org/abs/1909.05528v1,"Weixin Liang, Youzhi Tian, Chengcai Chen, Zhou Yu","cs.AI, cs.CL",dialogue,"A major bottleneck in training end-to-end task-oriented dialog system is the
lack of data. To utilize limited training data more efficiently, we propose
Modular Supervision Network (MOSS), an encoder-decoder training framework that
could incorporate supervision from various intermediate dialog system modules
including natural language understanding, dialog state tracking, dialog policy
learning, and natural language generation. With only 60% of the training data,
MOSS-all (i.e., MOSS with supervision from all four dialog modules) outperforms
state-of-the-art models on CamRest676. Moreover, introducing modular
supervision has even bigger benefits when the dialog task has a more complex
dialog state and action space. With only 40% of the training data, MOSS-all
outperforms the state-of-the-art model on a complex laptop network
troubleshooting dataset, LaptopNetwork, that we introduced. LaptopNetwork
consists of conversations between real customers and customer service agents in
Chinese. Moreover, MOSS framework can accommodate dialogs that have supervision
from different dialog modules at both the framework level and model level.
Therefore, MOSS is extremely flexible to update in a real-world deployment.",2019-09-12
"TransSent: Towards Generation of Structured Sentences with Discourse
  Marker",2019-09-05 14:03:35+00:00,http://arxiv.org/abs/1909.05364v3,"Xing Wu, Dongjun Wei, Liangjun Zang, Jizhong Han, Songlin Hu","cs.CL, cs.AI",dialogue,"Structured sentences are important expressions in human writings and
dialogues. Previous works on neural text generation fused semantic and
structural information by encoding the entire sentence into a mixed hidden
representation. However, when a generated sentence becomes complicated, the
structure is difficult to be properly maintained. To alleviate this problem, we
explicitly separate the modeling process of semantic and structural
information. Intuitively, humans generate structured sentences by directly
connecting discourses with discourse markers (such as and, but, etc.).
Therefore, we propose a task that mimics this process, called discourse
transfer. This task represents a structured sentence as (head discourse,
discourse marker, tail discourse), and aims at tail discourse generation based
on head discourse and discourse marker. We also propose a corresponding model
called TransSent, which interprets the relationship between two discourses as a
translation1 from the head discourse to the tail discourse in the embedding
space. We experiment TransSent not only in discourse transfer task but also in
free text generation and dialogue generation tasks. Automatic and human
evaluation results show that TransSent can generate structured sentences with
high quality, and has certain scalability in different tasks.",2019-09-05
"Learning Question-Guided Video Representation for Multi-Turn Video
  Question Answering",2019-07-31 01:37:58+00:00,http://arxiv.org/abs/1907.13280v1,"Guan-Lin Chao, Abhinav Rastogi, Semih Yavuz, Dilek Hakkani-Tür, Jindong Chen, Ian Lane",cs.CL,dialogue,"Understanding and conversing about dynamic scenes is one of the key
capabilities of AI agents that navigate the environment and convey useful
information to humans. Video question answering is a specific scenario of such
AI-human interaction where an agent generates a natural language response to a
question regarding the video of a dynamic scene. Incorporating features from
multiple modalities, which often provide supplementary information, is one of
the challenging aspects of video question answering. Furthermore, a question
often concerns only a small segment of the video, hence encoding the entire
video sequence using a recurrent neural network is not computationally
efficient. Our proposed question-guided video representation module efficiently
generates the token-level video summary guided by each word in the question.
The learned representations are then fused with the question to generate the
answer. Through empirical evaluation on the Audio Visual Scene-aware Dialog
(AVSD) dataset, our proposed models in single-turn and multi-turn question
answering achieve state-of-the-art performance on several automatic natural
language generation evaluation metrics.",2019-07-31
"Automatic Conditional Generation of Personalized Social Media Short
  Texts",2019-06-15 09:20:41+00:00,http://arxiv.org/abs/1906.09324v1,"Ziwen Wang, Jie Wang, Haiqian Gu, Fei Su, Bojin Zhuang","cs.CL, cs.AI, cs.SI",dialogue,"Automatic text generation has received much attention owing to rapid
development of deep neural networks. In general, text generation systems based
on statistical language model will not consider anthropomorphic
characteristics, which results in machine-like generated texts. To fill the
gap, we propose a conditional language generation model with Big Five
Personality (BFP) feature vectors as input context, which writes human-like
short texts. The short text generator consists of a layer of long short memory
network (LSTM), where a BFP feature vector is concatenated as one part of input
for each cell. To enable supervised training generation model, a text
classification model based convolution neural network (CNN) has been used to
prepare BFP-tagged Chinese micro-blog corpora. Validated by a BFP linguistic
computational model, our generated Chinese short texts exhibit discriminative
personality styles, which are also syntactically correct and semantically
smooth with appropriate emoticons. With combination of natural language
generation with psychological linguistics, our proposed BFP-dependent text
generation model can be widely used for individualization in machine
translation, image caption, dialogue generation and so on.",2019-06-15
"Jointly Learning Semantic Parser and Natural Language Generator via Dual
  Information Maximization",2019-06-03 05:00:09+00:00,http://arxiv.org/abs/1906.00575v3,"Hai Ye, Wenjie Li, Lu Wang",cs.CL,dialogue,"Semantic parsing aims to transform natural language (NL) utterances into
formal meaning representations (MRs), whereas an NL generator achieves the
reverse: producing a NL description for some given MRs. Despite this intrinsic
connection, the two tasks are often studied separately in prior work. In this
paper, we model the duality of these two tasks via a joint learning framework,
and demonstrate its effectiveness of boosting the performance on both tasks.
Concretely, we propose a novel method of dual information maximization (DIM) to
regularize the learning process, where DIM empirically maximizes the
variational lower bounds of expected joint distributions of NL and MRs. We
further extend DIM to a semi-supervision setup (SemiDIM), which leverages
unlabeled data of both tasks. Experiments on three datasets of dialogue
management and code generation (and summarization) show that performance on
both semantic parsing and NL generation can be consistently improved by DIM, in
both supervised and semi-supervised setups.",2019-06-03
"A Survey of Natural Language Generation Techniques with a Focus on
  Dialogue Systems - Past, Present and Future Directions",2019-06-02 22:55:14+00:00,http://arxiv.org/abs/1906.00500v1,"Sashank Santhanam, Samira Shaikh",cs.CL,dialogue,"One of the hardest problems in the area of Natural Language Processing and
Artificial Intelligence is automatically generating language that is coherent
and understandable to humans. Teaching machines how to converse as humans do
falls under the broad umbrella of Natural Language Generation. Recent years
have seen unprecedented growth in the number of research articles published on
this subject in conferences and journals both by academic and industry
researchers. There have also been several workshops organized alongside
top-tier NLP conferences dedicated specifically to this problem. All this
activity makes it hard to clearly define the state of the field and reason
about its future directions. In this work, we provide an overview of this
important and thriving area, covering traditional approaches, statistical
approaches and also approaches that use deep neural networks. We provide a
comprehensive review towards building open domain dialogue systems, an
important application of natural language generation. We find that,
predominantly, the approaches for building dialogue systems use seq2seq or
language models architecture. Notably, we identify three important areas of
further research towards building more effective dialogue systems: 1)
incorporating larger context, including conversation context and world
knowledge; 2) adding personae or personality in the NLG system; and 3)
overcoming dull and generic responses that affect the quality of
system-produced responses. We provide pointers on how to tackle these open
problems through the use of cognitive architectures that mimic human language
understanding and generation capabilities.",2019-06-02
Adversarial Generation and Encoding of Nested Texts,2019-06-01 15:01:16+00:00,http://arxiv.org/abs/1906.00238v1,Alon Rozental,cs.CL,dialogue,"In this paper we propose a new language model called AGENT, which stands for
Adversarial Generation and Encoding of Nested Texts. AGENT is designed for
encoding, generating and refining documents that consist of a long and coherent
text, such as an entire book, provided they are hierarchically annotated
(nested). i.e. divided into sentences, paragraphs and chapters. The core idea
of our system is learning vector representations for each level of the text
hierarchy (sentences, paragraphs, etc...), and train each such representation
to perform 3 tasks: The task of reconstructing the sequence of vectors from a
lower level that was used to create the representation, and generalized
versions of the Masked Language Modeling (MLM) and ""Next Sentence Prediction""
tasks from BERT Devlin et al. [2018]. Additionally we present a new adversarial
model for long text generation and suggest a way to improve the coherence of
the generated text by traversing its vector representation tree.",2019-06-01
Theme-aware generation model for chinese lyrics,2019-05-23 08:50:15+00:00,http://arxiv.org/abs/1906.02134v1,"Jie Wang, Xinyan Zhao","cs.CL, cs.LG",dialogue,"With rapid development of neural networks, deep-learning has been extended to
various natural language generation fields, such as machine translation,
dialogue generation and even literature creation. In this paper, we propose a
theme-aware language generation model for Chinese music lyrics, which improves
the theme-connectivity and coherence of generated paragraphs greatly. A
multi-channel sequence-to-sequence (seq2seq) model encodes themes and previous
sentences as global and local contextual information. Moreover, attention
mechanism is incorporated for sequence decoding, enabling to fuse context into
predicted next texts. To prepare appropriate train corpus, LDA (Latent
Dirichlet Allocation) is applied for theme extraction. Generated lyrics is
grammatically correct and semantically coherent with selected themes, which
offers a valuable modelling method in other fields including multi-turn
chatbots, long paragraph generation and etc.",2019-05-23
"Meta-Learning for Low-resource Natural Language Generation in
  Task-oriented Dialogue Systems",2019-05-14 14:35:06+00:00,http://arxiv.org/abs/1905.05644v1,"Fei Mi, Minlie Huang, Jiyong Zhang, Boi Faltings","cs.CL, cs.LG",dialogue,"Natural language generation (NLG) is an essential component of task-oriented
dialogue systems. Despite the recent success of neural approaches for NLG, they
are typically developed for particular domains with rich annotated training
examples. In this paper, we study NLG in a low-resource setting to generate
sentences in new scenarios with handful training examples. We formulate the
problem from a meta-learning perspective, and propose a generalized
optimization-based approach (Meta-NLG) based on the well-recognized
model-agnostic meta-learning (MAML) algorithm. Meta-NLG defines a set of meta
tasks, and directly incorporates the objective of adapting to new low-resource
NLG tasks into the meta-learning optimization process. Extensive experiments
are conducted on a large multi-domain dataset (MultiWoz) with diverse
linguistic variations. We show that Meta-NLG significantly outperforms other
training procedures in various low-resource configurations. We analyze the
results, and demonstrate that Meta-NLG adapts extremely fast and well to
low-resource situations.",2019-05-14
"Generate, Filter, and Rank: Grammaticality Classification for
  Production-Ready NLG Systems",2019-04-05 21:02:12+00:00,http://arxiv.org/abs/1904.03279v2,"Ashwini Challa, Kartikeya Upasani, Anusha Balakrishnan, Rajen Subba",cs.CL,dialogue,"Neural approaches to Natural Language Generation (NLG) have been promising
for goal-oriented dialogue. One of the challenges of productionizing these
approaches, however, is the ability to control response quality, and ensure
that generated responses are acceptable. We propose the use of a generate,
filter, and rank framework, in which candidate responses are first filtered to
eliminate unacceptable responses, and then ranked to select the best response.
While acceptability includes grammatical correctness and semantic correctness,
we focus only on grammaticality classification in this paper, and show that
existing datasets for grammatical error correction don't correctly capture the
distribution of errors that data-driven generators are likely to make. We
release a grammatical classification and semantic correctness classification
dataset for the weather domain that consists of responses generated by 3
data-driven NLG systems. We then explore two supervised learning approaches
(CNNs and GBDTs) for classifying grammaticality. Our experiments show that
grammaticality classification is very sensitive to the distribution of errors
in the data, and that these distributions vary significantly with both the
source of the response as well as the domain. We show that it's possible to
achieve high precision with reasonable recall on our dataset.",2019-04-05
"Unifying Human and Statistical Evaluation for Natural Language
  Generation",2019-04-04 21:03:34+00:00,http://arxiv.org/abs/1904.02792v1,"Tatsunori B. Hashimoto, Hugh Zhang, Percy Liang","cs.CL, cs.AI, stat.ML",dialogue,"How can we measure whether a natural language generation system produces both
high quality and diverse outputs? Human evaluation captures quality but not
diversity, as it does not catch models that simply plagiarize from the training
set. On the other hand, statistical evaluation (i.e., perplexity) captures
diversity but not quality, as models that occasionally emit low quality samples
would be insufficiently penalized. In this paper, we propose a unified
framework which evaluates both diversity and quality, based on the optimal
error rate of predicting whether a sentence is human- or machine-generated. We
demonstrate that this error rate can be efficiently estimated by combining
human and statistical evaluation, using an evaluation metric which we call
HUSE. On summarization and chit-chat dialogue, we show that (i) HUSE detects
diversity defects which fool pure human evaluation and that (ii) techniques
such as annealing for improving quality actually decrease HUSE due to decreased
diversity.",2019-04-04
"Natural Language Generation at Scale: A Case Study for Open Domain
  Question Answering",2019-03-19 16:35:29+00:00,http://arxiv.org/abs/1903.08097v2,"Alessandra Cervone, Chandra Khatri, Rahul Goel, Behnam Hedayatnia, Anu Venkatesh, Dilek Hakkani-Tur, Raefer Gabriel",cs.CL,dialogue,"Current approaches to Natural Language Generation (NLG) for dialog mainly
focus on domain-specific, task-oriented applications (e.g. restaurant booking)
using limited ontologies (up to 20 slot types), usually without considering the
previous conversation context. Furthermore, these approaches require large
amounts of data for each domain, and do not benefit from examples that may be
available for other domains. This work explores the feasibility of applying
statistical NLG to scenarios requiring larger ontologies, such as multi-domain
dialog applications or open-domain question answering (QA) based on knowledge
graphs. We model NLG through an Encoder-Decoder framework using a large dataset
of interactions between real-world users and a conversational agent for
open-domain QA. First, we investigate the impact of increasing the number of
slot types on the generation quality and experiment with different partitions
of the QA data with progressively larger ontologies (up to 369 slot types).
Second, we perform multi-task learning experiments between open-domain QA and
task-oriented dialog, and benchmark our model on a popular NLG dataset.
Moreover, we experiment with using the conversational context as an additional
input to improve response generation quality. Our experiments show the
feasibility of learning statistical NLG models for open-domain QA with larger
ontologies.",2019-03-19
"What makes a good conversation? How controllable attributes affect human
  judgments",2019-02-22 19:59:47+00:00,http://arxiv.org/abs/1902.08654v2,"Abigail See, Stephen Roller, Douwe Kiela, Jason Weston",cs.CL,dialogue,"A good conversation requires balance -- between simplicity and detail;
staying on topic and changing it; asking questions and answering them. Although
dialogue agents are commonly evaluated via human judgments of overall quality,
the relationship between quality and these individual factors is less
well-studied. In this work, we examine two controllable neural text generation
methods, conditional training and weighted decoding, in order to control four
important attributes for chitchat dialogue: repetition, specificity,
response-relatedness and question-asking. We conduct a large-scale human
evaluation to measure the effect of these control parameters on multi-turn
interactive conversations on the PersonaChat task. We provide a detailed
analysis of their relationship to high-level aspects of conversation, and show
that by controlling combinations of these variables our models obtain clear
improvements in human quality judgments.",2019-02-22
