title,pubdate,id,authors,categories,search,abstract,displaydate
Fluent Response Generation for Conversational Question Answering,2020-05-21 04:57:01+00:00,http://arxiv.org/abs/2005.10464v2,"Ashutosh Baheti, Alan Ritter, Kevin Small",cs.CL,dialogue,"Question answering (QA) is an important aspect of open-domain conversational
agents, garnering specific research focus in the conversational QA (ConvQA)
subtask. One notable limitation of recent ConvQA efforts is the response being
answer span extraction from the target corpus, thus ignoring the natural
language generation (NLG) aspect of high-quality conversational agents. In this
work, we propose a method for situating QA responses within a SEQ2SEQ NLG
approach to generate fluent grammatical answer responses while maintaining
correctness. From a technical perspective, we use data augmentation to generate
training data for an end-to-end system. Specifically, we develop Syntactic
Transformations (STs) to produce question-specific candidate answer responses
and rank them using a BERT-based classifier (Devlin et al., 2019). Human
evaluation on SQuAD 2.0 data (Rajpurkar et al., 2018) demonstrate that the
proposed model outperforms baseline CoQA and QuAC models in generating
conversational responses. We further show our model's scalability by conducting
tests on the CoQA dataset. The code and data are available at
https://github.com/abaheti95/QADialogSystem.",2020-05-21
"Artificial Intelligence versus Maya Angelou: Experimental evidence that
  people cannot differentiate AI-generated from human-written poetry",2020-05-20 11:52:28+00:00,http://arxiv.org/abs/2005.09980v2,"Nils Köbis, Luca Mossink","cs.AI, cs.CL, econ.GN, q-fin.EC",dialogue,"The release of openly available, robust natural language generation
algorithms (NLG) has spurred much public attention and debate. One reason lies
in the algorithms' purported ability to generate human-like text across various
domains. Empirical evidence using incentivized tasks to assess whether people
(a) can distinguish and (b) prefer algorithm-generated versus human-written
text is lacking. We conducted two experiments assessing behavioral reactions to
the state-of-the-art Natural Language Generation algorithm GPT-2 (Ntotal =
830). Using the identical starting lines of human poems, GPT-2 produced samples
of poems. From these samples, either a random poem was chosen
(Human-out-of-the-loop) or the best one was selected (Human-in-the-loop) and in
turn matched with a human-written poem. In a new incentivized version of the
Turing Test, participants failed to reliably detect the
algorithmically-generated poems in the Human-in-the-loop treatment, yet
succeeded in the Human-out-of-the-loop treatment. Further, people reveal a
slight aversion to algorithm-generated poetry, independent on whether
participants were informed about the algorithmic origin of the poem
(Transparency) or not (Opacity). We discuss what these results convey about the
performance of NLG algorithms to produce human-like text and propose
methodologies to study such learning algorithms in human-agent experimental
settings.",2020-05-20
Token Manipulation Generative Adversarial Network for Text Generation,2020-05-06 13:10:43+00:00,http://arxiv.org/abs/2005.02794v2,DaeJin Jo,"stat.ML, cs.AI, cs.LG",dialogue,"MaskGAN opens the query for the conditional language model by filling in the
blanks between the given tokens. In this paper, we focus on addressing the
limitations caused by having to specify blanks to be filled. We decompose
conditional text generation problem into two tasks, make-a-blank and
fill-in-the-blank, and extend the former to handle more complex manipulations
on the given tokens. We cast these tasks as a hierarchical multi agent RL
problem and introduce a conditional adversarial learning that allows the agents
to reach a goal, producing realistic texts, in cooperative setting. We show
that the proposed model not only addresses the limitations but also provides
good results without compromising the performance in terms of quality and
diversity.",2020-05-06
Towards Controllable Biases in Language Generation,2020-05-01 08:25:11+00:00,http://arxiv.org/abs/2005.00268v2,"Emily Sheng, Kai-Wei Chang, Premkumar Natarajan, Nanyun Peng",cs.CL,dialogue,"We present a general approach towards controllable societal biases in natural
language generation (NLG). Building upon the idea of adversarial triggers, we
develop a method to induce societal biases in generated text when input prompts
contain mentions of specific demographic groups. We then analyze two scenarios:
1) inducing negative biases for one demographic and positive biases for another
demographic, and 2) equalizing biases between demographics. The former scenario
enables us to detect the types of biases present in the model. Specifically, we
show the effectiveness of our approach at facilitating bias analysis by finding
topics that correspond to demographic inequalities in generated text and
comparing the relative effectiveness of inducing biases for different
demographics. The second scenario is useful for mitigating biases in downstream
applications such as dialogue generation. In our experiments, the mitigation
technique proves to be effective at equalizing the amount of biases across
demographics while simultaneously generating less negatively biased text
overall.",2020-05-01
"Towards Unsupervised Language Understanding and Generation by Joint Dual
  Learning",2020-04-30 12:02:33+00:00,http://arxiv.org/abs/2004.14710v1,"Shang-Yu Su, Chao-Wei Huang, Yun-Nung Chen",cs.CL,dialogue,"In modular dialogue systems, natural language understanding (NLU) and natural
language generation (NLG) are two critical components, where NLU extracts the
semantics from the given texts and NLG is to construct corresponding natural
language sentences based on the input semantic representations. However, the
dual property between understanding and generation has been rarely explored.
The prior work is the first attempt that utilized the duality between NLU and
NLG to improve the performance via a dual supervised learning framework.
However, the prior work still learned both components in a supervised manner,
instead, this paper introduces a general learning framework to effectively
exploit such duality, providing flexibility of incorporating both supervised
and unsupervised learning algorithms to train language understanding and
generation models in a joint fashion. The benchmark experiments demonstrate
that the proposed approach is capable of boosting the performance of both NLU
and NLG.",2020-04-30
"Boosting Naturalness of Language in Task-oriented Dialogues via
  Adversarial Training",2020-04-30 03:35:20+00:00,http://arxiv.org/abs/2004.14565v2,Chenguang Zhu,cs.CL,dialogue,"The natural language generation (NLG) module in a task-oriented dialogue
system produces user-facing utterances conveying required information. Thus, it
is critical for the generated response to be natural and fluent. We propose to
integrate adversarial training to produce more human-like responses. The model
uses Straight-Through Gumbel-Softmax estimator for gradient computation. We
also propose a two-stage training scheme to boost performance. Empirical
results show that the adversarial training can effectively improve the quality
of language generation in both automatic and human evaluations. For example, in
the RNN-LG Restaurant dataset, our model AdvNLG outperforms the previous
state-of-the-art result by 3.6% in BLEU.",2020-04-30
BLEU Neighbors: A Reference-less Approach to Automatic Evaluation,2020-04-27 11:51:28+00:00,http://arxiv.org/abs/2004.12726v3,"Kawin Ethayarajh, Dorsa Sadigh","cs.CL, cs.LG",dialogue,"Evaluation is a bottleneck in the development of natural language generation
(NLG) models. Automatic metrics such as BLEU rely on references, but for tasks
such as open-ended generation, there are no references to draw upon. Although
language diversity can be estimated using statistical measures such as
perplexity, measuring language quality requires human evaluation. However,
because human evaluation at scale is slow and expensive, it is used sparingly;
it cannot be used to rapidly iterate on NLG models, in the way BLEU is used for
machine translation. To this end, we propose BLEU Neighbors, a nearest
neighbors model for estimating language quality by using the BLEU score as a
kernel function. On existing datasets for chitchat dialogue and open-ended
sentence generation, we find that -- on average -- the quality estimation from
a BLEU Neighbors model has a lower mean squared error and higher Spearman
correlation with the ground truth than individual human annotators. Despite its
simplicity, BLEU Neighbors even outperforms state-of-the-art models on
automatically grading essays, including models that have access to a
gold-standard reference essay.",2020-04-27
Residual Energy-Based Models for Text Generation,2020-04-22 23:19:55+00:00,http://arxiv.org/abs/2004.11714v1,"Yuntian Deng, Anton Bakhtin, Myle Ott, Arthur Szlam, Marc'Aurelio Ranzato","cs.CL, cs.LG",dialogue,"Text generation is ubiquitous in many NLP tasks, from summarization, to
dialogue and machine translation. The dominant parametric approach is based on
locally normalized models which predict one word at a time. While these work
remarkably well, they are plagued by exposure bias due to the greedy nature of
the generation process. In this work, we investigate un-normalized energy-based
models (EBMs) which operate not at the token but at the sequence level. In
order to make training tractable, we first work in the residual of a pretrained
locally normalized language model and second we train using noise contrastive
estimation. Furthermore, since the EBM works at the sequence level, we can
leverage pretrained bi-directional contextual representations, such as BERT and
RoBERTa. Our experiments on two large language modeling datasets show that
residual EBMs yield lower perplexity compared to locally normalized baselines.
Moreover, generation via importance sampling is very efficient and of higher
quality than the baseline models according to human evaluation.",2020-04-22
Trading Off Diversity and Quality in Natural Language Generation,2020-04-22 09:12:10+00:00,http://arxiv.org/abs/2004.10450v1,"Hugh Zhang, Daniel Duckworth, Daphne Ippolito, Arvind Neelakantan",cs.CL,dialogue,"For open-ended language generation tasks such as storytelling and dialogue,
choosing the right decoding algorithm is critical to controlling the tradeoff
between generation quality and diversity. However, there presently exists no
consensus on which decoding procedure is best or even the criteria by which to
compare them. We address these issues by casting decoding as a multi-objective
optimization problem aiming to simultaneously maximize both response quality
and diversity. Our framework enables us to perform the first large-scale
evaluation of decoding methods along the entire quality-diversity spectrum. We
find that when diversity is a priority, all methods perform similarly, but when
quality is viewed as more important, the recently proposed nucleus sampling
(Holtzman et al. 2019) outperforms all other evaluated decoding algorithms. Our
experiments also confirm the existence of the `likelihood trap', the
counter-intuitive observation that high likelihood sequences are often
surprisingly low quality. We leverage our findings to create and evaluate an
algorithm called \emph{selective sampling} which tractably approximates
globally-normalized temperature sampling.",2020-04-22
Sparse Text Generation,2020-04-06 13:09:10+00:00,http://arxiv.org/abs/2004.02644v3,"Pedro Henrique Martins, Zita Marinho, André F. T. Martins",cs.CL,dialogue,"Current state-of-the-art text generators build on powerful language models
such as GPT-2, achieving impressive performance. However, to avoid degenerate
text, they require sampling from a modified softmax, via temperature parameters
or ad-hoc truncation techniques, as in top-$k$ or nucleus sampling. This
creates a mismatch between training and testing conditions. In this paper, we
use the recently introduced entmax transformation to train and sample from a
natively sparse language model, avoiding this mismatch. The result is a text
generator with favorable performance in terms of fluency and consistency, fewer
repetitions, and n-gram diversity closer to human text. In order to evaluate
our model, we propose three new metrics for comparing sparse or truncated
distributions: $\epsilon$-perplexity, sparsemax score, and Jensen-Shannon
divergence. Human-evaluated experiments in story completion and dialogue
generation show that entmax sampling leads to more engaging and coherent
stories and conversations.",2020-04-06
"An Empirical Investigation of Pre-Trained Transformer Language Models
  for Open-Domain Dialogue Generation",2020-03-09 15:20:21+00:00,http://arxiv.org/abs/2003.04195v1,Piji Li,"cs.CL, cs.AI",dialogue,"We present an empirical investigation of pre-trained Transformer-based
auto-regressive language models for the task of open-domain dialogue
generation. Training paradigm of pre-training and fine-tuning is employed to
conduct the parameter learning. Corpora of News and Wikipedia in Chinese and
English are collected for the pre-training stage respectively. Dialogue context
and response are concatenated into a single sequence utilized as the input of
the models during the fine-tuning stage. A weighted joint prediction paradigm
for both context and response is designed to evaluate the performance of models
with or without the loss term for context prediction. Various of decoding
strategies such as greedy search, beam search, top-k sampling, etc. are
employed to conduct the response text generation. Extensive experiments are
conducted on the typical single-turn and multi-turn dialogue corpora such as
Weibo, Douban, Reddit, DailyDialog, and Persona-Chat. Detailed numbers of
automatic evaluation metrics on relevance and diversity of the generated
results for the languages models as well as the baseline approaches are
reported.",2020-03-09
"Learning to Compare for Better Training and Evaluation of Open Domain
  Natural Language Generation Models",2020-02-12 15:52:21+00:00,http://arxiv.org/abs/2002.05058v1,"Wangchunshu Zhou, Ke Xu","cs.CL, cs.LG",dialogue,"Automated evaluation of open domain natural language generation (NLG) models
remains a challenge and widely used metrics such as BLEU and Perplexity can be
misleading in some cases. In our paper, we propose to evaluate natural language
generation models by learning to compare a pair of generated sentences by
fine-tuning BERT, which has been shown to have good natural language
understanding ability. We also propose to evaluate the model-level quality of
NLG models with sample-level comparison results with skill rating system. While
able to be trained in a fully self-supervised fashion, our model can be further
fine-tuned with a little amount of human preference annotation to better
imitate human judgment. In addition to evaluating trained models, we propose to
apply our model as a performance indicator during training for better
hyperparameter tuning and early-stopping. We evaluate our approach on both
story generation and chit-chat dialogue response generation. Experimental
results show that our model correlates better with human preference compared
with previous automated evaluation approaches. Training with the proposed
metric yields better performance in human evaluation, which further
demonstrates the effectiveness of the proposed model.",2020-02-12
"Bridging Text and Video: A Universal Multimodal Transformer for
  Video-Audio Scene-Aware Dialog",2020-02-01 07:50:43+00:00,http://arxiv.org/abs/2002.00163v1,"Zekang Li, Zongjia Li, Jinchao Zhang, Yang Feng, Cheng Niu, Jie Zhou",cs.CL,dialogue,"Audio-Visual Scene-Aware Dialog (AVSD) is a task to generate responses when
chatting about a given video, which is organized as a track of the 8th Dialog
System Technology Challenge (DSTC8). To solve the task, we propose a universal
multimodal transformer and introduce the multi-task learning method to learn
joint representations among different modalities as well as generate
informative and fluent responses. Our method extends the natural language
generation pre-trained model to multimodal dialogue generation task. Our system
achieves the best performance in both objective and subjective evaluations in
the challenge.",2020-02-01
"Incorporating Joint Embeddings into Goal-Oriented Dialogues with
  Multi-Task Learning",2020-01-28 17:15:02+00:00,http://arxiv.org/abs/2001.10468v1,"Firas Kassawat, Debanjan Chaudhuri, Jens Lehmann","cs.CL, cs.LG, cs.NE, stat.ML",dialogue,"Attention-based encoder-decoder neural network models have recently shown
promising results in goal-oriented dialogue systems. However, these models
struggle to reason over and incorporate state-full knowledge while preserving
their end-to-end text generation functionality. Since such models can greatly
benefit from user intent and knowledge graph integration, in this paper we
propose an RNN-based end-to-end encoder-decoder architecture which is trained
with joint embeddings of the knowledge graph and the corpus as input. The model
provides an additional integration of user intent along with text generation,
trained with a multi-task learning paradigm along with an additional
regularization technique to penalize generating the wrong entity as output. The
model further incorporates a Knowledge Graph entity lookup during inference to
guarantee the generated output is state-full based on the local knowledge graph
provided. We finally evaluated the model using the BLEU score, empirical
evaluation depicts that our proposed architecture can aid in the betterment of
task-oriented dialogue system`s performance.",2020-01-28
"ERNIE-GEN: An Enhanced Multi-Flow Pre-training and Fine-tuning Framework
  for Natural Language Generation",2020-01-26 02:54:49+00:00,http://arxiv.org/abs/2001.11314v3,"Dongling Xiao, Han Zhang, Yukun Li, Yu Sun, Hao Tian, Hua Wu, Haifeng Wang","cs.CL, cs.LG",dialogue,"Current pre-training works in natural language generation pay little
attention to the problem of exposure bias on downstream tasks. To address this
issue, we propose an enhanced multi-flow sequence to sequence pre-training and
fine-tuning framework named ERNIE-GEN, which bridges the discrepancy between
training and inference with an infilling generation mechanism and a noise-aware
generation method. To make generation closer to human writing patterns, this
framework introduces a span-by-span generation flow that trains the model to
predict semantically-complete spans consecutively rather than predicting word
by word. Unlike existing pre-training methods, ERNIE-GEN incorporates
multi-granularity target sampling to construct pre-training data, which
enhances the correlation between encoder and decoder. Experimental results
demonstrate that ERNIE-GEN achieves state-of-the-art results with a much
smaller amount of pre-training data and parameters on a range of language
generation tasks, including abstractive summarization (Gigaword and
CNN/DailyMail), question generation (SQuAD), dialogue generation (Persona-Chat)
and generative question answering (CoQA).",2020-01-26
"Graph Constrained Reinforcement Learning for Natural Language Action
  Spaces",2020-01-23 22:33:18+00:00,http://arxiv.org/abs/2001.08837v1,"Prithviraj Ammanabrolu, Matthew Hausknecht","cs.LG, cs.AI, cs.CL, stat.ML",dialogue,"Interactive Fiction games are text-based simulations in which an agent
interacts with the world purely through natural language. They are ideal
environments for studying how to extend reinforcement learning agents to meet
the challenges of natural language understanding, partial observability, and
action generation in combinatorially-large text-based action spaces. We present
KG-A2C, an agent that builds a dynamic knowledge graph while exploring and
generates actions using a template-based action space. We contend that the dual
uses of the knowledge graph to reason about game state and to constrain natural
language generation are the keys to scalable exploration of combinatorially
large natural language actions. Results across a wide variety of IF games show
that KG-A2C outperforms current IF agents despite the exponential increase in
action space size.",2020-01-23
Stochastic Natural Language Generation Using Dependency Information,2020-01-12 09:40:11+00:00,http://arxiv.org/abs/2001.03897v1,"Elham Seifossadat, Hossein Sameti","cs.CL, cs.LG",dialogue,"This article presents a stochastic corpus-based model for generating natural
language text. Our model first encodes dependency relations from training data
through a feature set, then concatenates these features to produce a new
dependency tree for a given meaning representation, and finally generates a
natural language utterance from the produced dependency tree. We test our model
on nine domains from tabular, dialogue act and RDF format. Our model
outperforms the corpus-based state-of-the-art methods trained on tabular
datasets and also achieves comparable results with neural network-based
approaches trained on dialogue act, E2E and WebNLG datasets for BLEU and ERR
evaluation metrics. Also, by reporting Human Evaluation results, we show that
our model produces high-quality utterances in aspects of informativeness and
naturalness as well as quality.",2020-01-12
"Natural Language Generation Using Reinforcement Learning with External
  Rewards",2019-11-26 08:46:11+00:00,http://arxiv.org/abs/1911.11404v1,"Vidhushini Srinivasan, Sashank Santhanam, Samira Shaikh",cs.CL,dialogue,"We propose an approach towards natural language generation using a
bidirectional encoder-decoder which incorporates external rewards through
reinforcement learning (RL). We use attention mechanism and maximum mutual
information as an initial objective function using RL. Using a two-part
training scheme, we train an external reward analyzer to predict the external
rewards and then use the predicted rewards to maximize the expected rewards
(both internal and external). We evaluate the system on two standard dialogue
corpora - Cornell Movie Dialog Corpus and Yelp Restaurant Review Corpus. We
report standard evaluation metrics including BLEU, ROUGE-L, and perplexity as
well as human evaluation to validate our approach.",2019-11-26
Conditioned Query Generation for Task-Oriented Dialogue Systems,2019-11-09 14:22:57+00:00,http://arxiv.org/abs/1911.03698v1,"Stéphane d'Ascoli, Alice Coucke, Francesco Caltagirone, Alexandre Caulier, Marc Lelarge","cs.CL, cs.LG, stat.ML",dialogue,"Scarcity of training data for task-oriented dialogue systems is a well known
problem that is usually tackled with costly and time-consuming manual data
annotation. An alternative solution is to rely on automatic text generation
which, although less accurate than human supervision, has the advantage of
being cheap and fast. In this paper we propose a novel controlled data
generation method that could be used as a training augmentation framework for
closed-domain dialogue. Our contribution is twofold. First we show how to
optimally train and control the generation of intent-specific sentences using a
conditional variational autoencoder. Then we introduce a novel protocol called
query transfer that allows to leverage a broad, unlabelled dataset to extract
relevant information. Comparison with two different baselines shows that our
method, in the appropriate regime, consistently improves the diversity of the
generated queries without compromising their quality.",2019-11-09
Generating Justifications for Norm-Related Agent Decisions,2019-11-01 06:53:12+00:00,http://arxiv.org/abs/1911.00226v1,"Daniel Kasenberg, Antonio Roque, Ravenna Thielstrom, Meia Chita-Tegmark, Matthias Scheutz","cs.CL, cs.AI",dialogue,"We present an approach to generating natural language justifications of
decisions derived from norm-based reasoning. Assuming an agent which maximally
satisfies a set of rules specified in an object-oriented temporal logic, the
user can ask factual questions (about the agent's rules, actions, and the
extent to which the agent violated the rules) as well as ""why"" questions that
require the agent comparing actual behavior to counterfactual trajectories with
respect to these rules. To produce natural-sounding explanations, we focus on
the subproblem of producing natural language clauses from statements in a
fragment of temporal logic, and then describe how to embed these clauses into
explanatory sentences. We use a human judgment evaluation on a testbed task to
compare our approach to variants in terms of intelligibility, mental model and
perceived trust.",2019-11-01
