title,pubdate,id,authors,categories,search,abstract,displaydate
"Guess who? Multilingual approach for the automated generation of
  author-stylized poetry",2018-07-17 15:13:20+00:00,http://arxiv.org/abs/1807.07147v3,"Alexey Tikhonov, Ivan P. Yamshchikov","cs.CL, cs.AI, cs.LG",poetry,"This paper addresses the problem of stylized text generation in a
multilingual setup. A version of a language model based on a long short-term
memory (LSTM) artificial neural network with extended phonetic and semantic
embeddings is used for stylized poetry generation. The quality of the resulting
poems generated by the network is estimated through bilingual evaluation
understudy (BLEU), a survey and a new cross-entropy based metric that is
suggested for the problems of such type. The experiments show that the proposed
model consistently outperforms random sample and vanilla-LSTM baselines, humans
also tend to associate machine generated texts with the target author.",2018-07-17
Natural Language Statistical Features of LSTM-generated Texts,2018-04-10 13:17:36+00:00,http://arxiv.org/abs/1804.04087v2,"Marco Lippi, Marcelo A Montemurro, Mirko Degli Esposti, Giampaolo Cristadoro","cs.CL, cs.LG",poetry,"Long Short-Term Memory (LSTM) networks have recently shown remarkable
performance in several tasks dealing with natural language generation, such as
image captioning or poetry composition. Yet, only few works have analyzed text
generated by LSTMs in order to quantitatively evaluate to which extent such
artificial texts resemble those generated by humans. We compared the
statistical structure of LSTM-generated language to that of written natural
language, and to those produced by Markov models of various orders. In
particular, we characterized the statistical structure of language by assessing
word-frequency statistics, long-range correlations, and entropy measures. Our
main finding is that while both LSTM and Markov-generated texts can exhibit
features similar to real ones in their word-frequency statistics and entropy
measures, LSTM-texts are shown to reproduce long-range correlations at scales
comparable to those found in natural language. Moreover, for LSTM networks a
temperature-like parameter controlling the generation process shows an optimal
value---for which the produced texts are closest to real language---consistent
across all the different statistical features investigated.",2018-04-10
X575: writing rengas with web services,2016-06-25 20:04:42+00:00,http://arxiv.org/abs/1606.07955v1,"Daniel Winterstein, Joseph Corneli","cs.AI, cs.CL, I.2.1; J.5",poetry,"Our software system simulates the classical collaborative Japanese poetry
form, renga, made of linked haikus. We used NLP methods wrapped up as web
services. Our experiments were only a partial success, since results fail to
satisfy classical constraints. To gather ideas for future work, we examine
related research in semiotics, linguistics, and computing.",2016-06-25
