title,pubdate,id,authors,categories,search,abstract,displaydate
"The Perils of Using Mechanical Turk to Evaluate Open-Ended Text
  Generation",2021-09-14 17:20:30+00:00,http://arxiv.org/abs/2109.06835v1,"Marzena Karpinska, Nader Akoury, Mohit Iyyer",cs.CL,poetry,"Recent text generation research has increasingly focused on open-ended
domains such as story and poetry generation. Because models built for such
tasks are difficult to evaluate automatically, most researchers in the space
justify their modeling choices by collecting crowdsourced human judgments of
text quality (e.g., Likert scores of coherence or grammaticality) from Amazon
Mechanical Turk (AMT). In this paper, we first conduct a survey of 45
open-ended text generation papers and find that the vast majority of them fail
to report crucial details about their AMT tasks, hindering reproducibility. We
then run a series of story evaluation experiments with both AMT workers and
English teachers and discover that even with strict qualification filters, AMT
workers (unlike teachers) fail to distinguish between model-generated text and
human-generated references. We show that AMT worker judgments improve when they
are shown model-generated output alongside human-generated references, which
enables the workers to better calibrate their ratings. Finally, interviews with
the English teachers provide deeper insights into the challenges of the
evaluation process, particularly when rating model-generated text.",2021-09-14
Lingxi: A Diversity-aware Chinese Modern Poetry Generation System,2021-08-27 03:33:28+00:00,http://arxiv.org/abs/2108.12108v1,"Xinran Zhang, Maosong Sun, Jiafeng Liu, Xiaobing Li",cs.CL,poetry,"Poetry generation has been a difficult task in natural language processing.
Unlike plain neural text generation tasks, poetry has a high requirement for
novelty, since an easily-understood sentence with too many high frequency words
might not be considered as poetic, while adequately ambiguous sentences with
low frequency words can possibly be novel and creative. Inspired by this, we
present Lingxi, a diversity-aware Chinese modern poetry generation system. We
propose nucleus sampling with randomized head (NS-RH) algorithm, which
randomizes the high frequency part (""head"") of the predicted distribution, in
order to emphasize on the ""comparatively low frequency"" words. The proposed
algorithm can significantly increase the novelty of generated poetry compared
with traditional sampling methods. The permutation of distribution is
controllable by tuning the filtering parameter that determines the ""head"" to
permutate, achieving diversity-aware sampling. We find that even when a large
portion of filtered vocabulary is randomized, it can actually generate fluent
poetry but with notably higher novelty. We also propose a
semantic-similarity-based rejection sampling algorithm, which creates longer
and more informative context on the basis of the short input poetry title while
maintaining high semantic similarity to the title, alleviating the off-topic
issue.",2021-08-27
Urdu & Hindi Poetry Generation using Neural Networks,2021-07-16 16:12:51+00:00,http://arxiv.org/abs/2107.14587v1,"Shakeeb A. M. Mukhtar, Pushkar S. Joglekar","cs.CL, cs.LG",poetry,"One of the major problems writers and poets face is the writer's block. It is
a condition in which an author loses the ability to produce new work or
experiences a creative slowdown. The problem is more difficult in the context
of poetry than prose, as in the latter case authors need not be very concise
while expressing their ideas, also the various aspects such as rhyme, poetic
meters are not relevant for prose. One of the most effective ways to overcome
this writing block for poets can be, to have a prompt system, which would help
their imagination and open their minds for new ideas. A prompt system can
possibly generate one liner, two liner or full ghazals. The purpose of this
work is to give an ode to the Urdu, Hindi poets, and helping them start their
next line of poetry, a couplet or a complete ghazal considering various factors
like rhymes, refrain, and meters. The result will help aspiring poets to get
new ideas and help them overcome writer's block by auto-generating pieces of
poetry using Deep Learning techniques. A concern with creative works like this,
especially in the literary context, is to ensure that the output is not
plagiarized. This work also addresses the concern and makes sure that the
resulting odes are not exact match with input data using parameters like
temperature and manual plagiarism check against input corpus. To the best of
our knowledge, although the automatic text generation problem has been studied
quite extensively in the literature, the specific problem of Urdu, Hindi poetry
generation has not been explored much. Apart from developing system to
auto-generate Urdu, Hindi poetry, another key contribution of our work is to
create a cleaned and preprocessed corpus of Urdu, Hindi poetry (derived from
authentic resources) and making it freely available for researchers in the
area.",2021-07-16
FUDGE: Controlled Text Generation With Future Discriminators,2021-04-12 05:59:53+00:00,http://arxiv.org/abs/2104.05218v1,"Kevin Yang, Dan Klein","cs.CL, cs.LG",poetry,"We propose Future Discriminators for Generation (FUDGE), a flexible and
modular method for controlled text generation. Given a pre-existing model G for
generating text from a distribution of interest, FUDGE enables conditioning on
a desired attribute a (for example, formality) while requiring access only to
G's output logits. FUDGE learns an attribute predictor operating on a partial
sequence, and uses this predictor's outputs to adjust G's original
probabilities. We show that FUDGE models terms corresponding to a Bayesian
decomposition of the conditional distribution of G given attribute a. Moreover,
FUDGE can easily compose predictors for multiple desired attributes. We
evaluate FUDGE on three tasks -- couplet completion in poetry, topic control in
language generation, and formality change in machine translation -- and observe
gains in all three tasks.",2021-04-12
WakaVT: A Sequential Variational Transformer for Waka Generation,2021-04-01 12:14:41+00:00,http://arxiv.org/abs/2104.00426v1,"Yuka Takeishi, Mingxuan Niu, Jing Luo, Zhong Jin, Xinyu Yang","cs.CL, cs.AI",poetry,"Poetry generation has long been a challenge for artificial intelligence. In
the scope of Japanese poetry generation, many researchers have paid attention
to Haiku generation, but few have focused on Waka generation. To further
explore the creative potential of natural language generation systems in
Japanese poetry creation, we propose a novel Waka generation model, WakaVT,
which automatically produces Waka poems given user-specified keywords. Firstly,
an additive mask-based approach is presented to satisfy the form constraint.
Secondly, the structures of Transformer and variational autoencoder are
integrated to enhance the quality of generated content. Specifically, to obtain
novelty and diversity, WakaVT employs a sequence of latent variables, which
effectively captures word-level variability in Waka data. To improve linguistic
quality in terms of fluency, coherence, and meaningfulness, we further propose
the fused multilevel self-attention mechanism, which properly models the
hierarchical linguistic structure of Waka. To the best of our knowledge, we are
the first to investigate Waka generation with models based on Transformer
and/or variational autoencoder. Both objective and subjective evaluation
results demonstrate that our model outperforms baselines significantly.",2021-04-01
AfriKI: Machine-in-the-Loop Afrikaans Poetry Generation,2021-03-30 09:17:56+00:00,http://arxiv.org/abs/2103.16190v1,"Imke van Heerden, Anil Bas","cs.CL, cs.LG",poetry,"This paper proposes a generative language model called AfriKI. Our approach
is based on an LSTM architecture trained on a small corpus of contemporary
fiction. With the aim of promoting human creativity, we use the model as an
authoring tool to explore machine-in-the-loop Afrikaans poetry generation. To
our knowledge, this is the first study to attempt creative text generation in
Afrikaans.",2021-03-30
"Controllable Generation from Pre-trained Language Models via Inverse
  Prompting",2021-03-19 08:36:52+00:00,http://arxiv.org/abs/2103.10685v1,"Xu Zou, Da Yin, Qingyang Zhong, Hongxia Yang, Zhilin Yang, Jie Tang","cs.CL, cs.AI, cs.LG",poetry,"Large-scale pre-trained language models have demonstrated strong capabilities
of generating realistic text. However, it remains challenging to control the
generation results. Previous approaches such as prompting are far from
sufficient, which limits the usage of language models. To tackle this
challenge, we propose an innovative method, inverse prompting, to better
control text generation. The core idea of inverse prompting is to use generated
text to inversely predict the prompt during beam search, which enhances the
relevance between the prompt and the generated text and provides better
controllability. Empirically, we pre-train a large-scale Chinese language model
to perform a systematic study using human evaluation on the tasks of
open-domain poem generation and open-domain long-form question answering. Our
results show that our proposed method substantially outperforms the baselines
and that our generation quality is close to human performance on some of the
tasks.
  Narrators can try our poem generation demo at
https://pretrain.aminer.cn/apps/poetry.html, while our QA demo can be found at
https://pretrain.aminer.cn/app/qa. For researchers, the code is provided in
https://github.com/THUDM/InversePrompting.",2021-03-19
"Exploring Transformers in Natural Language Generation: GPT, BERT, and
  XLNet",2021-02-16 09:18:16+00:00,http://arxiv.org/abs/2102.08036v1,"M. Onat Topal, Anil Bas, Imke van Heerden","cs.CL, cs.LG",poetry,"Recent years have seen a proliferation of attention mechanisms and the rise
of Transformers in Natural Language Generation (NLG). Previously,
state-of-the-art NLG architectures such as RNN and LSTM ran into vanishing
gradient problems; as sentences grew larger, distance between positions
remained linear, and sequential computation hindered parallelization since
sentences were processed word by word. Transformers usher in a new era. In this
paper, we explore three major Transformer-based models, namely GPT, BERT, and
XLNet, that carry significant implications for the field. NLG is a burgeoning
area that is now bolstered with rapid developments in attention mechanisms.
From poetry generation to summarization, text generation derives benefit as
Transformer-based language models achieve groundbreaking results.",2021-02-16
Generate and Revise: Reinforcement Learning in Neural Poetry,2021-02-08 10:35:33+00:00,http://arxiv.org/abs/2102.04114v1,"Andrea Zugarini, Luca Pasqualini, Stefano Melacci, Marco Maggini","cs.CL, cs.AI, cs.LG",poetry,"Writers, poets, singers usually do not create their compositions in just one
breath. Text is revisited, adjusted, modified, rephrased, even multiple times,
in order to better convey meanings, emotions and feelings that the author wants
to express. Amongst the noble written arts, Poetry is probably the one that
needs to be elaborated the most, since the composition has to formally respect
predefined meter and rhyming schemes. In this paper, we propose a framework to
generate poems that are repeatedly revisited and corrected, as humans do, in
order to improve their overall quality. We frame the problem of revising poems
in the context of Reinforcement Learning and, in particular, using Proximal
Policy Optimization. Our model generates poems from scratch and it learns to
progressively adjust the generated text in order to match a target criterion.
We evaluate this approach in the case of matching a rhyming scheme, without
having any information on which words are responsible of creating rhymes and on
how to coherently alter the poem words. The proposed framework is general and,
with an appropriate reward shaping, it can be applied to other text generation
problems.",2021-02-08
Weird AI Yankovic: Generating Parody Lyrics,2020-09-25 13:56:20+00:00,http://arxiv.org/abs/2009.12240v1,Mark Riedl,"cs.CL, cs.AI",poetry,"Lyrics parody swaps one set of words that accompany a melody with a new set
of words, preserving the number of syllables per line and the rhyme scheme.
Lyrics parody generation is a challenge for controllable text generation. We
show how a specialized sampling procedure, combined with backward text
generation with XLNet can produce parody lyrics that reliably meet the syllable
and rhyme scheme constraints.We introduce the Weird AI Yankovic system and
provide a case study evaluation. We conclude with societal implications of
neural lyric parody generation.",2020-09-25
"Artificial Intelligence versus Maya Angelou: Experimental evidence that
  people cannot differentiate AI-generated from human-written poetry",2020-05-20 11:52:28+00:00,http://arxiv.org/abs/2005.09980v2,"Nils Köbis, Luca Mossink","cs.AI, cs.CL, econ.GN, q-fin.EC",poetry,"The release of openly available, robust natural language generation
algorithms (NLG) has spurred much public attention and debate. One reason lies
in the algorithms' purported ability to generate human-like text across various
domains. Empirical evidence using incentivized tasks to assess whether people
(a) can distinguish and (b) prefer algorithm-generated versus human-written
text is lacking. We conducted two experiments assessing behavioral reactions to
the state-of-the-art Natural Language Generation algorithm GPT-2 (Ntotal =
830). Using the identical starting lines of human poems, GPT-2 produced samples
of poems. From these samples, either a random poem was chosen
(Human-out-of-the-loop) or the best one was selected (Human-in-the-loop) and in
turn matched with a human-written poem. In a new incentivized version of the
Turing Test, participants failed to reliably detect the
algorithmically-generated poems in the Human-in-the-loop treatment, yet
succeeded in the Human-out-of-the-loop treatment. Further, people reveal a
slight aversion to algorithm-generated poetry, independent on whether
participants were informed about the algorithmic origin of the poem
(Transparency) or not (Opacity). We discuss what these results convey about the
performance of NLG algorithms to produce human-like text and propose
methodologies to study such learning algorithms in human-agent experimental
settings.",2020-05-20
Rigid Formats Controlled Text Generation,2020-04-17 01:40:18+00:00,http://arxiv.org/abs/2004.08022v1,"Piji Li, Haisong Zhang, Xiaojiang Liu, Shuming Shi","cs.CL, cs.LG",poetry,"Neural text generation has made tremendous progress in various tasks. One
common characteristic of most of the tasks is that the texts are not restricted
to some rigid formats when generating. However, we may confront some special
text paradigms such as Lyrics (assume the music score is given), Sonnet, SongCi
(classical Chinese poetry of the Song dynasty), etc. The typical
characteristics of these texts are in three folds: (1) They must comply fully
with the rigid predefined formats. (2) They must obey some rhyming schemes. (3)
Although they are restricted to some formats, the sentence integrity must be
guaranteed. To the best of our knowledge, text generation based on the
predefined rigid formats has not been well investigated. Therefore, we propose
a simple and elegant framework named SongNet to tackle this problem. The
backbone of the framework is a Transformer-based auto-regressive language
model. Sets of symbols are tailor-designed to improve the modeling performance
especially on format, rhyme, and sentence integrity. We improve the attention
mechanism to impel the model to capture some future information on the format.
A pre-training and fine-tuning framework is designed to further improve the
generation quality. Extensive experiments conducted on two collected corpora
demonstrate that our proposed framework generates significantly better results
in terms of both automatic metrics and the human evaluation.",2020-04-17
"Generating Major Types of Chinese Classical Poetry in a Uniformed
  Framework",2020-03-13 14:16:25+00:00,http://arxiv.org/abs/2003.11528v1,"Jinyi Hu, Maosong Sun",cs.CL,poetry,"Poetry generation is an interesting research topic in the field of text
generation. As one of the most valuable literary and cultural heritages of
China, Chinese classical poetry is very familiar and loved by Chinese people
from generation to generation. It has many particular characteristics in its
language structure, ranging from form, sound to meaning, thus is regarded as an
ideal testing task for text generation. In this paper, we propose a GPT-2 based
uniformed framework for generating major types of Chinese classical poems. We
define a unified format for formulating all types of training samples by
integrating detailed form information, then present a simple form-stressed
weighting method in GPT-2 to strengthen the control to the form of the
generated poems, with special emphasis on those forms with longer body length.
Preliminary experimental results show this enhanced model can generate Chinese
classical poems of major types with high quality in both form and content,
validating the effectiveness of the proposed strategy. The model has been
incorporated into Jiuge, the most influential Chinese classical poetry
generation system developed by Tsinghua University (Guo et al., 2019).",2020-03-13
Introducing Aspects of Creativity in Automatic Poetry Generation,2020-02-06 20:44:12+00:00,http://arxiv.org/abs/2002.02511v1,"Brendan Bena, Jugal Kalita","cs.CL, cs.AI, cs.LG",poetry,"Poetry Generation involves teaching systems to automatically generate text
that resembles poetic work. A deep learning system can learn to generate poetry
on its own by training on a corpus of poems and modeling the particular style
of language. In this paper, we propose taking an approach that fine-tunes
GPT-2, a pre-trained language model, to our downstream task of poetry
generation. We extend prior work on poetry generation by introducing creative
elements. Specifically, we generate poems that express emotion and elicit the
same in readers, and poems that use the language of dreams---called dream
poetry. We are able to produce poems that correctly elicit the emotions of
sadness and joy 87.5 and 85 percent, respectively, of the time. We produce
dreamlike poetry by training on a corpus of texts that describe dreams. Poems
from this model are shown to capture elements of dream poetry with scores of no
less than 3.2 on the Likert scale. We perform crowdsourced human-evaluation for
all our poems. We also make use of the Coh-Metrix tool, outlining metrics we
use to gauge the quality of text generated.",2020-02-06
Let's FACE it. Finnish Poetry Generation with Aesthetics and Framing,2019-10-30 16:00:54+00:00,http://arxiv.org/abs/1910.13946v1,"Mika Hämäläinen, Khalid Alnajjar",cs.CL,poetry,"We present a creative poem generator for the morphologically rich Finnish
language. Our method falls into the master-apprentice paradigm, where a
computationally creative genetic algorithm teaches a BRNN model to generate
poetry. We model several parts of poetic aesthetics in the fitness function of
the genetic algorithm, such as sonic features, semantic coherence, imagery and
metaphor. Furthermore, we justify the creativity of our method based on the
FACE theory on computational creativity and take additional care in evaluating
our system by automatic metrics for concepts together with human evaluation for
aesthetics, framing and expressions.",2019-10-30
"Creative GANs for generating poems, lyrics, and metaphors",2019-09-20 14:40:18+00:00,http://arxiv.org/abs/1909.09534v1,"Asir Saeed, Suzana Ilić, Eva Zangerle","cs.CL, cs.LG",poetry,"Generative models for text have substantially contributed to tasks like
machine translation and language modeling, using maximum likelihood
optimization (MLE). However, for creative text generation, where multiple
outputs are possible and originality and uniqueness are encouraged, MLE falls
short. Methods optimized for MLE lead to outputs that can be generic,
repetitive and incoherent. In this work, we use a Generative Adversarial
Network framework to alleviate this problem. We evaluate our framework on
poetry, lyrics and metaphor datasets, each with widely different
characteristics, and report better performance of our objective function over
other generative models.",2019-09-20
"A Hierarchical Attention Based Seq2seq Model for Chinese Lyrics
  Generation",2019-06-15 06:58:42+00:00,http://arxiv.org/abs/1906.06481v1,"Haoshen Fan, Jie Wang, Bojin Zhuang, Shaojun Wang, Jing Xiao","cs.CL, cs.LG",poetry,"In this paper, we comprehensively study on context-aware generation of
Chinese song lyrics. Conventional text generative models generate a sequence or
sentence word by word, failing to consider the contextual relationship between
sentences. Taking account into the characteristics of lyrics, a hierarchical
attention based Seq2Seq (Sequence-to-Sequence) model is proposed for Chinese
lyrics generation. With encoding of word-level and sentence-level contextual
information, this model promotes the topic relevance and consistency of
generation. A large Chinese lyrics corpus is also leveraged for model training.
Eventually, results of automatic and human evaluations demonstrate that our
model is able to compose complete Chinese lyrics with one united topic
constraint.",2019-06-15
"Automated Speech Generation from UN General Assembly Statements: Mapping
  Risks in AI Generated Texts",2019-06-05 11:23:14+00:00,http://arxiv.org/abs/1906.01946v1,"Joseph Bullock, Miguel Luengo-Oroz","cs.CL, cs.AI",poetry,"Automated text generation has been applied broadly in many domains such as
marketing and robotics, and used to create chatbots, product reviews and write
poetry. The ability to synthesize text, however, presents many potential risks,
while access to the technology required to build generative models is becoming
increasingly easy. This work is aligned with the efforts of the United Nations
and other civil society organisations to highlight potential political and
societal risks arising through the malicious use of text generation software,
and their potential impact on human rights. As a case study, we present the
findings of an experiment to generate remarks in the style of political leaders
by fine-tuning a pretrained AWD- LSTM model on a dataset of speeches made at
the UN General Assembly. This work highlights the ease with which this can be
accomplished, as well as the threats of combining these techniques with other
technologies.",2019-06-05
Theme-aware generation model for chinese lyrics,2019-05-23 08:50:15+00:00,http://arxiv.org/abs/1906.02134v1,"Jie Wang, Xinyan Zhao","cs.CL, cs.LG",poetry,"With rapid development of neural networks, deep-learning has been extended to
various natural language generation fields, such as machine translation,
dialogue generation and even literature creation. In this paper, we propose a
theme-aware language generation model for Chinese music lyrics, which improves
the theme-connectivity and coherence of generated paragraphs greatly. A
multi-channel sequence-to-sequence (seq2seq) model encodes themes and previous
sentences as global and local contextual information. Moreover, attention
mechanism is incorporated for sequence decoding, enabling to fuse context into
predicted next texts. To prepare appropriate train corpus, LDA (Latent
Dirichlet Allocation) is applied for theme extraction. Generated lyrics is
grammatically correct and semantically coherent with selected themes, which
offers a valuable modelling method in other fields including multi-turn
chatbots, long paragraph generation and etc.",2019-05-23
Hierarchical Attention: What Really Counts in Various NLP Tasks,2018-08-10 23:28:33+00:00,http://arxiv.org/abs/1808.03728v1,"Zehao Dou, Zhihua Zhang",cs.CL,poetry,"Attention mechanisms in sequence to sequence models have shown great ability
and wonderful performance in various natural language processing (NLP) tasks,
such as sentence embedding, text generation, machine translation, machine
reading comprehension, etc. Unfortunately, existing attention mechanisms only
learn either high-level or low-level features. In this paper, we think that the
lack of hierarchical mechanisms is a bottleneck in improving the performance of
the attention mechanisms, and propose a novel Hierarchical Attention Mechanism
(Ham) based on the weighted sum of different layers of a multi-level attention.
Ham achieves a state-of-the-art BLEU score of 0.26 on Chinese poem generation
task and a nearly 6.5% averaged improvement compared with the existing machine
reading comprehension models such as BIDAF and Match-LSTM. Furthermore, our
experiments and theorems reveal that Ham has greater generalization and
representation ability than existing attention mechanisms.",2018-08-10
