title,pubdate,id,authors,categories,search,abstract,source,hf_upvotes,displaydate
LLM Tree Search,2024-10-24 19:38:50+00:00,http://arxiv.org/abs/2410.19117,Dylan Wilson,,poetry,"This project aims to investigate a novel sequence generation method inspired
by the AlphaGo paradigm, adapting it for use with large language models (LLMs).
The proposed approach involves creating search trees of different possible
completions and evaluating these completions based on model confidence. By
considering various paths in the search tree and scoring them according to the
model's confidence in each completion, we can generate diverse and high-quality
sequences. This research explores the implementation of this paradigm by using
confidence as a proxy for response quality akin to beam search
vijayakumar2016diverse. The primary goal of this paper is to outline
the paradigm and demonstrate its potential, rather than focusing on achieving
perfect results. The paper will outline the reasons why we believe this
paradigm has the potential to improve LLMs in the following manners: 1)
increase output quality, 2) decrease errors, 3) eliminate or reduce the
compound error problems, 4) generate diverse and creative completions, 5) allow
for iterative problem-solving, and 6) self-training. We expect this approach to
yield a set of diverse and coherent sequences, offering insights into balancing
exploration and exploitation in sequence generation. Potential applications
include creative text generation tasks, such as storytelling and content
creation, as well as other natural language processing domains, like machine
translation and automated summarization. The goal is that the model will be far
more effective as it will be able to consider many possible variations allowing
it to find the ideal completion. This research aims to contribute to the
understanding of effective search strategies in sequence generation and their
impact on generating high-quality, varied textual outputs.",hf,1,2024-10-24
Benchmarking Foundation Models on Exceptional Cases: Dataset Creation and Validation,2024-10-23 16:24:23+00:00,http://arxiv.org/abs/2410.18001v2,"Suho Kang, Jungyang Park, Joonseo Ha, SoMin Kim, JinHyeong Kim, Subeen Park, Kyungwoo Song",cs.AI,poetry,"Foundation models (FMs) have achieved significant success across various tasks, leading to research on benchmarks for reasoning abilities. However, there is a lack of studies on FMs performance in exceptional scenarios, which we define as out-of-distribution (OOD) reasoning tasks. This paper is the first to address these cases, developing a novel dataset for evaluation of FMs across multiple modalities, including graphic novels, calligraphy, news articles, and lyrics. It includes tasks for instance classification, character recognition, token prediction, and text generation. The paper also proposes prompt engineering techniques like Chain-of-Thought (CoT) and CoT+Few-Shot to enhance performance. Validation of FMs using various methods revealed improvements. The code repository is accessible at: https://github.com/MLAI-Yonsei/ExceptionalBenchmark",arxiv,0,2024-10-23
"Benchmarking Foundation Models on Exceptional Cases: Dataset Creation
  and Validation",2024-10-23 16:24:23+00:00,http://arxiv.org/abs/2410.18001v1,"Suho Kang, Jungyang Park, Joonseo Ha, SoMin Kim, JinHyeong Kim, Subeen Park, Kyungwoo Song",cs.AI,poetry,"Foundation models (FMs) have achieved significant success across various
tasks, leading to research on benchmarks for reasoning abilities. However,
there is a lack of studies on FMs performance in exceptional scenarios, which
we define as out-of-distribution (OOD) reasoning tasks. This paper is the first
to address these cases, developing a novel dataset for evaluation of FMs across
multiple modalities, including graphic novels, calligraphy, news articles, and
lyrics. It includes tasks for instance classification, character recognition,
token prediction, and text generation. The paper also proposes prompt
engineering techniques like Chain-of-Thought (CoT) and CoT+Few-Shot to enhance
performance. Validation of FMs using various methods revealed improvements. The
code repository is accessible at:
https://github.com/MLAI-Yonsei/ExceptionalBenchmark",,0,2024-10-23
Does ChatGPT Have a Poetic Style?,2024-10-20 06:01:34+00:00,http://arxiv.org/abs/2410.15299v2,"Melanie Walsh, Anna Preus, Elizabeth Gronski",cs.CL,poetry,"Generating poetry has become a popular application of LLMs, perhaps
especially of OpenAI's widely-used chatbot ChatGPT. What kind of poet is
ChatGPT? Does ChatGPT have its own poetic style? Can it successfully produce
poems in different styles? To answer these questions, we prompt the GPT-3.5 and
GPT-4 models to generate English-language poems in 24 different poetic forms
and styles, about 40 different subjects, and in response to 3 different writing
prompt templates. We then analyze the resulting 5.7k poems, comparing them to a
sample of 3.7k poems from the Poetry Foundation and the Academy of American
Poets. We find that the GPT models, especially GPT-4, can successfully produce
poems in a range of both common and uncommon English-language forms in
superficial yet noteworthy ways, such as by producing poems of appropriate
lengths for sonnets (14 lines), villanelles (19 lines), and sestinas (39
lines). But the GPT models also exhibit their own distinct stylistic
tendencies, both within and outside of these specific forms. Our results show
that GPT poetry is much more constrained and uniform than human poetry, showing
a strong penchant for rhyme, quatrains (4-line stanzas), iambic meter,
first-person plural perspectives (we, us, our), and specific vocabulary like
""heart,"" ""embrace,"" ""echo,"" and ""whisper.""",,0,2024-10-20
SongCreator: Lyrics-based Universal Song Generation,2024-09-09 19:37:07+00:00,http://arxiv.org/abs/2409.06029,"Shun Lei, Yixuan Zhou, Boshi Tang, Max W. Y. Lam, Feng Liu, Hangyu Liu, Jingcheng Wu, Shiyin Kang, Zhiyong Wu, Helen Meng",,poetry,"Music is an integral part of human culture, embodying human intelligence and
creativity, of which songs compose an essential part. While various aspects of
song generation have been explored by previous works, such as singing voice,
vocal composition and instrumental arrangement, etc., generating songs with
both vocals and accompaniment given lyrics remains a significant challenge,
hindering the application of music generation models in the real world. In this
light, we propose SongCreator, a song-generation system designed to tackle this
challenge. The model features two novel designs: a meticulously designed
dual-sequence language model (DSLM) to capture the information of vocals and
accompaniment for song generation, and an additional attention mask strategy
for DSLM, which allows our model to understand, generate and edit songs, making
it suitable for various song-related generation tasks. Extensive experiments
demonstrate the effectiveness of SongCreator by achieving state-of-the-art or
competitive performances on all eight tasks. Notably, it surpasses previous
works by a large margin in lyrics-to-song and lyrics-to-vocals. Additionally,
it is able to independently control the acoustic conditions of the vocals and
accompaniment in the generated song through different prompts, exhibiting its
potential applicability. Our samples are available at
https://songcreator.github.io/.",hf,22,2024-09-09
LLM-based multi-agent poetry generation in non-cooperative environments,2024-09-05 16:12:29+00:00,http://arxiv.org/abs/2409.03659v2,"Ran Zhang, Steffen Eger",cs.CL,poetry,"Despite substantial progress of large language models (LLMs) for automatic
poetry generation, the generated poetry lacks diversity while the training
process differs greatly from human learning. Under the rationale that the
learning process of the poetry generation systems should be more human-like and
their output more diverse and novel, we introduce a framework based on social
learning where we emphasize non-cooperative interactions besides cooperative
interactions to encourage diversity. Our experiments are the first attempt at
LLM-based multi-agent systems in non-cooperative environments for poetry
generation employing both TRAINING-BASED agents (GPT-2) and PROMPTING-BASED
agents (GPT-3 and GPT-4). Our evaluation based on 96k generated poems shows
that our framework benefits the poetry generation process for TRAINING-BASED
agents resulting in 1) a 3.0-3.7 percentage point (pp) increase in diversity
and a 5.6-11.3 pp increase in novelty according to distinct and novel n-grams.
The generated poetry from TRAINING-BASED agents also exhibits group divergence
in terms of lexicons, styles and semantics. PROMPTING-BASED agents in our
framework also benefit from non-cooperative environments and a more diverse
ensemble of models with non-homogeneous agents has the potential to further
enhance diversity, with an increase of 7.0-17.5 pp according to our
experiments. However, PROMPTING-BASED agents show a decrease in lexical
diversity over time and do not exhibit the group-based divergence intended in
the social network. Our paper argues for a paradigm shift in creative tasks
such as automatic poetry generation to include social learning processes (via
LLM-based agent modeling) similar to human interaction.",,0,2024-09-05
Negation Blindness in Large Language Models: Unveiling the NO Syndrome in Image Generation,2024-08-27 14:40:16+00:00,http://arxiv.org/abs/2409.00105v2,"Mohammad Nadeem, Shahab Saquib Sohail, Erik Cambria, Björn W. Schuller, Amir Hussain","cs.CL, cs.AI, cs.LG",poetry,"Foundational Large Language Models (LLMs) have changed the way we perceive technology. They have been shown to excel in tasks ranging from poem writing and coding to essay generation and puzzle solving. With the incorporation of image generation capability, they have become more comprehensive and versatile AI tools. At the same time, researchers are striving to identify the limitations of these tools to improve them further. Currently identified flaws include hallucination, biases, and bypassing restricted commands to generate harmful content. In the present work, we have identified a fundamental limitation related to the image generation ability of LLMs, and termed it The NO Syndrome. This negation blindness refers to LLMs inability to correctly comprehend NO related natural language prompts to generate the desired images. Interestingly, all tested LLMs including GPT-4, Gemini, and Copilot were found to be suffering from this syndrome. To demonstrate the generalization of this limitation, we carried out simulation experiments and conducted entropy-based and benchmark statistical analysis tests on various LLMs in multiple languages, including English, Hindi, and French. We conclude that the NO syndrome is a significant flaw in current LLMs that needs to be addressed. A related finding of this study showed a consistent discrepancy between image and textual responses as a result of this NO syndrome. We posit that the introduction of a negation context-aware reinforcement learning based feedback loop between the LLMs textual response and generated image could help ensure the generated text is based on both the LLMs correct contextual understanding of the negation query and the generated visual output.",arxiv,0,2024-08-27
Controllable Text Generation for Large Language Models: A Survey,2024-08-22 17:59:04+00:00,http://arxiv.org/abs/2408.12599,"Xun Liang, Hanyu Wang, Yezhaohui Wang, Shichao Song, Jiawei Yang, Simin Niu, Jie Hu, Dan Liu, Shunyu Yao, Feiyu Xiong, Zhiyu Li",,poetry,"In Natural Language Processing (NLP), Large Language Models (LLMs) have
demonstrated high text generation quality. However, in real-world applications,
LLMs must meet increasingly complex requirements. Beyond avoiding misleading or
inappropriate content, LLMs are also expected to cater to specific user needs,
such as imitating particular writing styles or generating text with poetic
richness. These varied demands have driven the development of Controllable Text
Generation (CTG) techniques, which ensure that outputs adhere to predefined
control conditions--such as safety, sentiment, thematic consistency, and
linguistic style--while maintaining high standards of helpfulness, fluency, and
diversity.
  This paper systematically reviews the latest advancements in CTG for LLMs,
offering a comprehensive definition of its core concepts and clarifying the
requirements for control conditions and text quality. We categorize CTG tasks
into two primary types: content control and attribute control. The key methods
are discussed, including model retraining, fine-tuning, reinforcement learning,
prompt engineering, latent space manipulation, and decoding-time intervention.
We analyze each method's characteristics, advantages, and limitations,
providing nuanced insights for achieving generation control. Additionally, we
review CTG evaluation methods, summarize its applications across domains, and
address key challenges in current research, including reduced fluency and
practicality. We also propose several appeals, such as placing greater emphasis
on real-world applications in future research. This paper aims to offer
valuable guidance to researchers and developers in the field. Our reference
list and Chinese version are open-sourced at
https://github.com/IAAR-Shanghai/CTGSurvey.",hf,65,2024-08-22
Rhyme-aware Chinese lyric generator based on GPT,2024-08-19 16:17:20+00:00,http://arxiv.org/abs/2408.10130v1,"Yixiao Yuan, Yangchen Huang, Yu Ma, Xinjin Li, Zhenglin Li, Yiming Shi, Huapeng Zhou","cs.CL, cs.AI",poetry,"Neural language representation models such as GPT, pre-trained on large-scale
corpora, can effectively capture rich semantic patterns from plain text and be
fine-tuned to consistently improve natural language generation performance.
However, existing pre-trained language models used to generate lyrics rarely
consider rhyme information, which is crucial in lyrics. Using a pre-trained
model directly results in poor performance. To enhance the rhyming quality of
generated lyrics, we incorporate integrated rhyme information into our model,
thereby improving lyric generation performance.",,0,2024-08-19
"Improving Structural Diversity of Blackbox LLMs via
  Chain-of-Specification Prompting",2024-08-12 14:34:06+00:00,http://arxiv.org/abs/2408.06186v1,"Halley Young, Yimeng Zeng, Jacob Gardner, Osbert Bastani","cs.CL, cs.LG",poetry,"The capability to generate diverse text is a key challenge facing large
language models (LLMs). Thus far, diversity has been studied via metrics such
as $n$-gram diversity or diversity of BERT embeddings. However, for these kinds
of diversity, the user has little control over the dimensions along which
diversity is considered. For example, in the poetry domain, one might desire
diversity in terms of rhyme and meter, whereas in the code domain, one might
desire diversity in terms of the kinds of expressions used to solve a problem.
We propose a diversity metric called structural diversity, where the user
provides a mapping from generated text to features capturing the kinds of
diversity that they care about. In addition, we propose a novel strategy called
chain-of-specification (CoS) prompting for improving diversity by first having
the LLM generate a specification encoding one instance of structural features,
and then prompting the LLM to generate text that satisfies these features;
notably, our strategy works with blackbox LLMs. In our experiments, we show
that for structural diversity in the poetry and code domains, CoS significantly
improves diversity compared to several baselines.",,0,2024-08-12
Evaluating Diversity in Automatic Poetry Generation,2024-06-21 16:03:21+00:00,http://arxiv.org/abs/2406.15267v1,"Yanran Chen, Hannes Gröner, Sina Zarrieß, Steffen Eger",cs.CL,poetry,"Natural Language Generation (NLG), and more generally generative AI, are
among the currently most impactful research fields. Creative NLG, such as
automatic poetry generation, is a fascinating niche in this area. While most
previous research has focused on forms of the Turing test when evaluating
automatic poetry generation - can humans distinguish between automatic and
human generated poetry - we evaluate the diversity of automatically generated
poetry, by comparing distributions of generated poetry to distributions of
human poetry along structural, lexical, semantic and stylistic dimensions,
assessing different model types (word vs. character-level, general purpose LLMs
vs. poetry-specific models), including the very recent LLaMA3, and types of
fine-tuning (conditioned vs. unconditioned). We find that current automatic
poetry systems are considerably underdiverse along multiple dimensions - they
often do not rhyme sufficiently, are semantically too uniform and even do not
match the length distribution of human poetry. Our experiments reveal, however,
that style-conditioning and character-level modeling clearly increases
diversity across virtually all dimensions we explore. Our identified
limitations may serve as the basis for more genuinely diverse future poetry
generation models.",,0,2024-06-21
Evaluating Diversity in Automatic Poetry Generation,2024-06-21 16:03:21+00:00,http://arxiv.org/abs/2406.15267v2,"Yanran Chen, Hannes Gröner, Sina Zarrieß, Steffen Eger",cs.CL,poetry,"Natural Language Generation (NLG), and more generally generative AI, are among the currently most impactful research fields. Creative NLG, such as automatic poetry generation, is a fascinating niche in this area. While most previous research has focused on forms of the Turing test when evaluating automatic poetry generation -- can humans distinguish between automatic and human generated poetry -- we evaluate the diversity of automatically generated poetry (with a focus on quatrains), by comparing distributions of generated poetry to distributions of human poetry along structural, lexical, semantic and stylistic dimensions, assessing different model types (word vs. character-level, general purpose LLMs vs. poetry-specific models), including the very recent LLaMA3-8B, and types of fine-tuning (conditioned vs. unconditioned). We find that current automatic poetry systems are considerably underdiverse along multiple dimensions -- they often do not rhyme sufficiently, are semantically too uniform and even do not match the length distribution of human poetry. Our experiments reveal, however, that style-conditioning and character-level modeling clearly increases diversity across virtually all dimensions we explore. Our identified limitations may serve as the basis for more genuinely diverse future poetry generation models.",arxiv,0,2024-06-21
GPT Czech Poet: Generation of Czech Poetic Strophes with Language Models,2024-06-18 06:19:45+00:00,http://arxiv.org/abs/2407.12790v1,"Michal Chudoba, Rudolf Rosa",cs.CL,poetry,"High-quality automated poetry generation systems are currently only available
for a small subset of languages. We introduce a new model for generating poetry
in Czech language, based on fine-tuning a pre-trained Large Language Model. We
demonstrate that guiding the generation process by explicitly specifying
strophe parameters within the poem text strongly improves the effectiveness of
the model. We also find that appropriate tokenization is crucial, showing that
tokenization methods based on syllables or individual characters instead of
subwords prove superior in generating poetic strophes. We further enhance the
results by introducing \textit{Forced~generation}, adding explicit
specifications of meter and verse parameters at inference time based on the
already generated text. We evaluate a range of setups, showing that our
proposed approach achieves high accuracies in rhyming and metric aspects of
formal quality of the generated poems.",both,0,2024-06-18
Poetry2Image: An Iterative Correction Framework for Images Generated from Chinese Classical Poetry,2024-06-15 19:45:08+00:00,http://arxiv.org/abs/2407.06196v1,"Jing Jiang, Yiran Ling, Binzhu Li, Pengxiang Li, Junming Piao, Yu Zhang","cs.CV, cs.AI",poetry,"Text-to-image generation models often struggle with key element loss or semantic confusion in tasks involving Chinese classical poetry.Addressing this issue through fine-tuning models needs considerable training costs. Additionally, manual prompts for re-diffusion adjustments need professional knowledge. To solve this problem, we propose Poetry2Image, an iterative correction framework for images generated from Chinese classical poetry. Utilizing an external poetry dataset, Poetry2Image establishes an automated feedback and correction loop, which enhances the alignment between poetry and image through image generation models and subsequent re-diffusion modifications suggested by large language models (LLM). Using a test set of 200 sentences of Chinese classical poetry, the proposed method--when integrated with five popular image generation models--achieves an average element completeness of 70.63%, representing an improvement of 25.56% over direct image generation. In tests of semantic correctness, our method attains an average semantic consistency of 80.09%. The study not only promotes the dissemination of ancient poetry culture but also offers a reference for similar non-fine-tuning methods to enhance LLM generation.",arxiv,0,2024-06-15
The Importance of Directional Feedback for LLM-based Optimizers,2024-05-26 05:22:35+00:00,http://arxiv.org/abs/2405.16434,"Allen Nie, Ching-An Cheng, Andrey Kolobov, Adith Swaminathan",,poetry,"We study the potential of using large language models (LLMs) as an
interactive optimizer for solving maximization problems in a text space using
natural language and numerical feedback. Inspired by the classical optimization
literature, we classify the natural language feedback into directional and
non-directional, where the former is a generalization of the first-order
feedback to the natural language space. We find that LLMs are especially
capable of optimization when they are provided with {directional feedback}.
Based on this insight, we design a new LLM-based optimizer that synthesizes
directional feedback from the historical optimization trace to achieve reliable
improvement over iterations. Empirically, we show our LLM-based optimizer is
more stable and efficient in solving optimization problems, from maximizing
mathematical functions to optimizing prompts for writing poems, compared with
existing techniques.",hf,1,2024-05-26
"Encoder-Decoder Framework for Interactive Free Verses with Generation
  with Controllable High-Quality Rhyming",2024-05-08 16:13:40+00:00,http://arxiv.org/abs/2405.05176,"Tommaso Pasini, Alejo López-Ávila, Husam Quteineh, Gerasimos Lampouras, Jinhua Du, Yubing Wang, Ze Li, Yusen Sun",,poetry,"Composing poetry or lyrics involves several creative factors, but a
challenging aspect of generation is the adherence to a more or less strict
metric and rhyming pattern. To address this challenge specifically, previous
work on the task has mainly focused on reverse language modeling, which brings
the critical selection of each rhyming word to the forefront of each verse. On
the other hand, reversing the word order requires that models be trained from
scratch with this task-specific goal and cannot take advantage of transfer
learning from a Pretrained Language Model (PLM). We propose a novel fine-tuning
approach that prepends the rhyming word at the start of each lyric, which
allows the critical rhyming decision to be made before the model commits to the
content of the lyric (as during reverse language modeling), but maintains
compatibility with the word order of regular PLMs as the lyric itself is still
generated in left-to-right order. We conducted extensive experiments to compare
this fine-tuning against the current state-of-the-art strategies for rhyming,
finding that our approach generates more readable text and better rhyming
capabilities. Furthermore, we furnish a high-quality dataset in English and 12
other languages, analyse the approach's feasibility in a multilingual context,
provide extensive experimental results shedding light on good and bad practices
for lyrics generation, and propose metrics to compare methods in the future.",hf,0,2024-05-08
