title,pubdate,id,authors,categories,search,abstract,source,hf_upvotes,displaydate
The Imitation Game: Detecting Human and AI-Generated Texts in the Era of ChatGPT and BARD,2023-07-22 21:00:14+00:00,http://arxiv.org/abs/2307.12166v2,"Kadhim Hayawi, Sakib Shahriar, Sujith Samuel Mathew","cs.CL, cs.AI",poetry,"The potential of artificial intelligence (AI)-based large language models (LLMs) holds considerable promise in revolutionizing education, research, and practice. However, distinguishing between human-written and AI-generated text has become a significant task. This paper presents a comparative study, introducing a novel dataset of human-written and LLM-generated texts in different genres: essays, stories, poetry, and Python code. We employ several machine learning models to classify the texts. Results demonstrate the efficacy of these models in discerning between human and AI-generated text, despite the dataset's limited sample size. However, the task becomes more challenging when classifying GPT-generated text, particularly in story writing. The results indicate that the models exhibit superior performance in binary classification tasks, such as distinguishing human-generated text from a specific LLM, compared to the more complex multiclass tasks that involve discerning among human-generated and multiple LLMs. Our findings provide insightful implications for AI text detection while our dataset paves the way for future research in this evolving area.",arxiv,0,2023-07-22
"The Imitation Game: Detecting Human and AI-Generated Texts in the Era of
  Large Language Models",2023-07-22 21:00:14+00:00,http://arxiv.org/abs/2307.12166v1,"Kadhim Hayawi, Sakib Shahriar, Sujith Samuel Mathew","cs.CL, cs.AI",poetry,"The potential of artificial intelligence (AI)-based large language models
(LLMs) holds considerable promise in revolutionizing education, research, and
practice. However, distinguishing between human-written and AI-generated text
has become a significant task. This paper presents a comparative study,
introducing a novel dataset of human-written and LLM-generated texts in
different genres: essays, stories, poetry, and Python code. We employ several
machine learning models to classify the texts. Results demonstrate the efficacy
of these models in discerning between human and AI-generated text, despite the
dataset's limited sample size. However, the task becomes more challenging when
classifying GPT-generated text, particularly in story writing. The results
indicate that the models exhibit superior performance in binary classification
tasks, such as distinguishing human-generated text from a specific LLM,
compared to the more complex multiclass tasks that involve discerning among
human-generated and multiple LLMs. Our findings provide insightful implications
for AI text detection while our dataset paves the way for future research in
this evolving area.",,0,2023-07-22
Efficient Guided Generation for Large Language Models,2023-07-19 01:14:49+00:00,http://arxiv.org/abs/2307.09702,"Brandon T. Willard, Rémi Louf",,poetry,"In this article we describe an efficient approach to guiding language model
text generation with regular expressions and context-free grammars. Our
approach adds little to no overhead to the token sequence generation process,
and makes guided generation feasible in practice. An implementation is provided
in the open source Python library Outlines.",hf,8,2023-07-19
"Ashaar: Automatic Analysis and Generation of Arabic Poetry Using Deep
  Learning Approaches",2023-07-12 15:07:16+00:00,http://arxiv.org/abs/2307.06218,"Zaid Alyafeai, Maged S. Al-Shaibani, Moataz Ahmed",,poetry,"Poetry holds immense significance within the cultural and traditional fabric
of any nation. It serves as a vehicle for poets to articulate their emotions,
preserve customs, and convey the essence of their culture. Arabic poetry is no
exception, having played a cherished role in the heritage of the Arabic
community throughout history and maintaining its relevance in the present era.
Typically, comprehending Arabic poetry necessitates the expertise of a linguist
who can analyze its content and assess its quality. This paper presents the
introduction of a framework called Ashaar
https://github.com/ARBML/Ashaar, which encompasses a collection of datasets and
pre-trained models designed specifically for the analysis and generation of
Arabic poetry. The pipeline established within our proposed approach
encompasses various aspects of poetry, such as meter, theme, and era
classification. It also incorporates automatic poetry diacritization, enabling
more intricate analyses like automated extraction of the Arudi style.
Additionally, we explore the feasibility of generating conditional poetry
through the pre-training of a character-based GPT model. Furthermore, as part
of this endeavor, we provide four datasets: one for poetry generation, another
for diacritization, and two for Arudi-style prediction. These datasets aim to
facilitate research and development in the field of Arabic poetry by enabling
researchers and enthusiasts to delve into the nuances of this rich literary
tradition.",hf,0,2023-07-12
"ALBERTI, a Multilingual Domain Specific Language Model for Poetry
  Analysis",2023-07-03 22:50:53+00:00,http://arxiv.org/abs/2307.01387,"Javier de la Rosa, Álvaro Pérez Pozo, Salvador Ros, Elena González-Blanco",,poetry,"The computational analysis of poetry is limited by the scarcity of tools to
automatically analyze and scan poems. In a multilingual settings, the problem
is exacerbated as scansion and rhyme systems only exist for individual
languages, making comparative studies very challenging and time consuming. In
this work, we present Alberti, the first multilingual pre-trained
large language model for poetry. Through domain-specific pre-training (DSP), we
further trained multilingual BERT on a corpus of over 12 million verses from 12
languages. We evaluated its performance on two structural poetry tasks: Spanish
stanza type classification, and metrical pattern prediction for Spanish,
English and German. In both cases, Alberti outperforms multilingual
BERT and other transformers-based models of similar sizes, and even achieves
state-of-the-art results for German when compared to rule-based systems,
demonstrating the feasibility and effectiveness of DSP in the poetry domain.",hf,1,2023-07-03
"Most Language Models can be Poets too: An AI Writing Assistant and
  Constrained Text Generation Studio",2023-06-28 05:10:51+00:00,http://arxiv.org/abs/2306.15926,"Allen Roush, Sanjay Basu, Akshay Moorthy, Dmitry Dubovoy",,poetry,"Despite rapid advancement in the field of Constrained Natural Language
Generation, little time has been spent on exploring the potential of language
models which have had their vocabularies lexically, semantically, and/or
phonetically constrained. We find that most language models generate compelling
text even under significant constraints. We present a simple and universally
applicable technique for modifying the output of a language model by
compositionally applying filter functions to the language models vocabulary
before a unit of text is generated. This approach is plug-and-play and requires
no modification to the model. To showcase the value of this technique, we
present an easy to use AI writing assistant called Constrained Text Generation
Studio (CTGS). CTGS allows users to generate or choose from text with any
combination of a wide variety of constraints, such as banning a particular
letter, forcing the generated words to have a certain number of syllables,
and/or forcing the words to be partial anagrams of another word. We introduce a
novel dataset of prose that omits the letter e. We show that our method results
in strictly superior performance compared to fine-tuning alone on this dataset.
We also present a Huggingface space web-app presenting this technique called
Gadsby. The code is available to the public here:
https://github.com/Hellisotherpeople/Constrained-Text-Generation-Studio",hf,1,2023-06-28
PoetryDiffusion: Towards Joint Semantic and Metrical Manipulation in Poetry Generation,2023-06-14 11:57:31+00:00,http://arxiv.org/abs/2306.08456v3,"Zhiyuan Hu, Chumin Liu, Yue Feng, Anh Tuan Luu, Bryan Hooi",cs.CL,poetry,"Controllable text generation is a challenging and meaningful field in natural language generation (NLG). Especially, poetry generation is a typical one with well-defined and strict conditions for text generation which is an ideal playground for the assessment of current methodologies. While prior works succeeded in controlling either semantic or metrical aspects of poetry generation, simultaneously addressing both remains a challenge. In this paper, we pioneer the use of the Diffusion model for generating sonnets and Chinese SongCi poetry to tackle such challenges. In terms of semantics, our PoetryDiffusion model, built upon the Diffusion model, generates entire sentences or poetry by comprehensively considering the entirety of sentence information. This approach enhances semantic expression, distinguishing it from autoregressive and large language models (LLMs). For metrical control, the separation feature of diffusion generation and its constraint control module enable us to flexibly incorporate a novel metrical controller to manipulate and evaluate metrics (format and rhythm). The denoising process in PoetryDiffusion allows for gradual enhancement of semantics and flexible integration of the metrical controller which can calculate and impose penalties on states that stray significantly from the target control distribution. Experimental results on two datasets demonstrate that our model outperforms existing models in automatic evaluation of semantic, metrical, and overall performance as well as human evaluation.",arxiv,0,2023-06-14
"PoetryDiffusion: Towards Joint Semantic and Metrical Manipulation in
  Poetry Generation",2023-06-14 11:57:31+00:00,http://arxiv.org/abs/2306.08456v1,"Zhiyuan Hu, Chumin Liu, Yue Feng, Bryan Hooi",cs.CL,poetry,"Poetry generation is a typical and popular task in natural language
generation. While prior works have shown success in controlling either semantic
or metrical aspects of poetry generation, there are still challenges in
addressing both perspectives simultaneously. In this paper, we employ the
Diffusion model to generate poetry in Sonnet and SongCi in Chinese for the
first time to tackle such challenges. Different from autoregressive generation,
our PoetryDiffusion model, based on Diffusion model, generates the complete
sentence or poetry by taking into account the whole sentence information,
resulting in improved semantic expression. Additionally, we incorporate a novel
metrical controller to manipulate and evaluate metrics (format and rhythm). The
denoising process in PoetryDiffusion allows for gradual enhancement of
semantics and flexible integration of the metrical controller. Experimental
results on two datasets demonstrate that our model outperforms existing models
in terms of semantic, metrical and overall performance.",,0,2023-06-14
"Identifying the style by a qualified reader on a short fragment of
  generated poetry",2023-06-05 10:55:15+00:00,http://arxiv.org/abs/2306.02771v1,Boris Orekhov,"cs.CL, cs.AI, cs.LG",poetry,"Style is an important concept in today's challenges in natural language
generating. After the success in the field of image style transfer, the task of
text style transfer became actual and attractive. Researchers are also
interested in the tasks of style reproducing in generation of the poetic text.
Evaluation of style reproducing in natural poetry generation remains a problem.
I used 3 character-based LSTM-models to work with style reproducing assessment.
All three models were trained on the corpus of texts by famous Russian-speaking
poets. Samples were shown to the assessors and 4 answer options were offered,
the style of which poet this sample reproduces. In addition, the assessors were
asked how well they were familiar with the work of the poet they had named.
Students studying history of literature were the assessors, 94 answers were
received. It has appeared that accuracy of definition of style increases if the
assessor can quote the poet by heart. Each model showed at least 0.7
macro-average accuracy. The experiment showed that it is better to involve a
professional rather than a naive reader in the evaluation of style in the tasks
of poetry generation, while lstm models are good at reproducing the style of
Russian poets even on a limited training corpus.",both,0,2023-06-05
Unsupervised Melody-to-Lyric Generation,2023-05-30 17:20:25+00:00,http://arxiv.org/abs/2305.19228v2,"Yufei Tian, Anjali Narayan-Chen, Shereen Oraby, Alessandra Cervone, Gunnar Sigurdsson, Chenyang Tao, Wenbo Zhao, Yiwen Chen, Tagyoung Chung, Jing Huang, Nanyun Peng","cs.CL, cs.AI, cs.SD, eess.AS",poetry,"Automatic melody-to-lyric generation is a task in which song lyrics are generated to go with a given melody. It is of significant practical interest and more challenging than unconstrained lyric generation as the music imposes additional constraints onto the lyrics. The training data is limited as most songs are copyrighted, resulting in models that underfit the complicated cross-modal relationship between melody and lyrics. In this work, we propose a method for generating high-quality lyrics without training on any aligned melody-lyric data. Specifically, we design a hierarchical lyric generation framework that first generates a song outline and second the complete lyrics. The framework enables disentanglement of training (based purely on text) from inference (melody-guided text generation) to circumvent the shortage of parallel data.
  We leverage the segmentation and rhythm alignment between melody and lyrics to compile the given melody into decoding constraints as guidance during inference. The two-step hierarchical design also enables content control via the lyric outline, a much-desired feature for democratizing collaborative song creation. Experimental results show that our model can generate high-quality lyrics that are more on-topic, singable, intelligible, and coherent than strong baselines, for example SongMASS, a SOTA model trained on a parallel dataset, with a 24% relative overall quality improvement based on human ratings.",arxiv,0,2023-05-30
Unsupervised Melody-to-Lyric Generation,2023-05-30 17:20:25+00:00,http://arxiv.org/abs/2305.19228v1,"Yufei Tian, Anjali Narayan-Chen, Shereen Oraby, Alessandra Cervone, Gunnar Sigurdsson, Chenyang Tao, Wenbo Zhao, Tagyoung Chung, Jing Huang, Nanyun Peng","cs.CL, cs.AI, cs.SD, eess.AS",poetry,"Automatic melody-to-lyric generation is a task in which song lyrics are
generated to go with a given melody. It is of significant practical interest
and more challenging than unconstrained lyric generation as the music imposes
additional constraints onto the lyrics. The training data is limited as most
songs are copyrighted, resulting in models that underfit the complicated
cross-modal relationship between melody and lyrics. In this work, we propose a
method for generating high-quality lyrics without training on any aligned
melody-lyric data. Specifically, we design a hierarchical lyric generation
framework that first generates a song outline and second the complete lyrics.
The framework enables disentanglement of training (based purely on text) from
inference (melody-guided text generation) to circumvent the shortage of
parallel data.
  We leverage the segmentation and rhythm alignment between melody and lyrics
to compile the given melody into decoding constraints as guidance during
inference. The two-step hierarchical design also enables content control via
the lyric outline, a much-desired feature for democratizing collaborative song
creation. Experimental results show that our model can generate high-quality
lyrics that are more on-topic, singable, intelligible, and coherent than strong
baselines, for example SongMASS, a SOTA model trained on a parallel dataset,
with a 24% relative overall quality improvement based on human ratings. O",,0,2023-05-30
RewriteLM: An Instruction-Tuned Large Language Model for Text Rewriting,2023-05-25 03:26:26+00:00,http://arxiv.org/abs/2305.15685,"Lei Shu, Liangchen Luo, Jayakumar Hoskere, Yun Zhu, Canoee Liu, Simon Tong, Jindong Chen, Lei Meng",,poetry,"Large Language Models (LLMs) have demonstrated impressive zero-shot
capabilities in long-form text generation tasks expressed through natural
language instructions. However, user expectations for long-form text rewriting
is high, and unintended rewrites (''hallucinations'') produced by the model can
negatively impact its overall performance. Existing evaluation benchmarks
primarily focus on limited rewriting styles and sentence-level rewriting rather
than long-form open-ended rewriting.We introduce OpenRewriteEval, a novel
benchmark that covers a wide variety of rewriting types expressed through
natural language instructions. It is specifically designed to facilitate the
evaluation of open-ended rewriting of long-form texts. In addition, we propose
a strong baseline model, RewriteLM, an instruction-tuned large language model
for long-form text rewriting. We develop new strategies that facilitate the
generation of diverse instructions and preference data with minimal human
intervention. We conduct empirical experiments and demonstrate that our model
outperforms the current state-of-the-art LLMs in text rewriting. Specifically,
it excels in preserving the essential content and meaning of the source text,
minimizing the generation of ''hallucinated'' content, while showcasing the
ability to generate rewrites with diverse wording and structures.",hf,4,2023-05-25
Creative Data Generation: A Review Focusing on Text and Poetry,2023-05-15 09:50:15+00:00,http://arxiv.org/abs/2305.08493v2,"Mohamad Elzohbi, Richard Zhao",cs.CL,poetry,"The rapid advancement in machine learning has led to a surge in automatic data generation, making it increasingly challenging to differentiate between naturally or human-generated data and machine-generated data. Despite these advancements, the generation of creative data remains a challenge. This paper aims to investigate and comprehend the essence of creativity, both in general and within the context of natural language generation. We review various approaches to creative writing devices and tasks, with a specific focus on the generation of poetry. We aim to shed light on the challenges and opportunities in the field of creative data generation.",arxiv,0,2023-05-15
Creative Data Generation: A Review Focusing on Text and Poetry,2023-05-15 09:50:15+00:00,http://arxiv.org/abs/2305.08493v1,"Mohamad Elzohbi, Richard Zhao",cs.CL,poetry,"The rapid advancement in machine learning has led to a surge in automatic
data generation, making it increasingly challenging to differentiate between
naturally or human-generated data and machine-generated data. Despite these
advancements, the generation of creative data remains a challenge. This paper
aims to investigate and comprehend the essence of creativity, both in general
and within the context of natural language generation. We review various
approaches to creative writing devices and tasks, with a specific focus on the
generation of poetry. We aim to shed light on the challenges and opportunities
in the field of creative data generation.",,0,2023-05-15
Unsupervised Melody-Guided Lyrics Generation,2023-05-12 20:57:20+00:00,http://arxiv.org/abs/2305.07760v2,"Yufei Tian, Anjali Narayan-Chen, Shereen Oraby, Alessandra Cervone, Gunnar Sigurdsson, Chenyang Tao, Wenbo Zhao, Tagyoung Chung, Jing Huang, Nanyun Peng","cs.AI, cs.CL, cs.MM",poetry,"Automatic song writing is a topic of significant practical interest. However, its research is largely hindered by the lack of training data due to copyright concerns and challenged by its creative nature. Most noticeably, prior works often fall short of modeling the cross-modal correlation between melody and lyrics due to limited parallel data, hence generating lyrics that are less singable. Existing works also lack effective mechanisms for content control, a much desired feature for democratizing song creation for people with limited music background. In this work, we propose to generate pleasantly listenable lyrics without training on melody-lyric aligned data. Instead, we design a hierarchical lyric generation framework that disentangles training (based purely on text) from inference (melody-guided text generation). At inference time, we leverage the crucial alignments between melody and lyrics and compile the given melody into constraints to guide the generation process. Evaluation results show that our model can generate high-quality lyrics that are more singable, intelligible, coherent, and in rhyme than strong baselines including those supervised on parallel data.",arxiv,0,2023-05-12
Unsupervised Melody-Guided Lyrics Generation,2023-05-12 20:57:20+00:00,http://arxiv.org/abs/2305.07760v1,"Yufei Tian, Anjali Narayan-Chen, Shereen Oraby, Alessandra Cervone, Gunnar Sigurdsson, Chenyang Tao, Wenbo Zhao, Tagyoung Chung, Jing Huang, Nanyun Peng","cs.AI, cs.CL, cs.MM",poetry,"Automatic song writing is a topic of significant practical interest. However,
its research is largely hindered by the lack of training data due to copyright
concerns and challenged by its creative nature. Most noticeably, prior works
often fall short of modeling the cross-modal correlation between melody and
lyrics due to limited parallel data, hence generating lyrics that are less
singable. Existing works also lack effective mechanisms for content control, a
much desired feature for democratizing song creation for people with limited
music background. In this work, we propose to generate pleasantly listenable
lyrics without training on melody-lyric aligned data. Instead, we design a
hierarchical lyric generation framework that disentangles training (based
purely on text) from inference (melody-guided text generation). At inference
time, we leverage the crucial alignments between melody and lyrics and compile
the given melody into constraints to guide the generation process. Evaluation
results show that our model can generate high-quality lyrics that are more
singable, intelligible, coherent, and in rhyme than strong baselines including
those supervised on parallel data.",,0,2023-05-12
Bits of Grass: Does GPT already know how to write like Whitman?,2023-05-10 09:02:34+00:00,http://arxiv.org/abs/2305.11064v1,"Piotr Sawicki, Marek Grzes, Fabricio Goes, Dan Brown, Max Peeperkorn, Aisha Khatun",cs.CL,poetry,"This study examines the ability of GPT-3.5, GPT-3.5-turbo (ChatGPT) and GPT-4
models to generate poems in the style of specific authors using zero-shot and
many-shot prompts (which use the maximum context length of 8192 tokens). We
assess the performance of models that are not fine-tuned for generating poetry
in the style of specific authors, via automated evaluation. Our findings
indicate that without fine-tuning, even when provided with the maximum number
of 17 poem examples (8192 tokens) in the prompt, these models do not generate
poetry in the desired style.",,0,2023-05-10
On the Creativity of Large Language Models,2023-03-27 18:00:01+00:00,http://arxiv.org/abs/2304.00008,"Giorgio Franceschelli, Mirco Musolesi",,poetry,"Large Language Models (LLMs) are revolutionizing several areas of Artificial
Intelligence. One of the most remarkable applications is creative writing,
e.g., poetry or storytelling: the generated outputs are often of astonishing
quality. However, a natural question arises: can LLMs be really considered
creative? In this article, we first analyze the development of LLMs under the
lens of creativity theories, investigating the key open questions and
challenges. In particular, we focus our discussion on the dimensions of value,
novelty, and surprise as proposed by Margaret Boden in her work. Then, we
consider different classic perspectives, namely product, process, press, and
person. We discuss a set of ``easy'' and ``hard'' problems in machine
creativity, presenting them in relation to LLMs. Finally, we examine the
societal impact of these technologies with a particular focus on the creative
industries, analyzing the opportunities offered, the challenges arising from
them, and the potential associated risks, from both legal and ethical points of
view.",hf,0,2023-03-27
Message Ritual: A Posthuman Account of Living with Lamp,2023-01-26 05:53:51+00:00,http://arxiv.org/abs/2301.10947v1,"Nina Rajcic, Jon McCormack","cs.HC, cs.AI, cs.NE, I.2; J.5; H.5",poetry,"As we become increasingly entangled with digital technologies, the boundary
between human and machine is progressively blurring. Adopting a performative,
posthumanist perspective resolves this ambiguity by proposing that such
boundaries are not predetermined, rather they are enacted within a certain
material configuration. Using this approach, dubbed `Entanglement HCI', this
paper presents \emph{Message Ritual} -- a novel, integrated AI system that
encourages the re-framing of memory through machine generated poetics. Embodied
within a domestic table lamp, the system listens in on conversations occurring
within the home, drawing out key topics and phrases of the day and
reconstituting them through machine generated poetry, delivered to household
members via SMS upon waking each morning. Participants across four households
were asked to live with the lamp over a two week period. We present a
diffractive analysis exploring how the lamp \emph{becomes with} participants
and discuss the implications of this method for future HCI research.",,0,2023-01-26
