title,pubdate,id,authors,categories,search,abstract,source,hf_upvotes,displaydate
"CCiV: A Benchmark for Structure, Rhythm and Quality in LLM-Generated Chinese \textit{Ci} Poetry",2026-02-15 10:19:02+00:00,http://arxiv.org/abs/2602.14081v1,"Shangqing Zhao, Yupei Ren, Yuhao Zhou, Xiaopeng Bai, Man Lan",cs.CL,poetry,"The generation of classical Chinese \textit{Ci} poetry, a form demanding a sophisticated blend of structural rigidity, rhythmic harmony, and artistic quality, poses a significant challenge for large language models (LLMs). To systematically evaluate and advance this capability, we introduce \textbf{C}hinese \textbf{Ci}pai \textbf{V}ariants (\textbf{CCiV}), a benchmark designed to assess LLM-generated \textit{Ci} poetry across these three dimensions: structure, rhythm, and quality. Our evaluation of 17 LLMs on 30 \textit{Cipai} reveals two critical phenomena: models frequently generate valid but unexpected historical variants of a poetic form, and adherence to tonal patterns is substantially harder than structural rules. We further show that form-aware prompting can improve structural and tonal control for stronger models, while potentially degrading weaker ones. Finally, we observe weak and inconsistent alignment between formal correctness and literary quality in our sample. CCiV highlights the need for variant-aware evaluation and more holistic constrained creative generation methods.",,0,2026-02-15
LLMs Got Rhythm? Hybrid Phonological Filtering for Greek Poetry Rhyme Detection and Generation,2026-01-14 17:05:17+00:00,http://arxiv.org/abs/2601.09631v4,"Stergios Chatzikyriakidis, Anastasia Natsina",cs.CL,poetry,"Large Language Models (LLMs), despite their remarkable capabilities across NLP tasks, struggle with phonologically-grounded phenomena like rhyme detection and generation. This is even more evident in lower-resource languages such as Modern Greek. In this paper, we present a hybrid system that combines LLMs with deterministic phonological algorithms to achieve accurate rhyme identification/analysis and generation. Our approach implements a comprehensive taxonomy of Greek rhyme types, including Pure, Rich, Imperfect, Mosaic, and Identical Pre-rhyme Vowel (IDV) patterns, and employs an agentic generation pipeline with phonological verification. We evaluate multiple prompting strategies (zero-shot, few-shot, Chain-of-Thought, and RAG-augmented) across several LLMs including Claude 3.7 and 4.5, GPT-4o, Gemini 2.0 and open-weight models like Llama 3.1 8B and 70B and Mistral Large. Results reveal a significant ""Reasoning Gap"": while native-like models (Claude 3.7) perform intuitively (40\% accuracy in identification), reasoning-heavy models (Claude 4.5) achieve state-of-the-art performance (54\%) only when prompted with Chain-of-Thought. Most critically, pure LLM generation fails catastrophically (under 4\% valid poems), while our hybrid verification loop restores performance to 73.1\%. We release our system and a corpus of 40,000+ rhymes, derived from the Anemoskala and Interwar Poetry corpora, to support future research.",arxiv,0,2026-01-14
LLMs Got Rhythm? Hybrid Phonological Filtering for Greek Poetry Rhyme Detection and Generation,2026-01-14 17:05:17+00:00,http://arxiv.org/abs/2601.09631v1,Stergios Chatzikyriakidis,cs.CL,poetry,"Large Language Models (LLMs), despite their remarkable capabilities across NLP tasks, struggle with phonologically-grounded phenomena like rhyme detection and generation. This is even more evident in lower-resource languages such as Modern Greek. In this paper, we present a hybrid system that combines LLMs with deterministic phonological algorithms to achieve accurate rhyme identification/analysis and generation. Our approach implements a comprehensive taxonomy of Greek rhyme types, including Pure, Rich, Imperfect, Mosaic, and Identical Pre-rhyme Vowel (IDV) patterns, and employs an agentic generation pipeline with phonological verification. We evaluate multiple prompting strategies (zero-shot, few-shot, Chain-of-Thought, and RAG-augmented) across several LLMs including Claude 3.7 and 4.5, GPT-4o, Gemini 2.0 and open-weight models like Llama 3.1 8B and 70B and Mistral Large. Results reveal a significant ""Reasoning Gap"": while native-like models (Claude 3.7) perform intuitively (40\% accuracy in identification), reasoning-heavy models (Claude 4.5) achieve state-of-the-art performance (54\%) only when prompted with Chain-of-Thought. Most critically, pure LLM generation fails catastrophically (under 4\% valid poems), while our hybrid verification loop restores performance to 73.1\%. We release our system and a crucial, rigorously cleaned corpus of 40,000+ rhymes, derived from the Anemoskala and Interwar Poetry corpora, to support future research.",,0,2026-01-14
SDUs DAISY: A Benchmark for Danish Culture,2026-01-11 22:17:34+00:00,http://arxiv.org/abs/2601.19930v1,"Jacob Nielsen, Stine L. Beltoft, Peter Schneider-Kamp, Lukas Galke Poech","cs.CL, cs.AI",poetry,"We introduce a new benchmark for Danish culture via cultural heritage, Daisy, based on the curated topics from the Danish Culture Canon 2006. For each artifact in the culture canon, we query the corresponding Wikipedia page and have a language model generate random questions. This yields a sampling strategy within each work, with a mix of central of peripheral questions for each work, not only knowledge of mainstream information, but also in-depth cornerstones defining the heritage of Danish Culture, defined by the Canon committee. Each question-answer pair is humanly approved or corrected in the final dataset consisting of 741 close-ended question answer pairs covering topics, from 1300 BC. archaeological findings, 1700 century poems and musicals pieces to contemporary pop music and Danish design and architecture.",arxiv,0,2026-01-11
Decoding the Black Box: Discerning AI Rhetorics About and Through Poetic Prompting,2025-12-04 20:41:39+00:00,http://arxiv.org/abs/2512.05243v1,"P. D. Edgar, Alia Hall","cs.CL, cs.CY",poetry,"Prompt engineering has emerged as a useful way studying the algorithmic tendencies and biases of large language models. Meanwhile creatives and academics have leveraged LLMs to develop creative works and explore the boundaries of their writing capabilities through text generation and code. This study suggests that creative text prompting, specifically Poetry Prompt Patterns, may be a useful addition to the toolbox of the prompt engineer, and outlines the process by which this approach may be taken. Then, the paper uses poetic prompts to assess descriptions and evaluations of three models of a renowned poet and test the consequences of the willingness of models to adapt or rewrite original creative works for presumed audiences.",,0,2025-12-04
"The author is dead, but what if they never lived? A reception experiment on Czech AI- and human-authored poetry",2025-11-26 17:53:59+00:00,http://arxiv.org/abs/2511.21629v1,"Anna Marklová, Ondřej Vinš, Martina Vokáčová, Jiří Milička",cs.CL,poetry,"Large language models are increasingly capable of producing creative texts, yet most studies on AI-generated poetry focus on English -- a language that dominates training data. In this paper, we examine the perception of AI- and human-written Czech poetry. We ask if Czech native speakers are able to identify it and how they aesthetically judge it. Participants performed at chance level when guessing authorship (45.8\% correct on average), indicating that Czech AI-generated poems were largely indistinguishable from human-written ones. Aesthetic evaluations revealed a strong authorship bias: when participants believed a poem was AI-generated, they rated it as less favorably, even though AI poems were in fact rated equally or more favorably than human ones on average. The logistic regression model uncovered that the more the people liked a poem, the less probable was that they accurately assign the authorship. Familiarity with poetry or literary background had no effect on recognition accuracy. Our findings show that AI can convincingly produce poetry even in a morphologically complex, low-resource (with respect of the training data of AI models) Slavic language such as Czech. The results suggest that readers' beliefs about authorship and the aesthetic evaluation of the poem are interconnected.",,0,2025-11-26
NAMeGEn: Creative Name Generation via A Novel Agent-based Multiple Personalized Goal Enhancement Framework,2025-11-19 13:05:25+00:00,http://arxiv.org/abs/2511.15408v1,"Shanlin Zhou, Xinpeng Wang, Jianxun Lian, Zhenghao Liu, Laks V. S. Lakshmanan, Xiaoyuan Yi, Yongtao Hao","cs.CL, cs.AI, cs.IR, cs.MA, cs.NE",poetry,"Trained on diverse human-authored texts, Large Language Models (LLMs) unlocked the potential for Creative Natural Language Generation (CNLG), benefiting various applications like advertising and storytelling. Nevertheless, CNLG still remains difficult due to two main challenges. (1) Multi-objective flexibility: user requirements are often personalized, fine-grained, and pluralistic, which LLMs struggle to satisfy simultaneously; (2) Interpretive complexity: beyond generation, creativity also involves understanding and interpreting implicit meaning to enhance users' perception. These challenges significantly limit current methods, especially in short-form text generation, in generating creative and insightful content. To address this, we focus on Chinese baby naming, a representative short-form CNLG task requiring adherence to explicit user constraints (e.g., length, semantics, anthroponymy) while offering meaningful aesthetic explanations. We propose NAMeGEn, a novel multi-agent optimization framework that iteratively alternates between objective extraction, name generation, and evaluation to meet diverse requirements and generate accurate explanations. To support this task, we further construct a classical Chinese poetry corpus with 17k+ poems to enhance aesthetics, and introduce CBNames, a new benchmark with tailored metrics. Extensive experiments demonstrate that NAMeGEn effectively generates creative names that meet diverse, personalized requirements while providing meaningful explanations, outperforming six baseline methods spanning various LLM backbones without any training.",,0,2025-11-19
Beyond Direct Generation: A Decomposed Approach to Well-Crafted Screenwriting with LLMs,2025-10-27 09:41:29+00:00,http://arxiv.org/abs/2510.23163,"Hang Lei, Shengyi Zong, Zhaoyan Li, Ziren Zhou, Hao Liu",,poetry,"The screenplay serves as the foundation for television production, defining narrative structure, character development, and dialogue. While Large Language Models (LLMs) show great potential in creative writing, direct end-to-end generation approaches often fail to produce well-crafted screenplays. We argue this failure stems from forcing a single model to simultaneously master two disparate capabilities: creative narrative construction and rigid format adherence. The resulting outputs may mimic superficial style but lack the deep structural integrity and storytelling substance required for professional use. To enable LLMs to generate high-quality screenplays, we introduce Dual-Stage Refinement (DSR), a decomposed framework that decouples creative narrative generation from format conversion. The first stage transforms a brief outline into rich, novel-style prose. The second stage refines this narrative into a professionally formatted screenplay. This separation enables the model to specialize in one distinct capability at each stage. A key challenge in implementing DSR is the scarcity of paired outline-to-novel training data. We address this through hybrid data synthesis: reverse synthesis deconstructs existing screenplays into structured inputs, while forward synthesis leverages these inputs to generate high-quality narrative texts as training targets. Blind evaluations by professional screenwriters show that DSR achieves a 75% win rate against strong baselines like Gemini-2.5-Pro and reaches 82.7% of human-level performance. Our work demonstrates that decomposed generation architecture with tailored data synthesis effectively specializes LLMs in complex creative domains.",hf,0,2025-10-27
so much depends / upon / a whitespace: Why Whitespace Matters for Poets and LLMs,2025-10-19 04:52:21+00:00,http://arxiv.org/abs/2510.16713v1,"Sriharsh Bhyravajjula, Melanie Walsh, Anna Preus, Maria Antoniak",cs.CL,poetry,"Whitespace is a critical component of poetic form, reflecting both adherence to standardized forms and rebellion against those forms. Each poem's whitespace distribution reflects the artistic choices of the poet and is an integral semantic and spatial feature of the poem. Yet, despite the popularity of poetry as both a long-standing art form and as a generation task for large language models (LLMs), whitespace has not received sufficient attention from the NLP community. Using a corpus of 19k English-language published poems from Poetry Foundation, we investigate how 4k poets have used whitespace in their works. We release a subset of 2.8k public-domain poems with preserved formatting to facilitate further research in this area. We compare whitespace usage in the published poems to (1) 51k LLM-generated poems, and (2) 12k unpublished poems posted in an online community. We also explore whitespace usage across time periods, poetic forms, and data sources. Additionally, we find that different text processing methods can result in significantly different representations of whitespace in poetry data, motivating us to use these poems and whitespace patterns to discuss implications for the processing strategies used to assemble pretraining datasets for LLMs.",,0,2025-10-19
"COIG-Writer: A High-Quality Dataset for Chinese Creative Writing with
  Thought Processes",2025-10-16 15:01:19+00:00,http://arxiv.org/abs/2510.14763,"Yunwen Li, Shuangshuang Ying, Xingwei Qu, Xin Li, Sheng Jin, Minghao Liu, Zhoufutu Wen, Tianyu Zheng, Xeron Du, Qiguang Chen, Jiajun Shi, Wangchunshu Zhou, Jiazhan Feng, Wanjun Zhong, Libo Qin, Stephen Huang, Wanxiang Che, Chenghua Lin, Eli Zhang",,poetry,"Large language models exhibit systematic deficiencies in creative writing,
particularly in non-English contexts where training data is scarce and lacks
process-level supervision. We present COIG-Writer, a novel Chinese creative
writing dataset that captures both diverse outputs and their underlying thought
processes through systematic reverse-engineering of high-quality texts. Unlike
existing datasets that provide only input-output pairs, COIG-Writer comprises
1,665 meticulously curated triplets spanning 51 genres, each containing: (1) a
reverse-engineered prompt, (2) detailed creative reasoning documenting
decision-making processes, and (3) the final text. Through comprehensive
experiments, we identify a two-component model of creative writing: narrative
logic (provided by process supervision) and linguistic expression (maintained
by general-purpose data). Our findings reveal three critical insights: (1)
Process supervision is highly effective but requires stabilization with general
data. A ratio of at least one creative sample to twelve general samples is
needed to achieve optimal performance; below this threshold, the win rate
progressively degrades (from 62.75% down to 35.78%)., (2) creative capabilities
are culturally-bound with no cross-lingual transfer (89.26pp gap between
Chinese and English performance), and (3) lexical diversity inversely
correlates with creative quality (TTR paradox), suggesting high diversity
signals compensatory behavior for logical deficiencies. These findings
establish that creative excellence emerges from the interaction between logical
scaffolding and linguistic grounding, analogous to how mathematical reasoning
enhances but cannot replace linguistic competence in foundation models.",hf,14,2025-10-16
DiTSinger: Scaling Singing Voice Synthesis with Diffusion Transformer and Implicit Alignment,2025-10-10 05:39:45+00:00,http://arxiv.org/abs/2510.09016v2,"Zongcai Du, Guilin Deng, Xiaofeng Guo, Xin Gao, Linke Li, Kaichang Cheng, Fubo Han, Siyu Yang, Peng Liu, Pan Zhong, Qiang Fu","cs.SD, cs.AI, eess.AS",poetry,"Recent progress in diffusion-based Singing Voice Synthesis (SVS) demonstrates strong expressiveness but remains limited by data scarcity and model scalability. We introduce a two-stage pipeline: a compact seed set of human-sung recordings is constructed by pairing fixed melodies with diverse LLM-generated lyrics, and melody-specific models are trained to synthesize over 500 hours of high-quality Chinese singing data. Building on this corpus, we propose DiTSinger, a Diffusion Transformer with RoPE and qk-norm, systematically scaled in depth, width, and resolution for enhanced fidelity. Furthermore, we design an implicit alignment mechanism that obviates phoneme-level duration labels by constraining phoneme-to-acoustic attention within character-level spans, thereby improving robustness under noisy or uncertain alignments. Extensive experiments validate that our approach enables scalable, alignment-free, and high-fidelity SVS.",arxiv,0,2025-10-10
Evaluating the Creativity of LLMs in Persian Literary Text Generation,2025-09-22 20:32:56+00:00,http://arxiv.org/abs/2509.18401v1,"Armin Tourajmehr, Mohammad Reza Modarres, Yadollah Yaghoobzadeh",cs.CL,poetry,"Large language models (LLMs) have demonstrated notable creative abilities in
generating literary texts, including poetry and short stories. However, prior
research has primarily centered on English, with limited exploration of
non-English literary traditions and without standardized methods for assessing
creativity. In this paper, we evaluate the capacity of LLMs to generate Persian
literary text enriched with culturally relevant expressions. We build a dataset
of user-generated Persian literary spanning 20 diverse topics and assess model
outputs along four creativity dimensions-originality, fluency, flexibility, and
elaboration-by adapting the Torrance Tests of Creative Thinking. To reduce
evaluation costs, we adopt an LLM as a judge for automated scoring and validate
its reliability against human judgments using intraclass correlation
coefficients, observing strong agreement. In addition, we analyze the models'
ability to understand and employ four core literary devices: simile, metaphor,
hyperbole, and antithesis. Our results highlight both the strengths and
limitations of LLMs in Persian literary text generation, underscoring the need
for further refinement.",both,0,2025-09-22
KPoEM: A Human-Annotated Dataset for Emotion Classification and RAG-Based Poetry Generation in Korean Modern Poetry,2025-09-04 06:45:39+00:00,http://arxiv.org/abs/2509.03932v2,"Iro Lim, Haein Ji, Byungjun Kim","cs.CL, cs.CY, cs.LG",poetry,"This study introduces KPoEM (Korean Poetry Emotion Mapping), a novel dataset that serves as a foundation for both emotion-centered analysis and generative applications in modern Korean poetry. Despite advancements in NLP, poetry remains underexplored due to its complex figurative language and cultural specificity. We constructed a multi-label dataset of 7,662 entries (7,007 line-level and 615 work-level), annotated with 44 fine-grained emotion categories from five influential Korean poets. The KPoEM emotion classification model, fine-tuned through a sequential strategy -- moving from general-purpose corpora to the specialized KPoEM dataset -- achieved an F1-micro score of 0.60, significantly outperforming previous models (0.43). The model demonstrates an enhanced ability to identify temporally and culturally specific emotional expressions while preserving core poetic sentiments. Furthermore, applying the structured emotion dataset to a RAG-based poetry generation model demonstrates the empirical feasibility of generating texts that reflect the emotional and cultural sensibilities of Korean literature. This integrated approach strengthens the connection between computational techniques and literary analysis, opening new pathways for quantitative emotion research and generative poetics. Overall, this study provides a foundation for advancing emotion-centered analysis and creation in modern Korean poetry.",arxiv,0,2025-09-04
Benchmarking the Detection of LLMs-Generated Modern Chinese Poetry,2025-09-01 17:01:45+00:00,http://arxiv.org/abs/2509.01620v1,"Shanshan Wang, Junchao Wu, Fengying Ye, Jingming Yao, Lidia S. Chao, Derek F. Wong","cs.CL, cs.AI",poetry,"The rapid development of advanced large language models (LLMs) has made
AI-generated text indistinguishable from human-written text. Previous work on
detecting AI-generated text has made effective progress, but has not involved
modern Chinese poetry. Due to the distinctive characteristics of modern Chinese
poetry, it is difficult to identify whether a poem originated from humans or
AI. The proliferation of AI-generated modern Chinese poetry has significantly
disrupted the poetry ecosystem. Based on the urgency of identifying
AI-generated poetry in the real Chinese world, this paper proposes a novel
benchmark for detecting LLMs-generated modern Chinese poetry. We first
construct a high-quality dataset, which includes both 800 poems written by six
professional poets and 41,600 poems generated by four mainstream LLMs.
Subsequently, we conduct systematic performance assessments of six detectors on
this dataset. Experimental results demonstrate that current detectors cannot be
used as reliable tools to detect modern Chinese poems generated by LLMs. The
most difficult poetic features to detect are intrinsic qualities, especially
style. The detection results verify the effectiveness and necessity of our
proposed benchmark. Our work lays a foundation for future detection of
AI-generated poetry.",,0,2025-09-01
"Quantum-Enhanced Natural Language Generation: A Multi-Model Framework
  with Hybrid Quantum-Classical Architectures",2025-08-29 05:20:18+00:00,http://arxiv.org/abs/2508.21332v1,"Chi-Sheng Chen, En-Jui Kuo","quant-ph, cs.CL, cs.LG",poetry,"This paper presents a comprehensive evaluation of quantum text generation
models against traditional Transformer/MLP architectures, addressing the
growing interest in quantum computing applications for natural language
processing. We conduct systematic experiments comparing five distinct models:
Transformer (baseline), Quantum Kernel Self-Attention Network (QKSAN), Quantum
RWKV (QRWKV), and Quantum Attention Sequence Architecture (QASA) across five
diverse datasets including simple sentences, short stories, quantum phrases,
haiku poetry, and proverbs. Our evaluation employs multiple metrics including
perplexity, BLEU scores, vocabulary diversity, repetition rates, and fluency
measures to assess different aspects of text generation quality. The
experimental results reveal that while traditional Transformer models maintain
overall superiority with the lowest average perplexity (1.21) and highest
BLEU-1 score (0.2895), quantum-inspired models demonstrate competitive
performance in specific scenarios. Notably, QKSAN achieves a competitive BLEU-1
score of 0.2800 while maintaining zero repetition rates, and QRWKV demonstrates
perfect vocabulary diversity (Distinct-1 = 1.000) in certain tasks.",,0,2025-08-29
"Attribution, Citation, and Quotation: A Survey of Evidence-based Text
  Generation with Large Language Models",2025-08-21 09:36:35+00:00,http://arxiv.org/abs/2508.15396,"Tobias Schreieder, Tim Schopf, Michael Färber",,poetry,"The increasing adoption of large language models (LLMs) has been accompanied
by growing concerns regarding their reliability and trustworthiness. As a
result, a growing body of research focuses on evidence-based text generation
with LLMs, aiming to link model outputs to supporting evidence to ensure
traceability and verifiability. However, the field is fragmented due to
inconsistent terminology, isolated evaluation practices, and a lack of unified
benchmarks. To bridge this gap, we systematically analyze 134 papers, introduce
a unified taxonomy of evidence-based text generation with LLMs, and investigate
300 evaluation metrics across seven key dimensions. Thereby, we focus on
approaches that use citations, attribution, or quotations for evidence-based
text generation. Building on this, we examine the distinctive characteristics
and representative methods in the field. Finally, we highlight open challenges
and outline promising directions for future work.",hf,0,2025-08-21
