title,pubdate,id,authors,categories,search,abstract,source,hf_upvotes,displaydate
Modern French Poetry Generation with RoBERTa and GPT-2,2022-12-06 12:10:14+00:00,http://arxiv.org/abs/2212.02911v1,"Mika Hämäläinen, Khalid Alnajjar, Thierry Poibeau",cs.CL,poetry,"We present a novel neural model for modern poetry generation in French. The
model consists of two pretrained neural models that are fine-tuned for the poem
generation task. The encoder of the model is a RoBERTa based one while the
decoder is based on GPT-2. This way the model can benefit from the superior
natural language understanding performance of RoBERTa and the good natural
language generation performance of GPT-2. Our evaluation shows that the model
can create French poetry successfully. On a 5 point scale, the lowest score of
3.57 was given by human judges to typicality and emotionality of the output
poetry while the best score of 3.79 was given to understandability.",,0,2022-12-06
"GENIUS: Sketch-based Language Model Pre-training via Extreme and
  Selective Masking for Text Generation and Augmentation",2022-11-18 16:39:45+00:00,http://arxiv.org/abs/2211.10330,"Biyang Guo, Yeyun Gong, Yelong Shen, Songqiao Han, Hailiang Huang, Nan Duan, Weizhu Chen",,poetry,"We introduce GENIUS: a conditional text generation model using sketches as
input, which can fill in the missing contexts for a given sketch (key
information consisting of textual spans, phrases, or words, concatenated by
mask tokens). GENIUS is pre-trained on a large-scale textual corpus with a
novel reconstruction from sketch objective using an extreme and selective
masking strategy, enabling it to generate diverse and high-quality texts given
sketches. Comparison with other competitive conditional language models (CLMs)
reveals the superiority of GENIUS's text generation quality. We further show
that GENIUS can be used as a strong and ready-to-use data augmentation tool for
various natural language processing (NLP) tasks. Most existing textual data
augmentation methods are either too conservative, by making small changes to
the original text, or too aggressive, by creating entirely new samples. With
GENIUS, we propose GeniusAug, which first extracts the target-aware sketches
from the original training set and then generates new samples based on the
sketches. Empirical experiments on 6 text classification datasets show that
GeniusAug significantly improves the models' performance in both
in-distribution (ID) and out-of-distribution (OOD) settings. We also
demonstrate the effectiveness of GeniusAug on named entity recognition (NER)
and machine reading comprehension (MRC) tasks. (Code and models are publicly
available at https://github.com/microsoft/SCGLab and
https://github.com/beyondguo/genius)",hf,0,2022-11-18
Creative Writing with an AI-Powered Writing Assistant: Perspectives from Professional Writers,2022-11-09 17:00:56+00:00,http://arxiv.org/abs/2211.05030,"Daphne Ippolito, Ann Yuan, Andy Coenen, Sehmon Burnam",,poetry,"Recent developments in natural language generation (NLG) using neural language models have brought us closer than ever to the goal of building AI-powered creative writing tools. However, most prior work on human-AI collaboration in the creative writing domain has evaluated new systems with amateur writers, typically in contrived user studies of limited scope. In this work, we commissioned 13 professional, published writers from a diverse set of creative writing backgrounds to craft stories using Wordcraft, a text editor with built-in AI-powered writing assistance tools. Using interviews and participant journals, we discuss the potential of NLG to have significant impact in the creative writing domain--especially with respect to brainstorming, generation of story details, world-building, and research assistance. Experienced writers, more so than amateurs, typically have well-developed systems and methodologies for writing, as well as distinctive voices and target audiences. Our work highlights the challenges in building for these writers; NLG technologies struggle to preserve style and authorial voice, and they lack deep understanding of story contents. In order for AI-powered writing assistants to realize their full potential, it is essential that they take into account the diverse goals and expertise of human writers.",hf,0,2022-11-09
Generation of Chinese classical poetry based on pre-trained model,2022-11-04 16:05:31+00:00,http://arxiv.org/abs/2211.02541v1,"Ziyao Wang, Lujin Guan, Guanyu Liu","cs.CL, cs.AI, J.5; I.2.7",poetry,"In order to test whether artificial intelligence can create qualified
classical poetry like humans, the author proposes a study of Chinese classical
poetry generation based on a pre-trained model. This paper mainly tries to use
BART and other pre training models, proposes FS2TEXT and RR2TEXT to generate
metrical poetry text and even specific style poetry text, and solves the
problem that the user's writing intention gradually reduces the relevance of
the generated poetry text.
  In order to test the model's results, the authors selected ancient poets, by
combining it with BART's poetic model work, developed a set of AI poetry Turing
problems, it was reviewed by a group of poets and poetry writing researchers.
There were more than 600 participants, and the final results showed that,
high-level poetry lovers can't distinguish between AI activity and human
activity, this indicates that the author's working methods are not
significantly different from human activities. The model of poetry generation
studied by the author generalizes works that cannot be distinguished from those
of advanced scholars.
  The number of modern Chinese poets has reached 5 million. However, many
modern Chinese poets lack language ability and skills as a result of their
childhood learning. However, many modern poets have no creative inspiration,
and the author's model can help them. They can look at this model when they
choose words and phrases and they can write works based on the poems they
already have, and they can write their own poems. The importance of poetry lies
in the author's thoughts and reflections. It doesn't matter how good AI poetry
is. The only thing that matters is for people to see and inspire them.",,0,2022-11-04
"Help me write a poem: Instruction Tuning as a Vehicle for Collaborative
  Poetry Writing",2022-10-25 00:07:10+00:00,http://arxiv.org/abs/2210.13669,"Tuhin Chakrabarty, Vishakh Padmakumar, He He",,poetry,"Recent work in training large language models (LLMs) to follow natural
language instructions has opened up exciting opportunities for natural language
interface design. Building on the prior success of LLMs in the realm of
computer-assisted creativity, we aim to study if LLMs can improve the quality
of user-generated content through collaboration. We present CoPoet, a
collaborative poetry writing system. In contrast to auto-completing a user's
text, CoPoet is controlled by user instructions that specify the attributes of
the desired text, such as Write a sentence about `love' or Write a sentence
ending in `fly'. The core component of our system is a language model
fine-tuned on a diverse collection of instructions for poetry writing. Our
model is not only competitive with publicly available LLMs trained on
instructions (InstructGPT), but is also capable of satisfying unseen
compositional instructions. A study with 15 qualified crowdworkers shows that
users successfully write poems with CoPoet on diverse topics ranging from
Monarchy to Climate change. Further, the collaboratively written poems are
preferred by third-party evaluators over those written without the system.",hf,0,2022-10-25
Controllable Text Generation for Open-Domain Creativity and Fairness,2022-09-24 22:40:01+00:00,http://arxiv.org/abs/2209.12099v1,Nanyun Peng,"cs.CL, cs.AI",poetry,"Recent advances in large pre-trained language models have demonstrated strong
results in generating natural languages and significantly improved performances
for many natural language generation (NLG) applications such as machine
translation and text summarization. However, when the generation tasks are more
open-ended and the content is under-specified, existing techniques struggle to
generate long-term coherent and creative content. Moreover, the models exhibit
and even amplify social biases that are learned from the training corpora. This
happens because the generation models are trained to capture the surface
patterns (i.e. sequences of words), instead of capturing underlying semantics
and discourse structures, as well as background knowledge including social
norms. In this paper, I introduce our recent works on controllable text
generation to enhance the creativity and fairness of language generation
models. We explore hierarchical generation and constrained decoding, with
applications to creative language generation including story, poetry, and
figurative languages, and bias mitigation for generation models.",,0,2022-09-24
Multi-Figurative Language Generation,2022-09-05 08:48:09+00:00,http://arxiv.org/abs/2209.01835,"Huiyuan Lai, Malvina Nissim",,poetry,"Figurative language generation is the task of reformulating a given text in
the desired figure of speech while still being faithful to the original
context. We take the first step towards multi-figurative language modelling by
providing a benchmark for the automatic generation of five common figurative
forms in English. We train mFLAG employing a scheme for multi-figurative
language pre-training on top of BART, and a mechanism for injecting the target
figurative information into the encoder; this enables the generation of text
with the target figurative form from another figurative form without parallel
figurative-figurative sentence pairs. Our approach outperforms all strong
baselines. We also offer some qualitative analysis and reflections on the
relationship between the different figures of speech.",hf,0,2022-09-05
Multi-Modal Experience Inspired AI Creation,2022-09-02 11:50:41+00:00,http://arxiv.org/abs/2209.02427v2,"Qian Cao, Xu Chen, Ruihua Song, Hao Jiang, Guang Yang, Zhao Cao",cs.AI,poetry,"AI creation, such as poem or lyrics generation, has attracted increasing attention from both industry and academic communities, with many promising models proposed in the past few years. Existing methods usually estimate the outputs based on single and independent visual or textual information. However, in reality, humans usually make creations according to their experiences, which may involve different modalities and be sequentially correlated. To model such human capabilities, in this paper, we define and solve a novel AI creation problem based on human experiences. More specifically, we study how to generate texts based on sequential multi-modal information. Compared with the previous works, this task is much more difficult because the designed model has to well understand and adapt the semantics among different modalities and effectively convert them into the output in a sequential manner. To alleviate these difficulties, we firstly design a multi-channel sequence-to-sequence architecture equipped with a multi-modal attention network. For more effective optimization, we then propose a curriculum negative sampling strategy tailored for the sequential inputs. To benchmark this problem and demonstrate the effectiveness of our model, we manually labeled a new multi-modal experience dataset. With this dataset, we conduct extensive experiments by comparing our model with a series of representative baselines, where we can demonstrate significant improvements in our model based on both automatic and human-centered metrics. The code and data are available at: \url{https://github.com/Aman-4-Real/MMTG}.",both,1,2022-09-02
Multi-Modal Experience Inspired AI Creation,2022-09-02 11:50:41+00:00,http://arxiv.org/abs/2209.02427v1,"Qian Cao, Xu Chen, Ruihua Song, Hao Jiang, Guang Yang, Zhao Cao",cs.AI,poetry,"AI creation, such as poem or lyrics generation, has attracted increasing
attention from both industry and academic communities, with many promising
models proposed in the past few years. Existing methods usually estimate the
outputs based on single and independent visual or textual information. However,
in reality, humans usually make creations according to their experiences, which
may involve different modalities and be sequentially correlated. To model such
human capabilities, in this paper, we define and solve a novel AI creation
problem based on human experiences. More specifically, we study how to generate
texts based on sequential multi-modal information. Compared with the previous
works, this task is much more difficult because the designed model has to well
understand and adapt the semantics among different modalities and effectively
convert them into the output in a sequential manner. To alleviate these
difficulties, we firstly design a multi-channel sequence-to-sequence
architecture equipped with a multi-modal attention network. For more effective
optimization, we then propose a curriculum negative sampling strategy tailored
for the sequential inputs. To benchmark this problem and demonstrate the
effectiveness of our model, we manually labeled a new multi-modal experience
dataset. With this dataset, we conduct extensive experiments by comparing our
model with a series of representative baselines, where we can demonstrate
significant improvements in our model based on both automatic and
human-centered metrics. The code and data are available at:
\url{https://github.com/Aman-4-Real/MMTG}.",,0,2022-09-02
"Understanding EFL Student Idea Generation Strategies for Creative
  Writing with NLG Tools",2022-06-04 09:11:38+00:00,http://arxiv.org/abs/2207.01484,"David James Woo, Yanzhi Wang, Hengky Susanto, Kai Guo",,poetry,"Natural language generation (NLG) is a process within artificial intelligence
where computer systems produce human-comprehensible language texts from
information. English as a foreign language (EFL) students' use of NLG tools
might facilitate their idea generation, which is fundamental to creative
writing. However, little is known about how EFL students interact with NLG
tools to generate ideas. This study explores strategies adopted by EFL students
when searching for ideas using NLG tools, evaluating ideas generated by NLG
tools and selecting NLG tools for ideas generation. Four Hong Kong secondary
school students attended workshops where they learned to write stories
comprising their own words and words generated by NLG tools. After the
workshops, they answered questions to reflect on their writing experience with
NLG tools. In a thematic analysis of the written reflections, we found students
may have existing ideas when searching for ideas and evaluating ideas with NLG
tools. Students showed some aversion to ideas generated by NLG tools and
selected NLG tools that generated a greater quantity of ideas. The findings
inform our understanding of EFL students' concerns when using NLG tools for
idea generation and can inform educators' instruction to implement NLG tools
for classroom creative writing.",hf,0,2022-06-04
Romantic-Computing,2022-06-01 14:27:17+00:00,http://arxiv.org/abs/2206.11864,Elizabeth Horishny,,poetry,"In this paper we compare various text generation models' ability to write
poetry in the style of early English Romanticism. These models include:
Character-Level Recurrent Neural Networks with Long Short-Term Memory, Hugging
Face's GPT-2, OpenAI's GPT-3, and EleutherAI's GPT-NEO. Quality was measured
based syllable count and coherence with the automatic evaluation metric GRUEN.
Character-Level Recurrent Neural Networks performed far worse compared to
transformer models. And, as parameter-size increased, the quality of
transformer models' poems improved. These models are typically not compared in
a creative context, and we are happy to contribute.",hf,0,2022-06-01
Romantic-Computing,2022-06-01 14:27:17+00:00,http://arxiv.org/abs/2206.11864v1,Elizabeth Horishny,"cs.CL, cs.AI",poetry,"In this paper we compare various text generation models' ability to write
poetry in the style of early English Romanticism. These models include:
Character-Level Recurrent Neural Networks with Long Short-Term Memory, Hugging
Face's GPT-2, OpenAI's GPT-3, and EleutherAI's GPT-NEO. Quality was measured
based syllable count and coherence with the automatic evaluation metric GRUEN.
Character-Level Recurrent Neural Networks performed far worse compared to
transformer models. And, as parameter-size increased, the quality of
transformer models' poems improved. These models are typically not compared in
a creative context, and we are happy to contribute.",,0,2022-06-01
GPoeT-2: A GPT-2 Based Poem Generator,2022-05-18 10:25:12+00:00,http://arxiv.org/abs/2205.08847v1,"Kai-Ling Lo, Rami Ariss, Philipp Kurz","cs.CL, cs.AI",poetry,"This project aims to produce the next volume of machine-generated poetry, a
complex art form that can be structured and unstructured, and carries depth in
the meaning between the lines. GPoeT-2 is based on fine-tuning a state of the
art natural language model (i.e. GPT-2) to generate limericks, typically
humorous structured poems consisting of five lines with a AABBA rhyming scheme.
With a two-stage generation system utilizing both forward and reverse language
modeling, GPoeT-2 is capable of freely generating limericks in diverse topics
while following the rhyming structure without any seed phrase or a posteriori
constraints.Based on the automated generation process, we explore a wide
variety of evaluation metrics to quantify ""good poetry,"" including syntactical
correctness, lexical diversity, and subject continuity. Finally, we present a
collection of 94 categorized limericks that rank highly on the explored ""good
poetry"" metrics to provoke human creativity.",,0,2022-05-18
Uniform Complexity for Text Generation,2022-04-11 15:19:47+00:00,http://arxiv.org/abs/2204.05185,"Joseph Marvin Imperial, Harish Tayyar Madabushi",,poetry,"Large language models (LLMs) have shown promising results in a wide array of
generative NLP tasks, such as summarization and machine translation. In the
context of narrative generation, however, existing models still do not capture
factors that contribute to producing consistent text. For instance, it is
logical that a piece of text or a story should be uniformly readable throughout
and that this form of complexity should be controllable. As such, if the
complexity of an input text prompt is rated first-grade reading level in the
Flesch Reading Ease test, then the generated text continuing the plot should
also be within this range of complexity. With this in mind, we introduce
Uniform Complexity for Text Generation (UCTG), a new benchmark test which
raises the challenge of making generative models observe uniform linguistic
properties with respect to prompts. We experiment with over 150+ linguistically
and cognitively motivated features for evaluating text complexity in humans and
generative models. From our results, we find that models such as GPT-2 struggle
to preserve the complexity of input prompts used in its generations, even if
finetuned with professionally written texts.",hf,0,2022-04-11
"Faithfulness in Natural Language Generation: A Systematic Survey of
  Analysis, Evaluation and Optimization Methods",2022-03-10 08:28:32+00:00,http://arxiv.org/abs/2203.05227,"Wei Li, Wenhao Wu, Moye Chen, Jiachen Liu, Xinyan Xiao, Hua Wu",,poetry,"Natural Language Generation (NLG) has made great progress in recent years due
to the development of deep learning techniques such as pre-trained language
models. This advancement has resulted in more fluent, coherent and even
properties controllable (e.g. stylistic, sentiment, length etc.) generation,
naturally leading to development in downstream tasks such as abstractive
summarization, dialogue generation, machine translation, and data-to-text
generation. However, the faithfulness problem that the generated text usually
contains unfaithful or non-factual information has become the biggest
challenge, which makes the performance of text generation unsatisfactory for
practical applications in many real-world scenarios. Many studies on analysis,
evaluation, and optimization methods for faithfulness problems have been
proposed for various tasks, but have not been organized, compared and discussed
in a combined manner. In this survey, we provide a systematic overview of the
research progress on the faithfulness problem of NLG, including problem
analysis, evaluation metrics and optimization methods. We organize the
evaluation and optimization methods for different tasks into a unified taxonomy
to facilitate comparison and learning across tasks. Several research trends are
discussed further.",hf,0,2022-03-10
Youling: an AI-Assisted Lyrics Creation System,2022-01-18 03:57:04+00:00,http://arxiv.org/abs/2201.06724v1,"Rongsheng Zhang, Xiaoxi Mao, Le Li, Lin Jiang, Lin Chen, Zhiwei Hu, Yadong Xi, Changjie Fan, Minlie Huang",cs.CL,poetry,"Recently, a variety of neural models have been proposed for lyrics
generation. However, most previous work completes the generation process in a
single pass with little human intervention. We believe that lyrics creation is
a creative process with human intelligence centered. AI should play a role as
an assistant in the lyrics creation process, where human interactions are
crucial for high-quality creation. This paper demonstrates \textit{Youling}, an
AI-assisted lyrics creation system, designed to collaborate with music
creators. In the lyrics generation process, \textit{Youling} supports
traditional one pass full-text generation mode as well as an interactive
generation mode, which allows users to select the satisfactory sentences from
generated candidates conditioned on preceding context. The system also provides
a revision module which enables users to revise undesired sentences or words of
lyrics repeatedly. Besides, \textit{Youling} allows users to use multifaceted
attributes to control the content and format of generated lyrics. The demo
video of the system is available at https://youtu.be/DFeNpHk0pm4.",,0,2022-01-18
"BACON: Deep-Learning Powered AI for Poetry Generation with Author
  Linguistic Style Transfer",2021-12-14 00:08:36+00:00,http://arxiv.org/abs/2112.11483,Alejandro Rodriguez Pascual,,poetry,"This paper describes BACON, a basic prototype of an automatic poetry
generator with author linguistic style transfer. It combines concepts and
techniques from finite state machinery, probabilistic models, artificial neural
networks and deep learning, to write original poetry with rich
aesthetic-qualities in the style of any given author. Extrinsic evaluation of
the output generated by BACON shows that participants were unable to tell the
difference between human and AI-generated poems in any statistically
significant way.",hf,0,2021-12-14
"Say What? Collaborative Pop Lyric Generation Using Multitask Transfer
  Learning",2021-11-15 08:13:26+00:00,http://arxiv.org/abs/2111.07592v1,"Naveen Ram, Tanay Gummadi, Rahul Bhethanabotla, Richard J. Savery, Gil Weinberg","cs.CL, cs.HC, cs.LG, I.2.7",poetry,"Lyric generation is a popular sub-field of natural language generation that
has seen growth in recent years. Pop lyrics are of unique interest due to the
genre's unique style and content, in addition to the high level of
collaboration that goes on behind the scenes in the professional pop
songwriting process. In this paper, we present a collaborative line-level lyric
generation system that utilizes transfer-learning via the T5 transformer model,
which, till date, has not been used to generate pop lyrics. By working and
communicating directly with professional songwriters, we develop a model that
is able to learn lyrical and stylistic tasks like rhyming, matching line beat
requirements, and ending lines with specific target words. Our approach
compares favorably to existing methods for multiple datasets and yields
positive results from our online studies and interviews with industry
songwriters.",,0,2021-11-15
