title,pubdate,id,authors,categories,search,abstract,displaydate
Selective Token Generation for Few-shot Natural Language Generation,2022-09-17 00:48:52+00:00,http://arxiv.org/abs/2209.08206v1,"Daejin Jo, Taehwan Kwon, Eun-Sol Kim, Sungwoong Kim","cs.CL, cs.LG",table2text,"Natural language modeling with limited training data is a challenging
problem, and many algorithms make use of large-scale pretrained language models
(PLMs) for this due to its great generalization ability. Among them, additive
learning that incorporates a task-specific adapter on top of the fixed
large-scale PLM has been popularly used in the few-shot setting. However, this
added adapter is still easy to disregard the knowledge of the PLM especially
for few-shot natural language generation (NLG) since an entire sequence is
usually generated by only the newly trained adapter. Therefore, in this work,
we develop a novel additive learning algorithm based on reinforcement learning
(RL) that selectively outputs language tokens between the task-general PLM and
the task-specific adapter during both training and inference. This output token
selection over the two generators allows the adapter to take into account
solely the task-relevant parts in sequence generation, and therefore makes it
more robust to overfitting as well as more stable in RL training. In addition,
to obtain the complementary adapter from the PLM for each few-shot task, we
exploit a separate selecting module that is also simultaneously trained using
RL. Experimental results on various few-shot NLG tasks including question
answering, data-to-text generation and text summarization demonstrate that the
proposed selective token generation significantly outperforms the previous
additive learning algorithms based on the PLMs.",2022-09-17
"Adaptive Natural Language Generation for Task-oriented Dialogue via
  Reinforcement Learning",2022-09-16 12:08:57+00:00,http://arxiv.org/abs/2209.07873v1,"Atsumoto Ohashi, Ryuichiro Higashinaka","cs.CL, cs.AI",table2text,"When a natural language generation (NLG) component is implemented in a
real-world task-oriented dialogue system, it is necessary to generate not only
natural utterances as learned on training data but also utterances adapted to
the dialogue environment (e.g., noise from environmental sounds) and the user
(e.g., users with low levels of understanding ability). Inspired by recent
advances in reinforcement learning (RL) for language generation tasks, we
propose ANTOR, a method for Adaptive Natural language generation for
Task-Oriented dialogue via Reinforcement learning. In ANTOR, a natural language
understanding (NLU) module, which corresponds to the user's understanding of
system utterances, is incorporated into the objective function of RL. If the
NLG's intentions are correctly conveyed to the NLU, which understands a
system's utterances, the NLG is given a positive reward. We conducted
experiments on the MultiWOZ dataset, and we confirmed that ANTOR could generate
adaptive utterances against speech recognition errors and the different
vocabulary levels of users.",2022-09-16
"TwHIN-BERT: A Socially-Enriched Pre-trained Language Model for
  Multilingual Tweet Representations",2022-09-15 19:01:21+00:00,http://arxiv.org/abs/2209.07562v1,"Xinyang Zhang, Yury Malkov, Omar Florez, Serim Park, Brian McWilliams, Jiawei Han, Ahmed El-Kishky",cs.CL,table2text,"We present TwHIN-BERT, a multilingual language model trained on in-domain
data from the popular social network Twitter. TwHIN-BERT differs from prior
pre-trained language models as it is trained with not only text-based
self-supervision, but also with a social objective based on the rich social
engagements within a Twitter heterogeneous information network (TwHIN). Our
model is trained on 7 billion tweets covering over 100 distinct languages
providing a valuable representation to model short, noisy, user-generated text.
We evaluate our model on a variety of multilingual social recommendation and
semantic understanding tasks and demonstrate significant metric improvement
over established pre-trained language models. We will freely open-source
TwHIN-BERT and our curated hashtag prediction and social engagement benchmark
datasets to the research community.",2022-09-15
Distribution Aware Metrics for Conditional Natural Language Generation,2022-09-15 17:58:13+00:00,http://arxiv.org/abs/2209.07518v1,"David M Chan, Yiming Ni, Austin Myers, Sudheendra Vijayanarasimhan, David A Ross, John Canny","cs.CL, cs.AI, cs.CV, cs.LG",table2text,"Traditional automated metrics for evaluating conditional natural language
generation use pairwise comparisons between a single generated text and the
best-matching gold-standard ground truth text. When multiple ground truths are
available, scores are aggregated using an average or max operation across
references. While this approach works well when diversity in the ground truth
data (i.e. dispersion of the distribution of conditional texts) can be ascribed
to noise, such as in automated speech recognition, it does not allow for robust
evaluation in the case where diversity in the ground truths represents signal
for the model. In this work we argue that existing metrics are not appropriate
for domains such as visual description or summarization where ground truths are
semantically diverse, and where the diversity in those captions captures useful
additional information about the context. We propose a novel paradigm for
multi-candidate evaluation of conditional language generation models, and a new
family of metrics that compare the distributions of reference and
model-generated caption sets using small sample sets of each. We demonstrate
the utility of our approach with a case study in visual description: where we
show that existing models optimize for single-description quality over
diversity, and gain some insights into how sampling methods and temperature
impact description quality and diversity.",2022-09-15
vec2text with Round-Trip Translations,2022-09-14 17:20:18+00:00,http://arxiv.org/abs/2209.06792v1,"Geoffrey Cideron, Sertan Girgin, Anton Raichuk, Olivier Pietquin, Olivier Bachem, Léonard Hussenot","cs.CL, cs.LG",table2text,"We investigate models that can generate arbitrary natural language text (e.g.
all English sentences) from a bounded, convex and well-behaved control space.
We call them universal vec2text models. Such models would allow making semantic
decisions in the vector space (e.g. via reinforcement learning) while the
natural language generation is handled by the vec2text model. We propose four
desired properties: universality, diversity, fluency, and semantic structure,
that such vec2text models should possess and we provide quantitative and
qualitative methods to assess them. We implement a vec2text model by adding a
bottleneck to a 250M parameters Transformer model and training it with an
auto-encoding objective on 400M sentences (10B tokens) extracted from a massive
web corpus. We propose a simple data augmentation technique based on round-trip
translations and show in extensive experiments that the resulting vec2text
model surprisingly leads to vector spaces that fulfill our four desired
properties and that this model strongly outperforms both standard and denoising
auto-encoders.",2022-09-14
LibertyMFD: A Lexicon to Assess the Moral Foundation of Liberty,2022-09-14 16:14:54+00:00,http://arxiv.org/abs/2209.06750v1,"Oscar Araque, Lorenzo Gatti, Kyriaki Kalimeri",cs.CL,table2text,"Quantifying the moral narratives expressed in the user-generated text, news,
or public discourses is fundamental for understanding individuals' concerns and
viewpoints and preventing violent protests and social polarisation. The Moral
Foundation Theory (MFT) was developed to operationalise morality in a
five-dimensional scale system. Recent developments of the theory urged for the
introduction of a new foundation, the Liberty Foundation. Being only recently
added to the theory, there are no available linguistic resources to assess
whether liberty is present in text corpora. Given its importance to current
social issues such as the vaccination debate, we propose two data-driven
approaches, deriving two candidate lexicons generated based on aligned
documents from online news sources with different worldviews. After extensive
experimentation, we contribute to the research community a novel lexicon that
assesses the liberty moral foundation in the way individuals with contrasting
viewpoints express themselves through written text. The LibertyMFD dictionary
can be a valuable tool for policymakers to understand diverse viewpoints on
controversial social issues such as vaccination, abortion, or even uprisings,
as they happen and on a large scale.",2022-09-14
"OPAL: Ontology-Aware Pretrained Language Model for End-to-End
  Task-Oriented Dialogue",2022-09-10 04:38:27+00:00,http://arxiv.org/abs/2209.04595v1,"Zhi Chen, Yuncong Liu, Lu Chen, Su Zhu, Mengyue Wu, Kai Yu",cs.CL,table2text,"This paper presents an ontology-aware pretrained language model (OPAL) for
end-to-end task-oriented dialogue (TOD). Unlike chit-chat dialogue models,
task-oriented dialogue models fulfill at least two task-specific modules:
dialogue state tracker (DST) and response generator (RG). The dialogue state
consists of the domain-slot-value triples, which are regarded as the user's
constraints to search the domain-related databases. The large-scale
task-oriented dialogue data with the annotated structured dialogue state
usually are inaccessible. It prevents the development of the pretrained
language model for the task-oriented dialogue. We propose a simple yet
effective pretraining method to alleviate this problem, which consists of two
pretraining phases. The first phase is to pretrain on large-scale contextual
text data, where the structured information of the text is extracted by the
information extracting tool. To bridge the gap between the pretraining method
and downstream tasks, we design two pretraining tasks: ontology-like triple
recovery and next-text generation, which simulates the DST and RG,
respectively. The second phase is to fine-tune the pretrained model on the TOD
data. The experimental results show that our proposed method achieves an
exciting boost and get competitive performance even without any TOD data on
CamRest676 and MultiWOZ benchmarks.",2022-09-10
"Layer or Representation Space: What makes BERT-based Evaluation Metrics
  Robust?",2022-09-06 09:10:54+00:00,http://arxiv.org/abs/2209.02317v2,"Doan Nam Long Vu, Nafise Sadat Moosavi, Steffen Eger",cs.CL,table2text,"The evaluation of recent embedding-based evaluation metrics for text
generation is primarily based on measuring their correlation with human
evaluations on standard benchmarks. However, these benchmarks are mostly from
similar domains to those used for pretraining word embeddings. This raises
concerns about the (lack of) generalization of embedding-based metrics to new
and noisy domains that contain a different vocabulary than the pretraining
data. In this paper, we examine the robustness of BERTScore, one of the most
popular embedding-based metrics for text generation. We show that (a) an
embedding-based metric that has the highest correlation with human evaluations
on a standard benchmark can have the lowest correlation if the amount of input
noise or unknown tokens increases, (b) taking embeddings from the first layer
of pretrained models improves the robustness of all metrics, and (c) the
highest robustness is achieved when using character-level embeddings, instead
of token-based embeddings, from the first layer of the pretrained model.",2022-09-06
"Every picture tells a story: Image-grounded controllable stylistic story
  generation",2022-09-04 15:07:53+00:00,http://arxiv.org/abs/2209.01638v1,"Holy Lovenia, Bryan Wilie, Romain Barraud, Samuel Cahyawijaya, Willy Chung, Pascale Fung",cs.CL,table2text,"Generating a short story out of an image is arduous. Unlike image captioning,
story generation from an image poses multiple challenges: preserving the story
coherence, appropriately assessing the quality of the story, steering the
generated story into a certain style, and addressing the scarcity of
image-story pair reference datasets limiting supervision during training. In
this work, we introduce Plug-and-Play Story Teller (PPST) and improve
image-to-story generation by: 1) alleviating the data scarcity problem by
incorporating large pre-trained models, namely CLIP and GPT-2, to facilitate a
fluent image-to-text generation with minimal supervision, and 2) enabling a
more style-relevant generation by incorporating stylistic adapters to control
the story generation. We conduct image-to-story generation experiments with
non-styled, romance-styled, and action-styled PPST approaches and compare our
generated stories with those of previous work over three aspects, i.e., story
coherence, image-story relevance, and style fitness, using both automatic and
human evaluation. The results show that PPST improves story coherence and has
better image-story relevance, but has yet to be adequately stylistic.",2022-09-04
Multi-Modal Experience Inspired AI Creation,2022-09-02 11:50:41+00:00,http://arxiv.org/abs/2209.02427v1,"Qian Cao, Xu Chen, Ruihua Song, Hao Jiang, Guang Yang, Zhao Cao",cs.AI,table2text,"AI creation, such as poem or lyrics generation, has attracted increasing
attention from both industry and academic communities, with many promising
models proposed in the past few years. Existing methods usually estimate the
outputs based on single and independent visual or textual information. However,
in reality, humans usually make creations according to their experiences, which
may involve different modalities and be sequentially correlated. To model such
human capabilities, in this paper, we define and solve a novel AI creation
problem based on human experiences. More specifically, we study how to generate
texts based on sequential multi-modal information. Compared with the previous
works, this task is much more difficult because the designed model has to well
understand and adapt the semantics among different modalities and effectively
convert them into the output in a sequential manner. To alleviate these
difficulties, we firstly design a multi-channel sequence-to-sequence
architecture equipped with a multi-modal attention network. For more effective
optimization, we then propose a curriculum negative sampling strategy tailored
for the sequential inputs. To benchmark this problem and demonstrate the
effectiveness of our model, we manually labeled a new multi-modal experience
dataset. With this dataset, we conduct extensive experiments by comparing our
model with a series of representative baselines, where we can demonstrate
significant improvements in our model based on both automatic and
human-centered metrics. The code and data are available at:
\url{https://github.com/Aman-4-Real/MMTG}.",2022-09-02
A Spanish dataset for Targeted Sentiment Analysis of political headlines,2022-08-30 01:30:30+00:00,http://arxiv.org/abs/2208.13947v1,"Tomás Alves Salgueiro, Emilio Recart Zapata, Damián Furman, Juan Manuel Pérez, Pablo Nicolás Fernández Larrosa",cs.CL,table2text,"Subjective texts have been studied by several works as they can induce
certain behaviours in their users. Most work focuses on user-generated texts in
social networks, but some other texts also comprise opinions on certain topics
and could influence judgement criteria during political decisions. In this
work, we address the task of Targeted Sentiment Analysis for the domain of news
headlines, published by the main outlets during the 2019 Argentinean
Presidential Elections. For this purpose, we present a polarity dataset of
1,976 headlines mentioning candidates in the 2019 elections at the target
level. Preliminary experiments with state-of-the-art classification algorithms
based on pre-trained linguistic models suggest that target information is
helpful for this task. We make our data and pre-trained models publicly
available.",2022-08-30
"StoryTrans: Non-Parallel Story Author-Style Transfer with Discourse
  Representations and Content Enhancing",2022-08-29 08:47:49+00:00,http://arxiv.org/abs/2208.13423v1,"Xuekai Zhu, Jian Guan, Minlie Huang, Juan Liu",cs.CL,table2text,"Non-parallel text style transfer is an important task in natural language
generation. However, previous studies concentrate on the token or sentence
level, such as sentence sentiment and formality transfer, but neglect long
style transfer at the discourse level. Long texts usually involve more
complicated author linguistic preferences such as discourse structures than
sentences. In this paper, we formulate the task of non-parallel story
author-style transfer, which requires transferring an input story into a
specified author style while maintaining source semantics. To tackle this
problem, we propose a generation model, named StoryTrans, which leverages
discourse representations to capture source content information and transfer
them to target styles with learnable style embeddings. We use an additional
training objective to disentangle stylistic features from the learned discourse
representation to prevent the model from degenerating to an auto-encoder.
Moreover, to enhance content preservation, we design a mask-and-fill framework
to explicitly fuse style-specific keywords of source texts into generation.
Furthermore, we constructed new datasets for this task in Chinese and English,
respectively. Extensive experiments show that our model outperforms strong
baselines in overall performance of style transfer and content preservation.",2022-08-29
Nearest Neighbor Non-autoregressive Text Generation,2022-08-26 08:21:21+00:00,http://arxiv.org/abs/2208.12496v1,"Ayana Niwa, Sho Takase, Naoaki Okazaki",cs.CL,table2text,"Non-autoregressive (NAR) models can generate sentences with less computation
than autoregressive models but sacrifice generation quality. Previous studies
addressed this issue through iterative decoding. This study proposes using
nearest neighbors as the initial state of an NAR decoder and editing them
iteratively. We present a novel training strategy to learn the edit operations
on neighbors to improve NAR text generation. Experimental results show that the
proposed method (NeighborEdit) achieves higher translation quality (1.69 points
higher than the vanilla Transformer) with fewer decoding iterations
(one-eighteenth fewer iterations) on the JRC-Acquis En-De dataset, the common
benchmark dataset for machine translation using nearest neighbors. We also
confirm the effectiveness of the proposed method on a data-to-text task
(WikiBio). In addition, the proposed method outperforms an NAR baseline on the
WMT'14 En-De dataset. We also report analysis on neighbor examples used in the
proposed method.",2022-08-26
"GenTUS: Simulating User Behaviour and Language in Task-oriented
  Dialogues with Generative Transformers",2022-08-23 09:01:17+00:00,http://arxiv.org/abs/2208.10817v1,"Hsien-Chin Lin, Christian Geishauser, Shutong Feng, Nurul Lubis, Carel van Niekerk, Michael Heck, Milica Gašić",cs.CL,table2text,"User simulators (USs) are commonly used to train task-oriented dialogue
systems (DSs) via reinforcement learning. The interactions often take place on
semantic level for efficiency, but there is still a gap from semantic actions
to natural language, which causes a mismatch between training and deployment
environment. Incorporating a natural language generation (NLG) module with USs
during training can partly deal with this problem. However, since the policy
and NLG of USs are optimised separately, these simulated user utterances may
not be natural enough in a given context. In this work, we propose a generative
transformer-based user simulator (GenTUS). GenTUS consists of an
encoder-decoder structure, which means it can optimise both the user policy and
natural language generation jointly. GenTUS generates both semantic actions and
natural language utterances, preserving interpretability and enhancing language
variation. In addition, by representing the inputs and outputs as word
sequences and by using a large pre-trained language model we can achieve
generalisability in feature representation. We evaluate GenTUS with automatic
metrics and human evaluation. Our results show that GenTUS generates more
natural language and is able to transfer to an unseen ontology in a zero-shot
fashion. In addition, its behaviour can be further shaped with reinforcement
learning opening the door to training specialised user simulators.",2022-08-23
Few-Shot Table-to-Text Generation with Prefix-Controlled Generator,2022-08-23 03:23:26+00:00,http://arxiv.org/abs/2208.10709v1,"Yutao Luo, Menghua Lu, Gongshen Liu, Shilin Wang",cs.CL,table2text,"Neural table-to-text generation approaches are data-hungry, limiting their
adaptation for low-resource real-world applications. Previous works mostly
resort to Pre-trained Language Models (PLMs) to generate fluent summaries of a
table. However, they often contain hallucinated contents due to the
uncontrolled nature of PLMs. Moreover, the topological differences between
tables and sequences are rarely studied. Last but not least, fine-tuning on
PLMs with a handful of instances may lead to over-fitting and catastrophic
forgetting. To alleviate these problems, we propose a prompt-based approach,
Prefix-Controlled Generator (i.e., PCG), for few-shot table-to-text generation.
We prepend a task-specific prefix for a PLM to make the table structure better
fit the pre-trained input. In addition, we generate an input-specific prefix to
control the factual contents and word order of the generated text. Both
automatic and human evaluations on different domains (humans, books and songs)
of the Wikibio dataset show substantial improvements over baseline approaches.",2022-08-23
Automatic tagging of knowledge points for K12 math problems,2022-08-21 11:11:30+00:00,http://arxiv.org/abs/2208.09867v1,"Xiaolu Wang, Ziqi Ding, Liangyu Chen",cs.CL,table2text,"Automatic tagging of knowledge points for practice problems is the basis for
managing question bases and improving the automation and intelligence of
education. Therefore, it is of great practical significance to study the
automatic tagging technology for practice problems. However, there are few
studies on the automatic tagging of knowledge points for math problems. Math
texts have more complex structures and semantics compared with general texts
because they contain unique elements such as symbols and formulas. Therefore,
it is difficult to meet the accuracy requirement of knowledge point prediction
by directly applying the text classification techniques in general domains. In
this paper, K12 math problems taken as the research object, the LABS model
based on label-semantic attention and multi-label smoothing combining textual
features is proposed to improve the automatic tagging of knowledge points for
math problems. The model combines the text classification techniques in general
domains and the unique features of math texts. The results show that the models
using label-semantic attention or multi-label smoothing perform better on
precision, recall, and F1-score metrics than the traditional BiLSTM model,
while the LABS model using both performs best. It can be seen that label
information can guide the neural networks to extract meaningful information
from the problem text, which improves the text classification performance of
the model. Moreover, multi-label smoothing combining textual features can fully
explore the relationship between text and labels, improve the model's
prediction ability for new data and improve the model's classification
accuracy.",2022-08-21
"Beyond Text Generation: Supporting Writers with Continuous Automatic
  Text Summaries",2022-08-19 13:09:56+00:00,http://arxiv.org/abs/2208.09323v1,"Hai Dang, Karim Benharrak, Florian Lehmann, Daniel Buschek","cs.HC, cs.CL, H.5.2; I.2.7",table2text,"We propose a text editor to help users plan, structure and reflect on their
writing process. It provides continuously updated paragraph-wise summaries as
margin annotations, using automatic text summarization. Summary levels range
from full text, to selected (central) sentences, down to a collection of
keywords. To understand how users interact with this system during writing, we
conducted two user studies (N=4 and N=8) in which people wrote analytic essays
about a given topic and article. As a key finding, the summaries gave users an
external perspective on their writing and helped them to revise the content and
scope of their drafted paragraphs. People further used the tool to quickly gain
an overview of the text and developed strategies to integrate insights from the
automated summaries. More broadly, this work explores and highlights the value
of designing AI tools for writers, with Natural Language Processing (NLP)
capabilities that go beyond direct text generation and correction.",2022-08-19
