title,pubdate,id,authors,categories,search,abstract,displaydate
"LEATHER: A Framework for Learning to Generate Human-like Text in
  Dialogue",2022-10-14 13:05:11+00:00,http://arxiv.org/abs/2210.07777v1,"Anthony Sicilia, Malihe Alikhani","cs.CL, cs.LG",table2text,"Algorithms for text-generation in dialogue can be misguided. For example, in
task-oriented settings, reinforcement learning that optimizes only task-success
can lead to abysmal lexical diversity. We hypothesize this is due to poor
theoretical understanding of the objectives in text-generation and their
relation to the learning process (i.e., model training). To this end, we
propose a new theoretical framework for learning to generate text in dialogue.
Compared to existing theories of learning, our framework allows for analysis of
the multi-faceted goals inherent to text-generation. We use our framework to
develop theoretical guarantees for learners that adapt to unseen data. As an
example, we apply our theory to study data-shift within a cooperative learning
algorithm proposed for the GuessWhat?! visual dialogue game. From this insight,
we propose a new algorithm, and empirically, we demonstrate our proposal
improves both task-success and human-likeness of the generated text. Finally,
we show statistics from our theory are empirically predictive of multiple
qualities of the generated dialogue, suggesting our theory is useful for
model-selection when human evaluations are not available.",2022-10-14
Towards a Unified Multi-Dimensional Evaluator for Text Generation,2022-10-13 17:17:03+00:00,http://arxiv.org/abs/2210.07197v1,"Ming Zhong, Yang Liu, Da Yin, Yuning Mao, Yizhu Jiao, Pengfei Liu, Chenguang Zhu, Heng Ji, Jiawei Han",cs.CL,table2text,"Multi-dimensional evaluation is the dominant paradigm for human evaluation in
Natural Language Generation (NLG), i.e., evaluating the generated text from
multiple explainable dimensions, such as coherence and fluency. However,
automatic evaluation in NLG is still dominated by similarity-based metrics, and
we lack a reliable framework for a more comprehensive evaluation of advanced
models. In this paper, we propose a unified multi-dimensional evaluator UniEval
for NLG. We re-frame NLG evaluation as a Boolean Question Answering (QA) task,
and by guiding the model with different questions, we can use one evaluator to
evaluate from multiple dimensions. Furthermore, thanks to the unified Boolean
QA format, we are able to introduce an intermediate learning phase that enables
UniEval to incorporate external knowledge from multiple related tasks and gain
further improvement. Experiments on three typical NLG tasks show that UniEval
correlates substantially better with human judgments than existing metrics.
Specifically, compared to the top-performing unified evaluators, UniEval
achieves a 23% higher correlation on text summarization, and over 43% on
dialogue response generation. Also, UniEval demonstrates a strong zero-shot
learning ability for unseen evaluation dimensions and tasks. Source code, data
and all pre-trained evaluators are available on our GitHub repository
(https://github.com/maszhongming/UniEval).",2022-10-13
"Scaling Back-Translation with Domain Text Generation for Sign Language
  Gloss Translation",2022-10-13 14:25:08+00:00,http://arxiv.org/abs/2210.07054v1,"Jinhui Ye, Wenxiang Jiao, Xing Wang, Zhaopeng Tu","cs.CL, cs.AI",table2text,"Sign language gloss translation aims to translate the sign glosses into
spoken language texts, which is challenging due to the scarcity of labeled
gloss-text parallel data. Back translation (BT), which generates
pseudo-parallel data by translating in-domain spoken language texts into sign
glosses, has been applied to alleviate the data scarcity problem. However, the
lack of large-scale high-quality domain spoken language text data limits the
effect of BT. In this paper, to overcome the limitation, we propose a Prompt
based domain text Generation (PGEN) approach to produce the large-scale
in-domain spoken language text data. Specifically, PGEN randomly concatenates
sentences from the original in-domain spoken language text data as prompts to
induce a pre-trained language model (i.e., GPT-2) to generate spoken language
texts in a similar style. Experimental results on three benchmarks of sign
language gloss translation in varied languages demonstrate that BT with spoken
language texts generated by PGEN significantly outperforms the compared
methods. In addition, as the scale of spoken language texts generated by PGEN
increases, the BT technique can achieve further improvements, demonstrating the
effectiveness of our approach. We release the code and data for facilitating
future research in this field.",2022-10-13
Instruction Tuning for Few-Shot Aspect-Based Sentiment Analysis,2022-10-12 23:38:57+00:00,http://arxiv.org/abs/2210.06629v1,"Siddharth Varia, Shuai Wang, Kishaloy Halder, Robert Vacareanu, Miguel Ballesteros, Yassine Benajiba, Neha Anna John, Rishita Anubhai, Smaranda Muresan, Dan Roth",cs.CL,table2text,"Aspect-based Sentiment Analysis (ABSA) is a fine-grained sentiment analysis
task which involves four elements from user-generated texts: aspect term,
aspect category, opinion term, and sentiment polarity. Most computational
approaches focus on some of the ABSA sub-tasks such as tuple (aspect term,
sentiment polarity) or triplet (aspect term, opinion term, sentiment polarity)
extraction using either pipeline or joint modeling approaches. Recently,
generative approaches have been proposed to extract all four elements as (one
or more) quadruplets from text as a single task. In this work, we take a step
further and propose a unified framework for solving ABSA, and the associated
sub-tasks to improve the performance in few-shot scenarios. To this end, we
fine-tune a T5 model with instructional prompts in a multi-task learning
fashion covering all the sub-tasks, as well as the entire quadruple prediction
task. In experiments with multiple benchmark data sets, we show that the
proposed multi-task prompting approach brings performance boost (by absolute
$6.75$ F1) in the few-shot learning setting.",2022-10-12
DATScore: Evaluating Translation with Data Augmented Translations,2022-10-12 20:31:42+00:00,http://arxiv.org/abs/2210.06576v1,"Moussa Kamal Eddine, Guokan Shang, Michalis Vazirgiannis",cs.CL,table2text,"The rapid development of large pretrained language models has revolutionized
not only the field of Natural Language Generation (NLG) but also its
evaluation. Inspired by the recent work of BARTScore: a metric leveraging the
BART language model to evaluate the quality of generated text from various
aspects, we introduce DATScore. DATScore uses data augmentation techniques to
improve the evaluation of machine translation. Our main finding is that
introducing data augmented translations of the source and reference texts is
greatly helpful in evaluating the quality of the generated translation. We also
propose two novel score averaging and term weighting strategies to improve the
original score computing process of BARTScore. Experimental results on WMT show
that DATScore correlates better with human meta-evaluations than the other
recent state-of-the-art metrics, especially for low-resource languages.
Ablation studies demonstrate the value added by our new scoring strategies.
Moreover, we report in our extended experiments the performance of DATScore on
3 NLG tasks other than translation.",2022-10-12
ASDOT: Any-Shot Data-to-Text Generation with Pretrained Language Models,2022-10-09 19:17:43+00:00,http://arxiv.org/abs/2210.04325v2,"Jiannan Xiang, Zhengzhong Liu, Yucheng Zhou, Eric P. Xing, Zhiting Hu",cs.CL,table2text,"Data-to-text generation is challenging due to the great variety of the input
data in terms of domains (e.g., finance vs sports) or schemata (e.g., diverse
predicates). Recent end-to-end neural methods thus require substantial training
examples to learn to disambiguate and describe the data. Yet, real-world
data-to-text problems often suffer from various data-scarce issues: one may
have access to only a handful of or no training examples, and/or have to rely
on examples in a different domain or schema. To fill this gap, we propose
Any-Shot Data-to-Text (ASDOT), a new approach flexibly applicable to diverse
settings by making efficient use of any given (or no) examples. ASDOT consists
of two steps, data disambiguation and sentence fusion, both of which are
amenable to be solved with off-the-shelf pretrained language models (LMs) with
optional finetuning. In the data disambiguation stage, we employ the prompted
GPT-3 model to understand possibly ambiguous triples from the input data and
convert each into a short sentence with reduced ambiguity. The sentence fusion
stage then uses an LM like T5 to fuse all the resulting sentences into a
coherent paragraph as the final description. We evaluate extensively on various
datasets in different scenarios, including the zero-/few-/full-shot settings,
and generalization to unseen predicates and out-of-domain data. Experimental
results show that ASDOT consistently achieves significant improvement over
baselines, e.g., a 30.81 BLEU gain on the DART dataset under the zero-shot
setting.",2022-10-09
"FAST: Improving Controllability for Text Generation with Feedback Aware
  Self-Training",2022-10-06 19:00:51+00:00,http://arxiv.org/abs/2210.03167v1,"Junyi Chai, Reid Pryzant, Victor Ye Dong, Konstantin Golobokov, Chenguang Zhu, Yi Liu",cs.CL,table2text,"Controllable text generation systems often leverage control codes to direct
various properties of the output like style and length. Inspired by recent work
on causal inference for NLP, this paper reveals a previously overlooked flaw in
these control code-based conditional text generation algorithms. Spurious
correlations in the training data can lead models to incorrectly rely on parts
of the input other than the control code for attribute selection, significantly
undermining downstream generation quality and controllability. We demonstrate
the severity of this issue with a series of case studies and then propose two
simple techniques to reduce these correlations in training sets. The first
technique is based on resampling the data according to an example's propensity
towards each linguistic attribute (IPS). The second produces multiple
counterfactual versions of each example and then uses an additional feedback
mechanism to remove noisy examples (feedback aware self-training, FAST). We
evaluate on 3 tasks -- news headline, meta review, and search ads generation --
and demonstrate that FAST can significantly improve the controllability and
language quality of generated outputs when compared to state-of-the-art
controllable text generation approaches.",2022-10-06
A Distributional Lens for Multi-Aspect Controllable Text Generation,2022-10-06 13:08:04+00:00,http://arxiv.org/abs/2210.02889v1,"Yuxuan Gu, Xiaocheng Feng, Sicheng Ma, Lingyuan Zhang, Heng Gong, Bing Qin",cs.CL,table2text,"Multi-aspect controllable text generation is a more challenging and practical
task than single-aspect control. Existing methods achieve complex multi-aspect
control by fusing multiple controllers learned from single-aspect, but suffer
from attribute degeneration caused by the mutual interference of these
controllers. To address this, we provide observations on attribute fusion from
a distributional perspective and propose to directly search for the
intersection areas of multiple attribute distributions as their combination for
generation. Our method first estimates the attribute space with an autoencoder
structure. Afterward, we iteratively approach the intersections by jointly
minimizing distances to points representing different attributes. Finally, we
map them to attribute-relevant sentences with a prefix-tuning-based decoder.
Experiments on the three-aspect control task, including sentiment, topic, and
detoxification aspects, reveal that our method outperforms several strong
baselines on attribute relevance and text quality and achieves the SOTA.
Further analysis also supplies some explanatory support for the effectiveness
of our approach.",2022-10-06
"Unsupervised Sentence Textual Similarity with Compositional Phrase
  Semantics",2022-10-05 14:14:04+00:00,http://arxiv.org/abs/2210.02284v1,"Zihao Wang, Jiaheng Dou, Yong Zhang",cs.CL,table2text,"Measuring Sentence Textual Similarity (STS) is a classic task that can be
applied to many downstream NLP applications such as text generation and
retrieval. In this paper, we focus on unsupervised STS that works on various
domains but only requires minimal data and computational resources.
Theoretically, we propose a light-weighted Expectation-Correction (EC)
formulation for STS computation. EC formulation unifies unsupervised STS
approaches including the cosine similarity of Additively Composed (AC) sentence
embeddings, Optimal Transport (OT), and Tree Kernels (TK). Moreover, we propose
the Recursive Optimal Transport Similarity (ROTS) algorithm to capture the
compositional phrase semantics by composing multiple recursive EC formulations.
ROTS finishes in linear time and is faster than its predecessors. ROTS is
empirically more effective and scalable than previous approaches. Extensive
experiments on 29 STS tasks under various settings show the clear advantage of
ROTS over existing approaches. Detailed ablation studies demonstrate the
effectiveness of our approaches.",2022-10-05
CodeDSI: Differentiable Code Search,2022-10-01 17:39:57+00:00,http://arxiv.org/abs/2210.00328v1,"Usama Nadeem, Noah Ziems, Shaoen Wu","cs.SE, cs.IR",table2text,"Reimplementing solutions to previously solved software engineering problems
is not only inefficient but also introduces inadequate and error-prone code.
Many existing methods achieve impressive performance on this issue by using
autoregressive text-generation models trained on code. However, these methods
are not without their flaws. The generated code from these models can be buggy,
lack documentation, and introduce vulnerabilities that may go unnoticed by
developers. An alternative to code generation -- neural code search -- is a
field of machine learning where a model takes natural language queries as input
and, in turn, relevant code samples from a database are returned. Due to the
nature of this pre-existing database, code samples can be documented, tested,
licensed, and checked for vulnerabilities before being used by developers in
production. In this work, we present CodeDSI, an end-to-end unified approach to
code search. CodeDSI is trained to directly map natural language queries to
their respective code samples, which can be retrieved later. In an effort to
improve the performance of code search, we have investigated docid
representation strategies, impact of tokenization on docid structure, and
dataset sizes on overall code search performance. Our results demonstrate
CodeDSI strong performance, exceeding conventional robust baselines by 2-6%
across varying dataset sizes.",2022-10-01
Calibrating Sequence likelihood Improves Conditional Language Generation,2022-09-30 19:16:16+00:00,http://arxiv.org/abs/2210.00045v1,"Yao Zhao, Misha Khalman, Rishabh Joshi, Shashi Narayan, Mohammad Saleh, Peter J. Liu",cs.CL,table2text,"Conditional language models are predominantly trained with maximum likelihood
estimation (MLE), giving probability mass to sparsely observed target
sequences. While MLE trained models assign high probability to plausible
sequences given the context, the model probabilities often do not accurately
rank-order generated sequences by quality. This has been empirically observed
in beam search decoding as output quality degrading with large beam sizes, and
decoding strategies benefiting from heuristics such as length normalization and
repetition-blocking. In this work, we introduce sequence likelihood calibration
(SLiC) where the likelihood of model generated sequences are calibrated to
better align with reference sequences in the model's latent space. With SLiC,
decoding heuristics become unnecessary and decoding candidates' quality
significantly improves regardless of the decoding method. Furthermore, SLiC
shows no sign of diminishing returns with model scale, and presents alternative
ways to improve quality with limited training and inference budgets. With SLiC,
we exceed or match SOTA results on a wide range of generation tasks spanning
abstractive summarization, question generation, abstractive question answering
and data-to-text generation, even with modest-sized models.",2022-09-30
"Co-Writing Screenplays and Theatre Scripts with Language Models: An
  Evaluation by Industry Professionals",2022-09-29 17:26:22+00:00,http://arxiv.org/abs/2209.14958v1,"Piotr Mirowski, Kory W. Mathewson, Jaylen Pittman, Richard Evans","cs.HC, cs.CL",table2text,"Language models are increasingly attracting interest from writers. However,
such models lack long-range semantic coherence, limiting their usefulness for
longform creative writing. We address this limitation by applying language
models hierarchically, in a system we call Dramatron. By building structural
context via prompt chaining, Dramatron can generate coherent scripts and
screenplays complete with title, characters, story beats, location
descriptions, and dialogue. We illustrate Dramatron's usefulness as an
interactive co-creative system with a user study of 15 theatre and film
industry professionals. Participants co-wrote theatre scripts and screenplays
with Dramatron and engaged in open-ended interviews. We report critical
reflections both from our interviewees and from independent reviewers who
watched stagings of the works to illustrate how both Dramatron and hierarchical
text generation could be useful for human-machine co-creativity. Finally, we
discuss the suitability of Dramatron for co-creativity, ethical considerations
-- including plagiarism and bias -- and participatory models for the design and
deployment of such tools.",2022-09-29
"DR.BENCH: Diagnostic Reasoning Benchmark for Clinical Natural Language
  Processing",2022-09-29 16:05:53+00:00,http://arxiv.org/abs/2209.14901v1,"Yanjun Gao, Dmitriy Dligach, Timothy Miller, John Caskey, Brihat Sharma, Matthew M Churpek, Majid Afshar","cs.CL, cs.AI",table2text,"The meaningful use of electronic health records (EHR) continues to progress
in the digital era with clinical decision support systems augmented by
artificial intelligence. A priority in improving provider experience is to
overcome information overload and reduce the cognitive burden so fewer medical
errors and cognitive biases are introduced during patient care. One major type
of medical error is diagnostic error due to systematic or predictable errors in
judgment that rely on heuristics. The potential for clinical natural language
processing (cNLP) to model diagnostic reasoning in humans with forward
reasoning from data to diagnosis and potentially reduce the cognitive burden
and medical error has not been investigated. Existing tasks to advance the
science in cNLP have largely focused on information extraction and named entity
recognition through classification tasks. We introduce a novel suite of tasks
coined as Diagnostic Reasoning Benchmarks, DR.BENCH, as a new benchmark for
developing and evaluating cNLP models with clinical diagnostic reasoning
ability. The suite includes six tasks from ten publicly available datasets
addressing clinical text understanding, medical knowledge reasoning, and
diagnosis generation. DR.BENCH is the first clinical suite of tasks designed to
be a natural language generation framework to evaluate pre-trained language
models. Experiments with state-of-the-art pre-trained generative language
models using large general domain models and models that were continually
trained on a medical corpus demonstrate opportunities for improvement when
evaluated in DR. BENCH. We share DR. BENCH as a publicly available GitLab
repository with a systematic approach to load and evaluate models for the cNLP
community.",2022-09-29
Informative Text Generation from Knowledge Triples,2022-09-26 14:35:57+00:00,http://arxiv.org/abs/2209.12733v1,"Zihao Fu, Yijiang River Dong, Lidong Bing, Wai Lam",cs.CL,table2text,"As the development of the encoder-decoder architecture, researchers are able
to study the text generation tasks with broader types of data. Among them,
KB-to-text aims at converting a set of knowledge triples into human readable
sentences. In the original setting, the task assumes that the input triples and
the text are exactly aligned in the perspective of the embodied
knowledge/information. In this paper, we extend this setting and explore how to
facilitate the trained model to generate more informative text, namely,
containing more information about the triple entities but not conveyed by the
input triples. To solve this problem, we propose a novel memory augmented
generator that employs a memory network to memorize the useful knowledge
learned during the training and utilizes such information together with the
input triples to generate text in the operational or testing phase. We derive a
dataset from WebNLG for our new setting and conduct extensive experiments to
investigate the effectiveness of our model as well as uncover the intrinsic
characteristics of the setting.",2022-09-26
Controllable Text Generation for Open-Domain Creativity and Fairness,2022-09-24 22:40:01+00:00,http://arxiv.org/abs/2209.12099v1,Nanyun Peng,"cs.CL, cs.AI",table2text,"Recent advances in large pre-trained language models have demonstrated strong
results in generating natural languages and significantly improved performances
for many natural language generation (NLG) applications such as machine
translation and text summarization. However, when the generation tasks are more
open-ended and the content is under-specified, existing techniques struggle to
generate long-term coherent and creative content. Moreover, the models exhibit
and even amplify social biases that are learned from the training corpora. This
happens because the generation models are trained to capture the surface
patterns (i.e. sequences of words), instead of capturing underlying semantics
and discourse structures, as well as background knowledge including social
norms. In this paper, I introduce our recent works on controllable text
generation to enhance the creativity and fairness of language generation
models. We explore hierarchical generation and constrained decoding, with
applications to creative language generation including story, poetry, and
figurative languages, and bias mitigation for generation models.",2022-09-24
XF2T: Cross-lingual Fact-to-Text Generation for Low-Resource Languages,2022-09-22 18:01:27+00:00,http://arxiv.org/abs/2209.11252v1,"Shivprasad Sagare, Tushar Abhishek, Bhavyajeet Singh, Anubhav Sharma, Manish Gupta, Vasudeva Varma",cs.CL,table2text,"Multiple business scenarios require an automated generation of descriptive
human-readable text from structured input data. Hence, fact-to-text generation
systems have been developed for various downstream tasks like generating soccer
reports, weather and financial reports, medical reports, person biographies,
etc. Unfortunately, previous work on fact-to-text (F2T) generation has focused
primarily on English mainly due to the high availability of relevant datasets.
Only recently, the problem of cross-lingual fact-to-text (XF2T) was proposed
for generation across multiple languages alongwith a dataset, XALIGN for eight
languages. However, there has been no rigorous work on the actual XF2T
generation problem. We extend XALIGN dataset with annotated data for four more
languages: Punjabi, Malayalam, Assamese and Oriya. We conduct an extensive
study using popular Transformer-based text generation models on our extended
multi-lingual dataset, which we call XALIGNV2. Further, we investigate the
performance of different text generation strategies: multiple variations of
pretraining, fact-aware embeddings and structure-aware input encoding. Our
extensive experiments show that a multi-lingual mT5 model which uses fact-aware
embeddings with structure-aware input encoding leads to best results on average
across the twelve languages. We make our code, dataset and model publicly
available, and hope that this will help advance further research in this
critical area.",2022-09-22
