title,pubdate,id,authors,categories,search,abstract,displaydate
Time-aware Prompting for Text Generation,2022-11-03 22:10:25+00:00,http://arxiv.org/abs/2211.02162v1,"Shuyang Cao, Lu Wang",cs.CL,table2text,"In this paper, we study the effects of incorporating timestamps, such as
document creation dates, into generation systems. Two types of time-aware
prompts are investigated: (1) textual prompts that encode document timestamps
in natural language sentences; and (2) linear prompts that convert timestamps
into continuous vectors. To explore extrapolation to future data points, we
further introduce a new data-to-text generation dataset, TempWikiBio,
containing more than 4 millions of chronologically ordered revisions of
biographical articles from English Wikipedia, each paired with structured
personal profiles. Through data-to-text generation on TempWikiBio, text-to-text
generation on the content transfer dataset, and summarization on XSum, we show
that linear prompts on encoder and textual prompts improve the generation
quality on all datasets. Despite having less performance drop when testing on
data drawn from a later time, linear prompts focus more on non-temporal
information and are less sensitive to the given timestamps, according to human
evaluations and sensitivity analyses. Meanwhile, textual prompts establish the
association between the given timestamps and the output dates, yielding more
factual temporal information in the output.",2022-11-03
TaTa: A Multilingual Table-to-Text Dataset for African Languages,2022-10-31 21:05:42+00:00,http://arxiv.org/abs/2211.00142v1,"Sebastian Gehrmann, Sebastian Ruder, Vitaly Nikolaev, Jan A. Botha, Michael Chavinda, Ankur Parikh, Clara Rivera","cs.CL, cs.LG",table2text,"Existing data-to-text generation datasets are mostly limited to English. To
address this lack of data, we create Table-to-Text in African languages (TaTa),
the first large multilingual table-to-text dataset with a focus on African
languages. We created TaTa by transcribing figures and accompanying text in
bilingual reports by the Demographic and Health Surveys Program, followed by
professional translation to make the dataset fully parallel. TaTa includes
8,700 examples in nine languages including four African languages (Hausa, Igbo,
Swahili, and Yor\`ub\'a) and a zero-shot test language (Russian). We
additionally release screenshots of the original figures for future research on
multilingual multi-modal approaches. Through an in-depth human evaluation, we
show that TaTa is challenging for current models and that less than half the
outputs from an mT5-XXL-based model are understandable and attributable to the
source data. We further demonstrate that existing metrics perform poorly for
TaTa and introduce learned metrics that achieve a high correlation with human
judgments. We release all data and annotations at
https://github.com/google-research/url-nlp.",2022-10-31
DiffusER: Discrete Diffusion via Edit-based Reconstruction,2022-10-30 16:55:23+00:00,http://arxiv.org/abs/2210.16886v1,"Machel Reid, Vincent J. Hellendoorn, Graham Neubig","cs.CL, cs.LG",table2text,"In text generation, models that generate text from scratch one token at a
time are currently the dominant paradigm. Despite being performant, these
models lack the ability to revise existing text, which limits their usability
in many practical scenarios. We look to address this, with DiffusER (Diffusion
via Edit-based Reconstruction), a new edit-based generative model for text
based on denoising diffusion models -- a class of models that use a Markov
chain of denoising steps to incrementally generate data. DiffusER is not only a
strong generative model in general, rivalling autoregressive models on several
tasks spanning machine translation, summarization, and style transfer; it can
also perform other varieties of generation that standard autoregressive models
are not well-suited for. For instance, we demonstrate that DiffusER makes it
possible for a user to condition generation on a prototype, or an incomplete
sequence, and continue revising based on previous edit steps.",2022-10-30
"Diverse Parallel Data Synthesis for Cross-Database Adaptation of
  Text-to-SQL Parsers",2022-10-29 14:30:53+00:00,http://arxiv.org/abs/2210.16613v1,"Abhijeet Awasthi, Ashutosh Sathe, Sunita Sarawagi","cs.CL, cs.AI, cs.LG",table2text,"Text-to-SQL parsers typically struggle with databases unseen during the train
time. Adapting parsers to new databases is a challenging problem due to the
lack of natural language queries in the new schemas. We present ReFill, a
framework for synthesizing high-quality and textually diverse parallel datasets
for adapting a Text-to-SQL parser to a target schema. ReFill learns to
retrieve-and-edit text queries from the existing schemas and transfers them to
the target schema. We show that retrieving diverse existing text, masking their
schema-specific tokens, and refilling with tokens relevant to the target
schema, leads to significantly more diverse text queries than achievable by
standard SQL-to-Text generation methods. Through experiments spanning multiple
databases, we demonstrate that fine-tuning parsers on datasets synthesized
using ReFill consistently outperforms the prior data-augmentation methods.",2022-10-29
Nearest Neighbor Language Models for Stylistic Controllable Generation,2022-10-27 20:46:12+00:00,http://arxiv.org/abs/2210.15762v1,"Severino Trotta, Lucie Flek, Charles Welch",cs.CL,table2text,"Recent language modeling performance has been greatly improved by the use of
external memory. This memory encodes the context so that similar contexts can
be recalled during decoding. This similarity depends on how the model learns to
encode context, which can be altered to include other attributes, such as
style. We construct and evaluate an architecture for this purpose, using
corpora annotated for politeness, formality, and toxicity. Through extensive
experiments and human evaluation we demonstrate the potential of our method to
generate text while controlling style. We find that style-specific datastores
improve generation performance, though results vary greatly across styles, and
the effect of pretraining data and specific styles should be explored in future
work.",2022-10-27
Categorical SDEs with Simplex Diffusion,2022-10-26 15:27:43+00:00,http://arxiv.org/abs/2210.14784v1,"Pierre H. Richemond, Sander Dieleman, Arnaud Doucet",cs.LG,table2text,"Diffusion models typically operate in the standard framework of generative
modelling by producing continuously-valued datapoints. To this end, they rely
on a progressive Gaussian smoothing of the original data distribution, which
admits an SDE interpretation involving increments of a standard Brownian
motion. However, some applications such as text generation or reinforcement
learning might naturally be better served by diffusing categorical-valued data,
i.e., lifting the diffusion to a space of probability distributions. To this
end, this short theoretical note proposes Simplex Diffusion, a means to
directly diffuse datapoints located on an n-dimensional probability simplex. We
show how this relates to the Dirichlet distribution on the simplex and how the
analogous SDE is realized thanks to a multi-dimensional Cox-Ingersoll-Ross
process (abbreviated as CIR), previously used in economics and mathematical
finance. Finally, we make remarks as to the numerical implementation of
trajectories of the CIR process, and discuss some limitations of our approach.",2022-10-26
SentBS: Sentence-level Beam Search for Controllable Summarization,2022-10-26 06:21:01+00:00,http://arxiv.org/abs/2210.14502v1,"Chenhui Shen, Liying Cheng, Lidong Bing, Yang You, Luo Si",cs.CL,table2text,"A wide range of control perspectives have been explored in controllable text
generation. Structure-controlled summarization is recently proposed as a useful
and interesting research direction. However, current structure-controlling
methods have limited effectiveness in enforcing the desired structure. To
address this limitation, we propose a sentence-level beam search generation
method (SentBS), where evaluation is conducted throughout the generation
process to select suitable sentences for subsequent generations. We experiment
with different combinations of decoding methods to be used as subcomponents by
SentBS and evaluate results on the structure-controlled dataset MReD.
Experiments show that all explored combinations for SentBS can improve the
agreement between the generated text and the desired structure, with the best
method significantly reducing the structural discrepancies suffered by the
existing model, by approximately 68%.",2022-10-26
On the Effectiveness of Automated Metrics for Text Generation Systems,2022-10-24 08:15:28+00:00,http://arxiv.org/abs/2210.13025v1,"Pius von Däniken, Jan Deriu, Don Tuggener, Mark Cieliebak","cs.CL, cs.AI",table2text,"A major challenge in the field of Text Generation is evaluation because we
lack a sound theory that can be leveraged to extract guidelines for evaluation
campaigns. In this work, we propose a first step towards such a theory that
incorporates different sources of uncertainty, such as imperfect automated
metrics and insufficiently sized test sets. The theory has practical
applications, such as determining the number of samples needed to reliably
distinguish the performance of a set of Text Generation systems in a given
setting. We showcase the application of the theory on the WMT 21 and
Spot-The-Bot evaluation data and outline how it can be leveraged to improve the
evaluation protocol regarding the reliability, robustness, and significance of
the evaluation outcome.",2022-10-24
"Finding Memo: Extractive Memorization in Constrained Sequence Generation
  Tasks",2022-10-24 03:01:52+00:00,http://arxiv.org/abs/2210.12929v1,"Vikas Raunak, Arul Menezes","cs.CL, cs.AI, cs.LG",table2text,"Memorization presents a challenge for several constrained Natural Language
Generation (NLG) tasks such as Neural Machine Translation (NMT), wherein the
proclivity of neural models to memorize noisy and atypical samples reacts
adversely with the noisy (web crawled) datasets. However, previous studies of
memorization in constrained NLG tasks have only focused on counterfactual
memorization, linking it to the problem of hallucinations. In this work, we
propose a new, inexpensive algorithm for extractive memorization (exact
training data generation under insufficient context) in constrained sequence
generation tasks and use it to study extractive memorization and its effects in
NMT. We demonstrate that extractive memorization poses a serious threat to NMT
reliability by qualitatively and quantitatively characterizing the memorized
samples as well as the model behavior in their vicinity. Based on empirical
observations, we develop a simple algorithm which elicits non-memorized
translations of memorized samples from the same model, for a large fraction of
such samples. Finally, we show that the proposed algorithm could also be
leveraged to mitigate memorization in the model through finetuning. We have
released the code to reproduce our results at
https://github.com/vyraun/Finding-Memo.",2022-10-24
"Mapping Process for the Task: Wikidata Statements to Text as Wikipedia
  Sentences",2022-10-23 08:34:33+00:00,http://arxiv.org/abs/2210.12659v1,"Hoang Thang Ta, Alexander Gelbukha, Grigori Sidorov","cs.CL, cs.AI",table2text,"Acknowledged as one of the most successful online cooperative projects in
human society, Wikipedia has obtained rapid growth in recent years and desires
continuously to expand content and disseminate knowledge values for everyone
globally. The shortage of volunteers brings to Wikipedia many issues, including
developing content for over 300 languages at the present. Therefore, the
benefit that machines can automatically generate content to reduce human
efforts on Wikipedia language projects could be considerable. In this paper, we
propose our mapping process for the task of converting Wikidata statements to
natural language text (WS2T) for Wikipedia projects at the sentence level. The
main step is to organize statements, represented as a group of quadruples and
triples, and then to map them to corresponding sentences in English Wikipedia.
We evaluate the output corpus in various aspects: sentence structure analysis,
noise filtering, and relationships between sentence components based on word
embedding models. The results are helpful not only for the data-to-text
generation task but also for other relevant works in the field.",2022-10-23
"Hard Gate Knowledge Distillation -- Leverage Calibration for Robust and
  Reliable Language Model",2022-10-22 11:57:10+00:00,http://arxiv.org/abs/2210.12427v1,"Dongkyu Lee, Zhiliang Tian, Yingxiu Zhao, Ka Chun Cheung, Nevin L. Zhang","cs.CL, cs.AI",table2text,"In knowledge distillation, a student model is trained with supervisions from
both knowledge from a teacher and observations drawn from a training data
distribution. Knowledge of a teacher is considered a subject that holds
inter-class relations which send a meaningful supervision to a student; hence,
much effort has been put to find such knowledge to be distilled. In this paper,
we explore a question that has been given little attention: ""when to distill
such knowledge."" The question is answered in our work with the concept of model
calibration; we view a teacher model not only as a source of knowledge but also
as a gauge to detect miscalibration of a student. This simple and yet novel
view leads to a hard gate knowledge distillation scheme that switches between
learning from a teacher model and training data. We verify the gating mechanism
in the context of natural language generation at both the token-level and the
sentence-level. Empirical comparisons with strong baselines show that hard gate
knowledge distillation not only improves model generalization, but also
significantly lowers model calibration error.",2022-10-22
"Recurrence Boosts Diversity! Revisiting Recurrent Latent Variable in
  Transformer-Based Variational AutoEncoder for Diverse Text Generation",2022-10-22 10:25:35+00:00,http://arxiv.org/abs/2210.12409v2,"Jinyi Hu, Xiaoyuan Yi, Wenhao Li, Maosong Sun, Xing Xie",cs.CL,table2text,"Variational Auto-Encoder (VAE) has been widely adopted in text generation.
Among many variants, recurrent VAE learns token-wise latent variables with each
conditioned on the preceding ones, which captures sequential variability better
in the era of RNN. However, it is unclear how to incorporate such recurrent
dynamics into the recently dominant Transformer due to its parallelism. In this
work, we propose TRACE, a Transformer-based recurrent VAE structure. TRACE
imposes recurrence on segment-wise latent variables with arbitrarily separated
text segments and constructs the posterior distribution with residual
parameterization. Besides, we design an acceleration method by approximating
idempotent matrices, which allows parallelism while maintaining the conditional
dependence of latent variables. We demonstrate that TRACE could enhance the
entanglement of each segment and preceding latent variables and deduce a
non-zero lower bound of the KL term, providing a theoretical guarantee of
generation diversity. Experiments on two unconditional and one conditional
generation tasks show that TRACE achieves significantly improved diversity
while maintaining satisfactory generation quality.",2022-10-22
"ReasTAP: Injecting Table Reasoning Skills During Pre-training via
  Synthetic Reasoning Examples",2022-10-22 07:04:02+00:00,http://arxiv.org/abs/2210.12374v1,"Yilun Zhao, Linyong Nan, Zhenting Qi, Rui Zhang, Dragomir Radev",cs.CL,table2text,"Reasoning over tabular data requires both table structure understanding and a
broad set of table reasoning skills. Current models with table-specific
architectures and pre-training methods perform well on understanding table
structures, but they still struggle with tasks that require various table
reasoning skills. In this work, we develop ReasTAP to show that high-level
table reasoning skills can be injected into models during pre-training without
a complex table-specific architecture design. We define 7 table reasoning
skills, such as numerical operation, temporal comparison, and conjunction. Each
reasoning skill is associated with one example generator, which synthesizes
questions over semi-structured tables according to the sampled templates. We
model the table pre-training task as a sequence generation task and pre-train
ReasTAP to generate precise answers to the synthetic examples. ReasTAP is
evaluated on four benchmarks covering three downstream tasks including: 1)
WikiSQL and WTQ for Table Question Answering; 2) TabFact for Table Fact
Verification; and 3) LogicNLG for Faithful Table-to-Text Generation.
Experimental results demonstrate that ReasTAP achieves new state-of-the-art
performance on all benchmarks and delivers a significant improvement on
low-resource setting. Our code is publicly available at
https://github.com/Yale-LILY/ReasTAP.",2022-10-22
"The University of Edinburgh's Submission to the WMT22 Code-Mixing Shared
  Task (MixMT)",2022-10-20 14:40:10+00:00,http://arxiv.org/abs/2210.11309v1,"Faheem Kirefu, Vivek Iyer, Pinzhen Chen, Laurie Burchell",cs.CL,table2text,"The University of Edinburgh participated in the WMT22 shared task on
code-mixed translation. This consists of two subtasks: i) generating code-mixed
Hindi/English (Hinglish) text generation from parallel Hindi and English
sentences and ii) machine translation from Hinglish to English. As both
subtasks are considered low-resource, we focused our efforts on careful data
generation and curation, especially the use of backtranslation from monolingual
resources. For subtask 1 we explored the effects of constrained decoding on
English and transliterated subwords in order to produce Hinglish. For subtask
2, we investigated different pretraining techniques, namely comparing simple
initialisation from existing machine translation models and aligned
augmentation. For both subtasks, we found that our baseline systems worked
best. Our systems for both subtasks were one of the overall top-performing
submissions.",2022-10-20
Image Semantic Relation Generation,2022-10-19 16:15:19+00:00,http://arxiv.org/abs/2210.11253v1,Mingzhe Du,"cs.CV, cs.CL",table2text,"Scene graphs provide structured semantic understanding beyond images. For
downstream tasks, such as image retrieval, visual question answering, visual
relationship detection, and even autonomous vehicle technology, scene graphs
can not only distil complex image information but also correct the bias of
visual models using semantic-level relations, which has broad application
prospects. However, the heavy labour cost of constructing graph annotations may
hinder the application of PSG in practical scenarios. Inspired by the
observation that people usually identify the subject and object first and then
determine the relationship between them, we proposed to decouple the scene
graphs generation task into two sub-tasks: 1) an image segmentation task to
pick up the qualified objects. 2) a restricted auto-regressive text generation
task to generate the relation between given objects. Therefore, in this work,
we introduce image semantic relation generation (ISRG), a simple but effective
image-to-text model, which achieved 31 points on the OpenPSG dataset and
outperforms strong baselines respectively by 16 points (ResNet-50) and 5 points
(CLIP).",2022-10-19
NGEP: A Graph-based Event Planning Framework for Story Generation,2022-10-19 14:49:27+00:00,http://arxiv.org/abs/2210.10602v1,"Chen Tang, Zhihao Zhang, Tyler Loakman, Chenghua Lin, Frank Guerin","cs.CL, cs.AI",table2text,"To improve the performance of long text generation, recent studies have
leveraged automatically planned event structures (i.e. storylines) to guide
story generation. Such prior works mostly employ end-to-end neural generation
models to predict event sequences for a story. However, such generation models
struggle to guarantee the narrative coherence of separate events due to the
hallucination problem, and additionally the generated event sequences are often
hard to control due to the end-to-end nature of the models. To address these
challenges, we propose NGEP, an novel event planning framework which generates
an event sequence by performing inference on an automatically constructed event
graph and enhances generalisation ability through a neural event advisor. We
conduct a range of experiments on multiple criteria, and the results
demonstrate that our graph-based neural framework outperforms the
state-of-the-art (SOTA) event planning approaches, considering both the
performance of event sequence generation and the effectiveness on the
downstream task of story generation.",2022-10-19
"Attribution and Obfuscation of Neural Text Authorship: A Data Mining
  Perspective",2022-10-19 11:53:13+00:00,http://arxiv.org/abs/2210.10488v2,"Adaku Uchendu, Thai Le, Dongwon Lee","cs.CL, cs.LG",table2text,"Two interlocking research questions of growing interest and importance in
privacy research are Authorship Attribution (AA) and Authorship Obfuscation
(AO). Given an artifact, especially a text t in question, an AA solution aims
to accurately attribute t to its true author out of many candidate authors
while an AO solution aims to modify t to hide its true authorship.
Traditionally, the notion of authorship and its accompanying privacy concern is
only toward human authors. However, in recent years, due to the explosive
advancements in Neural Text Generation (NTG) techniques in NLP, capable of
synthesizing human-quality open-ended texts (so-called ""neural texts""), one has
to now consider authorships by humans, machines, or their combination. Due to
the implications and potential threats of neural texts when used maliciously,
it has become critical to understand the limitations of traditional AA/AO
solutions and develop novel AA/AO solutions in dealing with neural texts. In
this survey, therefore, we make a comprehensive review of recent literature on
the attribution and obfuscation of neural text authorship from a Data Mining
perspective, and share our view on their limitations and promising research
directions.",2022-10-19
"Team Flow at DRC2022: Pipeline System for Travel Destination
  Recommendation Task in Spoken Dialogue",2022-10-18 01:11:16+00:00,http://arxiv.org/abs/2210.09518v1,"Ryu Hirai, Atsumoto Ohashi, Ao Guo, Hideki Shiroma, Xulin Zhou, Yukihiko Tone, Shinya Iizuka, Ryuichiro Higashinaka","cs.CL, cs.AI, cs.RO",table2text,"To improve the interactive capabilities of a dialogue system, e.g., to adapt
to different customers, the Dialogue Robot Competition (DRC2022) was held. As
one of the teams, we built a dialogue system with a pipeline structure
containing four modules. The natural language understanding (NLU) and natural
language generation (NLG) modules were GPT-2 based models, and the dialogue
state tracking (DST) and policy modules were designed on the basis of
hand-crafted rules. After the preliminary round of the competition, we found
that the low variation in training examples for the NLU and failed
recommendation due to the policy used were probably the main reasons for the
limited performance of the system.",2022-10-18
Table-To-Text generation and pre-training with TabT5,2022-10-17 15:05:53+00:00,http://arxiv.org/abs/2210.09162v1,"Ewa Andrejczuk, Julian Martin Eisenschlos, Francesco Piccinno, Syrine Krichene, Yasemin Altun","cs.CL, cs.LG",table2text,"Encoder-only transformer models have been successfully applied to different
table understanding tasks, as in TAPAS (Herzig et al., 2020). A major
limitation of these architectures is that they are constrained to
classification-like tasks such as cell selection or entailment detection. We
present TABT5, an encoder-decoder model that generates natural language text
based on tables and textual inputs. TABT5 overcomes the encoder-only limitation
by incorporating a decoder component and leverages the input structure with
table specific embeddings and pre-training. TABT5 achieves new state-of-the-art
results on several domains, including spreadsheet formula prediction with a 15%
increase in sequence accuracy, QA with a 2.5% increase in sequence accuracy and
data-to-text generation with a 2.5% increase in BLEU.",2022-10-17
Model Criticism for Long-Form Text Generation,2022-10-16 04:35:58+00:00,http://arxiv.org/abs/2210.08444v1,"Yuntian Deng, Volodymyr Kuleshov, Alexander M. Rush","cs.CL, cs.LG, stat.ML",table2text,"Language models have demonstrated the ability to generate highly fluent text;
however, it remains unclear whether their output retains coherent high-level
structure (e.g., story progression). Here, we propose to apply a statistical
tool, model criticism in latent space, to evaluate the high-level structure of
the generated text. Model criticism compares the distributions between real and
generated data in a latent space obtained according to an assumptive generative
process. Different generative processes identify specific failure modes of the
underlying model. We perform experiments on three representative aspects of
high-level discourse -- coherence, coreference, and topicality -- and find that
transformer-based language models are able to capture topical structures but
have a harder time maintaining structural coherence or modeling coreference.",2022-10-16
