title,pubdate,id,authors,categories,search,abstract,source,hf_upvotes,displaydate
MINES: Explainable Anomaly Detection through Web API Invariant Inference,2025-12-07 16:13:35+00:00,http://arxiv.org/abs/2512.06906v1,"Wenjie Zhang, Yun Lin, Chun Fung Amos Kwok, Xiwen Teoh, Xiaofei Xie, Frank Liauw, Hongyu Zhang, Jin Song Dong","cs.SE, cs.CR, cs.DB, cs.LG",creativity,"Detecting the anomalies of web applications, important infrastructures for running modern companies and governments, is crucial for providing reliable web services. Many modern web applications operate on web APIs (e.g., RESTful, SOAP, and WebSockets), their exposure invites intended attacks or unintended illegal visits, causing abnormal system behaviors. However, such anomalies can share very similar logs with normal logs, missing crucial information (which could be in database) for log discrimination. Further, log instances can be also noisy, which can further mislead the state-of-the-art log learning solutions to learn spurious correlation, resulting superficial models and rules for anomaly detection. In this work, we propose MINES which infers explainable API invariants for anomaly detection from the schema level instead of detailed raw log instances, which can (1) significantly discriminate noise in logs to identify precise normalities and (2) detect abnormal behaviors beyond the instrumented logs. Technically, MINES (1) converts API signatures into table schema to enhance the original database shema; and (2) infers the potential database constraints on the enhanced database schema to capture the potential relationships between APIs and database tables. MINES uses LLM for extracting potential relationship based on two given table structures; and use normal log instances to reject and accept LLM-generated invariants. Finally, MINES translates the inferred constraints into invariants to generate Python code for verifying the runtime logs. We extensively evaluate MINES on web-tamper attacks on the benchmarks of TrainTicket, NiceFish, Gitea, Mastodon, and NextCloud against baselines such as LogRobust, LogFormer, and WebNorm. The results show that MINES achieves high recall for the anomalies while introducing almost zero false positives, indicating a new state-of-the-art.",,0,2025-12-07
LLM as a Neural Architect: Controlled Generation of Image Captioning Models Under Strict API Contracts,2025-12-07 10:47:28+00:00,http://arxiv.org/abs/2512.14706v1,"Krunal Jesani, Dmitry Ignatov, Radu Timofte","cs.LG, cs.AI, cs.CL, cs.CV",creativity,"Neural architecture search (NAS) traditionally requires significant human expertise or automated trial-and-error to design deep learning models. We present NN-Caption, an LLM-guided neural architecture search pipeline that generates runnable image-captioning models by composing CNN encoders from LEMUR's classification backbones with sequence decoders (LSTM/GRU/Transformer) under a strict Net API. Using DeepSeek-R1-0528-Qwen3-8B as the primary generator, we present the prompt template and examples of generated architectures. We evaluate on MS COCO with BLEU-4. The LLM generated dozens of captioning models, with over half successfully trained and producing meaningful captions. We analyse the outcomes of using different numbers of input model snippets (5 vs. 10) in the prompt, finding a slight drop in success rate when providing more candidate components. We also report training dynamics (caption accuracy vs. epochs) and the highest BLEU-4 attained. Our results highlight the promise of LLM-guided NAS: the LLM not only proposes architectures but also suggests hyperparameters and training practices. We identify the challenges encountered (e.g., code hallucinations or API compliance issues) and detail how prompt rules and iterative code fixes addressed them. This work presents a pipeline that integrates prompt-based code generation with automatic evaluation, and adds dozens of novel captioning models to the open LEMUR dataset to facilitate reproducible benchmarking and downstream AutoML research.",,0,2025-12-07
Faithfulness metric fusion: Improving the evaluation of LLM trustworthiness across domains,2025-12-05 13:28:29+00:00,http://arxiv.org/abs/2512.05700v1,"Ben Malin, Tatiana Kalganova, Nikolaos Boulgouris","cs.CL, cs.AI",creativity,"We present a methodology for improving the accuracy of faithfulness evaluation in Large Language Models (LLMs). The proposed methodology is based on the combination of elementary faithfulness metrics into a combined (fused) metric, for the purpose of improving the faithfulness of LLM outputs. The proposed strategy for metric fusion deploys a tree-based model to identify the importance of each metric, which is driven by the integration of human judgements evaluating the faithfulness of LLM responses. This fused metric is demonstrated to correlate more strongly with human judgements across all tested domains for faithfulness. Improving the ability to evaluate the faithfulness of LLMs, allows for greater confidence to be placed within models, allowing for their implementation in a greater diversity of scenarios. Additionally, we homogenise a collection of datasets across question answering and dialogue-based domains and implement human judgements and LLM responses within this dataset, allowing for the reproduction and trialling of faithfulness evaluation across domains.",,0,2025-12-05
Decoding the Black Box: Discerning AI Rhetorics About and Through Poetic Prompting,2025-12-04 20:41:39+00:00,http://arxiv.org/abs/2512.05243v1,"P. D. Edgar, Alia Hall","cs.CL, cs.CY",creativity,"Prompt engineering has emerged as a useful way studying the algorithmic tendencies and biases of large language models. Meanwhile creatives and academics have leveraged LLMs to develop creative works and explore the boundaries of their writing capabilities through text generation and code. This study suggests that creative text prompting, specifically Poetry Prompt Patterns, may be a useful addition to the toolbox of the prompt engineer, and outlines the process by which this approach may be taken. Then, the paper uses poetic prompts to assess descriptions and evaluations of three models of a renowned poet and test the consequences of the willingness of models to adapt or rewrite original creative works for presumed audiences.",,0,2025-12-04
Automatic Attack Discovery for Few-Shot Class-Incremental Learning via Large Language Models,2025-12-03 15:34:26+00:00,http://arxiv.org/abs/2512.03882v1,"Haidong Kang, Wei Wu, Hanling Wang",cs.LG,creativity,"Few-shot class incremental learning (FSCIL) is a more realistic and challenging paradigm in continual learning to incrementally learn unseen classes and overcome catastrophic forgetting on base classes with only a few training examples. Previous efforts have primarily centered around studying more effective FSCIL approaches. By contrast, less attention was devoted to thinking the security issues in contributing to FSCIL. This paper aims to provide a holistic study of the impact of attacks on FSCIL. We first derive insights by systematically exploring how human expert-designed attack methods (i.e., PGD, FGSM) affect FSCIL. We find that those methods either fail to attack base classes, or suffer from huge labor costs due to relying on huge expert knowledge. This highlights the need to craft a specialized attack method for FSCIL. Grounded in these insights, in this paper, we propose a simple yet effective ACraft method to automatically steer and discover optimal attack methods targeted at FSCIL by leveraging Large Language Models (LLMs) without human experts. Moreover, to improve the reasoning between LLMs and FSCIL, we introduce a novel Proximal Policy Optimization (PPO) based reinforcement learning to optimize learning, making LLMs generate better attack methods in the next generation by establishing positive feedback. Experiments on mainstream benchmarks show that our ACraft significantly degrades the performance of state-of-the-art FSCIL methods and dramatically beyond human expert-designed attack methods while maintaining the lowest costs of attack.",,0,2025-12-03
LLM-Generated Ads: From Personalization Parity to Persuasion Superiority,2025-12-03 02:13:38+00:00,http://arxiv.org/abs/2512.03373v1,"Elyas Meguellati, Stefano Civelli, Lei Han, Abraham Bernstein, Shazia Sadiq, Gianluca Demartini","cs.CY, cs.CL",creativity,"As large language models (LLMs) become increasingly capable of generating persuasive content, understanding their effectiveness across different advertising strategies becomes critical. This paper presents a two-part investigation examining LLM-generated advertising through complementary lenses: (1) personality-based and (2) psychological persuasion principles.
  In our first study (n=400), we tested whether LLMs could generate personalized advertisements tailored to specific personality traits (openness and neuroticism) and how their performance compared to human experts. Results showed that LLM-generated ads achieved statistical parity with human-written ads (51.1% vs. 48.9%, p > 0.05), with no significant performance differences for matched personalities.
  Building on these insights, our second study (n=800) shifted focus from individual personalization to universal persuasion, testing LLM performance across four foundational psychological principles: authority, consensus, cognition, and scarcity. AI-generated ads significantly outperformed human-created content, achieving a 59.1% preference rate (vs. 40.9%, p < 0.001), with the strongest performance in authority (63.0%) and consensus (62.5%) appeals. Qualitative analysis revealed AI's advantage stems from crafting more sophisticated, aspirational messages and achieving superior visual-narrative coherence. Critically, this quality advantage proved robust: even after applying a 21.2 percentage point detection penalty when participants correctly identified AI-origin, AI ads still outperformed human ads, and 29.4% of participants chose AI content despite knowing its origin. These findings demonstrate LLMs' evolution from parity in personalization to superiority in persuasive storytelling, with significant implications for advertising practice given LLMs' near-zero marginal cost and time requirements compared to human experts.",,0,2025-12-03
ASCIIBench: Evaluating Language-Model-Based Understanding of Visually-Oriented Text,2025-12-02 20:55:42+00:00,http://arxiv.org/abs/2512.04125v1,"Kerry Luo, Michael Fu, Joshua Peguero, Husnain Malik, Anvay Patil, Joyce Lin, Megan Van Overborg, Ryan Sarmiento, Kevin Zhu",cs.LG,creativity,"Large language models (LLMs) have demonstrated several emergent behaviors with scale, including reasoning and fluency in long-form text generation. However, they continue to struggle with tasks requiring precise spatial and positional reasoning. ASCII art, a symbolic medium where characters encode structure and form, provides a unique probe of this limitation. We introduce ASCIIBench, a novel benchmark for evaluating both the generation and classification of ASCII-text images. ASCIIBench consists of a filtered dataset of 5,315 class-labeled ASCII images and is, to our knowledge, the first publicly available benchmark of its kind. Alongside the dataset, we release weights for a fine-tuned CLIP model adapted to capture ASCII structure, enabling the evaluation of LLM-generated ASCII art. Our analysis shows that cosine similarity over CLIP embeddings fails to separate most ASCII categories, yielding chance-level performance even for low-variance classes. In contrast, classes with high internal mean similarity exhibit clear discriminability, revealing that the bottleneck lies in representation rather than generational variance. These findings position ASCII art as a stress test for multimodal representations and motivate the development of new embedding methods or evaluation metrics tailored to symbolic visual modalities. All resources are available at https://github.com/ASCIIBench/ASCIIBench.",,0,2025-12-02
PEFT-Factory: Unified Parameter-Efficient Fine-Tuning of Autoregressive Large Language Models,2025-12-02 13:44:41+00:00,http://arxiv.org/abs/2512.02764v1,"Robert Belanec, Ivan Srba, Maria Bielikova",cs.CL,creativity,"Parameter-Efficient Fine-Tuning (PEFT) methods address the increasing size of Large Language Models (LLMs). Currently, many newly introduced PEFT methods are challenging to replicate, deploy, or compare with one another. To address this, we introduce PEFT-Factory, a unified framework for efficient fine-tuning LLMs using both off-the-shelf and custom PEFT methods. While its modular design supports extensibility, it natively provides a representative set of 19 PEFT methods, 27 classification and text generation datasets addressing 12 tasks, and both standard and PEFT-specific evaluation metrics. As a result, PEFT-Factory provides a ready-to-use, controlled, and stable environment, improving replicability and benchmarking of PEFT methods. PEFT-Factory is a downstream framework that originates from the popular LLaMA-Factory, and is publicly available at https://github.com/kinit-sk/PEFT-Factory",,0,2025-12-02
DialogGuard: Multi-Agent Psychosocial Safety Evaluation of Sensitive LLM Responses,2025-12-01 23:53:45+00:00,http://arxiv.org/abs/2512.02282v1,"Han Luo, Guy Laban","cs.AI, cs.HC, cs.MA",creativity,"Large language models (LLMs) now mediate many web-based mental-health, crisis, and other emotionally sensitive services, yet their psychosocial safety in these settings remains poorly understood and weakly evaluated. We present DialogGuard, a multi-agent framework for assessing psychosocial risks in LLM-generated responses along five high-severity dimensions: privacy violations, discriminatory behaviour, mental manipulation, psychological harm, and insulting behaviour. DialogGuard can be applied to diverse generative models through four LLM-as-a-judge pipelines, including single-agent scoring, dual-agent correction, multi-agent debate, and stochastic majority voting, grounded in a shared three-level rubric usable by both human annotators and LLM judges. Using PKU-SafeRLHF with human safety annotations, we show that multi-agent mechanisms detect psychosocial risks more accurately than non-LLM baselines and single-agent judging; dual-agent correction and majority voting provide the best trade-off between accuracy, alignment with human ratings, and robustness, while debate attains higher recall but over-flags borderline cases. We release Dialog-Guard as open-source software with a web interface that provides per-dimension risk scores and explainable natural-language rationales. A formative study with 12 practitioners illustrates how it supports prompt design, auditing, and supervision of web-facing applications for vulnerable users.",,0,2025-12-01
InstructLR: A Scalable Approach to Create Instruction Dataset for Under-Resourced Languages,2025-12-01 21:25:33+00:00,http://arxiv.org/abs/2512.02213v1,"Mamadou K. Keita, Sebastien Diarra, Christopher Homan, Seydou Diallo",cs.LG,creativity,"Effective text generation and chat interfaces for low-resource languages (LRLs) remain a challenge for state-of-the-art large language models (LLMs) to support. This is mainly due to the difficulty of curating high-quality instruction datasets for LRLs, a limitation prevalent in the languages spoken across the African continent and other regions. Current approaches, such as automated translation and synthetic data generation, frequently yield outputs that lack fluency or even orthographic consistency. In this paper, we introduce InstructLR, a novel framework designed to generate high-quality instruction datasets for LRLs. Our approach integrates LLM-driven text generation with a dual-layer quality filtering mechanism: an automated filtering layer based on retrieval-augmented-generation (RAG)-based n-shot prompting, and a human-in-the-loop validation layer. Drawing inspiration from benchmarks such as MMLU in task definition, InstructLR has facilitated the creation of three multi-domain instruction benchmarks: ZarmaInstruct-50k, BambaraInstruct-50k, and FulfuldeInstruct-50k.",,0,2025-12-01
"First, do NOHARM: towards clinically safe large language models",2025-12-01 03:33:16+00:00,http://arxiv.org/abs/2512.01241v2,"David Wu, Fateme Nateghi Haredasht, Saloni Kumar Maharaj, Priyank Jain, Jessica Tran, Matthew Gwiazdon, Arjun Rustagi, Jenelle Jindal, Jacob M. Koshy, Vinay Kadiyala, Anup Agarwal, Bassman Tappuni, Brianna French, Sirus Jesudasen, Christopher V. Cosgriff, Rebanta Chakraborty, Jillian Caldwell, Susan Ziolkowski, David J. Iberri, Robert Diep, Rahul S. Dalal, Kira L. Newman, Kristin Galetta, J. Carl Pallais, Nancy Wei, Kathleen M. Buchheit, David I. Hong, Ernest Y. Lee, Allen Shih, Vartan Pahalyants, Tamara B. Kaplan, Vishnu Ravi, Sarita Khemani, April S. Liang, Daniel Shirvani, Advait Patil, Nicholas Marshall, Kanav Chopra, Joel Koh, Adi Badhwar, Liam G. McCoy, David J. H. Wu, Yingjie Weng, Sumant Ranji, Kevin Schulman, Nigam H. Shah, Jason Hom, Arnold Milstein, Adam Rodman, Jonathan H. Chen, Ethan Goh","cs.CY, cs.AI",creativity,"Large language models (LLMs) are routinely used by physicians and patients for medical advice, yet their clinical safety profiles remain poorly characterized. We present NOHARM (Numerous Options Harm Assessment for Risk in Medicine), a benchmark using 100 real primary care-to-specialist consultation cases to measure frequency and severity of harm from LLM-generated medical recommendations. NOHARM covers 10 specialties, with 12,747 expert annotations for 4,249 clinical management options. Across 31 LLMs, potential for severe harm from LLM recommendations occurs in up to 22.2% (95% CI 21.6-22.8%) of cases, with harm of omission accounting for 76.6% (95% CI 76.4-76.8%) of errors. Safety performance is only moderately correlated (r = 0.61-0.64) with existing AI and medical knowledge benchmarks. The best models outperform generalist physicians on safety (mean difference 9.7%, 95% CI 7.0-12.5%), and a diverse multi-agent approach improves safety compared to solo models (mean difference 8.0%, 95% CI 4.0-12.1%). Therefore, despite strong performance on existing evaluations, widely used AI models can produce severely harmful medical advice at nontrivial rates, underscoring clinical safety as a distinct performance dimension necessitating explicit measurement.",,0,2025-12-01
Evaluating Legal Reasoning Traces with Legal Issue Tree Rubrics,2025-11-30 18:32:43+00:00,http://arxiv.org/abs/2512.01020v1,"Jinu Lee, Kyoung-Woon On, Simeng Han, Arman Cohan, Julia Hockenmaier","cs.AI, cs.CL",creativity,"Evaluating the quality of LLM-generated reasoning traces in expert domains (e.g., law) is essential for ensuring credibility and explainability, yet remains challenging due to the inherent complexity of such reasoning tasks. We introduce LEGIT (LEGal Issue Trees), a novel large-scale (24K instances) expert-level legal reasoning dataset with an emphasis on reasoning trace evaluation. We convert court judgments into hierarchical trees of opposing parties' arguments and the court's conclusions, which serve as rubrics for evaluating the issue coverage and correctness of the reasoning traces. We verify the reliability of these rubrics via human expert annotations and comparison with coarse, less informative rubrics. Using the LEGIT dataset, we show that (1) LLMs' legal reasoning ability is seriously affected by both legal issue coverage and correctness, and that (2) retrieval-augmented generation (RAG) and RL with rubrics bring complementary benefits for legal reasoning abilities, where RAG improves overall reasoning capability, whereas RL improves correctness albeit with reduced coverage.",,0,2025-11-30
Large Language Models for Scientific Idea Generation: A Creativity-Centered Survey,2025-11-05 07:50:43+00:00,http://arxiv.org/abs/2511.07448,"Fatemeh Shahhosseini, Arash Marioriyad, Ali Momen, Mahdieh Soleymani Baghshah, Mohammad Hossein Rohban, Shaghayegh Haghjooy Javanmard",,creativity,"Scientific idea generation lies at the heart of scientific discovery and has driven human progress-whether by solving unsolved problems or proposing novel hypotheses to explain unknown phenomena. Unlike standard scientific reasoning or general creative generation, idea generation in science is a multi-objective and open-ended task, where the novelty of a contribution is as essential as its empirical soundness. Large language models (LLMs) have recently emerged as promising generators of scientific ideas, capable of producing coherent and factual outputs with surprising intuition and acceptable reasoning, yet their creative capacity remains inconsistent and poorly understood. This survey provides a structured synthesis of methods for LLM-driven scientific ideation, examining how different approaches balance creativity with scientific soundness. We categorize existing methods into five complementary families: External knowledge augmentation, Prompt-based distributional steering, Inference-time scaling, Multi-agent collaboration, and Parameter-level adaptation. To interpret their contributions, we employ two complementary frameworks: Boden's taxonomy of Combinatorial, Exploratory and Transformational creativity to characterize the level of ideas each family expected to generate, and Rhodes' 4Ps framework-Person, Process, Press, and Product-to locate the aspect or source of creativity that each method emphasizes. By aligning methodological advances with creativity frameworks, this survey clarifies the state of the field and outlines key directions toward reliable, systematic, and transformative applications of LLMs in scientific discovery.",hf,3,2025-11-05
VLM-Guided Adaptive Negative Prompting for Creative Generation,2025-10-12 17:34:59+00:00,http://arxiv.org/abs/2510.10715,"Shelly Golan, Yotam Nitzan, Zongze Wu, Or Patashnik",,creativity,"Creative generation is the synthesis of new, surprising, and valuable samples
that reflect user intent yet cannot be envisioned in advance. This task aims to
extend human imagination, enabling the discovery of visual concepts that exist
in the unexplored spaces between familiar domains. While text-to-image
diffusion models excel at rendering photorealistic scenes that faithfully match
user prompts, they still struggle to generate genuinely novel content. Existing
approaches to enhance generative creativity either rely on interpolation of
image features, which restricts exploration to predefined categories, or
require time-intensive procedures such as embedding optimization or model
fine-tuning. We propose VLM-Guided Adaptive Negative-Prompting, a
training-free, inference-time method that promotes creative image generation
while preserving the validity of the generated object. Our approach utilizes a
vision-language model (VLM) that analyzes intermediate outputs of the
generation process and adaptively steers it away from conventional visual
concepts, encouraging the emergence of novel and surprising outputs. We
evaluate creativity through both novelty and validity, using statistical
metrics in the CLIP embedding space. Through extensive experiments, we show
consistent gains in creative novelty with negligible computational overhead.
Moreover, unlike existing methods that primarily generate single objects, our
approach extends to complex scenarios, such as generating coherent sets of
creative objects and preserving creativity within elaborate compositional
prompts. Our method integrates seamlessly into existing diffusion pipelines,
offering a practical route to producing creative outputs that venture beyond
the constraints of textual descriptions.",hf,4,2025-10-12
Combinatorial Creativity: A New Frontier in Generalization Abilities,2025-09-25 11:48:37+00:00,http://arxiv.org/abs/2509.21043,"Samuel Schapiro, Sumuk Shashidhar, Alexi Gladstone, Jonah Black, Royce Moon, Dilek Hakkani-Tur, Lav R. Varshney",,creativity,"Artificial intelligence (AI) systems, and Large Language Models (LLMs) in
particular, are increasingly employed for creative tasks like scientific idea
generation, constituting a form of generalization from training data
unaddressed by existing conceptual frameworks. Despite its similarities to
compositional generalization (CG), combinatorial creativity (CC) is an
open-ended ability. Instead of evaluating for accuracy or correctness against
fixed targets, which would contradict the open-ended nature of CC, we propose a
theoretical framework and algorithmic task for evaluating outputs by their
degrees of novelty and utility. From here, we make several important empirical
contributions: (1) We obtain the first insights into the scaling behavior of
creativity for LLMs. (2) We discover that, for fixed compute budgets, there
exist optimal model depths and widths for creative ability. (3) We find that
the ideation-execution gap, whereby LLMs excel at generating novel scientific
ideas but struggle to ensure their practical feasibility, may be explained by a
more fundamental novelty-utility tradeoff characteristic of creativity
algorithms in general. Importantly, this tradeoff remains persistent even at
scale, casting doubt on the long-term creative potential of LLMs in their
current form. Together, our conceptual framework and empirical findings provide
a foundation for understanding and improving creativity in modern AI models,
bridging the gap between human and machine intelligence.",hf,3,2025-09-25
