title,pubdate,id,authors,categories,search,abstract,source,hf_upvotes,displaydate
LogitScope: A Framework for Analyzing LLM Uncertainty Through Information Metrics,2026-03-26 01:46:24+00:00,http://arxiv.org/abs/2603.24929v1,"Farhan Ahmed, Yuya Jeremy Ong, Chad DeLuca","cs.AI, cs.CL, cs.IT",creativity,"Understanding and quantifying uncertainty in large language model (LLM) outputs is critical for reliable deployment. However, traditional evaluation approaches provide limited insight into model confidence at individual token positions during generation. To address this issue, we introduce LogitScope, a lightweight framework for analyzing LLM uncertainty through token-level information metrics computed from probability distributions. By measuring metrics such as entropy and varentropy at each generation step, LogitScope reveals patterns in model confidence, identifies potential hallucinations, and exposes decision points where models exhibit high uncertainty, all without requiring labeled data or semantic interpretation. We demonstrate LogitScope's utility across diverse applications including uncertainty quantification, model behavior analysis, and production monitoring. The framework is model-agnostic, computationally efficient through lazy evaluation, and compatible with any HuggingFace model, enabling both researchers and practitioners to inspect LLM behavior during inference.",,0,2026-03-26
MARCH: Multi-Agent Reinforced Self-Check for LLM Hallucination,2026-03-25 17:54:10+00:00,http://arxiv.org/abs/2603.24579v1,"Zhuo Li, Yupeng Zhang, Pengyu Cheng, Jiajun Song, Mengyu Zhou, Hao Li, Shujie Hu, Yu Qin, Erchao Zhao, Xiaoxi Jiang, Guanjun Jiang",cs.CL,creativity,"Hallucination remains a critical bottleneck for large language models (LLMs), undermining their reliability in real-world applications, especially in Retrieval-Augmented Generation (RAG) systems. While existing hallucination detection methods employ LLM-as-a-judge to verify LLM outputs against retrieved evidence, they suffer from inherent confirmation bias, where the verifier inadvertently reproduces the errors of the original generation. To address this, we introduce Multi-Agent Reinforced Self-Check for Hallucination (MARCH), a framework that enforces rigorous factual alignment by leveraging deliberate information asymmetry. MARCH orchestrates a collaborative pipeline of three specialized agents: a Solver, a Proposer, and a Checker. The Solver generates an initial RAG response, which the Proposer decomposes into claim-level verifiable atomic propositions. Crucially, the Checker validates these propositions against retrieved evidence in isolation, deprived of the Solver's original output. This well-crafted information asymmetry scheme breaks the cycle of self-confirmation bias. By training this pipeline with multi-agent reinforcement learning (MARL), we enable the agents to co-evolve and optimize factual adherence. Extensive experiments across hallucination benchmarks demonstrate that MARCH substantially reduces hallucination rates. Notably, an 8B-parameter LLM equipped with MARCH achieves performance competitive with powerful closed-source models. MARCH paves a scalable path for factual self-improvement of LLMs through co-evolution. The code is at https://github.com/Qwen-Applications/MARCH.",,0,2026-03-25
Evaluating LLM-Based Test Generation Under Software Evolution,2026-03-24 17:14:18+00:00,http://arxiv.org/abs/2603.23443v1,"Sabaat Haroon, Mohammad Taha Khan, Muhammad Ali Gulzar","cs.SE, cs.AI",creativity,"Large Language Models (LLMs) are increasingly used for automated unit test generation. However, it remains unclear whether these tests reflect genuine reasoning about program behavior or simply reproduce superficial patterns learned during training. If the latter dominates, LLM-generated tests may exhibit weaknesses such as reduced coverage, missed regressions, and undetected faults. Understanding how LLMs generate tests and how those tests respond to code evolution is therefore essential. We present a large-scale empirical study of LLM-based test generation under program changes. Using an automated mutation-driven framework, we analyze how generated tests react to semantic-altering changes (SAC) and semantic-preserving changes (SPC) across eight LLMs and 22,374 program variants.
  LLMs achieve strong baseline results, reaching 79% line coverage and 76% branch coverage with fully passing test suites on the original programs. However, performance degrades as programs evolve. Under SACs, the pass rate of newly generated tests drops to 66%, and branch coverage declines to 60%. More than 99% of failing SAC tests pass on the original program while executing the modified region, indicating residual alignment with the original behavior rather than adaptation to updated semantics. Performance also declines under SPCs despite unchanged functionality: pass rates fall to 79% and branch coverage to 69%. Although SPC edits preserve semantics, they often introduce larger syntactic changes, leading to instability in generated test suites. Models generate more new tests while discarding many baseline tests, suggesting sensitivity to lexical changes rather than true semantic impact. Overall, our results indicate that current LLM-based test generation relies heavily on surface-level cues and struggles to maintain regression awareness as programs evolve.",,0,2026-03-24
"Is AI Catching Up to Human Expression? Exploring Emotion, Personality, Authorship, and Linguistic Style in English and Arabic with Six Large Language Models",2026-03-24 14:17:02+00:00,http://arxiv.org/abs/2603.23251v1,Nasser A Alsadhan,"cs.CL, cs.LG",creativity,"The advancing fluency of LLMs raises important questions about their ability to emulate complex human traits, including emotional expression and personality, across diverse linguistic and cultural contexts. This study investigates whether LLMs can convincingly mimic emotional nuance in English and personality markers in Arabic, a critical under-resourced language with unique linguistic and cultural characteristics. We conduct two tasks across six models:Jais, Mistral, LLaMA, GPT-4o, Gemini, and DeepSeek. First, we evaluate whether machine classifiers can reliably distinguish between human-authored and AI-generated texts. Second, we assess the extent to which LLM-generated texts exhibit emotional or personality traits comparable to those of humans. Our results demonstrate that AI-generated texts are distinguishable from human-authored ones (F1>0.95), though classification performance deteriorates on paraphrased samples, indicating a reliance on superficial stylistic cues. Emotion and personality classification experiments reveal significant generalization gaps: classifiers trained on human data perform poorly on AI-generated texts and vice versa, suggesting LLMs encode affective signals differently from humans. Importantly, augmenting training with AI-generated data enhances performance in the Arabic personality classification task, highlighting the potential of synthetic data to address challenges in under-resourced languages. Model-specific analyses show that GPT-4o and Gemini exhibit superior affective coherence. Linguistic and psycholinguistic analyses reveal measurable divergences in tone, authenticity, and textual complexity between human and AI texts. These findings have implications for affective computing, authorship attribution, and responsible AI deployment, particularly within underresourced language contexts where generative AI detection and alignment pose unique challenges.",,0,2026-03-24
Parametric Knowledge and Retrieval Behavior in RAG Fine-Tuning for Electronic Design Automation,2026-03-24 10:33:57+00:00,http://arxiv.org/abs/2603.23047v1,"Julian Oestreich, Maximilian Bley, Frank Binder, Lydia Müller, Maksym Sydorenko, André Alcalde","cs.CL, cs.AI, cs.CE",creativity,"Retrieval-Augmented Generation (RAG) fine-tuning has shown substantial improvements over vanilla RAG, yet most studies target document question answering and often rely on standard NLP metrics that can obscure factual differences. We evaluate RAG fine-tuning for long-form text generation in electronic design automation, adapting a 7B model under five context augmentation strategies with varying retrieval conditions. We introduce TriFEX, a human-validated, triple-based evaluation pipeline that attributes generated claims to their origin-user query, context and reference-and propose Parametric Knowledge Precision (PKP), which isolates internalized knowledge by filtering out claims leaked in the prompt. We show that ROUGE and BERTScore fail to detect factual differences that our triple-based evaluation reveals. Additionally, we demonstrate that an existing metric for knowledge internalization is retrieva-sensitive, with about 75% of its cross-condition variance driven by changes in the rate at which internal knowledge is expressed (PR), rather than by changes in its actual correctness (PKP). The fine-tuned 7B variants outperform a 72B baseline on most metrics, further showing generalization across conditions and on a related benchmark. These results underscore the limitations of available metrics in RAG evaluation and show that smaller models could be reasonably well adapted to specialized tasks for cost-efficient, on-premises deployment.",,0,2026-03-24
LLM-guided headline rewriting for clickability enhancement without clickbait,2026-03-23 18:25:48+00:00,http://arxiv.org/abs/2603.22459v1,"Yehudit Aperstein, Linoy Halifa, Sagiv Bar, Alexander Apartsin","cs.CL, cs.AI",creativity,"Enhancing reader engagement while preserving informational fidelity is a central challenge in controllable text generation for news media. Optimizing news headlines for reader engagement is often conflated with clickbait, resulting in exaggerated or misleading phrasing that undermines editorial trust. We frame clickbait not as a separate stylistic category, but as an extreme outcome of disproportionate amplification of otherwise legitimate engagement cues. Based on this view, we formulate headline rewriting as a controllable generation problem, where specific engagement-oriented linguistic attributes are selectively strengthened under explicit constraints on semantic faithfulness and proportional emphasis. We present a guided headline rewriting framework built on a large language model (LLM) that uses the Future Discriminators for Generation (FUDGE) paradigm for inference-time control. The LLM is steered by two auxiliary guide models: (1) a clickbait scoring model that provides negative guidance to suppress excessive stylistic amplification, and (2) an engagement-attribute model that provides positive guidance aligned with target clickability objectives. Both guides are trained on neutral headlines drawn from a curated real-world news corpus. At the same time, clickbait variants are generated synthetically by rewriting these original headlines using an LLM under controlled activation of predefined engagement tactics. By adjusting guidance weights at inference time, the system generates headlines along a continuum from neutral paraphrases to more engaging yet editorially acceptable formulations. The proposed framework provides a principled approach for studying the trade-off between attractiveness, semantic preservation, and clickbait avoidance, and supports responsible LLM-based headline optimization in journalistic settings.",,0,2026-03-23
Dual-Space Knowledge Distillation with Key-Query Matching for Large Language Models with Vocabulary Mismatch,2026-03-23 14:53:55+00:00,http://arxiv.org/abs/2603.22056v1,"Stella Eva Tsiapali, Cong-Thanh Do, Kate Knill",cs.CL,creativity,"Large language models (LLMs) achieve state-of-the-art (SOTA) performance across language tasks, but are costly to deploy due to their size and resource demands. Knowledge Distillation (KD) addresses this by training smaller Student models to mimic larger Teacher models, improving efficiency without significant performance loss. Dual-Space Knowledge Distillation with Cross-Model Attention (DSKD-CMA) has emerged as a SOTA method for KD between LLMs with distinct tokenizers, yet its internal workings remain largely opaque. In this work, we systematically analyse the attention mechanism of DSKD-CMA through manual token alignment probing and heatmap visualisations, revealing both strengths and limitations. Building on this, we introduce a novel method, DSKD-CMA-GA, based on Generative Adversarial (GA) learning, to address the mismatched distributions between the keys and queries computed from distinct models. Experiments show modest but consistent ROUGE-L gains in text generation quality, particularly on out-of-distribution data (+0.37 on average), narrowing the gap between cross- and same-tokenizer KD.",,0,2026-03-23
Optimizing Multi-Agent Weather Captioning via Text Gradient Descent: A Training-Free Approach with Consensus-Aware Gradient Fusion,2026-03-23 07:55:45+00:00,http://arxiv.org/abs/2603.21673v1,Shixu Liu,cs.CL,creativity,"Generating interpretable natural language captions from weather time series data remains a significant challenge at the intersection of meteorological science and natural language processing. While recent advances in Large Language Models (LLMs) have demonstrated remarkable capabilities in time series forecasting and analysis, existing approaches either produce numerical predictions without human-accessible explanations or generate generic descriptions lacking domain-specific depth. We introduce WeatherTGD, a training-free multi-agent framework that reinterprets collaborative caption refinement through the lens of Text Gradient Descent (TGD). Our system deploys three specialized LLM agents including a Statistical Analyst, a Physics Interpreter, and a Meteorology Expert that generate domain-specific textual gradients from weather time series observations. These gradients are aggregated through a novel Consensus-Aware Gradient Fusion mechanism that extracts common signals while preserving unique domain perspectives. The fused gradients then guide an iterative refinement process analogous to gradient descent, where each LLM-generated feedback signal updates the caption toward an optimal solution. Experiments on real-world meteorological datasets demonstrate that WeatherTGD achieves significant improvements in both LLM-based evaluation and human expert evaluation, substantially outperforming existing multi-agent baselines while maintaining computational efficiency through parallel agent execution.",,0,2026-03-23
LLM-Based Test Case Generation in DBMS through Monte Carlo Tree Search,2026-03-23 03:42:17+00:00,http://arxiv.org/abs/2603.21530v1,"Yujia Chen, Yingli Zhou, Fangyuan Zhang, Cuiyun Gao","cs.SE, cs.AI",creativity,"Database Management Systems (DBMSs) are fundamental infrastructure for modern data-driven applications, where thorough testing with high-quality SQL test cases is essential for ensuring system reliability. Traditional approaches such as fuzzing can be effective for specific DBMSs, but adapting them to different proprietary dialects requires substantial manual effort. Large Language Models (LLMs) present promising opportunities for automated SQL test generation, but face critical challenges in industrial environments. First, lightweight models are widely used in organizations due to security and privacy constraints, but they struggle to generate syntactically valid queries for proprietary SQL dialects. Second, LLM-generated queries are often semantically similar and exercise only shallow execution paths, thereby quickly reaching a coverage plateau. To address these challenges, we propose MIST, an LLM-based test case generatIon framework for DBMS through Monte Carlo Tree search. MIST consists of two stages: Feature-Guided Error-Driven Test Case Synthetization, which constructs a hierarchical feature tree and uses error feedback to guide LLM generation, aiming to produce syntactically valid and semantically diverse queries for different DBMS dialects, and Monte Carlo Tree Search-Based Test Case Mutation, which jointly optimizes seed query selection and mutation rule application guided by coverage feedback, aiming at boosting code coverage by exploring deeper execution paths. Experiments on three widely-used DBMSs with four lightweight LLMs show that MIST achieves average improvements of 43.3% in line coverage, 32.3% in function coverage, and 46.4% in branch coverage compared to the baseline approach with the highest line coverage of 69.3% in the Optimizer module.",,0,2026-03-23
SafePilot: A Framework for Assuring LLM-enabled Cyber-Physical Systems,2026-03-23 03:31:51+00:00,http://arxiv.org/abs/2603.21523v1,"Weizhe Xu, Mengyu Liu, Fanxin Kong","cs.RO, cs.AI",creativity,"Large Language Models (LLMs), deep learning architectures with typically over 10 billion parameters, have recently begun to be integrated into various cyber-physical systems (CPS) such as robotics, industrial automation, and autopilot systems. The abstract knowledge and reasoning capabilities of LLMs are employed for tasks like planning and navigation. However, a significant challenge arises from the tendency of LLMs to produce ""hallucinations"" - outputs that are coherent yet factually incorrect or contextually unsuitable. This characteristic can lead to undesirable or unsafe actions in the CPS. Therefore, our research focuses on assuring the LLM-enabled CPS by enhancing their critical properties. We propose SafePilot, a novel hierarchical neuro-symbolic framework that provides end-to-end assurance for LLM-enabled CPS according to attribute-based and temporal specifications. Given a task and its specification, SafePilot first invokes a hierarchical planner with a discriminator that assesses task complexity. If the task is deemed manageable, it is passed directly to an LLM-based task planner with built-in verification. Otherwise, the hierarchical planner applies a divide-and-conquer strategy, decomposing the task into sub-tasks, each of which is individually planned and later merged into a final solution. The LLM-based task planner translates natural language constraints into formal specifications and verifies the LLM's output against them. If violations are detected, it identifies the flaw, adjusts the prompt accordingly, and re-invokes the LLM. This iterative process continues until a valid plan is produced or a predefined limit is reached. Our framework supports LLM-enabled CPS with both attribute-based and temporal constraints. Its effectiveness and adaptability are demonstrated through two illustrative case studies.",,0,2026-03-23
MzansiText and MzansiLM: An Open Corpus and Decoder-Only Language Model for South African Languages,2026-03-21 09:35:40+00:00,http://arxiv.org/abs/2603.20732v1,"Anri Lombard, Simbarashe Mawere, Temi Aina, Ethan Wolff, Sbonelo Gumede, Elan Novick, Francois Meyer, Jan Buys",cs.CL,creativity,"Decoder-only language models can be adapted to diverse tasks through instruction finetuning, but the extent to which this generalizes at small scale for low-resource languages remains unclear. We focus on the languages of South Africa, where we are not aware of a publicly available decoder-only model that explicitly targets all eleven official written languages, nine of which are low-resource. We introduce MzansiText, a curated multilingual pretraining corpus with a reproducible filtering pipeline, and MzansiLM, a 125M-parameter language model trained from scratch. We evaluate MzansiLM on natural language understanding and generation using three adaptation regimes: monolingual task-specific finetuning, multilingual task-specific finetuning, and general multi-task instruction finetuning. Monolingual task-specific finetuning achieves strong performance on data-to-text generation, reaching 20.65 BLEU on isiXhosa and competing with encoder-decoder baselines over ten times larger. Multilingual task-specific finetuning benefits closely related languages on topic classification, achieving 78.5% macro-F1 on isiXhosa news classification. While MzansiLM adapts effectively to supervised NLU and NLG tasks, few-shot reasoning remains challenging at this model size, with performance near chance even for much larger decoder-only models. We release MzansiText and MzansiLM to provide a reproducible decoder-only baseline and clear guidance on adaptation strategies for South African languages at small scale.",,0,2026-03-21
D5P4: Partition Determinantal Point Process for Diversity in Parallel Discrete Diffusion Decoding,2026-03-19 17:02:08+00:00,http://arxiv.org/abs/2603.19146v1,"Jonathan Lys, Vincent Gripon, Bastien Pasdeloup, Axel Marmoret, Lukas Mauch, Fabien Cardinaux, Ghouthi Boukli Hacene","cs.AI, cs.LG",creativity,"Discrete diffusion models are promising alternatives to autoregressive approaches for text generation, yet their decoding methods remain under-studied. Standard decoding methods for autoregressive models, such as beam search, do not directly apply to iterative denoising, and existing diffusion decoding techniques provide limited control over in-batch diversity. To bridge this gap, we introduce a generalized beam-search framework for discrete diffusion that generates candidates in parallel and supports modular beam-selection objectives. As a diversity-focused instantiation, we propose D5P4, which formulates the selection step as MAP inference over a Determinantal Point Process. Leveraging a scalable greedy solver, D5P4 maintains multi-GPU compatibility and enables an explicit trade-off between model probability and target diversity with near-zero compute overhead. Experiments on free-form generation and question answering demonstrate that D5P4 improves diversity over strong baselines while maintaining competitive generation quality.",,0,2026-03-19
Serendipity by Design: Evaluating the Impact of Cross-domain Mappings on Human and LLM Creativity,2026-03-19 16:12:05+00:00,http://arxiv.org/abs/2603.19087v1,"Qiawen Ella Liu, Marina Dubova, Henry Conklin, Takumi Harada, Thomas L. Griffiths","cs.AI, cs.CL",creativity,"Are large language models (LLMs) creative in the same way humans are, and can the same interventions increase creativity in both? We evaluate a promising but largely untested intervention for creativity: forcing creators to draw an analogy from a random, remote source domain (''cross-domain mapping''). Human participants and LLMs generated novel features for ten daily products (e.g., backpack, TV) under two prompts: (i) cross-domain mapping, which required translating a property from a randomly assigned source (e.g., octopus, cactus, GPS), and (ii) user-need, which required proposing innovations targeting unmet user needs. We show that humans reliably benefit from randomly assigned cross-domain mappings, while LLMs, on average, generate more original ideas than humans and do not show a statistically significant effect of cross-domain mappings. However, in both systems, the impact of cross-domain mapping increases when the inspiration source becomes more semantically distant from the target. Our results highlight both the role of remote association in creative ideation and systematic differences in how humans and LLMs respond to the same intervention for creativity.",,0,2026-03-19
Expert Personas Improve LLM Alignment but Damage Accuracy: Bootstrapping Intent-Based Persona Routing with PRISM,2026-03-19 05:28:21+00:00,http://arxiv.org/abs/2603.18507v1,"Zizhao Hu, Mohammad Rostami, Jesse Thomason",cs.AI,creativity,"Persona prompting can steer LLM generation towards a domain-specific tone and pattern. This behavior enables use cases in multi-agent systems where diverse interactions are crucial and human-centered tasks require high-level human alignment. Prior works provide mixed opinions on their utility: some report performance gains when using expert personas for certain domains and their contribution to data diversity in synthetic data creation, while others find near-zero or negative impact on general utility. To fully leverage the benefits of the LLM persona and avoid its harmfulness, a more comprehensive investigation of the mechanism is crucial. In this work, we study how model optimization, task type, prompt length, and placement can impact expert persona effectiveness across instruction-tuned and reasoning LLMs, and provide insight into conditions under which expert personas fail and succeed. Based on our findings, we developed a pipeline to fully leverage the benefits of an expert persona, named PRISM (Persona Routing via Intent-based Self-Modeling), which self-distills an intent-conditioned expert persona into a gated LoRA adapter through a bootstrapping process that requires no external data, models, or knowledge. PRISM enhances human preference and safety alignment on generative tasks while maintaining accuracy on discriminative tasks across all models, with minimal memory and computing overhead.",,0,2026-03-19
