title,pubdate,id,authors,categories,search,abstract,source,hf_upvotes,displaydate
PaperTrail: A Claim-Evidence Interface for Grounding Provenance in LLM-based Scholarly Q&A,2026-02-24 16:04:50+00:00,http://arxiv.org/abs/2602.21045v1,"Anna Martin-Boyle, Cara A. C. Leckey, Martha C. Brown, Harmanpreet Kaur","cs.HC, cs.CL",creativity,"Large language models (LLMs) are increasingly used in scholarly question-answering (QA) systems to help researchers synthesize vast amounts of literature. However, these systems often produce subtle errors (e.g., unsupported claims, errors of omission), and current provenance mechanisms like source citations are not granular enough for the rigorous verification that scholarly domain requires. To address this, we introduce PaperTrail, a novel interface that decomposes both LLM answers and source documents into discrete claims and evidence, mapping them to reveal supported assertions, unsupported claims, and information omitted from the source texts. We evaluated PaperTrail in a within-subjects study with 26 researchers who performed two scholarly editing tasks using PaperTrail and a baseline interface. Our results show that PaperTrail significantly lowered participants' trust compared to the baseline. However, this increased caution did not translate to behavioral changes, as people continued to rely on LLM-generated scholarly edits to avoid a cognitively burdensome task. We discuss the value of claim-evidence matching for understanding LLM trustworthiness in scholarly settings, and present design implications for cognition-friendly communication of provenance information.",,0,2026-02-24
HELP: HyperNode Expansion and Logical Path-Guided Evidence Localization for Accurate and Efficient GraphRAG,2026-02-24 14:05:29+00:00,http://arxiv.org/abs/2602.20926v1,"Yuqi Huang, Ning Liao, Kai Yang, Anning Hu, Shengchao Hu, Xiaoxing Wang, Junchi Yan",cs.AI,creativity,"Large Language Models (LLMs) often struggle with inherent knowledge boundaries and hallucinations, limiting their reliability in knowledge-intensive tasks. While Retrieval-Augmented Generation (RAG) mitigates these issues, it frequently overlooks structural interdependencies essential for multi-hop reasoning. Graph-based RAG approaches attempt to bridge this gap, yet they typically face trade-offs between accuracy and efficiency due to challenges such as costly graph traversals and semantic noise in LLM-generated summaries. In this paper, we propose HyperNode Expansion and Logical Path-Guided Evidence Localization strategies for GraphRAG (HELP), a novel framework designed to balance accuracy with practical efficiency through two core strategies: 1) HyperNode Expansion, which iteratively chains knowledge triplets into coherent reasoning paths abstracted as HyperNodes to capture complex structural dependencies and ensure retrieval accuracy; and 2) Logical Path-Guided Evidence Localization, which leverages precomputed graph-text correlations to map these paths directly to the corpus for superior efficiency. HELP avoids expensive random walks and semantic distortion, preserving knowledge integrity while drastically reducing retrieval latency. Extensive experiments demonstrate that HELP achieves competitive performance across multiple simple and multi-hop QA benchmarks and up to a 28.8$\times$ speedup over leading Graph-based RAG baselines.",,0,2026-02-24
Next Reply Prediction X Dataset: Linguistic Discrepancies in Naively Generated Content,2026-02-22 13:14:27+00:00,http://arxiv.org/abs/2602.19177v1,"Simon Münker, Nils Schwager, Kai Kugler, Michael Heseltine, Achim Rettinger","cs.CL, cs.AI",creativity,"The increasing use of Large Language Models (LLMs) as proxies for human participants in social science research presents a promising, yet methodologically risky, paradigm shift. While LLMs offer scalability and cost-efficiency, their ""naive"" application, where they are prompted to generate content without explicit behavioral constraints, introduces significant linguistic discrepancies that challenge the validity of research findings. This paper addresses these limitations by introducing a novel, history-conditioned reply prediction task on authentic X (formerly Twitter) data, to create a dataset designed to evaluate the linguistic output of LLMs against human-generated content. We analyze these discrepancies using stylistic and content-based metrics, providing a quantitative framework for researchers to assess the quality and authenticity of synthetic data. Our findings highlight the need for more sophisticated prompting techniques and specialized datasets to ensure that LLM-generated content accurately reflects the complex linguistic patterns of human communication, thereby improving the validity of computational social science studies.",,0,2026-02-22
IDLM: Inverse-distilled Diffusion Language Models,2026-02-22 06:47:04+00:00,http://arxiv.org/abs/2602.19066v1,"David Li, Nikita Gushchin, Dmitry Abulkhanov, Eric Moulines, Ivan Oseledets, Maxim Panov, Alexander Korotin","cs.LG, cs.AI",creativity,"Diffusion Language Models (DLMs) have recently achieved strong results in text generation. However, their multi-step sampling leads to slow inference, limiting practical use. To address this, we extend Inverse Distillation, a technique originally developed to accelerate continuous diffusion models, to the discrete setting. Nonetheless, this extension introduces both theoretical and practical challenges. From a theoretical perspective, the inverse distillation objective lacks uniqueness guarantees, which may lead to suboptimal solutions. From a practical standpoint, backpropagation in the discrete space is non-trivial and often unstable. To overcome these challenges, we first provide a theoretical result demonstrating that our inverse formulation admits a unique solution, thereby ensuring valid optimization. We then introduce gradient-stable relaxations to support effective training. As a result, experiments on multiple DLMs show that our method, Inverse-distilled Diffusion Language Models (IDLM), reduces the number of inference steps by 4x-64x, while preserving the teacher model's entropy and generative perplexity.",,0,2026-02-22
Feedback-based Automated Verification in Vibe Coding of CAS Adaptation Built on Constraint Logic,2026-02-20 20:49:12+00:00,http://arxiv.org/abs/2602.18607v1,"Michal Töpfer, František Plášil, Tomáš Bureš, Petr Hnětynka",cs.AI,creativity,"In CAS adaptation, a challenge is to define the dynamic architecture of the system and changes in its behavior. Implementation-wise, this is projected into an adaptation mechanism, typically realized as an Adaptation Manager (AM). With the advances of generative LLMs, generating AM code based on system specification and desired AM behavior (partially in natural language) is a tempting opportunity. The recent introduction of vibe coding suggests a way to target the problem of the correctness of generated code by iterative testing and vibe coding feedback loops instead of direct code inspection.
  In this paper, we show that generating an AM via vibe coding feedback loops is a viable option when the verification of the generated AM is based on a very precise formulation of the functional requirements. We specify these as constraints in a novel temporal logic FCL that allows us to express the behavior of traces with much finer granularity than classical LTL enables.
  Furthermore, we show that by combining the adaptation and vibe coding feedback loops where the FCL constraints are evaluated for the current system state, we achieved good results in the experiments with generating AMs for two example systems from the CAS domain. Typically, just a few feedback loop iterations were necessary, each feeding the LLM with reports describing detailed violations of the constraints. This AM testing was combined with high run path coverage achieved by different initial settings.",,0,2026-02-20
TFL: Targeted Bit-Flip Attack on Large Language Model,2026-02-19 20:59:47+00:00,http://arxiv.org/abs/2602.17837v1,"Jingkai Guo, Chaitali Chakrabarti, Deliang Fan","cs.CR, cs.CL, cs.LG",creativity,"Large language models (LLMs) are increasingly deployed in safety and security critical applications, raising concerns about their robustness to model parameter fault injection attacks. Recent studies have shown that bit-flip attacks (BFAs), which exploit computer main memory (i.e., DRAM) vulnerabilities to flip a small number of bits in model weights, can severely disrupt LLM behavior. However, existing BFA on LLM largely induce un-targeted failure or general performance degradation, offering limited control over manipulating specific or targeted outputs. In this paper, we present TFL, a novel targeted bit-flip attack framework that enables precise manipulation of LLM outputs for selected prompts while maintaining almost no or minor degradation on unrelated inputs. Within our TFL framework, we propose a novel keyword-focused attack loss to promote attacker-specified target tokens in generative outputs, together with an auxiliary utility score that balances attack effectiveness against collateral performance impact on benign data. We evaluate TFL on multiple LLMs (Qwen, DeepSeek, Llama) and benchmarks (DROP, GSM8K, and TriviaQA). The experiments show that TFL achieves successful targeted LLM output manipulations with less than 50 bit flips and significantly reduced effect on unrelated queries compared to prior BFA approaches. This demonstrates the effectiveness of TFL and positions it as a new class of stealthy and targeted LLM model attack.",,0,2026-02-19
MusicSem: A Semantically Rich Language--Audio Dataset of Natural Music Descriptions,2026-02-19 19:01:42+00:00,http://arxiv.org/abs/2602.17769v1,"Rebecca Salganik, Teng Tu, Fei-Yueh Chen, Xiaohao Liu, Keifeng Lu, Ethan Luvisia, Zhiyao Duan, Guillaume Salha-Galvan, Anson Kahng, Yunshan Ma, Jian Kang","cs.MM, cs.SD, eess.AS",creativity,"Music representation learning is central to music information retrieval and generation. While recent advances in multimodal learning have improved alignment between text and audio for tasks such as cross-modal music retrieval, text-to-music generation, and music-to-text generation, existing models often struggle to capture users' expressed intent in natural language descriptions of music. This observation suggests that the datasets used to train and evaluate these models do not fully reflect the broader and more natural forms of human discourse through which music is described. In this paper, we introduce MusicSem, a dataset of 32,493 language-audio pairs derived from organic music-related discussions on the social media platform Reddit. Compared to existing datasets, MusicSem captures a broader spectrum of musical semantics, reflecting how listeners naturally describe music in nuanced and human-centered ways. To structure these expressions, we propose a taxonomy of five semantic categories: descriptive, atmospheric, situational, metadata-related, and contextual. In addition to the construction, analysis, and release of MusicSem, we use the dataset to evaluate a wide range of multimodal models for retrieval and generation, highlighting the importance of modeling fine-grained semantics. Overall, MusicSem serves as a novel semantics-aware resource to support future research on human-aligned multimodal music representation learning.",,0,2026-02-19
How Uncertain Is the Grade? A Benchmark of Uncertainty Metrics for LLM-Based Automatic Assessment,2026-02-17 21:46:52+00:00,http://arxiv.org/abs/2602.16039v1,"Hang Li, Kaiqi Yang, Xianxuan Long, Fedor Filippov, Yucheng Chu, Yasemin Copur-Gencturk, Peng He, Cory Miller, Namsoo Shin, Joseph Krajcik, Hui Liu, Jiliang Tang",cs.AI,creativity,"The rapid rise of large language models (LLMs) is reshaping the landscape of automatic assessment in education. While these systems demonstrate substantial advantages in adaptability to diverse question types and flexibility in output formats, they also introduce new challenges related to output uncertainty, stemming from the inherently probabilistic nature of LLMs. Output uncertainty is an inescapable challenge in automatic assessment, as assessment results often play a critical role in informing subsequent pedagogical actions, such as providing feedback to students or guiding instructional decisions. Unreliable or poorly calibrated uncertainty estimates can lead to unstable downstream interventions, potentially disrupting students' learning processes and resulting in unintended negative consequences. To systematically understand this challenge and inform future research, we benchmark a broad range of uncertainty quantification methods in the context of LLM-based automatic assessment. Although the effectiveness of these methods has been demonstrated in many tasks across other domains, their applicability and reliability in educational settings, particularly for automatic grading, remain underexplored. Through comprehensive analyses of uncertainty behaviors across multiple assessment datasets, LLM families, and generation control settings, we characterize the uncertainty patterns exhibited by LLMs in grading scenarios. Based on these findings, we evaluate the strengths and limitations of different uncertainty metrics and analyze the influence of key factors, including model families, assessment tasks, and decoding strategies, on uncertainty estimates. Our study provides actionable insights into the characteristics of uncertainty in LLM-based automatic assessment and lays the groundwork for developing more reliable and effective uncertainty-aware grading systems in the future.",,0,2026-02-17
FeDecider: An LLM-Based Framework for Federated Cross-Domain Recommendation,2026-02-17 21:42:28+00:00,http://arxiv.org/abs/2602.16034v1,"Xinrui He, Ting-Wei Li, Tianxin Wei, Xuying Ning, Xinyu He, Wenxuan Bao, Hanghang Tong, Jingrui He",cs.IR,creativity,"Federated cross-domain recommendation (Federated CDR) aims to collaboratively learn personalized recommendation models across heterogeneous domains while preserving data privacy. Recently, large language model (LLM)-based recommendation models have demonstrated impressive performance by leveraging LLMs' strong reasoning capabilities and broad knowledge. However, adopting LLM-based recommendation models in Federated CDR scenarios introduces new challenges. First, there exists a risk of overfitting with domain-specific local adapters. The magnitudes of locally optimized parameter updates often vary across domains, causing biased aggregation and overfitting toward domain-specific distributions. Second, unlike traditional recommendation models (e.g., collaborative filtering, bipartite graph-based methods) that learn explicit and comparable user/item representations, LLMs encode knowledge implicitly through autoregressive text generation training. This poses additional challenges for effectively measuring the cross-domain similarities under heterogeneity. To address these challenges, we propose an LLM-based framework for federated cross-domain recommendation, FeDecider. Specifically, FeDecider tackles the challenge of scale-specific noise by disentangling each client's low-rank updates and sharing only their directional components. To handle the need for flexible and effective integration, each client further learns personalized weights that achieve the data-aware integration of updates from other domains. Extensive experiments across diverse datasets validate the effectiveness of our proposed FeDecider.",,0,2026-02-17
LLM-to-Speech: A Synthetic Data Pipeline for Training Dialectal Text-to-Speech Models,2026-02-17 15:58:27+00:00,http://arxiv.org/abs/2602.15675v1,"Ahmed Khaled Khamis, Hesham Ali",cs.CL,creativity,"Despite the advances in neural text to speech (TTS), many Arabic dialectal varieties remain marginally addressed, with most resources concentrated on Modern Spoken Arabic (MSA) and Gulf dialects, leaving Egyptian Arabic -- the most widely understood Arabic dialect -- severely under-resourced. We address this gap by introducing NileTTS: 38 hours of transcribed speech from two speakers across diverse domains including medical, sales, and general conversations. We construct this dataset using a novel synthetic pipeline: large language models (LLM) generate Egyptian Arabic content, which is then converted to natural speech using audio synthesis tools, followed by automatic transcription and speaker diarization with manual quality verification. We fine-tune XTTS v2, a state-of-the-art multilingual TTS model, on our dataset and evaluate against the baseline model trained on other Arabic dialects. Our contributions include: (1) the first publicly available Egyptian Arabic TTS dataset, (2) a reproducible synthetic data generation pipeline for dialectal TTS, and (3) an open-source fine-tuned model. All resources are released to advance Egyptian Arabic speech synthesis research.",,0,2026-02-17
"CCiV: A Benchmark for Structure, Rhythm and Quality in LLM-Generated Chinese \textit{Ci} Poetry",2026-02-15 10:19:02+00:00,http://arxiv.org/abs/2602.14081v1,"Shangqing Zhao, Yupei Ren, Yuhao Zhou, Xiaopeng Bai, Man Lan",cs.CL,creativity,"The generation of classical Chinese \textit{Ci} poetry, a form demanding a sophisticated blend of structural rigidity, rhythmic harmony, and artistic quality, poses a significant challenge for large language models (LLMs). To systematically evaluate and advance this capability, we introduce \textbf{C}hinese \textbf{Ci}pai \textbf{V}ariants (\textbf{CCiV}), a benchmark designed to assess LLM-generated \textit{Ci} poetry across these three dimensions: structure, rhythm, and quality. Our evaluation of 17 LLMs on 30 \textit{Cipai} reveals two critical phenomena: models frequently generate valid but unexpected historical variants of a poetic form, and adherence to tonal patterns is substantially harder than structural rules. We further show that form-aware prompting can improve structural and tonal control for stronger models, while potentially degrading weaker ones. Finally, we observe weak and inconsistent alignment between formal correctness and literary quality in our sample. CCiV highlights the need for variant-aware evaluation and more holistic constrained creative generation methods.",,0,2026-02-15
EPRBench: A High-Quality Benchmark Dataset for Event Stream Based Visual Place Recognition,2026-02-13 13:25:05+00:00,http://arxiv.org/abs/2602.12919v1,"Xiao Wang, Xingxing Xiong, Jinfeng Gao, Xufeng Lou, Bo Jiang, Si-bao Chen, Yaowei Wang, Yonghong Tian","cs.CV, cs.AI, cs.NE",creativity,"Event stream-based Visual Place Recognition (VPR) is an emerging research direction that offers a compelling solution to the instability of conventional visible-light cameras under challenging conditions such as low illumination, overexposure, and high-speed motion. Recognizing the current scarcity of dedicated datasets in this domain, we introduce EPRBench, a high-quality benchmark specifically designed for event stream-based VPR. EPRBench comprises 10K event sequences and 65K event frames, collected using both handheld and vehicle-mounted setups to comprehensively capture real-world challenges across diverse viewpoints, weather conditions, and lighting scenarios. To support semantic-aware and language-integrated VPR research, we provide LLM-generated scene descriptions, subsequently refined through human annotation, establishing a solid foundation for integrating LLMs into event-based perception pipelines. To facilitate systematic evaluation, we implement and benchmark 15 state-of-the-art VPR algorithms on EPRBench, offering a strong baseline for future algorithmic comparisons. Furthermore, we propose a novel multi-modal fusion paradigm for VPR: leveraging LLMs to generate textual scene descriptions from raw event streams, which then guide spatially attentive token selection, cross-modal feature fusion, and multi-scale representation learning. This framework not only achieves highly accurate place recognition but also produces interpretable reasoning processes alongside its predictions, significantly enhancing model transparency and explainability. The dataset and source code will be released on https://github.com/Event-AHU/Neuromorphic_ReID",,0,2026-02-13
"WavBench: Benchmarking Reasoning, Colloquialism, and Paralinguistics for End-to-End Spoken Dialogue Models",2026-02-12 16:22:11+00:00,http://arxiv.org/abs/2602.12135v2,"Yangzhuo Li, Shengpeng Ji, Yifu Chen, Tianle Liang, Haorong Ying, Yule Wang, Junbo Li, Jun Fang, Zhou Zhao",cs.CL,creativity,"With the rapid integration of advanced reasoning capabilities into spoken dialogue models, the field urgently demands benchmarks that transcend simple interactions to address real-world complexity. However, current evaluations predominantly adhere to text-generation standards, overlooking the unique audio-centric characteristics of paralinguistics and colloquialisms, alongside the cognitive depth required by modern agents. To bridge this gap, we introduce WavBench, a comprehensive benchmark designed to evaluate realistic conversational abilities where prior works fall short. Uniquely, WavBench establishes a tripartite framework: 1) Pro subset, designed to rigorously challenge reasoning-enhanced models with significantly increased difficulty; 2) Basic subset, defining a novel standard for spoken colloquialism that prioritizes ""listenability"" through natural vocabulary, linguistic fluency, and interactive rapport, rather than rigid written accuracy; and 3) Acoustic subset, covering explicit understanding, generation, and implicit dialogue to rigorously evaluate comprehensive paralinguistic capabilities within authentic real-world scenarios. Through evaluating five state-of-the-art models, WavBench offers critical insights into the intersection of complex problem-solving, colloquial delivery, and paralinguistic fidelity, guiding the evolution of robust spoken dialogue models. The benchmark dataset and evaluation toolkit are available at https://naruto-2024.github.io/wavbench.github.io/.",,0,2026-02-12
Improving HPC Code Generation Capability of LLMs via Online Reinforcement Learning with Real-Machine Benchmark Rewards,2026-02-12 15:12:59+00:00,http://arxiv.org/abs/2602.12049v1,"Ryo Mikasa, Shun-ichiro Hayashi, Daichi Mukunoki, Tetsuya Hoshino, Takahiro Katagiri",cs.LG,creativity,"Large language models (LLMs) have demonstrated strong code generation capabilities, yet the runtime performance of generated code is not guaranteed, and there have been few attempts to train LLMs using runtime performance as a reward in the HPC domain. We propose an online reinforcement learning approach that executes LLM-generated code on a supercomputer and directly feeds back the measured runtime performance (GFLOPS) as a reward. We further introduce a Staged Quality-Diversity (SQD) algorithm that progressively varies the permitted optimization techniques on a per-problem basis, enabling the model to learn code optimization from diverse perspectives. We build a distributed system connecting a GPU training cluster with a CPU benchmarking cluster, and train Qwen2.5 Coder 14B on a double-precision matrix multiplication task using Group Relative Policy Optimization (GRPO). Through two experiments, we show that reinforcement learning combining runtime performance feedback with staged optimization can improve the HPC code generation capability of LLMs.",,0,2026-02-12
Evaluating AGENTS.md: Are Repository-Level Context Files Helpful for Coding Agents?,2026-02-12 14:15:22+00:00,http://arxiv.org/abs/2602.11988v1,"Thibaud Gloaguen, Niels Mündler, Mark Müller, Veselin Raychev, Martin Vechev","cs.SE, cs.AI",creativity,"A widespread practice in software development is to tailor coding agents to repositories using context files, such as AGENTS.md, by either manually or automatically generating them. Although this practice is strongly encouraged by agent developers, there is currently no rigorous investigation into whether such context files are actually effective for real-world tasks. In this work, we study this question and evaluate coding agents' task completion performance in two complementary settings: established SWE-bench tasks from popular repositories, with LLM-generated context files following agent-developer recommendations, and a novel collection of issues from repositories containing developer-committed context files.
  Across multiple coding agents and LLMs, we find that context files tend to reduce task success rates compared to providing no repository context, while also increasing inference cost by over 20%. Behaviorally, both LLM-generated and developer-provided context files encourage broader exploration (e.g., more thorough testing and file traversal), and coding agents tend to respect their instructions. Ultimately, we conclude that unnecessary requirements from context files make tasks harder, and human-written context files should describe only minimal requirements.",,0,2026-02-12
