title,pubdate,id,authors,categories,search,abstract,source,hf_upvotes,displaydate
AI Generated Text Detection,2026-01-07 11:18:10+00:00,http://arxiv.org/abs/2601.03812v1,"Adilkhan Alikhanov, Aidar Amangeldi, Diar Demeubay, Dilnaz Akhmetzhan, Nurbek Moldakhmetov, Omar Polat, Galymzhan Zharas","cs.CL, cs.AI",creativity,"The rapid development of large language models has led to an increase in AI-generated text, with students increasingly using LLM-generated content as their own work, which violates academic integrity. This paper presents an evaluation of AI text detection methods, including both traditional machine learning models and transformer-based architectures. We utilize two datasets, HC3 and DAIGT v2, to build a unified benchmark and apply a topic-based data split to prevent information leakage. This approach ensures robust generalization across unseen domains. Our experiments show that TF-IDF logistic regression achieves a reasonable baseline accuracy of 82.87%. However, deep learning models outperform it. The BiLSTM classifier achieves an accuracy of 88.86%, while DistilBERT achieves a similar accuracy of 88.11% with the highest ROC-AUC score of 0.96, demonstrating the strongest overall performance. The results indicate that contextual semantic modeling is significantly superior to lexical features and highlight the importance of mitigating topic memorization through appropriate evaluation protocols. The limitations of this work are primarily related to dataset diversity and computational constraints. In future work, we plan to expand dataset diversity and utilize parameter-efficient fine-tuning methods such as LoRA. We also plan to explore smaller or distilled models and employ more efficient batching strategies and hardware-aware optimization.",,0,2026-01-07
Evaluation Framework for AI Creativity: A Case Study Based on Story Generation,2026-01-07 08:31:08+00:00,http://arxiv.org/abs/2601.03698v1,"Pharath Sathya, Yin Jou Huang, Fei Cheng",cs.CL,creativity,"Evaluating creative text generation remains a challenge because existing reference-based metrics fail to capture the subjective nature of creativity. We propose a structured evaluation framework for AI story generation comprising four components (Novelty, Value, Adherence, and Resonance) and eleven sub-components. Using controlled story generation via ``Spike Prompting'' and a crowdsourced study of 115 readers, we examine how different creative components shape both immediate and reflective human creativity judgments. Our findings show that creativity is evaluated hierarchically rather than cumulatively, with different dimensions becoming salient at different stages of judgment, and that reflective evaluation substantially alters both ratings and inter-rater agreement. Together, these results support the effectiveness of our framework in revealing dimensions of creativity that are obscured by reference-based evaluation.",,0,2026-01-07
A Preliminary Agentic Framework for Matrix Deflation,2026-01-06 23:59:18+00:00,http://arxiv.org/abs/2601.08219v1,"Paimon Goulart, Evangelos E. Papalexakis",cs.LG,creativity,"Can a small team of agents peel a matrix apart, one rank-1 slice at a time? We propose an agentic approach to matrix deflation in which a solver Large Language Model (LLM) generates rank-1 Singular Value Decomposition (SVD) updates and a Vision Language Model (VLM) accepts or rejects each update and decides when to stop, eliminating fixed norm thresholds. Solver stability is improved through in-context learning (ICL) and types of row/column permutations that expose visually coherent structure. We evaluate on Digits ($8{\times}8$), CIFAR-10 ($32{\times}32$ grayscale), and synthetic ($16{\times}16$) matrices with and without Gaussian noise. In the synthetic noisy case, where the true construction rank $k$ is known, numerical deflation provides the noise target and our best agentic configuration differs by only $1.75$ RMSE of the target. For Digits and CIFAR-10, targets are defined by deflating until the Frobenius norm reaches $10\%$ of the original. Across all settings, our agent achieves competitive results, suggesting that fully agentic, threshold-free deflation is a viable alternative to classical numerical algorithms.",,0,2026-01-06
ReTreVal: Reasoning Tree with Validation -- A Hybrid Framework for Enhanced LLM Multi-Step Reasoning,2026-01-06 10:05:30+00:00,http://arxiv.org/abs/2601.02880v1,"Abhishek HS, Pavan C Shekar, Arpit Jain, Ashwanth Krishnan","cs.AI, cs.CL",creativity,"Multi-step reasoning remains a key challenge for Large Language Models (LLMs), particularly in complex domains such as mathematics and creative writing. While recent approaches including ReAct, Reflexion, and Self-Refine improve reasoning through iterative refinement and reflection, they often lack structured exploration of alternative solution paths and persistent learning across problems. We propose ReTreVal (Reasoning Tree with Validation), a hybrid framework that integrates Tree-of-Thoughts exploration, self-refinement, LLM-based critique scoring, and reflexion memory to enable bounded and validated multi-step reasoning. ReTreVal constructs a structured reasoning tree with adaptive depth based on problem complexity, where each node undergoes iterative self-critique and refinement guided by explicit LLM-generated feedback. A dual validation mechanism evaluates reasoning quality, coherence, and correctness at each node while persistently storing insights from successful reasoning paths and failure patterns in a reflexion memory buffer, enabling cross-problem learning. Critique-based pruning retains only the top-k highest-scoring nodes at each level, controlling computational cost while preserving high-quality solution paths. We evaluate ReTreVal against ReAct, Reflexion, and Self-Refine across 500 mathematical problems and creative writing tasks using Qwen 2.5 7B as the underlying LLM, and demonstrate that ReTreVal consistently outperforms existing methods through its combination of structured exploration, critique-driven refinement, and cross-problem memory, making it particularly effective for tasks requiring exploratory reasoning, rigorous verification, and knowledge transfer.",,0,2026-01-06
FlowPlan-G2P: A Structured Generation Framework for Transforming Scientific Papers into Patent Descriptions,2026-01-05 22:40:15+00:00,http://arxiv.org/abs/2601.02589v1,"Kris W Pan, Yongmin Yoo","cs.CL, cs.AI",creativity,"Over 3.5 million patents are filed annually, with drafting patent descriptions requiring deep technical and legal expertise. Transforming scientific papers into patent descriptions is particularly challenging due to their differing rhetorical styles and stringent legal requirements. Unlike black-box text-to-text approaches that struggle to model structural reasoning and legal constraints, we propose FlowPlan-G2P, a novel framework that mirrors the cognitive workflow of expert drafters by reformulating this task into three stages: (1) Concept Graph Induction, extracting technical entities and relationships into a directed graph via expert-like reasoning; (2) Paragraph and Section Planning, reorganizing the graph into coherent clusters aligned with canonical patent sections; and (3) Graph-Conditioned Generation, producing legally compliant paragraphs using section-specific subgraphs and tailored prompts. Experiments demonstrate that FlowPlan-G2P significantly improves logical coherence and legal compliance over end-to-end LLM baselines. Our framework establishes a new paradigm for paper-to-patent generation and advances structured text generation for specialized domains.",,0,2026-01-05
Deferred Commitment Decoding for Diffusion Language Models with Confidence-Aware Sliding Windows,2026-01-05 12:57:33+00:00,http://arxiv.org/abs/2601.02076v1,"Yingte Shu, Yuchuan Tian, Chao Xu, Yunhe Wang, Hanting Chen","cs.CL, cs.AI",creativity,"Diffusion language models (DLMs) have recently emerged as a strong alternative to autoregressive models by enabling parallel text generation. To improve inference efficiency and KV-cache compatibility, prior work commonly adopts block-based diffusion, decoding tokens block by block. However, this paradigm suffers from a structural limitation that we term Boundary-Induced Context Truncation (BICT): undecoded tokens near block boundaries are forced to commit without access to nearby future context, even when such context could substantially reduce uncertainty. This limitation degrades decoding confidence and generation quality, especially for tasks requiring precise reasoning, such as mathematical problem solving and code generation. We propose Deferred Commitment Decoding (DCD), a novel, training-free decoding strategy that mitigates this issue. DCD maintains a confidence-aware sliding window over masked tokens, resolving low-uncertainty tokens early while deferring high-uncertainty tokens until sufficient contextual evidence becomes available. This design enables effective bidirectional information flow within the decoding window without sacrificing efficiency. Extensive experiments across multiple diffusion language models, benchmarks, and caching configurations show that DCD improves generation accuracy by 1.39% with comparable time on average compared to fixed block-based diffusion methods, with the most significant improvement reaching 9.0%. These results demonstrate that deferring token commitment based on uncertainty is a simple yet effective principle for improving both the quality and efficiency of diffusion language model decoding.",,0,2026-01-05
MORE: Multi-Objective Adversarial Attacks on Speech Recognition,2026-01-05 07:27:57+00:00,http://arxiv.org/abs/2601.01852v2,"Xiaoxue Gao, Zexin Li, Yiming Chen, Nancy F. Chen","eess.AS, cs.AI, cs.LG",creativity,"The emergence of large-scale automatic speech recognition (ASR) models such as Whisper has greatly expanded their adoption across diverse real-world applications. Ensuring robustness against even minor input perturbations is therefore critical for maintaining reliable performance in real-time environments. While prior work has mainly examined accuracy degradation under adversarial attacks, robustness with respect to efficiency remains largely unexplored. This narrow focus provides only a partial understanding of ASR model vulnerabilities. To address this gap, we conduct a comprehensive study of ASR robustness under multiple attack scenarios. We introduce MORE, a multi-objective repetitive doubling encouragement attack, which jointly degrades recognition accuracy and inference efficiency through a hierarchical staged repulsion-anchoring mechanism. Specifically, we reformulate multi-objective adversarial optimization into a hierarchical framework that sequentially achieves the dual objectives. To further amplify effectiveness, we propose a novel repetitive encouragement doubling objective (REDO) that induces duplicative text generation by maintaining accuracy degradation and periodically doubling the predicted sequence length. Overall, MORE compels ASR models to produce incorrect transcriptions at a substantially higher computational cost, triggered by a single adversarial input. Experiments show that MORE consistently yields significantly longer transcriptions while maintaining high word error rates compared to existing baselines, underscoring its effectiveness in multi-objective adversarial attack.",,0,2026-01-05
WebCoderBench: Benchmarking Web Application Generation with Comprehensive and Interpretable Evaluation Metrics,2026-01-05 05:23:07+00:00,http://arxiv.org/abs/2601.02430v1,"Chenxu Liu, Yingjie Fu, Wei Yang, Ying Zhang, Tao Xie","cs.SE, cs.AI",creativity,"Web applications (web apps) have become a key arena for large language models (LLMs) to demonstrate their code generation capabilities and commercial potential. However, building a benchmark for LLM-generated web apps remains challenging due to the need for real-world user requirements, generalizable evaluation metrics without relying on ground-truth implementations or test cases, and interpretable evaluation results. To address these challenges, we introduce WebCoderBench, the first real-world-collected, generalizable, and interpretable benchmark for web app generation. WebCoderBench comprises 1,572 real user requirements, covering diverse modalities and expression styles that reflect realistic user intentions. WebCoderBench provides 24 fine-grained evaluation metrics across 9 perspectives, combining rule-based and LLM-as-a-judge paradigm for fully automated, objective, and general evaluation. Moreover, WebCoderBench adopts human-preference-aligned weights over metrics to yield interpretable overall scores. Experiments across 12 representative LLMs and 2 LLM-based agents show that there exists no dominant model across all evaluation metrics, offering an opportunity for LLM developers to optimize their models in a targeted manner for a more powerful version.",,0,2026-01-05
Can LLMs Track Their Output Length? A Dynamic Feedback Mechanism for Precise Length Regulation,2026-01-05 03:49:14+00:00,http://arxiv.org/abs/2601.01768v2,"Meiman Xiao, Ante Wang, Qingguo Hu, Zhongjian Miao, Huangjun Shen, Longyue Wang, Weihua Luo, Jinsong Su",cs.CL,creativity,"Precisely controlling the length of generated text is a common requirement in real-world applications. However, despite significant advancements in following human instructions, Large Language Models (LLMs) still struggle with this task. In this work, we demonstrate that LLMs often fail to accurately measure their response lengths, leading to poor adherence to length constraints. To address this issue, we propose a novel length regulation approach that incorporates dynamic length feedback during generation, enabling adaptive adjustments to meet target lengths. Experiments on summarization and biography tasks show our training-free approach significantly improves precision in achieving target token, word, or sentence counts without compromising quality. Additionally, we demonstrate that further supervised fine-tuning allows our method to generalize effectively to broader text-generation tasks.",,0,2026-01-05
QSLM: A Performance- and Memory-aware Quantization Framework with Tiered Search Strategy for Spike-driven Language Models,2026-01-02 13:05:33+00:00,http://arxiv.org/abs/2601.00679v1,"Rachmad Vidya Wicaksana Putra, Pasindu Wickramasinghe, Muhammad Shafique","cs.NE, cs.AI, cs.LG",creativity,"Large Language Models (LLMs) have been emerging as prominent AI models for solving many natural language tasks due to their high performance (e.g., accuracy) and capabilities in generating high-quality responses to the given inputs. However, their large computational cost, huge memory footprints, and high processing power/energy make it challenging for their embedded deployments. Amid several tinyLLMs, recent works have proposed spike-driven language models (SLMs) for significantly reducing the processing power/energy of LLMs. However, their memory footprints still remain too large for low-cost and resource-constrained embedded devices. Manual quantization approach may effectively compress SLM memory footprints, but it requires a huge design time and compute power to find the quantization setting for each network, hence making this approach not-scalable for handling different networks, performance requirements, and memory budgets. To bridge this gap, we propose QSLM, a novel framework that performs automated quantization for compressing pre-trained SLMs, while meeting the performance and memory constraints. To achieve this, QSLM first identifies the hierarchy of the given network architecture and the sensitivity of network layers under quantization, then employs a tiered quantization strategy (e.g., global-, block-, and module-level quantization) while leveraging a multi-objective performance-and-memory trade-off function to select the final quantization setting. Experimental results indicate that our QSLM reduces memory footprint by up to 86.5%, reduces power consumption by up to 20%, maintains high performance across different tasks (i.e., by up to 84.4% accuracy of sentiment classification on the SST-2 dataset and perplexity score of 23.2 for text generation on the WikiText-2 dataset) close to the original non-quantized model while meeting the performance and memory constraints.",,0,2026-01-02
How Large Language Models Systematically Misrepresent American Climate Opinions,2025-12-29 22:29:10+00:00,http://arxiv.org/abs/2512.23889v1,"Sola Kim, Jieshu Wang, Marco A. Janssen, John M. Anderies","cs.CY, cs.AI",creativity,"Federal agencies and researchers increasingly use large language models to analyze and simulate public opinion. When AI mediates between the public and policymakers, accuracy across intersecting identities becomes consequential; inaccurate group-level estimates can mislead outreach, consultation, and policy design. While research examines intersectionality in LLM outputs, no study has compared these outputs against real human responses across intersecting identities. Climate policy is one such domain, and this is particularly urgent for climate change, where opinion is contested and diverse. We investigate how LLMs represent intersectional patterns in U.S. climate opinions. We prompted six LLMs with profiles of 978 respondents from a nationally representative U.S. climate opinion survey and compared AI-generated responses to actual human answers across 20 questions. We find that LLMs appear to compress the diversity of American climate opinions, predicting less-concerned groups as more concerned and vice versa. This compression is intersectional: LLMs apply uniform gender assumptions that match reality for White and Hispanic Americans but misrepresent Black Americans, where actual gender patterns differ. These patterns, which may be invisible to standard auditing approaches, could undermine equitable climate governance.",,0,2025-12-29
Web World Models,2025-12-29 18:31:45+00:00,http://arxiv.org/abs/2512.23676v1,"Jichen Feng, Yifan Zhang, Chenggong Zhang, Yifu Lu, Shilong Liu, Mengdi Wang","cs.AI, cs.CL, cs.CV",creativity,"Language agents increasingly require persistent worlds in which they can act, remember, and learn. Existing approaches sit at two extremes: conventional web frameworks provide reliable but fixed contexts backed by databases, while fully generative world models aim for unlimited environments at the expense of controllability and practical engineering. In this work, we introduce the Web World Model (WWM), a middle ground where world state and ``physics'' are implemented in ordinary web code to ensure logical consistency, while large language models generate context, narratives, and high-level decisions on top of this structured latent state. We build a suite of WWMs on a realistic web stack, including an infinite travel atlas grounded in real geography, fictional galaxy explorers, web-scale encyclopedic and narrative worlds, and simulation- and game-like environments. Across these systems, we identify practical design principles for WWMs: separating code-defined rules from model-driven imagination, representing latent state as typed web interfaces, and utilizing deterministic generation to achieve unlimited but structured exploration. Our results suggest that web stacks themselves can serve as a scalable substrate for world models, enabling controllable yet open-ended environments. Project Page: https://github.com/Princeton-AI2-Lab/Web-World-Models.",,0,2025-12-29
Divergent-Convergent Thinking in Large Language Models for Creative Problem Generation,2025-12-29 16:53:48+00:00,http://arxiv.org/abs/2512.23601v1,"Manh Hung Nguyen, Adish Singla",cs.AI,creativity,"Large language models (LLMs) have significant potential for generating educational questions and problems, enabling educators to create large-scale learning materials. However, LLMs are fundamentally limited by the ``Artificial Hivemind'' effect, where they generate similar responses within the same model and produce homogeneous outputs across different models. As a consequence, students may be exposed to overly similar and repetitive LLM-generated problems, which harms diversity of thought. Drawing inspiration from Wallas's theory of creativity and Guilford's framework of divergent-convergent thinking, we propose CreativeDC, a two-phase prompting method that explicitly scaffolds the LLM's reasoning into distinct phases. By decoupling creative exploration from constraint satisfaction, our method enables LLMs to explore a broader space of ideas before committing to a final problem. We evaluate CreativeDC for creative problem generation using a comprehensive set of metrics that capture diversity, novelty, and utility. The results show that CreativeDC achieves significantly higher diversity and novelty compared to baselines while maintaining high utility. Moreover, scaling analysis shows that CreativeDC generates a larger effective number of distinct problems as more are sampled, increasing at a faster rate than baseline methods.",,0,2025-12-29
Divergent-Convergent Thinking in Large Language Models for Creative Problem Generation,2025-12-29 16:53:48+00:00,http://arxiv.org/abs/2512.23601,"Manh Hung Nguyen, Adish Singla",,creativity,"Large language models (LLMs) have significant potential for generating educational questions and problems, enabling educators to create large-scale learning materials. However, LLMs are fundamentally limited by the ``Artificial Hivemind'' effect, where they generate similar responses within the same model and produce homogeneous outputs across different models. As a consequence, students may be exposed to overly similar and repetitive LLM-generated problems, which harms diversity of thought. Drawing inspiration from Wallas's theory of creativity and Guilford's framework of divergent-convergent thinking, we propose CreativeDC, a two-phase prompting method that explicitly scaffolds the LLM's reasoning into distinct phases. By decoupling creative exploration from constraint satisfaction, our method enables LLMs to explore a broader space of ideas before committing to a final problem. We evaluate CreativeDC for creative problem generation using a comprehensive set of metrics that capture diversity, novelty, and utility. The results show that CreativeDC achieves significantly higher diversity and novelty compared to baselines while maintaining high utility. Moreover, scaling analysis shows that CreativeDC generates a larger effective number of distinct problems as more are sampled, increasing at a faster rate than baseline methods.",hf,0,2025-12-29
Anka: A Domain-Specific Language for Reliable LLM Code Generation,2025-12-29 05:28:17+00:00,http://arxiv.org/abs/2512.23214v1,Saif Khalfan Saif Al Mazrouei,"cs.CL, cs.LG, cs.PL, cs.SE",creativity,"Large Language Models (LLMs) have demonstrated remarkable capabilities in code generation, yet they exhibit systematic errors on complex, multi-step programming tasks. We hypothesize that these errors stem from the flexibility of general-purpose languages, which permits multiple valid approaches and requires implicit state management. To test this hypothesis, we introduce Anka, a domain-specific language (DSL) for data transformation pipelines designed with explicit, constrained syntax that reduces ambiguity in code generation. Despite having zero prior training exposure to Anka, Claude 3.5 Haiku achieves 99.9% parse success and 95.8% overall task accuracy across 100 benchmark problems. Critically, Anka demonstrates a 40 percentage point accuracy advantage over Python on multi-step pipeline tasks (100% vs. 60%), where Python's flexible syntax leads to frequent errors in operation sequencing and variable management. Cross-model validation with GPT-4o-mini confirms this advantage (+26.7 percentage points on multi-step tasks). Our results demonstrate that: (1) LLMs can learn novel DSLs entirely from in-context prompts, achieving near-native accuracy; (2) constrained syntax significantly reduces errors on complex tasks; and (3) domain-specific languages purposefully designed for LLM generation can outperform general-purpose languages on which the LLM has extensive training. We release the complete language implementation, benchmark suite, and evaluation framework to facilitate further research.",,0,2025-12-29
"Scoring, Reasoning, and Selecting the Best! Ensembling Large Language Models via a Peer-Review Process",2025-12-29 05:25:49+00:00,http://arxiv.org/abs/2512.23213v1,"Zhijun Chen, Zeyu Ji, Qianren Mao, Junhang Cheng, Bangjie Qin, Hao Wu, Zhuoran Li, Jingzheng Li, Kai Sun, Zizhe Wang, Yikun Ban, Zhu Sun, Xiangyang Ji, Hailong Sun","cs.CL, cs.AI",creativity,"We propose LLM-PeerReview, an unsupervised LLM Ensemble method that selects the most ideal response from multiple LLM-generated candidates for each query, harnessing the collective wisdom of multiple models with diverse strengths. LLM-PeerReview is built on a novel, peer-review-inspired framework that offers a clear and interpretable mechanism, while remaining fully unsupervised for flexible adaptability and generalization. Specifically, it operates in three stages: For scoring, we use the emerging LLM-as-a-Judge technique to evaluate each response by reusing multiple LLMs at hand; For reasoning, we can apply a principled graphical model-based truth inference algorithm or a straightforward averaging strategy to aggregate multiple scores to produce a final score for each response; Finally, the highest-scoring response is selected as the best ensemble output. LLM-PeerReview is conceptually simple and empirically powerful. The two variants of the proposed approach obtain strong results across four datasets, including outperforming the recent advanced model Smoothie-Global by 6.9% and 7.3% points, respectively.",,0,2025-12-29
